Company_Name,Company_Link,Title,Location,Estimated_Salary,Job_Description,Job_Age,Application_Link
"['Lawrence Livermore National Laboratory', '4.4']",http://www.llnl.gov/,"Associate Principal, Software Engineering: UI/UX","Chicago, IL",$100K - $143K (Glassdoor est.),"Company Description
Join us and make YOUR mark on the World!
Are you interested in joining some of the brightest talent in the world to strengthen the United States’ security? Come join Lawrence Livermore National Laboratory (LLNL) where our employees apply their expertise to create solutions for BIG ideas that make our world a better place.
We are committed to a diverse and equitable workforce with an inclusive culture that values and celebrates the diversity of our people, talents, ideas, experiences, and perspectives. This is essential to innovation and creativity for continued success of the Laboratory’s mission.
Job Description",30d+,www.glassdoor.com/partner/jobListing.htm?pos=113&ao=1136043&s=58&guid=000001846a1cedaf9c0ea4fcdce1051b&src=GD_JOB_VIEW&t=SR&vt=w&cs=1_d532cde6&cb=1668227640023&jobListingId=1008089421203&jrtk=3-0-1ghl1previs17801-1ghl1prfjghqn800-ae1900746b3ff397-
"['University of California Merced', '4.2']",http://www.ucmerced.edu/,"Associate Principal, Software Engineering: UI/UX","Chicago, IL",$100K - $143K (Glassdoor est.),"Hiring Range


$75,000/yr - $92,000/yr

Job Closing Date


Initial applicant review will begin on or around November 17, 2022. Posting may close any time after that without notice.",9d,www.glassdoor.com/partner/jobListing.htm?pos=114&ao=1136043&s=58&guid=000001846a1cedaf9c0ea4fcdce1051b&src=GD_JOB_VIEW&t=SR&vt=w&cs=1_a0eacaed&cb=1668227642937&jobListingId=1008253658122&jrtk=3-0-1ghl1previs17801-1ghl1prfjghqn800-ecb3978c8e491394-
"['US Bankruptcy Court, District of DE']",,"Associate Principal, Software Engineering: UI/UX","Chicago, IL",$100K - $143K (Glassdoor est.),"United States Bankruptcy Court
District of Delaware
824 Market Street
Wilmington, DE 19801 www.deb.uscourts.gov
CAREER OPPORTUNITY
Vacancy Announcement #22-02
Position: INFORMATION SYSTEMS MANAGER
Position Type: Full-Time Permanent
Number of Positions: One",30d+,
"['Samsung Semiconductor, Inc.', '4.2']",https://www.samsung.com/us/samsungsemiconductor,"Associate Principal, Software Engineering: UI/UX","Chicago, IL",$100K - $143K (Glassdoor est.),"Advancing the World's Technology Together
Our technology solutions power the tools you use every day-including smartphones, electric vehicles, hyperscale data centers, IoT devices, and so much more. Here, you'll have an opportunity to be part of a global leader whose innovative designs are pushing the boundaries of what's possible and powering the future.
We believe that innovation and growth are driven by an inclusive culture and a diverse workforce. We're dedicated to empowering people to be their true selves. Together, we're building a better tomorrow for our employees, customers, partners, and communities.
What You'll Do
SAIT creates disruptive technologies as well as new technology convergence by combining Samsung's most advanced technologies. SAIT also conducts science-based research in promising new areas to generate novel, powerful solutions to pressing global problems.",30d+,www.glassdoor.com/partner/jobListing.htm?pos=116&ao=1136043&s=58&guid=000001846a1cedaf9c0ea4fcdce1051b&src=GD_JOB_VIEW&t=SR&vt=w&cs=1_3e193e40&cb=1668227648884&jobListingId=1008184172743&jrtk=3-0-1ghl1previs17801-1ghl1prfjghqn800-a707b8191bb1bc00-
"['JPMorgan Chase Bank, N.A.', '3.8']",http://www.chase.com/,"Associate Principal, Software Engineering: UI/UX","Chicago, IL",$100K - $143K (Glassdoor est.),"Our Global Technology Infrastructure group is a team of innovators who love technology as much as you do. Together, you will use a disciplined, innovative and a business focused approach to develop a wide variety of high-quality products and solutions. You will work in a stable, resilient, and secure operating environment where you-and the products you deliver-will thrive.

Job Description

As a leader in the Application Connectivity Product line for Infrastructure Engineering, you will be one of the visionaries responsible for developing the roadmap for the computing platforms, servers, and networks, which means your work will have a day-to-day impact on customers, clients, and businesses around the globe. Your expertise in infrastructure technology, architecture design, and performance monitoring will be essential in guiding a team that delivers multiple IT projects on time and within budget. Your team will look to you to mentor them as they work collaboratively to drive the strategic technology roadmap of the firm and implement high-quality technology solutions . And while you will be part of a tight-knit team of high-performers who share your passion for technology, you will also gain access to the best minds in the business-both as part of the JPMorgan Chase & Co. global technology community, and through our partnerships with some of the most important tech firms in the world.

In this role you will lead a team of engineers building applications that support one of the largest enterprise data networks in the world . Your focus on automation and the development of micro services in support of the provisioning and management of the data network will position JPMorgan as a technology leader in the networking space.

This role requires a wide variety of strengths and capabilities, including:",26d,www.glassdoor.com/partner/jobListing.htm?pos=117&ao=1136043&s=58&guid=000001846a1cedaf9c0ea4fcdce1051b&src=GD_JOB_VIEW&t=SR&vt=w&cs=1_d8ea48a6&cb=1668227650836&jobListingId=1008211329735&jrtk=3-0-1ghl1previs17801-1ghl1prfjghqn800-34d1a922b30cfb64-
"['Apple', '4.2']",http://www.apple.com/,"Associate Principal, Software Engineering: UI/UX","Chicago, IL",$100K - $143K (Glassdoor est.),"Summary
Posted: Oct 6, 2022
Role Number:200411327
At Apple, we work every day to create products that enrich people’s lives. Our Advertising Platforms group makes it possible for people around the world to access easily informative and imaginative content on their devices while helping publishers and developers promote and monetize their work. Our technology and services power advertising in Search Ads in App Store and Apple News. Our platforms are highly-performant, deployed at scale, and setting new standards for enabling effective advertising while protecting user privacy. Our Quality Engineering Organization brings engineering talent to the forefront and works closely with development to continuously deliver code to our customers that is reliable, scalable, and functional. We are looking for quality leaders who will help us continue our mission of providing a high-quality experience for our customers. Are you a software engineer with a passion for improving product quality? If so, we’d like to talk to you! As a senior member of the Finance and Billing quality engineering team, you will be responsible for building automation frameworks, and be responsible for the delivery of robust, reliable, and stable automation capable of finding issues early to enable continuous product delivery. You will work closely with Product Managers and Developers to ensure high quality products. To be successful, you must be a strong programmer, proficient at thoroughly testing applications and services, and helping improve team velocity through automation. We are looking for highly motivated, hard-working individuals, who can continually research and apply the latest technologies to test engineering, independently solve issues and influence the teams to adopt best test practices. This position is located in Austin, Texas.",30d+,www.glassdoor.com/partner/jobListing.htm?pos=118&ao=1136043&s=58&guid=000001846a1cedaf9c0ea4fcdce1051b&src=GD_JOB_VIEW&t=SR&vt=w&cs=1_9b471850&cb=1668227653612&jobListingId=1008141069989&jrtk=3-0-1ghl1previs17801-1ghl1prfjghqn800-baf617755c3177d9-
"['Skyworks', '3.6']",http://www.skyworksinc.com/,"Associate Principal, Software Engineering: UI/UX","Chicago, IL",$100K - $143K (Glassdoor est.),"If you are looking for a challenging and exciting career in the world of technology, then look no further. Skyworks is an innovator of high performance analog semiconductors whose solutions are powering the wireless networking revolution. At Skyworks, you will find a fast-paced environment with a strong focus on global collaboration, minimal layers of management and the freedom to make meaningful contributions in a setting that encourages creativity and out-of-the-box thinking. Our work culture values diversity, social responsibility, open communication, mutual trust and respect. We are excited about the opportunity to work with you and glad you want to be part of a team of talented individuals who together can change the way the world communicates.
Requisition ID: 69984
Job Description
The Process Engineering group at Skyworks in Woburn, Massachusetts is responsible for developing and supporting all wafer fabrication processes used to produce Skyworks’ diverse portfolio of products. The primary device technologies include HBT, GaN, BiFET, pHEMT and BiHEMT at various performance nodes. The group works closely with the Advanced Technology Development team to develop technologies and with the Manufacturing Operations team to deliver world-class quality products to market.",15d,www.glassdoor.com/partner/jobListing.htm?pos=119&ao=1136043&s=58&guid=000001846a1cedaf9c0ea4fcdce1051b&src=GD_JOB_VIEW&t=SR&vt=w&cs=1_4e64c81b&cb=1668227655643&jobListingId=1008238572739&jrtk=3-0-1ghl1previs17801-1ghl1prfjghqn800-e3071d7e7f654c00-
"['Advanced Micro Devices, Inc.', '4.2']",http://www.amd.com/,"Associate Principal, Software Engineering: UI/UX","Chicago, IL",$100K - $143K (Glassdoor est.),"What you do at AMD changes everything
We care deeply about transforming lives with AMD technology to enrich our industry, our communities and the world. Our mission is to build great products that accelerate next-generation computing experiences – the building blocks for the data center, artificial intelligence, PCs, gaming and embedded. Underpinning our mission is the AMD culture. We push the limits of innovation to solve the world’s most important challenges. We strive for execution excellence, while being direct, humble, collaborative and inclusive of diverse perspectives. This is who we are at our best. One Company. One Team.
AMD together we advance_
SAP Basis Administration Manager",9d,www.glassdoor.com/partner/jobListing.htm?pos=120&ao=1136043&s=58&guid=000001846a1cedaf9c0ea4fcdce1051b&src=GD_JOB_VIEW&t=SR&vt=w&cs=1_90274581&cb=1668227659659&jobListingId=1008253688899&jrtk=3-0-1ghl1previs17801-1ghl1prfjghqn800-84a88e8ec15c7980-
"['Droplette, Inc.', '4.5']",http://www.droplette.io/,"Associate Principal, Software Engineering: UI/UX","Chicago, IL",$100K - $143K (Glassdoor est.),"Droplette is the world's most advanced skin care system. Born from cellular drug delivery technology, we're building a disruptive needle-free, iot platform technology with groundbreaking applications in anti-aging, skin wellness and cosmetics.
Droplette is looking for an experienced engineering leader to own all of engineering: electrical, firmware, and mechanical engineering across early R&D and the manufacturing integration stage as we scale up. We created an amazing handheld device that allows large drugs to enter into the skin. We launched 2 years ago with a Gen1 device that has since undergone a lot of design changes and improvements and we're thrilled to have a customer base that loves our product. As we scale, we need a leader to own all of our hardware engineering. You will be responsible for ensuring our users receive the best possible device we can create.
What's on the Horizon:",30d+,
"['Pi-Square Technologies', '4.1']",http://www.pisquaretech.com/,"Associate Principal, Software Engineering: UI/UX","Chicago, IL",$100K - $143K (Glassdoor est.),"Overview
Description: Pi-square technologies is a Michigan (USA) Headquartered Automotive Embedded Engineering Services and Consulting company, Synergy Partner for major OEMs and Tier 1s and their implementation partners in Automotive Embedded Product Development, Projects, Requirements Analysis, Software Design, Software Implementation, Efficient Build, Release Process, and turnkey software V & V Services. We have more than 20+ years of industry expertise with specialization in the latest cutting-edge automotive technologies such as Infotainment, connected vehicles, Cyber security, OTA, and Advanced Safety/ Body electronics.
Job Description:
ESM generation",30d+,www.glassdoor.com/partner/jobListing.htm?pos=122&ao=1136043&s=58&guid=000001846a1cedaf9c0ea4fcdce1051b&src=GD_JOB_VIEW&t=SR&vt=w&cs=1_201fcb9a&cb=1668227666396&jobListingId=1007987260961&jrtk=3-0-1ghl1previs17801-1ghl1prfjghqn800-1dbfc0fd0c4e574d-
"['Ceva Logistics', '3.6']",https://www.cevalogistics.com/,"Associate Principal, Software Engineering: UI/UX","Chicago, IL",$100K - $143K (Glassdoor est.),"CEVA Logistics provides global supply chain solutions to connect people, products and providers all around the world. We are supply chain experts. We live and breathe logistics every day. Above all, we believe that this is a people business. That’s why we are building a global culture of teamwork and respect. We encourage initiative, and we engage and empower our diverse workforce to grow their careers within CEVA.
CEVA Logistics offers a broad range of end-to-end, customized solutions in both Contract Logistics and Freight Management thanks to our approximately 98,000 employees at more than 1,000 facilities in 160 countries worldwide. With the recent acquisition of the former Ingram Micro Commerce & Lifecycle Services business, we are building one of the world’s leading end-to-end eCommerce service offerings through the dedication and passion of our people—the heartbeat of our organization. As we continue growing at a fast pace, will you “Dare to Grow” with us?",30d+,www.glassdoor.com/partner/jobListing.htm?pos=123&ao=1136043&s=58&guid=000001846a1cedaf9c0ea4fcdce1051b&src=GD_JOB_VIEW&t=SR&vt=w&cs=1_7f9e2f9f&cb=1668227669144&jobListingId=1008074389791&jrtk=3-0-1ghl1previs17801-1ghl1prfjghqn800-a42ceab88f8f8813-
"['Fairview Health Services', '3.3']",http://www.fairview.org/,"Associate Principal, Software Engineering: UI/UX","Chicago, IL",$100K - $143K (Glassdoor est.),"Overview:
M Health Fairview is currently seeking a Cybersecurtiy Manager to join our IT team! The Manager, Cybersecurity – Network & Medical Devices Security is responsible for overseeing critical functions such as network security, segmentation, monitoring of network for cyber threats, protection of medical/IoT devices security at M Health Fairview. Manager oversees skilled cybersecurity personnel including supervisors, principal engineers, senior engineers, and analysts working on VPN, Network Access Controls, Firewalls, VPN, Network device discovery, medical/IoT devices discovery, device security, WAF, DDoS etc. This role reports into Director of Cybersecurity helping build strategy, roadmap and execute on targeted plans to accomplish digital transformation. The ideal candidate shall possess deep security knowledge/expertise in the areas of network security, network segmentation, medical device security, vulnerability management, advanced threat detection, strategies around Macro and Micro segmentation. Successful candidate in this role will lead engineering, architecture, solution design, operational aspects of traditional network perimeter security, cloud edge, cloud hosted systems.

Responsibilities/Job Description:
Qualifications:",30d+,www.glassdoor.com/partner/jobListing.htm?pos=124&ao=1136043&s=58&guid=000001846a1cedaf9c0ea4fcdce1051b&src=GD_JOB_VIEW&t=SR&vt=w&cs=1_fb8c572b&cb=1668227672425&jobListingId=1008181845368&jrtk=3-0-1ghl1previs17801-1ghl1prfjghqn800-02d00bb6c48c3ad2-
"['Pi-Square Technologies', '4.1']",http://www.pisquaretech.com/,"Associate Principal, Software Engineering: UI/UX","Chicago, IL",$100K - $143K (Glassdoor est.),"Overview
Description: Pi-square technologies is a Michigan (USA) Headquartered Automotive Embedded Engineering Services and company, Synergy Partner for major OEMs and Tier 1s and their implementation partners in Automotive Embedded Product Development, Projects, Requirements Analysis, Software Design, Software Implementation, Efficient Build, Release Process, and turnkey software V & V Services. We have more than 20+ years of industry expertise with specialization in the latest cutting-edge automotive technologies such as Infotainment, connected vehicles, Cyber security, OTA, and Advanced Safety/ Body electronics.
Job Description:",30d+,www.glassdoor.com/partner/jobListing.htm?pos=125&ao=1136043&s=58&guid=000001846a1cedaf9c0ea4fcdce1051b&src=GD_JOB_VIEW&t=SR&vt=w&cs=1_ebb7e267&cb=1668227674071&jobListingId=1007987261033&jrtk=3-0-1ghl1previs17801-1ghl1prfjghqn800-9fc52d72cc0896fb-
"['Excelitas Technologies', '3.9']",http://www.excelitas.com/,"Associate Principal, Software Engineering: UI/UX","Chicago, IL",$100K - $143K (Glassdoor est.),"Continuous Improvement Leader**
BILLERICA, MA, UNITED STATES
ENABLE your future through light.
Excelitas is a global technology leader with more than 7,500 employees, focused on delivering market-driven solutions to fulfill the illumination, optical, detection and imaging needs of OEMs and end-users across the biomedical, semiconductor, industrial, consumer products, scientific, security, defense, and aerospace sectors.
ENGAGE with us today and make your contribution to the future! Join the team that leading technology companies turn to for cutting-edge photonic innovation. At Excelitas Technologies you are how we EXCEL.
Our facility in Billerica, Massachusetts is located in the metropolitan Boston area and specializes in the design and manufacturing of advanced photonics products based on MEMS and other micro-scale optical devices. Our unique technology enables the highest system performance in the most compact and cost-effective formats in a variety of applications.
This site's Optical Coherence Tomography (OCT) products are laser-based imaging tools that have transformed ophthalmic care and made notable impacts on patients in cardiology, dermatology, oncology, gastroenterology, and other medical specialties.
We are presently seeking a Continuous Improvement Leader that will have overall responsibility for Continuous Improvement efforts for Excelitas Technologies Corp. in Billerica MA. The overall purpose of this position is to drive, deploy, and manage Continuous Improvement initiatives at the local level. The primary measure of success in this position will be the achievement of savings targets for the Site. Other success factors will be Site engagement as measured by solo improvement projects; coordination / tracking of projects and savings; and coaching and mentoring of teams within the Site. This position will report to the Manufacturing Engineering Manager.
Main responsibilities:",4d,
"['Advanced Micro Devices, Inc.', '4.2']",http://www.amd.com/,"Associate Principal, Software Engineering: UI/UX","Chicago, IL",$100K - $143K (Glassdoor est.),"What you do at AMD changes everything
At AMD, we push the boundaries of what is possible. We believe in changing the world for the better by driving innovation in high-performance computing, graphics, and visualization technologies – building blocks for gaming, immersive platforms, and the data center.
Developing great technology takes more than talent: it takes amazing people who understand collaboration, respect, and who will go the “extra mile” to achieve unthinkable results. It takes people who have the passion and desire to disrupt the status quo, push boundaries, deliver innovation, and change the world. If you have this type of passion, we invite you to take a look at the opportunities available to come join our team.
Platform Power Management Enablement Technical Manager - 139607",30d+,www.glassdoor.com/partner/jobListing.htm?pos=127&ao=1136043&s=58&guid=000001846a1cedaf9c0ea4fcdce1051b&src=GD_JOB_VIEW&t=SR&vt=w&cs=1_736944b8&cb=1668227678917&jobListingId=1007646605495&jrtk=3-0-1ghl1previs17801-1ghl1prfjghqn800-c830aff705eac2ea-
"['Advanced Micro Devices, Inc.', '4.2']",http://www.amd.com/,"Associate Principal, Software Engineering: UI/UX","Chicago, IL",$100K - $143K (Glassdoor est.),"What you do at AMD changes everything
At AMD, we push the boundaries of what is possible. We believe in changing the world for the better by driving innovation in high-performance computing, graphics, and visualization technologies – building blocks for gaming, Immersive platforms, and the data center.
Developing great technology takes more than talent: it takes amazing people who understand collaboration, respect, and who will go the “extra mile” to achieve unthinkable results. It takes people who have the passion and desire to disrupt the status quo, push boundaries, deliver innovation, and change the world. If you have this type of passion, we invite you to take a look at the opportunities available to come join our team!
Administrative Assistant",30d+,www.glassdoor.com/partner/jobListing.htm?pos=128&ao=1136043&s=58&guid=000001846a1cedaf9c0ea4fcdce1051b&src=GD_JOB_VIEW&t=SR&vt=w&cs=1_46699b4b&cb=1668227682765&jobListingId=1007128149505&jrtk=3-0-1ghl1previs17801-1ghl1prfjghqn800-751b709f6017d6e4-
"['Proterra, Inc.', '3.6']",http://www.proterra.com/,"Associate Principal, Software Engineering: UI/UX","Chicago, IL",$100K - $143K (Glassdoor est.),"Position Overview
This position will provide comprehensive IT support to Proterra’s to the Director of IT, Infrastructure and other leadership team members. The Infrastructure Engineer will design, implement, and support operations for IT infrastructure at Proterra’s datacenters, and advanced manufacturing environments. You will be responsible for the day-to-day operations of a virtual environment hosted on VMware, Windows based operating systems and technology. Must possess an extensive knowledge of supporting a traditional data center. Will be required to be on-site Monday – Friday. Must understand how to work and operate data center operations within a Micro Data center. Will be working extensively within VmWare and Windows servers environments.
About the Role – You will:",30d,
"['Advanced Micro Devices, Inc.', '4.2']",http://www.amd.com/,"Associate Principal, Software Engineering: UI/UX","Chicago, IL",$100K - $143K (Glassdoor est.),"What you do at AMD changes everything
At AMD, we push the boundaries of what is possible. We believe in changing the world for the better by driving innovation in high-performance computing, graphics, and visualization technologies – building blocks for gaming, immersive platforms, and the data center.
Developing great technology takes more than talent: it takes amazing people who understand collaboration, respect, and who will go the “extra mile” to achieve unthinkable results. It takes people who have the passion and desire to disrupt the status quo, push boundaries, deliver innovation, and change the world. If you have this type of passion, we invite you to take a look at the opportunities available to come join our team.
Sr Project/Program Management Specialist",30d+,www.glassdoor.com/partner/jobListing.htm?pos=130&ao=1136043&s=58&guid=000001846a1cedaf9c0ea4fcdce1051b&src=GD_JOB_VIEW&t=SR&vt=w&cs=1_5f9880ef&cb=1668227688533&jobListingId=1007678541694&jrtk=3-0-1ghl1previs17801-1ghl1prfjghqn800-a51607ad8251a9ae-
"['Ideal Integrations', '3.8']",http://www.idealintegrations.net/,Security Engineer (WFH/REMOTE WORK),Remote,$80K (Employer est.),"Security Engineer
The Security Operations Engineer will be responsible for the implementation of all security solutions. The desired candidate will be a subject matter expert in all technical solutions which the security operations center (SOC) offers. The desired candidate will oversee all aspects of implementations and projects from initiation to completion of the project. The desired candidate will allocate time to finding new solutions for those issues which may arise in the security department. The desired candidate must document all situations accurately and completely. The desired candidate must possess strong verbal and written communication skills to convey information accurately to clients, and for the training of SOC members.
This position requires 24/7 on-call work.
Principle Accountabilities:",22d,
