Company_Name,Company_Link,Title,Location,Estimated_Salary,Job_Description,Job_Age,Application_Link
"['BAE Systems', '3.8']",https://jobs.baesystems.com/,Nanofabrication Engineer,"Berkeley, CA",$75K - $125K (Employer est.),"Job Description
Because this role involves a combination of collaborative/in-person and independent work, it will take the form of a hybrid work format, with time split between working onsite and remotely.

BAE Systems FAST Labs™ is looking for a full time materials scientist / epitaxial growth scientist to perform research, process development, and small-scale production of III-V materials and devices based on a combination of molecular beam and vapor phase epitaxy. As an the lead epitaxial growth scientist in FAST Labs, you will work at the state of the art Micro-Electronics Center (MEC), BAE Systems’ III-V foundry in Nashua, NH. The employee will support the Sensor Technologies product line in FAST Labs™, the agile, research and development center for BAE Systems Electronics Solutions. The Electronic Solutions Sector of BAE Systems is a $4B business, composed of 7 business areas serving key areas of the defense market, including countermeasures, electronic warfare, precision strike, and vehicle electrification.








BAE Systems, Inc. is the U.S. subsidiary of BAE Systems plc, an international defense, aerospace and security company which delivers a full range of products and services for air, land and naval forces, as well as advanced electronics, security, information technology solutions and customer support services. Improving the future and protecting lives is an ambitious mission, but it’s what we do at BAE Systems. Working here means using your passion and ingenuity where it counts – defending national security with breakthrough technology, superior products, and intelligence solutions. As you develop the latest technology and defend national security, you will continually hone your skills on a team—making a big impact on a global scale. At BAE Systems, you’ll find a rewarding career that truly makes a difference. Electronic Systems (ES) is the global innovator behind BAE Systems’ game-changing defense and commercial electronics. Exploiting every electron, we push the limits of what is possible, giving our customers the edge and our employees opportunities to change the world. Our products and capabilities can be found everywhere – from the depths of the ocean to the far reaches of space. At our core are more than 14,000 highly talented Electronic Systems employees with the brightest minds in the industry, we make an impact – for our customers and the communities we serve. At BAE Systems, we celebrate the array of skills, experiences, and perspectives our employees bring to the table. For us, differences are a source of strength. We’re laser-focused on high performance, and we work hard every day to nurture an inclusive culture where all employees can innovate and thrive. Here, you will not only build your career, but you will also enjoy work-life balance, uncover new experiences, and collaborate with passionate colleagues.",30d+,www.glassdoor.com/partner/jobListing.htm?pos=119&ao=1136043&s=58&guid=000001846a28201a856d9d322abd71bd&src=GD_JOB_VIEW&t=SR&vt=w&cs=1_9dc8164e&cb=1668228383153&jobListingId=1008126850198&jrtk=3-0-1ghl2g82gklt0801-1ghl2g832ii2f801-48858e2bd73ac2c3-
"['Azimuth Corporation', '4.6']",http://www.azimuth-corp.com/,Nanofabrication Engineer,"Berkeley, CA",$75K - $125K (Employer est.),"Status: * Open*
Position Summary
We are looking for a qualified candidate to support on-base research efforts in support of the Air Force Research Laboratory, Materials and Manufacturing Directorate. At the broadest level our research group plans, directs and conducts in house and extramural research and development of materials technologies with an emphasis on functional applications. The Agile Electromagnetic Materials and Processes team, part of the Photonics Branch of the Materials and Manufacturing Directorate (RXAP) at Wright-Patterson Air Force Base, is looking for a research scientist to work in the field of chiral organic-inorganic hybrid materials. These materials hold promise for future DAF applications in sensing for intelligence, surveillance, and reconnaissance (ISR) as well as integrated photonic quantum information systems (QIS). The candidate will lead the synthesis, processing, and characterization of solutions, films, and devices comprising members of this material family.

The successful candidate will implement fundamental scientific principles, sound laboratory practices, and good judgement to lead and execute a research project in the fundamental materials science and optoelectronics of chiral photodetectors. This will entail:",30d+,
"['Medtronic', '4.0']",http://www.medtronic.com/,Nanofabrication Engineer,"Berkeley, CA",$75K - $125K (Employer est.),"Careers that Change Lives:
Engineers and Scientists create our market-leading portfolio of innovations. Join us to make a lasting impact. Help bring the next generation of life-changing medical technology to patients worldwide.
Together, we can change healthcare worldwide. At Medtronic, we push the limits of what technology can do to help alleviate pain, restore health and extend life. We challenge ourselves and each other to make tomorrow better than yesterday. It is what makes this an exciting and rewarding place to be.
Join us to make a lasting impact. We believe that when people from different cultures, genders, and points of view come together, innovation is the result,and everyone wins. Medtronic walks the walk, creating an inclusive culture where you can thrive.
Help bring the next generation of life-changing medical technology to patients worldwide.",30d+,www.glassdoor.com/partner/jobListing.htm?pos=121&ao=1136043&s=58&guid=000001846a28201a856d9d322abd71bd&src=GD_JOB_VIEW&t=SR&vt=w&cs=1_288b7012&cb=1668228389886&jobListingId=1008054524764&jrtk=3-0-1ghl2g82gklt0801-1ghl2g832ii2f801-373c0df0a8f4e984-
"['Secant Group, LLC', '2.8']",http://www.secant.com/,Nanofabrication Engineer,"Berkeley, CA",$75K - $125K (Employer est.),"Who we are:
Secant Group, located in the Philadelphia area, provides biomedical, pharmaceutical, biopharmaceutical, and technical components to industry partners for use in commercialized finished medical devices, drug products, and single-use solutions for cell and gene therapy. The Translational Product Development team serves as the development arm of Secant R&D, and our mission is to bring novel biomaterial solutions to these markets through diverse and innovative development projects with partners.
As a Scientist, you will formulate and prototype drug-loaded polymer implants for the Advanced Biomaterials Development team, by designing and conducting experiments, leveraging your knowledge of biomaterial drug delivery, and contributing ideas and solutions. You will study drug-polymer interactions and make fabrication process improvements for controlled release combination devices, such as parenteral and ocular long-acting implantables. You will have the opportunity to work with teams comprised of multi-disciplinary scientists and non-scientists to effectively coordinate internal efforts and customer requests, while progressing multiple projects through to completion quickly. This position provides you with ample opportunities to keep abreast of innovative and novel scientific developments in the pharmaceutical industry by presenting your own work at meetings, attending conferences, reading relevant literature, contributing to intellectual property, and trialing your ideas in the lab.",30d+,www.glassdoor.com/partner/jobListing.htm?pos=122&ao=1136043&s=58&guid=000001846a28201a856d9d322abd71bd&src=GD_JOB_VIEW&t=SR&vt=w&cs=1_84b25187&cb=1668228391776&jobListingId=1008139819503&jrtk=3-0-1ghl2g82gklt0801-1ghl2g832ii2f801-f6df890fca2642f4-
"['Lawrence Livermore National Laboratory', '4.4']",http://www.llnl.gov/,Nanofabrication Engineer,"Berkeley, CA",$75K - $125K (Employer est.),"Company Description
Join us and make YOUR mark on the World!
Are you interested in joining some of the brightest talent in the world to strengthen the United States’ security? Come join Lawrence Livermore National Laboratory (LLNL) where our employees apply their expertise to create solutions for BIG ideas that make our world a better place.
We are committed to a diverse and equitable workforce with an inclusive culture that values and celebrates the diversity of our people, talents, ideas, experiences, and perspectives. This is essential to innovation and creativity for continued success of the Laboratory’s mission.
Job Description
All your information will be kept confidential according to EEO guidelines.",30d+,www.glassdoor.com/partner/jobListing.htm?pos=123&ao=1136043&s=58&guid=000001846a28201a856d9d322abd71bd&src=GD_JOB_VIEW&t=SR&vt=w&cs=1_cf7f9ec1&cb=1668228394734&jobListingId=1008156685165&jrtk=3-0-1ghl2g82gklt0801-1ghl2g832ii2f801-da991fde6a5653ca-
"['FIREANT STUDIO', '3.5']",http://www.fireantstudio.com/,Nanofabrication Engineer,"Berkeley, CA",$75K - $125K (Employer est.),"ABOUT THE POSITION
FIREANT STUDIO is looking for a Web Developer to join our team of high-skilled developers in building custom, award-winning websites and digital solutions. You will have an opportunity to build web experiences across a myriad of industries, providing unique challenges and opportunities for creative problem solving and advanced programming concepts to build high-quality, dynamic websites. Our ideal candidate has demonstrated strong technical and problem-solving skills, a passion for technology and strong leadership qualities.
This is a full-time, in-office or full-telecommute opportunity. We leverage all the great tools on the web to get work done, and done well. The position offers excellent work life balance with exciting opportunities for personal growth and advancement.",30d+,www.glassdoor.com/partner/jobListing.htm?pos=124&ao=1136043&s=58&guid=000001846a28201a856d9d322abd71bd&src=GD_JOB_VIEW&t=SR&vt=w&cs=1_0f49d475&cb=1668228396989&jobListingId=1007304168172&jrtk=3-0-1ghl2g82gklt0801-1ghl2g832ii2f801-ec8c033908408b90-
"['Mojo Vision', '5.0']",http://mojo.vision/,Nanofabrication Engineer,"Berkeley, CA",$75K - $125K (Employer est.),"Mojo Vision is the Invisible Computing Company dedicated to developing products and platforms that re-imagine the intersection of ideas, information, and people. Instead of being tethered to devices that are increasingly a distraction in many aspects of our lives, Mojo envisions delivering information and knowledge that is immediate but without the disruption of traditional instruments. Mojo is inventing the future of computing – Invisible Computing – which imagines a world where information is there when you need it, the technology fades away, and you can freely connect with others in a more meaningful and confident way.
Founded by technology experts with decades of experience developing pioneering products and platforms and backed by some of the world’s leading technology investors, Mojo believes the future is invisible. Mojo Vision is based in Saratoga, CA.

We are looking for a Vice President of Business Development for our Micro-LED display business. You will develop and own the business strategy for the display business, working closely with product management, engineering, and finance to ensure cross-functional alignment of objectives. You will work with your management and peers to develop the investment thesis for the display business and support the presentation of this to investors. You will develop strategic partnerships that drive business and support the creation of a healthy ecosystem for our products. You will work cross-functionally to define and drive the P&L for the business. You will build and manage a team of business development, sales and marketing professionals as the business grows.",30d+,
"['MST', '2.4']",http://www.grupomst.com/,Nanofabrication Engineer,"Berkeley, CA",$75K - $125K (Employer est.),"Working for Micro Systems Engineering, Inc. (MSEI) means joining an elite team to work on some of the most
exciting challenges in medical technology today. We are a pioneer in developing innovative implantable medical
device technologies and devices that save and enhance the quality of life for millions of individuals living with
cardiovascular and chronic neurologic pain disorders. With more than 40 years of experience in design and
manufacturing active implantable medical devices, our continuing success is based on our company’s core",30d+,www.glassdoor.com/partner/jobListing.htm?pos=126&ao=1136043&s=58&guid=000001846a28201a856d9d322abd71bd&src=GD_JOB_VIEW&t=SR&vt=w&cs=1_03ee9c2b&cb=1668228403549&jobListingId=1007408557265&jrtk=3-0-1ghl2g82gklt0801-1ghl2g832ii2f801-8a605c7c78b06038-
"['CEDARS-SINAI', '4.1']",https://jobs.cedars-sinai.edu/,Nanofabrication Engineer,"Berkeley, CA",$75K - $125K (Employer est.),"Are you ready to be a part of breakthrough research?
The Groups of Drs. Li and Han at Cedars-Sinai focuses on novel magnetic resonance hardware and methodologies for in vivo applications. To learn more, please visit: Li Research Lab | Cedars-Sinai & Han Research Lab | Cedars-Sinai .
Cedars-Sinai Medical Center, affiliated with UCLA, is a world-leading hospital and is currently ranked #7 nationally on the Best Hospitals Honor Roll. The Cedars-Sinai Biomedical Imaging Research Institute (BIRI) is one of leading MRI research groups with a central focus on developing and applying novel imaging technologies to today’s most pressing translational research and clinical questions. BIRI has been constantly growing into a team of 70 onsite personnel including research and clinician scientists, technical and support staff, postdoctoral scientists and doctoral students. BIRI has two full-time on-site MRI scientists from Siemens Healthcare.


Project Scientist - Li & Han Lab - Biomedical Imaging Research Institute
BMS - BioMed Imaging Res Inst
Academic / Research
,Academic/Research,Academic/Research
Research Studies/Clinical Trials
Full-time
8 hour shift
Day",30d+,www.glassdoor.com/partner/jobListing.htm?pos=127&ao=1136043&s=58&guid=000001846a28201a856d9d322abd71bd&src=GD_JOB_VIEW&t=SR&vt=w&cs=1_42029f0b&cb=1668228405392&jobListingId=1007947191413&jrtk=3-0-1ghl2g82gklt0801-1ghl2g832ii2f801-b7c40ca20707661e-
"['BIOTRONIK SE & Co. KG', '3.6']",http://www.biotronik.com/,Nanofabrication Engineer,"Berkeley, CA",$75K - $125K (Employer est.),"Working for Micro Systems Engineering, Inc. (MSEI) means joining an elite team to work on some of the most
exciting challenges in medical technology today. We are a pioneer in developing innovative implantable medical
device technologies and devices that save and enhance the quality of life for millions of individuals living with
cardiovascular and chronic neurologic pain disorders. With more than 40 years of experience in design and
manufacturing active implantable medical devices, our continuing success is based on our company’s core",30d+,www.glassdoor.com/partner/jobListing.htm?pos=128&ao=1136043&s=58&guid=000001846a28201a856d9d322abd71bd&src=GD_JOB_VIEW&t=SR&vt=w&cs=1_d0d9db2a&cb=1668228409363&jobListingId=1007134889660&jrtk=3-0-1ghl2g82gklt0801-1ghl2g832ii2f801-91c75e464ff5ccb6-
"['OXOS Medical, Inc.', '5.0']",http://www.oxos.com/,Nanofabrication Engineer,"Berkeley, CA",$75K - $125K (Employer est.),"OXOS Medical, Inc. is a fast-growing medical technology startup that is revolutionizing radiology with its FDA cleared, handheld, digital X-ray imaging system, the Micro C®. OXOS Medical puts the future of x-ray in the palm of your hand with unprecedented safety and speed. We enable anyone anywhere to access radiologic diagnostics at the point of care, expanding availability and changing the way healthcare is delivered.
OXOS Medical is constantly innovating, building on our best-in-class imaging device, expanding into cloud-based imaging platforms, robotic guided imaging, intraoperative computed tomography, and telemedical solutions. OXOS Medical has raised $20M to date from prominent MedTech investors, venture capital firms, and renowned orthopedic surgeons.
OXOS is searching for a X-Ray Sr. Scientist to join our high growth company. The ideal candidate will be joining a dynamic team of passionate people who work daily to change the way radiographic diagnostics are delivered. OXOS’ mission is to increase access and availability using the world’s first handheld Dynamic Digital Radiography Device, the Micro C. The X-Ray Sr. Scientist will be responsible for developing X-Ray imaging systems to enable new product development and enhancements of the current product line. The successful candidate will be a key member of the OXOS Medical X-Ray Electronics Engineering group and will be responsible for X-Ray imaging system research and development projects. The successful candidate will be a key member of the X-Ray Electronics development group with primary responsibilities in research and development related tasks. These tasks will include writing product specifications, system modelling, algorithm development, and providing guidance to product development engineers. Designing cutting edge X-Ray imaging systems to advance performance, safety, and reliability of the OXOS Medical product line will be the primary goal of this position.",30d+,
"['University of Minnesota', '4.2']",http://www.umn.edu/,Nanofabrication Engineer,"Berkeley, CA",$75K - $125K (Employer est.),"Required:
A Ph.D. in a relevant field of Engineering or Biology or a related field
Strong computer programming skills (especially cross-platform C++ and/or Matlab).
Demonstrated biophysical modeling expertise
A demonstrated track record of productive research is required (1st author publications in established journals).

Preferred:
Expertise in mammalian cell culture, live cell imaging via fluorescence and transmitted light microscopy, cloning, gel electrophoresis, DNA & RNA purification, and statistical analysis of data.",9d,www.glassdoor.com/partner/jobListing.htm?pos=130&ao=1136043&s=58&guid=000001846a28201a856d9d322abd71bd&src=GD_JOB_VIEW&t=SR&vt=w&cs=1_c864cb79&cb=1668228417214&jobListingId=1008252880738&jrtk=3-0-1ghl2g82gklt0801-1ghl2g832ii2f801-76b3e24b3bf92675-
"['Options Clearing Corporation', '3.6']",http://www.theocc.com/,"Associate Principal, Software Engineering: UI/UX","Chicago, IL",$96K - $139K (Glassdoor est.),"Who We Are
The Options Clearing Corporation (OCC) is the world's largest equity derivatives clearing organization. Founded in 1973, OCC is dedicated to promoting stability and market integrity by delivering clearing and settlement services for options, futures and securities lending transactions. As a Systemically Important Financial Market Utility (SIFMU), OCC operates under the jurisdiction of the U.S. Securities and Exchange Commission (SEC), the U.S. Commodity Futures Trading Commission (CFTC), and the Board of Governors of the Federal Reserve System. OCC has more than 100 clearing members and provides central counterparty (CCP) clearing and settlement services to 19 exchanges and trading platforms. More information about OCC is available at www.theocc.com.
What We Offer
A highly collaborative and supportive environment developed to encourage work-life balance and employee wellness. Some of these components include:
A hybrid work environment, up to 3 days per week of remote work",30d+,www.glassdoor.com/partner/jobListing.htm?pos=101&ao=1110586&s=58&guid=000001846a298f13a28a94bfec046dc0&src=GD_JOB_VIEW&t=SR&vt=w&cs=1_dc3bca64&cb=1668228435415&jobListingId=1007844167633&cpc=9908D8D4413DBB8A&jrtk=3-0-1ghl2j3spkujg801-1ghl2j3tggrgj800-85696ff334fd4b2a--6NYlbfkN0DHTfY2R4CHA1M8nnimMZ5tgIxVB9jIrd-jfrUmz0n1tYErFHFlQVjz5yC5_5zxZ6SfZqB5mkmnjkB9DdPZ_nE_nFK5K5sKBgt6BDzrYQBwuSNpIM5jqPlNeBVjV-MUbbZ9y0o15qkncgeoBjsX0x2lNMNB5vIWLzY71Caob2IB5vOyHe_HTWRHhfeMD2i-qYbSj2b0QWBXmrV1cgDVVeGNhgJCb5-1OcTKECrXikZLuv8q960QaOHYIoJSn5cpK_GPDkrbQuAY_oXKhBqwiUefa0a_AqoOrxMJM6_u6KDdqHDVQGodNrQvWfaAspJkXqYYNk76vlJH8Y_ljNWnxSLMjWtgFbNCiU1qvYqhU7My7b8IVWDL6BJr3jVuEJ52SPT4rAaKjCRCC8ewhFKm0nn72oY3bfqCc_AHbTURbqhxlkEvpXHHeI_i_fs5yGOntezWmN_TzpFoG4-WCTn2GYjVi0adceLb6e3XRbm3uI0hQXO0pWuGwvgRO8Mrfy6zEBcuXB4apkpEMS5X5pAviIYx8fTZy_QS7Jg7gWVqompHwpjmjrqNmf-SsgcVUoAsydEisURr6r92OZpcd-xh41ziVssX9PhMkWdcQRw_OBp8Ng%3D%3D
"['ChampionX', '3.6']",http://www.championx.com/,"Associate Principal, Software Engineering: UI/UX","Chicago, IL",$96K - $139K (Glassdoor est.),"ChampionX is seeking a Device Platform Engineering Manager in Knoxville, TN or The Woodlands, TX. This position is part of the strategic leadership team of ChampionX that drives business success. The Device Platform Engineering Manager is accountable for managing and leading a team of Engineers to design and develop innovative automation technology used for artificial lift oil production. Responsible for directing, leading and driving all aspects of cross functional product development related activities from idea-to launch.
What’s in it For You:
A flexible, independent work environment.
Access to best-in-class resources, tools, and technology.
Thrive in a company that values a culture of safety.",30d+,www.glassdoor.com/partner/jobListing.htm?pos=102&ao=1110586&s=58&guid=000001846a298f13a28a94bfec046dc0&src=GD_JOB_VIEW&t=SR&vt=w&cs=1_78837185&cb=1668228437191&jobListingId=1008181722877&cpc=3BA4CE39D5B5DEF5&jrtk=3-0-1ghl2j3spkujg801-1ghl2j3tggrgj800-a3aae47b90f41eeb--6NYlbfkN0DUpEo3no2hQ-kw48Wgth6or7nMQVrRpdXrxnGnkjmUuuqLlxXfT3-UO9SHhmSlaNqorT_R1NTedBbFACXib1SE-Lrml9YBKY_vmeYAaV7x-nOeV4s7K9-41GAGy0QQmcJV6k3AQGBTEv-yRJKLY9PupBRaeBwKJEcUsUruxrvp5bUNcxPXBnB3DFVcTOG_ZCujMQ7ScnqkejgW46cZ2ZDIh-KE0VL35XDOyOoLr55MXo6G55eDTPsswT5Lse9B6fyunAirjU0_Laur7jw8N__iGBjSl_qIork3c7QeUY_QdAq5WA-NJPMswvIKkaI1FvGINwVJKuqos6s_7yzZA5bMFHfw6uBxAjsVghN416lmPplvYyenYPuWHl4cGOY25NmYDvS0iiETANkOmnENTBul_wyVVr-OUCliReWF8Q0mW5veb_8OBYF9VCgVGqr-wavl3LxJwm-ZDx1e1T0N4SAhAz33_ap9y073kQY2S1HD4lmGlFBRyzKCX1BSpYZbOqhrOT1leKvXIMZJ6PcBP6lGngJ_0sG1R1cXw8EYNnKV3-hZfTFgrJZET5yBypan8i6a81nomO_Xv2pSt29QENNpkG_dLJM7iYboo2BN5Iw3WFurrl37qmRlL-YaC4eUvgywv_tBaS625TvA2rDzBlnAR8yxa6B6SbI9C15aTnXlUdkxlZDSdBfXj7dpDCKXKZbYcGzYZhA0WiwaU8i6KwmtibdtanIyJn_4_r7eHMEz1_lZNfcQlbZY7hAcsCaJKYxa5LuqGBdslT4WSFARXUp4ng1X8hv-CyFHXCSFQF9HHHPLUoBv8AW70ePAOfJttZtCbvr0gN43m8Tc0tLWWW7Rrv6yULVl_8Br5j56I2Q_HvHCH1cF_rFcZKhSh4aio55guoYDKq-wEwccZT4w_2lviPFY1n1_hvn1Les6XkaTpG-gMABpAUpy2k7y_pY-uXDB7UQ07a2z7QEBbDWZ1KYLZcmtIsFeR6696CVZoqb5TnOK1ESXGnFWJIJBKnCoh-P5EF7tftDx_oHtUaTFgZ4pmYpC9C3HOu8391B2ys7sCE1YeU2APl8TsGCDPL7ZN_WBZFw7kjHiskWtnweKg-1M2Ha47kApBgwLVutt8KNLt-DqBIhH_Lrype90QLP3btalhkJn0CJTgCq1kPKrXtlmjPmuEAk_Emn6vArTbmnpHtXkGwFAua8KzZ-kIa40m7QIRup2UOw4eo4AIAEPQD9UsScsgTuCbcnmyywbJqyezg%3D%3D
"['APR Consulting Inc', '3.9']",http://www.aprconsulting.com/,"Associate Principal, Software Engineering: UI/UX","Chicago, IL",$96K - $139K (Glassdoor est.),"An aerospace client is looking for an Embedded Software Engineer 2 who will be a part of a team developing a Secure Processor ASIC as well as a full SDK (libraries, drivers, tools).
Location: Beavercreek, OH 45431
Position: Embedded Software Engineer 2
Pay Rate: $53.81/hr on W2
Duration: 12 months or longer

Responsibilities:",1d,
