Company_Name,Company_Link,Title,Location,Estimated_Salary,Job_Description,Job_Age,Application_Link
"['Spectrum Brands', '3.8']",http://www.spectrumbrands.com/,Angular/C# Software Engineer (Mid Level),"Monett, MO",$58K - $85K (Glassdoor est.),"Division Information

The Hardware and Home Improvement (HHI) division of Spectrum Brands, located in Orange County, CA, is a major manufacturer and supplier of residential locksets, residential builders' hardware, faucets, and commercial locksets and doors, with a portfolio of renowned brands, including Kwikset®, Weiser®, Baldwin®, National Hardware®, Pfister™, EZSET®, and Tell. We have a history and reputation of blending trend-leading designs with game-changing innovation to deliver an exceptional consumer experience, earning #1 market share on most of our lines. If you’re passionate about home improvement—and maybe have a pin board or two of design ideas on your favorite app—this may be a great place for you.

Job Summary













Job Reference: US15099",16d,
"['Alif Semiconductor', '3.8']",http://www.alifsemi.com/,Angular/C# Software Engineer (Mid Level),"Monett, MO",$58K - $85K (Glassdoor est.),"Alif Semiconductor is revolutionizing the way to create secure connected AI-enabled embedded solutions. We are looking for self-driven and motivated Senior Application Engineer with AI/ML experience in Pleasanton, CA to help us promote and support the groundbreaking family or Ensemble and Crescendo Micro Controllers that have received a lot of industry attention.
Responsibilities:
Design Embedded Firmware, Application Examples and a Proof-of-Concept solutions.
Develop reference designs in cooperation with Partners and Independent Design Houses.
Create and present training material targeting embedded applications and solutions.
Develop/Port machine learning software algorithms applying relevant scientific rigor to analyze data.",28d,www.glassdoor.com/partner/jobListing.htm?pos=121&ao=1136043&s=58&guid=000001846a22958c9788753bc528a1e7&src=GD_JOB_VIEW&t=SR&vt=w&cs=1_0508f97e&cb=1668228029781&jobListingId=1008206657227&jrtk=3-0-1ghl255duma5k801-1ghl255efirkn800-929f53485049d69c-
"['TekTreeINC', '4.2']",https://tektreeinc.com/,Angular/C# Software Engineer (Mid Level),"Monett, MO",$58K - $85K (Glassdoor est.),"Job Description
Overview
The client is looking for a candidate to fulfill a hands-on technical team member role responsible for both process and technology development. The candidate will be involved in all aspects of product and process development, from the early stages of the concept development up through process validation, market launch, and beyond. The candidate will work closely with their R&D and Operations partners, insuring that reliable, capable, and sustainable processes are developed, while ensuring that product performance is not compromised. The candidate will, with little supervision, develop new and innovate from current manufacturing processes, design fixturing/tooling, define process/design controls, work with custom and off the shelf equipment vendors, and work towards and accomplish process validation with Operations. The candidate will influence the technical team, providing guidance via sound engineering judgement and structured data analysis",23d,
"['Advanced Micro Devices, Inc.', '4.2']",http://www.amd.com/,Angular/C# Software Engineer (Mid Level),"Monett, MO",$58K - $85K (Glassdoor est.),"What you do at AMD changes everything
We care deeply about transforming lives with AMD technology to enrich our industry, our communities and the world. Our mission is to build great products that accelerate next-generation computing experiences – the building blocks for the data center, artificial intelligence, PCs, gaming and embedded. Underpinning our mission is the AMD culture. We push the limits of innovation to solve the world’s most important challenges. We strive for execution excellence, while being direct, humble, collaborative and inclusive of diverse perspectives. This is who we are at our best. One Company. One Team.
AMD together we advance_
CPU Emulation Design Verification Engineer",7d,www.glassdoor.com/partner/jobListing.htm?pos=123&ao=1136043&s=58&guid=000001846a22958c9788753bc528a1e7&src=GD_JOB_VIEW&t=SR&vt=w&cs=1_6c78de40&cb=1668228034473&jobListingId=1008257215765&jrtk=3-0-1ghl255duma5k801-1ghl255efirkn800-8ea64e23434dace5-
"['Ambiq Micro', '4.5']",http://www.ambiqmicro.com/,Angular/C# Software Engineer (Mid Level),"Monett, MO",$58K - $85K (Glassdoor est.),"Company Overview:
Ambiq has been on a singular mission since 2010 to put intelligence everywhere by creating the most energy-efficient semiconductor solutions for IoT endpoint devices. Using the revolutionary Subthreshold Power Optimized Technology (SPOT®) Platform, Ambiq’s record-breaking ultra-low power solutions, including MCU and SoCs, have helped global device makers deliver more than 150 million products with advanced features, enhanced performance, and extended battery life.
With a leading market share in wearables at the speed of shipping 1 million units per month, Ambiq is now expanding its impact on novel endpoint products such as hearables, smart home automation, industrial IoT preventive monitoring, and more.
Our innovative and fast-moving teams of research, development, production, marketing, sales and operations are spread across several continents, including the US (Austin and San Jose), Taiwan (Hsinchu), China (Shenzhen and Shanghai), Japan (Tokyo), and Singapore. We value continued technology innovation, fanatical attention to customer needs, collaborative decision making, and, above all, enthusiasm for energy efficiency. We embrace candidates who also share these same values. The successful candidate must be self-motivated, creative, and comfortable learning and driving exciting new technologies. We encourage and nurture an environment for growth and opportunities to work on complex, interesting, and challenging projects that will create a lasting impact. Come join us on our quest for 100 billion devices. The endpoint intelligence revolution starts here.",30d+,www.glassdoor.com/partner/jobListing.htm?pos=124&ao=1136043&s=58&guid=000001846a22958c9788753bc528a1e7&src=GD_JOB_VIEW&t=SR&vt=w&cs=1_7ddee9f3&cb=1668228038296&jobListingId=1008027459002&jrtk=3-0-1ghl255duma5k801-1ghl255efirkn800-a8515bd9c9dc654f-
"['Xenter', '2.5']",http://xentermd.com/,Angular/C# Software Engineer (Mid Level),"Monett, MO",$58K - $85K (Glassdoor est.),"Reports to:
Director, Research & Development

Overview:
Xenter Medical Technologies is looking for a candidate to fulfill a hands-on technical team member role responsible for both process and technology development. The candidate will be involved in all aspects of product and process development, from the early stages of the concept development up through process validation, market launch, and beyond. The candidate will work closely with their R&D and Operations partners, insuring that reliable, capable, and sustainable processes are developed, while ensuring that product performance is not compromised. The candidate will, with little supervision, develop new and innovate from current manufacturing processes, design fixturing/tooling, define process/design controls, work with custom and off the shelf equipment vendors, and work towards and accomplish process validation with Operations. The candidate will influence the technical team, providing guidance via sound engineering judgement and structured data analysis",24d,www.glassdoor.com/partner/jobListing.htm?pos=125&ao=1136043&s=58&guid=000001846a22958c9788753bc528a1e7&src=GD_JOB_VIEW&t=SR&vt=w&cs=1_8b4425e5&cb=1668228041153&jobListingId=1008216587175&jrtk=3-0-1ghl255duma5k801-1ghl255efirkn800-f3bca1adbe849dc7-
"['Madison Square Garden Entertainment', '3.8']",http://www.msgentertainment.com/,Angular/C# Software Engineer (Mid Level),"Monett, MO",$58K - $85K (Glassdoor est.),"Who are we hiring?

The Network Operations Engineer will work with the Senior Network Engineer to get an all-round understanding of networks and systems. The Network Operations Engineer will be responsible for resolving complex issues that involve analyzing packets and troubleshooting networks, supporting and maintaining Voice and Video networks. This role is the crucial point of contact between the network operations team and other internal departments. The engineer must work towards improving the quality of technical and telecommunication services. The Network Operations Engineer will offer Network Support that includes operation and change management, fulfils the request for Network Devices such as Routers, Firewalls, WAN Optimization. Network Operations Engineer will examine, evaluate and monitor the incoming network change requests.

What will you do?











At MSG, we recognize the importance of upskilling employees’ talents and strengths so they can drive their careers forward. We are proud to offer a robust set of tools and resources to help employees understand their interests and purpose, harness their talents and obtain the skills they need to reach the next step in their careers. Growth and longevity for our employees are top priorities here.



At MSG we value diversity and are looking for extraordinary employees of all backgrounds! MSG is an Equal Opportunity Employer and provides equal employment opportunities to all employees and applicants for employment without regard to race, color, religion, gender, sexual orientation, gender identity or expression, sexual and reproductive health choices, national origin, citizenship, age, genetic information, disability, or veteran status. In addition to federal law requirements, MSG complies with all applicable state and local laws governing nondiscrimination in all locations. #LI-AB1",30d+,www.glassdoor.com/partner/jobListing.htm?pos=126&ao=1136043&s=58&guid=000001846a22958c9788753bc528a1e7&src=GD_JOB_VIEW&t=SR&vt=w&cs=1_b833c751&cb=1668228043007&jobListingId=1007851629725&jrtk=3-0-1ghl255duma5k801-1ghl255efirkn800-c026b49ecaca27be-
"['Samsung Semiconductor, Inc.', '4.2']",https://www.samsung.com/us/samsungsemiconductor,Angular/C# Software Engineer (Mid Level),"Monett, MO",$58K - $85K (Glassdoor est.),"Advancing the World's Technology Together
Our technology solutions power the tools you use every day-including smartphones, electric vehicles, hyperscale data centers, IoT devices, and so much more. Here, you'll have an opportunity to be part of a global leader whose innovative designs are pushing the boundaries of what's possible and powering the future.
We believe that innovation and growth are driven by an inclusive culture and a diverse workforce. We're dedicated to empowering people to be their true selves. Together, we're building a better tomorrow for our employees, customers, partners, and communities.
Samsung Semiconductor Inc. (SSI) is advancing the world's technology. As a leader in Memory, System, LSI and LCD technologies, our US teams contribute to breakthroughs in 5G, SOC, memory and display. With our global perspective and diversity of thought, we proudly serve our customers around the world. We are looking for team members who share our commitment to learning and growth and excel when collaborating within and across teams.",30d+,www.glassdoor.com/partner/jobListing.htm?pos=127&ao=1136043&s=58&guid=000001846a22958c9788753bc528a1e7&src=GD_JOB_VIEW&t=SR&vt=w&cs=1_59d0bf3c&cb=1668228045953&jobListingId=1008183968664&jrtk=3-0-1ghl255duma5k801-1ghl255efirkn800-ee782f5bc95b7fad-
"['Analog Devices', '4.1']",http://www.analog.com/,Angular/C# Software Engineer (Mid Level),"Monett, MO",$58K - $85K (Glassdoor est.),"Analog Devices (NASDAQ: ADI) designs and manufactures semiconductor products and solutions. We enable our customers to interpret the world around us by intelligently bridging the physical and digital worlds with unmatched technologies that sense, measure and connect.

Analog Devices, Inc. is looking for a Staff Digital Design Engineer to join our Digital Platforms Platform Team in Tampa, FL, Wilmington, MA, Raleigh, NC, Bengaluru, India or at other ADI Site locations.

About ADI:",30d+,www.glassdoor.com/partner/jobListing.htm?pos=128&ao=1136043&s=58&guid=000001846a22958c9788753bc528a1e7&src=GD_JOB_VIEW&t=SR&vt=w&cs=1_7f39920a&cb=1668228048732&jobListingId=1008056064345&jrtk=3-0-1ghl255duma5k801-1ghl255efirkn800-168fa647bada065c-
"['Trend Micro', '4.0']",http://www.trendmicro.com/,Angular/C# Software Engineer (Mid Level),"Monett, MO",$58K - $85K (Glassdoor est.),"Trend Micro, a global cybersecurity leader, helps make the world safe for exchanging digital information. Fueled by decades of security expertise, world-leading global threat research and intelligence, and continuous innovation, our cybersecurity platform protects hundreds of thousands of organizations and millions of individuals across clouds, networks, devices, and endpoints

With 7,000 employees across 65 countries, and the world’s most advanced global threat research and intelligence, Trend Micro enables organizations to simplify and secure their connected world.
TrendMicro.com
Overview:
The Technical Support Engineer for Trend Micro is a technical leader with the opportunity to solve technically complex, and often critical, problems. They handle several technical support scenarios across multiple Trend Micro product lines. As a trusted advisor to network, cloud, and security professionals, they supply post sales technical support and service from first contact via phone/web-based case creation through problem resolution. They use advanced observation, detection and troubleshooting methods to resolve problems that require a broad technical understanding. They also contribute to the growth of other engineers through mentoring, training and collaboration during problem solving. Due to customer requirements, we can only accept applicants who are US Citizens.",21d,www.glassdoor.com/partner/jobListing.htm?pos=129&ao=1136043&s=58&guid=000001846a22958c9788753bc528a1e7&src=GD_JOB_VIEW&t=SR&vt=w&cs=1_bc42cf49&cb=1668228052580&jobListingId=1008222993422&jrtk=3-0-1ghl255duma5k801-1ghl255efirkn800-9b5b27ad3e56458d-
"['Super Micro Computer, Inc.', '2.8']",http://www.supermicro.com/,Angular/C# Software Engineer (Mid Level),"Monett, MO",$58K - $85K (Glassdoor est.),"Job Req ID: 15436
About Supermicro:
Supermicro® is a Top Tier provider of advanced server, storage, and networking solutions for Data Center, Cloud Computing, Enterprise IT, Hadoop/ Big Data, Hyperscale, HPC and IoT/Embedded customers worldwide. We are the #5 fastest growing company among the Silicon Valley Top 50 technology firms. Our unprecedented global expansion has provided us with the opportunity to offer a large number of new positions to the technology community. We seek talented, passionate, and committed engineers, technologists, and business leaders to join us.
Job Summary:
As a global leader for networking solution innovation, Super Micro Computer's mission is to develop and provide the market with end-to end computing solution and high performance networking products. The candidate will play a key role in the development process of in-house server motherboards, by working collaboratively with cross-functional engineering team as well as outside partners to ensure the robust design of the boards. As a Sr. Hardware Design Engineer, you are expected to be self-motivated and possess a strong will to do great things, with result-driven mindset to develop the most competitive and endurance board products.",30d+,www.glassdoor.com/partner/jobListing.htm?pos=130&ao=1136043&s=58&guid=000001846a22958c9788753bc528a1e7&src=GD_JOB_VIEW&t=SR&vt=w&cs=1_bfd405de&cb=1668228055499&jobListingId=1007330906811&jrtk=3-0-1ghl255duma5k801-1ghl255efirkn800-e522190c2f0580d0-
