Company_Name,Company_Link,Title,Location,Estimated_Salary,Job_Description,Job_Age,Application_Link
"['Adapt Forward', '4.0']",http://www.adaptforward.com/,Cyber Security Engineer - Business Analyst (Remote),"Franklin, TN",$70K - $96K (Glassdoor est.),"Computer Network Defense & Incident Response Analyst

Charleston, SC

Minimum of a Secret Clearance Required with ability to obtain TS/SCI.

Position Description
As a CND Incident Response Analyst you will identify, isolate, investigate, inform, and implement measures to detect and protect data across a wide spectrum of sources and locations. You will validate suspicious events or reports and determine if the event constitutes an incident. You will ensure incidents are properly entered into the appropriate reporting system and determine the severity of the incident.",30d+,
"['CHS Inc', '3.7']",https://www.chsinc.com/,Cyber Security Engineer - Business Analyst (Remote),"Franklin, TN",$70K - $96K (Glassdoor est.),"CHS Inc. is a leading global agribusiness owned by farmers, ranchers and cooperatives across the United States that provides grain, food and energy resources to businesses and consumers around the world. We serve agriculture customers and consumers across the United States and around the world. Most of our 10,000 employees are in the United States, but today we have employees in 19 countries. At CHS, we are creating connections to empower agriculture.
Summary
Middle office employees perform functions that support the operations of the front office in various areas, such as risk management, financial control, strategic management, and information technology. The department’s employees ensure that the deals transacted by the front office are accurately recorded and processed and that all compliance documents are filled and completed. They also provide the front office with market data related to various securities and financial markets to help risk managers mitigate market risk and stay within the limits of risk management policy. Middle Office Analysts mitigate market and financial risk exposure through trade interpretation and analysis along with ensuring proper regulatory and financial compliance and general ledger activity.",16d,www.glassdoor.com/partner/jobListing.htm?pos=112&ao=1136043&s=58&guid=000001846b7ce0e7ba43cf4769b5deea&src=GD_JOB_VIEW&t=SR&vt=w&cs=1_d8400a19&cb=1668250694266&jobListingId=1008235246370&jrtk=3-0-1ghlnpo9nkuhk801-1ghlnpoadi14k800-fe88539ca65f5881-
"['Acuity International', '3.3']",http://acuityinternational.com/,Cyber Security Engineer - Business Analyst (Remote),"Franklin, TN",$70K - $96K (Glassdoor est.),"Our vision aims to empower our clients by actively leveraging our broad range of services. With our global presence, we have career opportunities all across the world which can lead to a unique, exciting and fulfilling career path. Pick your path today! To see what career opportunities we have available, explore below to find your next career!
SCOPE:
This position is responsible for supporting the DoD Agency medical aspects of service delivery under a particular contract(s) within the Exam Management Department. Works directly with program management to support the performance of the contract while working within the agency location, in order to meet agreed-upon commitments under assigned contract(s). Supports the PM in the execution of service deliverables per the contract while consistently achieving profit targets. Serves as the on the ground interface with the client, under the guidance of the program management team. This position is employed by Acuity International, however will be working onsite and receives direct reporting orders from the agency’s Program Analyst or otherwise directed by the agency.
Acuity-CHS, LLC",30d+,www.glassdoor.com/partner/jobListing.htm?pos=113&ao=1136043&s=58&guid=000001846b7ce0e7ba43cf4769b5deea&src=GD_JOB_VIEW&t=SR&vt=w&cs=1_69d0f5b0&cb=1668250698580&jobListingId=1008111320217&jrtk=3-0-1ghlnpo9nkuhk801-1ghlnpoadi14k800-eeca80b2c97513d4-
"['King County', '3.9']",http://www.kingcounty.gov/,Cyber Security Engineer - Business Analyst (Remote),"Franklin, TN",$70K - $96K (Glassdoor est.),"Summary
This position will primarily be part of a multi-disciplinary team within the Refugee Health Screening Clinic at our Downtown Public Health Center in Seattle and will focus on facilitating culturally and linguistically appropriate communication between Refugee Health Screening team members (Nurse, Medial Assistant, Administration Specialist) and Ukrainian and Russia to speaking clients. This clinic serves newly arrived refugees, humanitarian parolees and asylees and provides a basic health screening, vaccinations and linkage to ongoing primary care. The position will be based at Downtown Public Health in Seattle. There may be opportunities to work in other Public Health Centers King County such as Eastgate, North Federal Way, Auburn, and Kent.

The purpose of Community Health Services (CHS) Division is to strengthen King County’s safety net services and partnerships to deliver racially just and responsive health care for historically underserved communities. CHS provides direct services through its Public Health Center system (with clinics and other locations across the county), as well as assuring access to quality health-care services through partnerships and regional programs. CHS is a large family, with more than 600 employees, across many roles and services.


As the only jurisdiction in the world named after Dr. Martin Luther King, Jr., one of the most influential civil rights leaders in our nation's history, King County is a vibrant international community with residents that represent countries from around the world. It is a region with increasing diversity that cherishes the traditions of many cultures.

We have a deep commitment to equity and social justice and advancing practices, strategies, and policies that promote fairness, justice, and opportunity for all – in our workplaces and our communities. With this commitment, King County has adopted a pro-equity agenda to advance regional change and ensure that residents from vulnerable communities are incorporated into our emergency planning and public outreach efforts.

Applicants should be committed to working with diverse populations throughout King County to provide excellent customer service to a broad range of cultures, in accordance with the King County Equity and Social Justice Ordinance and the King County Strategic Plan.",30d+,www.glassdoor.com/partner/jobListing.htm?pos=114&ao=1136043&s=58&guid=000001846b7ce0e7ba43cf4769b5deea&src=GD_JOB_VIEW&t=SR&vt=w&cs=1_bf22d449&cb=1668250700001&jobListingId=1008053768393&jrtk=3-0-1ghlnpo9nkuhk801-1ghlnpoadi14k800-ef5a7bc8715b9aa6-
"['Northwest Health La Porte', '3.3']",http://www.nwhealthlaporte.com/,Cyber Security Engineer - Business Analyst (Remote),"Franklin, TN",$70K - $96K (Glassdoor est.),"Directs, plans, supervises, and provides leadership for Pharmaceutical and Outpatient Oncology/Infusion Center Services under the Chief Nursing Officer. Coordinates the functions and activities of each department to provide pharmacy and infusion services for patients and other appropriate individuals and groups throughout La Porte and Starke Hospitals and Health System. Works collaboratively with the medical staff and the CHS pharmacy and infusion teams to provide high quality safe medication therapy and infusion services.",30d+,www.glassdoor.com/partner/jobListing.htm?pos=115&ao=1136043&s=58&guid=000001846b7ce0e7ba43cf4769b5deea&src=GD_JOB_VIEW&t=SR&vt=w&cs=1_505864f1&cb=1668250703848&jobListingId=1007869125108&jrtk=3-0-1ghlnpo9nkuhk801-1ghlnpoadi14k800-43b2e38dbce2fd4b-
"['Los Angeles County Department of Human Resources', '3.6']",http://dhs.lacounty.gov/,Cyber Security Engineer - Business Analyst (Remote),"Franklin, TN",$70K - $96K (Glassdoor est.),"FILING DATES: November 24, 2020 @ 8:00 A.M. (PST)
Until the needs of the service are met and is subject to closure without prior notice.

EXAM NUMBER: Y5456H

TYPE OF RECRUITMENT
Open Competitive Job Opportunity
COVID-19 VACCINATION MANDATE:
All County workforce members must be fully vaccinated against COVID-19 as a condition of employment. Successful candidates for this position will be required to submit proof of vaccination against COVID-19 or request an exemption for qualifying medical or religious reasons during the onboarding process. Candidates should not present proof of vaccination until instructed to do so by the hiring department.















To apply, click on the link below:

https://apps.dhs.lacounty.gov/SpecialRecruitment/Questionnaire?examNo=Y5456H


of your information, it is necessary to ensure that all information is complete and includes all required documents as directed on the job posting in order for your information to be reviewed and processed in a timely manner.",30d+,www.glassdoor.com/partner/jobListing.htm?pos=116&ao=1136043&s=58&guid=000001846b7ce0e7ba43cf4769b5deea&src=GD_JOB_VIEW&t=SR&vt=w&cs=1_f9db27f4&cb=1668250706864&jobListingId=1006765323624&jrtk=3-0-1ghlnpo9nkuhk801-1ghlnpoadi14k800-1da4ceba3cf7fa11-
"['STG International', '3.9']",http://www.stginternational.com/,Cyber Security Engineer - Business Analyst (Remote),"Franklin, TN",$70K - $96K (Glassdoor est.),"STG International (STGi) is currently seeking qualified candidates to support our Federal Occupational Health (FOH) contract as a Clinical Account Executive in Bethesda, Maryland.

Duties and Responsibilities as listed in the contract:
Job Specific Duties and Responsibilities: (customized list of the actual duties performed in support of FOH mission)
The Account Executive (AE) is responsible for the strategic management of the FOH customer relationship. The incumbent works collaboratively with other FOH service components to ensure that service delivery is integrated and seamless to the customer. AEs are responsible for supporting and managing the customer experience ensuring that the customer is highly satisfied with the quality of services received. The AE works in coordination with the assigned Federal POC for each customer to arrange strategic meetings with customers and FOH SME's, in response to customer requests for new or changes to services and to anticipate future needs through ongoing customer assessment. Provides relevant details and information to Account Analyst team to assist with drafting, vetting, and seeking the approval to finalize scope documentation and IAAs, in consultation with the appropriate SME's. The individual assists in the coordination of service matters including basic service charges, ongoing service performance, and service improvement initiatives. Work products support FOH’s Strategic Narrative and customer agency’s vision, goals, and values.





Required Skills



Required Experience",30d+,
"['CHS Inc', '3.7']",https://www.chsinc.com/,"Systems Engineer, Voice\UC","Inver Grove Heights, MN",$61K - $89K (Glassdoor est.),"CHS Inc. is a leading global agribusiness owned by farmers, ranchers and cooperatives across the United States that provides grain, food and energy resources to businesses and consumers around the world. We serve agriculture customers and consumers across the United States and around the world. Most of our 10,000 employees are in the United States, but today we have employees in 19 countries. At CHS, we are creating connections to empower agriculture.
Summary

CHS has an exciting opportunity in the Information Technology group. We are seeking an experienced Systems Engineer (Voice) to join the IT Global Infrastructure team. The ideal candidate will have experience in enterprise support for Skype for Business\Teams as a phone solution, and in particular experience designing, deploying, and supporting Contact center solutions and experience in supporting Audiocodes Session Boarder. In addition, the Voice Engineer must have excellent communication skills, both verbal and written, possess the ability to analyze and problem solve independently as well as prioritize tasks to complete requests and meet deadlines. If interested, apply today!",5d,www.glassdoor.com/partner/jobListing.htm?pos=101&ao=1110586&s=58&guid=000001846b7dba4291fcffcf69cf6a53&src=GD_JOB_VIEW&t=SR&vt=w&cs=1_9792fbd1&cb=1668250729260&jobListingId=1008261035825&jrtk=3-0-1ghlnrejki16u801-1ghlnrek7im92800-5c6fa642f8183b27--6NYlbfkN0C9mbZLvsmOzNegXE07uftS4zluHdwhJrArDgrJtFrNo2tQ4H9xk1RSRuFEdqZP9cr2jfB2D1KFnehQukFlE9_eOTkthA3n6TBraLLk8oTnQu2U9zkR6sOfiknr2-VG8IIVUZLjjsLCcM0zZ0dGzdfBzKcMcUCdOk44RUMAozBT9sMcdRWP7Fe9xcw6qNk0rCCiG-RnqzHtsHADu8fdM6VijOAzM7zclIQa9ZnPqetLnkVd6O3yG8tTb-6eMZXVhuJOcetr9uyUy-LwaU6cfHXq2DfqFitEXLghOwxNvgx0SodV4Upl-TQOxLQhGeUwEsGLlkoJU6UwPzf44HgZvFAaHyMlkdddONzofpAZnZtJ9RCBp3bLrvl8dbrni_PAA52kNNtuPqDVjiKyHupMFxppbalQseXjQymHKbkt-sbQ3EHzqNj2uZSEqAXjaGWXdIkoEnVcX9NjJw%3D%3D
"['CHS Inc', '3.7']",https://www.chsinc.com/,"Systems Engineer, Voice\UC","Inver Grove Heights, MN",$61K - $89K (Glassdoor est.),"CHS Inc. is a leading global agribusiness owned by farmers, ranchers and cooperatives across the United States that provides grain, food and energy resources to businesses and consumers around the world. We serve agriculture customers and consumers across the United States and around the world. Most of our 10,000 employees are in the United States, but today we have employees in 19 countries. At CHS, we are creating connections to empower agriculture.
Summary
CHS has an exciting opportunity in the Information Technology group. We are seeking an experienced Systems Engineer (Voice) to join the IT Global Infrastructure team. The ideal candidate will have experience in enterprise support for Skype for Business\Teams as a phone solution, and in particular experience designing, deploying, and supporting Contact center solutions and experience in supporting Audiocodes Session Boarder. In addition, the Voice Engineer must have excellent communication skills, both verbal and written, possess the ability to analyze and problem solve independently as well as prioritize tasks to complete requests and meet deadlines. If interested, apply today!",30d+,www.glassdoor.com/partner/jobListing.htm?pos=102&ao=1136043&s=58&guid=000001846b7dba4291fcffcf69cf6a53&src=GD_JOB_VIEW&t=SR&vt=w&cs=1_1cf53043&cb=1668250731292&jobListingId=1008156064488&jrtk=3-0-1ghlnrejki16u801-1ghlnrek7im92800-f6aa8c63df9d68b6-
"['CHS', '3.2']",http://www.chsbuffalo.org/,"Systems Engineer, Voice\UC","Inver Grove Heights, MN",$61K - $89K (Glassdoor est.),"Facility: Sisters of Charity Hospital Dever Building
Shift: Shift 1
Status: Full Time FTE: 1.000000
Bargaining Unit: ACE Associates
Exempt from Overtime: Exempt: Yes
Work Schedule: Days
Hours: Monday through Friday 8:00AM to 4:30PM
Summary:

The Lead Technical Engineer—Level I provides advanced technical support and assistance to a broad customer base, specializing in a wide range of products and services. Proactively detect anomalies and performance issues, and bring to resolution to the full satisfaction of our customers and associates. Utilize test tools and equipment to diagnose and isolate the cause of service interruptions on the Catholic Health Network. Work with engineering team members to perform a full range of complex network designs encompassing multiple technologies and make recommendations to project managers regarding the integration of these technologies into the existing network while working with senior staff to ensure platform stability and standardization of implementations. Associates will also have responsibility for mentoring Networking staff for the purpose of support, monitoring, troubleshooting, and knowledge development.",30d+,www.glassdoor.com/partner/jobListing.htm?pos=103&ao=1136043&s=58&guid=000001846b7dba4291fcffcf69cf6a53&src=GD_JOB_VIEW&t=SR&vt=w&cs=1_7f2246f9&cb=1668250735083&jobListingId=1007905400285&jrtk=3-0-1ghlnrejki16u801-1ghlnrek7im92800-fb6faf475f282958-
"['CHS', '3.2']",http://www.chsbuffalo.org/,"Systems Engineer, Voice\UC","Inver Grove Heights, MN",$61K - $89K (Glassdoor est.),"Facility: Administrative Regional Training Cntr
Shift: Shift 1
Status: Full Time FTE: 1.000000
Bargaining Unit: ACE Associates
Exempt from Overtime: Exempt: Yes
Work Schedule: Days
Hours:
8-4 M-F 37.5 hours per week
Summary:

The Lead Security Engineer II will be responsible for executing the technical security vision of the CISO by providing input and assistance to the Information Security Office (ISO), Compliance and Integrity department, and Information Technology (IT) leadership by architecting, designing, and developing secure solutions for the Catholic Health systems, services and processes. The Engineer will conceptualize, create, and disseminate compelling roadmaps, architecture diagrams and high availability solutions with involvement in reviewing and certifying (direct and indirect) changes to the critical systems and their production environments. The Engineer has a primary role in implementing technical security policy, creating & configuring automated alerting schemes, monitoring & reviewing alerts from technologies they administer, identifying potential malicious security activity, and responding to activity by beginning initial triage and escalating information regarding the event timely and according to response plans. Thus, it is very important to demonstrate advance impact analysis skills and knowledge and adherence to change management processes and procedures. Senior staff will also work with the engineering team members to perform a full range of complex network designs encompassing multiple technologies and make recommendations to project managers regarding the integration of these technologies into the existing network while working with staff to ensure platform stability and standardization of implementations. The Engineer will act as escalation point in critical multi user issues and collaborate in identifying root cause of outages, and provide escalation support of issues to other teams when necessary. Engineers in this role also have the responsibility to maintain strong knowledge and expertise in several IT administrator roles (networking and operating systems as examples) with the ability to step in and assist with lead or secondary support roles when required.",30d+,www.glassdoor.com/partner/jobListing.htm?pos=104&ao=1136043&s=58&guid=000001846b7dba4291fcffcf69cf6a53&src=GD_JOB_VIEW&t=SR&vt=w&cs=1_f6677fbc&cb=1668250739077&jobListingId=1008007615105&jrtk=3-0-1ghlnrejki16u801-1ghlnrek7im92800-36faae600441746e-
"['Community Health Systems', '3.4']",http://www.chs.net/,Senior Cloud Data and Machine Learning Engineer,"Antioch, TN",$93K - $129K (Glassdoor est.),"Summary:

Responsible for applying the latest in advanced analytics and ML technology to help CHS and the facilities we serve realize the potential of big data and automation in the cloud. Builds ML models to solve business challenges using Google Cloud technologies and knowledge of proven ML models and techniques.

Essential Duties and Responsibilities",30d+,www.glassdoor.com/partner/jobListing.htm?pos=101&ao=1136043&s=58&guid=000001846b7e2c4f93d73fd2cfde9298&src=GD_JOB_VIEW&t=SR&vt=w&cs=1_4c45fac6&cb=1668250746622&jobListingId=1007676732931&jrtk=3-0-1ghlnsb3qk613801-1ghlnsb4gg4do800-758effcb534790ae-
,,DevOps Pipeline Security Engineer,"Reston, VA",$105K - $148K (Glassdoor est.),,30d+,
"['Acuity International', '3.3']",http://acuityinternational.com/,DevOps Pipeline Security Engineer,"Reston, VA",$105K - $148K (Glassdoor est.),"Our vision aims to empower our clients by actively leveraging our broad range of services. With our global presence, we have career opportunities all across the world which can lead to a unique, exciting and fulfilling career path. Pick your path today! To see what career opportunities we have available, explore below to find your next career!
COVID Notification:
Candidates selected for a position must provide proof of COVID-19 vaccination or have an approved reasonable accommodation request on file for a medical condition or sincerely held religious belief that prevents them from complying with Acuity's mandatory COVID-19 vaccination requirement.
To request a reasonable accommodation form, email
humanresources@acuityinternational.com
The Acuity DevOps Engineer serves as a technical lead for mission-critical production information system operations, ensuring that Acuity cloud services, platforms, and networks meet or surpass customer requirements for availability, performance, and secure operation on a 24x7x365 basis.
Acuity-CHS, LLC",30d+,www.glassdoor.com/partner/jobListing.htm?pos=102&ao=1110586&s=58&guid=000001846b7e601787a9845a3b75c5e5&src=GD_JOB_VIEW&t=SR&vt=w&cs=1_a9321c17&cb=1668250765477&jobListingId=1007731292769&cpc=3BA4CE39D5B5DEF5&jrtk=3-0-1ghlnso26klt0801-1ghlnso2mj4hp800-67e03d106a689403--6NYlbfkN0DJ62wqZ4miQ0chZ6S_utToTuFtQGDqTiSE5zQRSIXVMWBYVXUknzpzLlJksAJ-WS30IFoARa0pw7Vup2IkrQy_7KH4rdFlIKNs2KBZYRrpERF4GM99eYBdEwMXWK0IdEw555tK8xpQhVld12Jk_UWR-Ue78A-fZo_V3Zxo3quva80KIGJVps6LmcmrM8o9cy_1w71v5MoNJ4T4GXm3vc2a9khj8Mb3dY6AMlL7HzqQH1z32OnrZ16DfUtl0YFW2X-v5IrTOyIGNsO-HV0kYyzraHnLtpUGK8PLeG45EWR0A4qEw9arzCz3uClGU7BBDz-JbelDyLm7dosVlRwiSx--DxWfckTerWVBJWzYWQIbZl5g0OuQxvk_NZeGA-q2v1OlEtkCzH_KNT_u06hYgbgtG3JFg-AyrpErWnP6zjSfkTlPbDmjPquqLbeGCrw0gRwTdEIXgd9rCnymIGCRvhGmD1PQn5XYItXjwd_vLuScVQIFLzHdN-SUtTcZGkwjgdJMDkZuMVFI-EDaWLWCpiRNlMoUGr3E40FZpxAdfFIL94Y6MUkUGCwqZ7NAcgHxUu8pe7j_D5XQxw%3D%3D
"['Acuity International', '3.3']",http://acuityinternational.com/,DevOps Pipeline Security Engineer,"Reston, VA",$105K - $148K (Glassdoor est.),"Our vision aims to empower our clients by actively leveraging our broad range of services. With our global presence, we have career opportunities all across the world which can lead to a unique, exciting and fulfilling career path. Pick your path today! To see what career opportunities we have available, explore below to find your next career!
Location: Remote
Clearance Level: None
Primary Function
Working within the Acuity Office of Corporate Technologies, the Senior Telecommunications Engineer will have a high degree of autonomy in establishing daily priorities and activities as part of a “hands-on” position requiring technical and operational skills.",14d,www.glassdoor.com/partner/jobListing.htm?pos=103&ao=1110586&s=58&guid=000001846b7e601787a9845a3b75c5e5&src=GD_JOB_VIEW&t=SR&vt=w&cs=1_6405a3d6&cb=1668250769260&jobListingId=1008240729010&jrtk=3-0-1ghlnso26klt0801-1ghlnso2mj4hp800-24e94c584875d6de--6NYlbfkN0DJ62wqZ4miQ0chZ6S_utToTuFtQGDqTiSE5zQRSIXVMbO2hR0Myj0OilX6xrAfUJjqqq3LheXYl3CCre8jGoAOQdKLg8GZlYrOGkW-jSassPZmRXIt-tXn_PzMkeaob7ofZAW88tMZwDzuMxhMlB5re5WmPkmpnhBqmT7eGfDzOlBxUGARSUGo3VyUiOJMPKQdgS6yn-OZyIOJcOh7kpHmIqV6prKXE2H0MdZREuLMtfOEZ3RjiktGv0N_D6e8faavWI3csznSIAu1eaN2tPM8DrUS6j-YjO7Q3GgTfJS8jc8iqnHQd4eGvh5hCljKZpr31E1XqMwAcXOStnk-QoWUvXUHtT_k393nMPHL8guYnGhHF7OknmqW3gJp_YSGT47CJURnRFqkdHUxY_zqfx6QmF4zNRCyDDwzMUaZaEGxooSBYvkk5e_1rzpZ02LBQEPDjBXy9U22WugC2sPRbQr2DRujrJJHT2hsmLVG4fBpvB8Tg7tt94IUjuSKDbzFgbTJ6b4-_8jEIz9TC1EHbh0el0ALLmfsIl7tsQ4sXPhFlYS6AITH6clkXVWMpFWcRnxhN7v_sHZ1SRdw5ZBqv3kY
"['Community Health Systems', '3.4']",http://www.chs.net/,DevOps Pipeline Security Engineer,"Reston, VA",$105K - $148K (Glassdoor est.),"Community Health Systems is one of the nation’s leading healthcare providers. Developing and operating healthcare delivery systems in 48 distinct markets across 16 states, CHS is committed to helping people get well and live healthier. CHS affiliates 82 operate acute-care hospitals and more than 1,000 other sites of care, including physician practices, urgent care centers, freestanding emergency departments, occupational medicine clinics, imaging centers, cancer centers and ambulatory surgery centers.

Summary:
As a Network Security Specialist, this role reports to the Manager of Network Security. This role develops, engineers, and maintains the Network Security Program for the Cybersecurity Risk Management Department. This role is expected to have expert level knowledge of firewalls and network security technologies. The specialist will be responsible for identifying and remediating security gaps, the continued improvement of existing controls, mentoring and collaborating with other Cyber Security and Information Technology team members to secure the many information technology assets and data of Community Health Systems. The specialist will collaborate with architects to design and implement solutions that better protect CHS systems and data.",30d+,www.glassdoor.com/partner/jobListing.htm?pos=104&ao=1136043&s=58&guid=000001846b7e601787a9845a3b75c5e5&src=GD_JOB_VIEW&t=SR&vt=w&cs=1_472584b4&cb=1668250771944&jobListingId=1008182999487&jrtk=3-0-1ghlnso26klt0801-1ghlnso2mj4hp800-035767e2860400c1-
