Company_Name,Company_Link,Title,Location,Estimated_Salary,Job_Description,Job_Age,Application_Link
"['Oklahoma State University', '4.2']",http://www.okstate.edu/,DevOps Pipeline Security Engineer,"Reston, VA",$105K - $148K (Glassdoor est.),"Provide day-to-day network and server administration of OSU Center for Health Sciences, OSU Cherokee Nation and clinics’ communication and infrastructure systems. Responsible for developing, deploying, and maintaining functional virtual and physical server infrastructure Responsible for the performance, integrity, and security of the OSU CHS network infrastructure by protecting all OSU Center for Health Sciences and clinics’ computer assets from being accessed, tampered with, or physically damaged by unauthorized parties. Configure, install, and troubleshoot Server and other network infrastructure including but not limited to physical and virtual servers and other network devices. Deploy, maintain, and keep Anti-virus software, IPS, DLP, Desktop management software up to date, perform patch management on network devices and server infrastructure. Resolve issues that been escalated. Assist with the automation and implementation of tasks and processes to allow for efficiencies while maintaining a stable and secure environment.",30d+,www.glassdoor.com/partner/jobListing.htm?pos=105&ao=1136043&s=58&guid=000001846b7e601787a9845a3b75c5e5&src=GD_JOB_VIEW&t=SR&vt=w&cs=1_915ee308&cb=1668250773773&jobListingId=1007954872183&jrtk=3-0-1ghlnso26klt0801-1ghlnso2mj4hp800-4afde6682db5c40a-
"['CHS Inc', '3.7']",https://www.chsinc.com/,DevOps Pipeline Security Engineer,"Reston, VA",$105K - $148K (Glassdoor est.),"CHS Inc. is a leading global agribusiness owned by farmers, ranchers and cooperatives across the United States that provides grain, food and energy resources to businesses and consumers around the world. We serve agriculture customers and consumers across the United States and around the world. Most of our 10,000 employees are in the United States, but today we have employees in 19 countries. At CHS, we are creating connections to empower agriculture.
Summary
CHS has an exciting opportunity in our Information Technology group. We are looking for an associate level IT Security Engineer to help support a variety projects that will range in scale and complexity. You must have excellent communication skills, both verbal and written, strong analytical and problem-solving skills, and be able to function in a team-oriented environment with resource and time constraints.",1d,www.glassdoor.com/partner/jobListing.htm?pos=106&ao=1136043&s=58&guid=000001846b7e601787a9845a3b75c5e5&src=GD_JOB_VIEW&t=SR&vt=w&cs=1_c8d67987&cb=1668250775531&jobListingId=1008271230401&jrtk=3-0-1ghlnso26klt0801-1ghlnso2mj4hp800-00865168072e0b04-
"['CHS', '3.2']",http://www.chsbuffalo.org/,DevOps Pipeline Security Engineer,"Reston, VA",$105K - $148K (Glassdoor est.),"Facility: Sisters of Charity Hospital Dever Building
Shift: Shift 1
Status: Full Time FTE: 1.000000
Bargaining Unit: ACE Associates
Exempt from Overtime: Exempt: Yes
Work Schedule: Days
Hours: Monday through Friday 8:00AM to 4:30PM
Summary:

The Lead Technical Engineer—Level I provides advanced technical support and assistance to a broad customer base, specializing in a wide range of products and services. Proactively detect anomalies and performance issues, and bring to resolution to the full satisfaction of our customers and associates. Utilize test tools and equipment to diagnose and isolate the cause of service interruptions on the Catholic Health Network. Work with engineering team members to perform a full range of complex network designs encompassing multiple technologies and make recommendations to project managers regarding the integration of these technologies into the existing network while working with senior staff to ensure platform stability and standardization of implementations. Associates will also have responsibility for mentoring Networking staff for the purpose of support, monitoring, troubleshooting, and knowledge development.",30d+,www.glassdoor.com/partner/jobListing.htm?pos=107&ao=1136043&s=58&guid=000001846b7e601787a9845a3b75c5e5&src=GD_JOB_VIEW&t=SR&vt=w&cs=1_6ee2555d&cb=1668250779351&jobListingId=1007905400285&jrtk=3-0-1ghlnso26klt0801-1ghlnso2mj4hp800-fb6faf475f282958-
"['Cottage Health', '4.2']",http://www.cottagehealth.org/,DevOps Pipeline Security Engineer,"Reston, VA",$105K - $148K (Glassdoor est.),"The Telecommunications Specialist is responsible for all technical aspects of communications systems at Cottage Health facilities. This involves engineering and design of new network and communications facilities including wiring design and management. Coordinates, oversees, and maintains functions of all communications systems including but not limited to phone and voicemail systems, cell repeater systems, pager system, hands free wireless communications system devices. Completes moves, adds and change orders for all systems and troubleshoots hardware and software phone problems at SBCH, CRH, GVCH, SYVCH, the Hollister Building, and all other CH ancillary sites.
This role is also responsible for moves, adds, and changes to telephone systems at all CHS facilities. This includes installing new phones, moving phones, and troubleshooting hardware and software phone problems at SBCH, CRH, GVCH, SYVCH, Hollister Building, and other CHS ancillary buildings.
The Telecommunications Specialist also supervises all communications system vendors while onsite for project rollout as well as routine maintenance. Assures vendor compliance with CHS policies and procedures. Monitors phone system, voicemail and all other associated systems on a regular basis. Troubleshoots problems as they arise. Continually assesses the communications needs of CHS, recommending additions or changes in services, trunks, etc. Trains users on phone and voicemail features. Helps administer, maintain and troubleshoot hands free wireless communication system, cell phone repeaters, distributed antenna systems as well as the associated devices such as Vocera badges, smart phones, tablets, pagers, etc. Designs and engineers network and communications telephone wiring for all campuses. Works with Project Management as necessary to provide design requirements for existing and new facilities.",30d+,www.glassdoor.com/partner/jobListing.htm?pos=108&ao=1136043&s=58&guid=000001846b7e601787a9845a3b75c5e5&src=GD_JOB_VIEW&t=SR&vt=w&cs=1_82329ca9&cb=1668250781326&jobListingId=1008171536044&jrtk=3-0-1ghlnso26klt0801-1ghlnso2mj4hp800-907139b092f2b53a-
"['CHS', '3.2']",http://www.chsbuffalo.org/,DevOps Pipeline Security Engineer,"Reston, VA",$105K - $148K (Glassdoor est.),"Facility: Administrative Regional Training Cntr
Shift: Shift 1
Status: Full Time FTE: 1.000000
Bargaining Unit: ACE Associates
Exempt from Overtime: Exempt: Yes
Work Schedule: Days
Hours:
8-4 M-F 37.5 hours per week
Summary:

The Lead Security Engineer II will be responsible for executing the technical security vision of the CISO by providing input and assistance to the Information Security Office (ISO), Compliance and Integrity department, and Information Technology (IT) leadership by architecting, designing, and developing secure solutions for the Catholic Health systems, services and processes. The Engineer will conceptualize, create, and disseminate compelling roadmaps, architecture diagrams and high availability solutions with involvement in reviewing and certifying (direct and indirect) changes to the critical systems and their production environments. The Engineer has a primary role in implementing technical security policy, creating & configuring automated alerting schemes, monitoring & reviewing alerts from technologies they administer, identifying potential malicious security activity, and responding to activity by beginning initial triage and escalating information regarding the event timely and according to response plans. Thus, it is very important to demonstrate advance impact analysis skills and knowledge and adherence to change management processes and procedures. Senior staff will also work with the engineering team members to perform a full range of complex network designs encompassing multiple technologies and make recommendations to project managers regarding the integration of these technologies into the existing network while working with staff to ensure platform stability and standardization of implementations. The Engineer will act as escalation point in critical multi user issues and collaborate in identifying root cause of outages, and provide escalation support of issues to other teams when necessary. Engineers in this role also have the responsibility to maintain strong knowledge and expertise in several IT administrator roles (networking and operating systems as examples) with the ability to step in and assist with lead or secondary support roles when required.",30d+,www.glassdoor.com/partner/jobListing.htm?pos=109&ao=1136043&s=58&guid=000001846b7e601787a9845a3b75c5e5&src=GD_JOB_VIEW&t=SR&vt=w&cs=1_28fb3f8c&cb=1668250785250&jobListingId=1008007615105&jrtk=3-0-1ghlnso26klt0801-1ghlnso2mj4hp800-36faae600441746e-
"['CCSWW', '3.5']",http://www.ccsww.org/,DevOps Pipeline Security Engineer,"Reston, VA",$105K - $148K (Glassdoor est.),"Overview:
Full-time position starting at $24.60 - $27.36/hr (D.O.E) with COMPETITIVE BENEFITS INCLUDE:
Medical, Dental, Vision, Life Insurance and Long-Term Disability
Health Savings Account and Flexible Spending Account
Generous PTO, paid sick time, 15 days of paid vacations, 13 days of paid holidays, plus a personal holiday
CCS/CHS 403(b) Employee Saving Plan
Employee assistance program
Lots of room for advancement

Responsibilities:
Qualifications:",30d+,www.glassdoor.com/partner/jobListing.htm?pos=110&ao=1136043&s=58&guid=000001846b7e601787a9845a3b75c5e5&src=GD_JOB_VIEW&t=SR&vt=w&cs=1_13dbbef5&cb=1668250788992&jobListingId=1007672038439&jrtk=3-0-1ghlnso26klt0801-1ghlnso2mj4hp800-4403b0b9afeb60d5-
"['Coplin Health Systems', '4.0']",http://www.coplinhealth.com/,Behavioral Health Referrals,"Elizabeth, WV",$12.00 - $18.00 Per Hour(Employer est.),"Department Name: Referrals
Position Title: Referral Clerk
Position Reports to: Site Director & Informatics Director
FLSA Requirements:
Date Issued: August 19, 2021
Location:
JOB STATEMENT/SUMMARY
The referral clerk is responsible for coordinating all service referrals for patients at Coplin Health Systems.",17d,
"['Baylor Scott & White Health', '3.8']",https://jobs.bswhealth.com/,Behavioral Health Referrals,"Elizabeth, WV",$12.00 - $18.00 Per Hour(Employer est.),"JOB SUMMARY
SIGN ON BONUS $5,000.00 New Hires Only
Shift: Evening 5:00PM-1:30AM
Location: HTPN Downtown Dallas TX will oversee Chemistry and Hematology


The Supervisor of Lab supervises the routine activities of the laboratory or a laboratory section to ensure that staffing is adequate and that tests are performed, recorded, and reported in a timely manner and in accordance with quality standards. Assists with staff hiring, training, performance evaluations, payroll, etc.



Supervises the work of assigned subordinates engaged in the pre-analytical, analytical, and/or post-analytical phases of testing. Performs all delegated functions as defined by facility CLIA Director.

Prepares schedules, coordinates job assignments, and monitors personnel. Assist in the selection, orientation, training, assignments, evaluations, discipline, and discharge of employees.

Assists in the development of policies and procedures related to the laboratory, staffing, and scheduling.

Communicates and escalates staffing issues or other concerns to management in a timely manner.

Monitors the inventory system to ensure that necessary supplies are available as needed and in the proper quantity.

Assists with implementing quality assurance programs and maintains standards and records that document compliance with regulatory agencies.

Assists with the review of all quality control, proficiency testing, instrument maintenance, and quality assurance records, and any associated corrective action.

Assists with the preparation and monitoring of annual budgets.



Knowledge of laboratory regulations, protocols and procedures.

Analytical and critical thinking abilities.

Ability to comprehend and communicate instructions.

Ability to perform laboratory protocols and procedures.

Knowledge of safety and infection control standards.

Ability to work in a team environment.

Ability to make tactical decisions around the allocation and direction of the work of supervised employees using established guidelines, policies and/or procedures.

Ability to make effective hiring and termination recommendations.

Ability to train, and evaluate performance of supervised staff.

General computer skills, including but not limited to: Microsoft Office, information security, scheduling and payroll systems, electronic medical documentation, and email.



Our competitive benefits package includes the following
Note: Benefits may vary based upon position type and/or level",30d+,www.glassdoor.com/partner/jobListing.htm?pos=102&ao=1110586&s=58&guid=000001846b7ef3d98d52a516a0868ebc&src=GD_JOB_VIEW&t=SR&vt=w&cs=1_a11feaeb&cb=1668250805516&jobListingId=1008128543595&cpc=3BA4CE39D5B5DEF5&jrtk=3-0-1ghlntt0ijij6801-1ghlntt0ui171800-09f969a0cb45d4cc--6NYlbfkN0CqakopEpzqm78DXwtdYVff5_5YYyXVJlvooYfnQth5W-rQfXc93tNI4aoq65PkA2x_FsPxSUFZjDaZVja4GYxbML4ArTrKTE3e8RaJC3BkS2IOyVlXnLdBMij0_Mk-W6-jeTU3YcZ7WYBqf34G3Dqu96Ei0mkJf0aSxCw0RMSiASnrLJ2-OO97drQvTItSS_UZBnCNN1BoLOEmCB5eZH15Ka71cQwBzJfUfvpkyRStEJNhwzm6LcqLjareIgLHMjYgckxRFLGs0j__EoJSu6G5cpsivg6Vavb7hM90YlTJFEF_11aaXgwPW2ZunQySybINVt04rVXaDk-Idc4ZwCq8yNZy1569QAxpQSjZevsjCLsec0nyASaEEutYJD6iPyqhXa3GjgTIWS4TEzka7dkPbTPsY99u8iJidoCzjH8FFaSgVLUkQvWKG7OWx2wXCRGTD3gvpDivg3y5s1z4f4nGsokiKdF7jpP7Z-dhsqlt68i8m8Xdlnv-DXcasn0hp79SpW-rpQLwDEGdJY3yjRqkGq9DaMZTKha1mrPOi27J3rJyV5mPG00sel3KxSMLBxv2kkSq1z6YXuTbm3VshvZRMGLJWsh5_EybgQ9CDTiKrpx1mlWcTTauqVUjKJHwEv_fi0i19rFRwgreoVIQUr0QAX4nwLpmfV7hLfa4fKuKlz09Gnuc2YhVMji5bDLBdDBgA-05nQNkwrXLobmqPbonZTy8tzh7h2tXrMCsxXH6BBJR4pl4xzS1O8MmQXU9WyNKI8aItE1EVmSYPKJxnVgcfHlUuIAhigUfpJtCvWwuz3TH2AG2CWf1_MhljRN_1gXLN5_Xn9HQMX7KhSIb1BzP4P6yXKX0ykxIsrbEBtcE7_p2X-1FQuoz0R4sUeJqnCE1Wb4dA2taHlXbNQ6YqkzHoXVBnS8wdpkdDIeaoin5knThWh8gDkTBITQ_OYXTTr4moVgA1m7B0gkHN_BSNiAj3fPitBQzsKGe4DB7I73EGGCW2YN9L0Ck1PnKTDNT52oTqy4ZuYFrFg%3D%3D
"['Baylor Scott & White Health', '3.8']",https://jobs.bswhealth.com/,Behavioral Health Referrals,"Elizabeth, WV",$12.00 - $18.00 Per Hour(Employer est.),"JOB SUMMARY


Cytopathology Trained a must
Hours Mon-Fri 8a-5p


The Manager of Lab supervises technical and support personnel while overseeing the daily the operations of the Laboratory. This includes ensuring that regulatory requirements are met, monitoring test systems to ensure they are in control, and supervising staff, including all activities relative to work assignments, hiring/termination, performance reviews, orientation, and professional development.



Manages the daily functions of the laboratory to ensure it runs efficiently. Performs all delegated functions as defined by facility CLIA Director.

Prepares schedules, coordinates job assignments, and monitors personnel including the selection, orientation, training, assignments, evaluations, discipline, and discharge of employees.

Ensures staff has the necessary training, experience, and competencies required to perform their duties by coordinating continuing education and providing in-services and orientations.

Maintains appropriate personnel and patient records in accordance with established policies and procedures.

Assist with budgeting, provides information about supplies, personnel, and equipment, seeks avenues of cost containment, and plans long-term purchases or capital equipment.

Establishes and implements quality assurance programs and maintains standards and records that document compliance with regulatory agencies.

Ensures the review of all quality control, proficiency testing, instrument maintenance, and quality assurance records, and any associated corrective action.

Provides input/support in the selection/purchase of capital equipment and the development of yearly budgets.



Knowledge of laboratory regulations, protocols and procedures.

Analytical and critical thinking abilities.

Ability to comprehend and communicate instructions.

Ability to perform laboratory protocols and procedures.

Knowledge of safety and infection control standards.

Ability to work in a team environment.

Provides training and opportunities for continuing education.

Ability to make operational decisions around how work gets done quality and productivity standards, measurable goals for employees and project teams, etc.

Ability to use broader objectives to determine how best to use resources to meet schedules and goals.

Ability to make or approve effective hiring and termination decisions.

Ability to evaluate and recommend changes to policies, and establish procedures that affect the managed organization.

Basic business knowledge, including but not limited to: annual planning and goal setting, adherence to budgets, employee compensation, compliance and risk management.

General computer skills, including but not limited to: Microsoft Office, information security, scheduling and payroll systems, electronic medical documentation, and email.



Our competitive benefits package includes the following
Note: Benefits may vary based upon position type and/or level


- EDUCATION - Bachelor's or 4 years of work experience above the minimum qualification

- EXPERIENCE - 4 Years of Experience

- CERTIFICATION/LICENSE/REGISTRATION -
ASCP-BloodBanking Technologist (ASCP-BB), ASCP-Chemistry Technologist (ASCP-C), ASCP-Cytogenetics Technologist (ASCP-CG), ASCP-Cytologist (ASCP-CT), ASCP-Hematology Technologist (ASCP-H), ASCP-Microbiology Technologist (ASCP-M), Molecular Biology Technologist (ASCP-MB), ASCP-Blood Banking Specialist (ASCP-SBB), ASCP-Chemistry Specialist (ASCP-SC), ASCP-Hematology Specialist (ASCP-SH), ASCP-Microbiology Specialist (ASCP-SM), Cert Histocompatibility Spec (CHS-ABHI): Must have ONE of the following:
ASCP-BB
ASCP-C
ASCP-CG
ASCP-CT
ASCP-H
ASCP-M
ASCP-MB
ASCP-SBB
ASCP-SC
ASCP-SH
ASCP-SM
CHS-ABHI
CHT-ABHI
CLS
MLS
MT
SCT
SCYM
SMB.

Cert Histocompatibility Techno (CHT-ABHI), Clinical Laboratory Scientist (CLS), Medical Laboratory Scientist (MLS), Medical Technologist (MT), Specialist in Cytology-ASCP (SCT), Specialist in Cytometry-ASCP (SCYM), Molecular Biology Spec-ASCP (SMB): .",30d+,www.glassdoor.com/partner/jobListing.htm?pos=103&ao=1110586&s=58&guid=000001846b7ef3d98d52a516a0868ebc&src=GD_JOB_VIEW&t=SR&vt=w&cs=1_fba34154&cb=1668250807489&jobListingId=1008130980515&cpc=3BA4CE39D5B5DEF5&jrtk=3-0-1ghlntt0ijij6801-1ghlntt0ui171800-7864a316ec2dc22b--6NYlbfkN0CqakopEpzqm78DXwtdYVff5_5YYyXVJlvooYfnQth5W-rQfXc93tNI4aoq65PkA2ywd__6FaEIQt-luB2PqpXAfxoq4ST-nCoIa2rx8kqyxDJEKlP7G3loQucwOcumbkdHfDcI8Y9KtvPaGjKMm7Vnl-0WURk4vHwIxX7wkgwvTHzfv2_rr1gEiKwsP3UdT1x6eDRNoP10GpI2avmbWQRYAf_ji4o1ZwrZDIj80k32hwQ3ED01d-gkHR02T7pyMTyTdKk7hC5hnDDkXweCtTbGe3r5m2UoOoBxtBnqv35fD52p_vKftS76Lfg6yM_GzmwXKFl7OCh0Gz0vsVc-gau4SoOI6knAvNFAuBlHAEX0B1zobH01G7-CKsiaqMXL-BGPILXlYJfCC4uRcjYCyYynvbXkBX6t1C84HKuFf3qJyB1OtPsj9mDEBdK8LXxv3WDRHdNAHrXMtR6RaWRs0ymGhG9xECXC-YW2leA0psIEehTd4mnnloR1jVd8QCiXS94enT32YuJMUzyyxVMebD_w7pCQ9SnvUT9IDN2-y7bov91Zga0M3ibiy-zpCD4nI_Ij5uERxqng3hZV9s54fOXz97YUEIlOPD_BdMkp_uozMqIf8OosoAXmeJ1646gFlwSXaq67YoKbdUlbmFdxvHNxZntv8vc5G6le-MGbLmaYdqEdbvCZKN6QYREEGbNo7K4Ln7Td54z462Zfe9GjCuufc780KbXZzmu0WgTsICHMa8XwkA5flHh3Lqgskb_gRmF0SIHwfgO-EuttvdHj5ndHCabSdm12NgwVi5c4QM5M1ZQX4oeOX2EtLYKX_cq3awVnfdmgAqH5598v28nCCfDHZk6_vGmtRJciapPeYSOYQEFStGlRFPjoLS4_kZFt5tBSCfbBv1rrw02xEqS5jWw9eIGbtQWDXUl8TsYidLgEl2IufMZxrWm8ObFBzv_MvSyNcc-FmW1Tjc9gmistF7hgnaM2VjGC631xlsNJp1WyvTQxslX1RvxzYKKjc7j4WI2c4hT8nX1BfowCWku2Sbb1
"['Community Health Systems', '3.4']",http://www.chs.net/,Behavioral Health Referrals,"Elizabeth, WV",$12.00 - $18.00 Per Hour(Employer est.),"Community Health Systems is one of the nation’s leading healthcare providers. Developing and operating healthcare delivery systems in 47 distinct markets across 16 states, CHS is committed to helping people get well and live healthier. CHS affiliates 81 operate acute-care hospitals and more than 1,000 other sites of care, including physician practices, urgent care centers, freestanding emergency departments, occupational medicine clinics, imaging centers, cancer centers and ambulatory surgery centers.
Summary:
This position is responsible for developing and implementing Oracle Fusion Cloud application roles to address the current and emerging security and compliance needs of the Oracle ERP transformation (Finance, Supply Chain, Human Capital, and Risk Management suite of products).
Individuals will be responsible for participants in functional workshops, capturing role design requirements, aligning role design to a segregation of dues framework, and building required application security roles. Furthermore, the individual will facilitate and support application security unit testing, system integration and end user acceptance testing cycles.",2d,www.glassdoor.com/partner/jobListing.htm?pos=104&ao=1136043&s=58&guid=000001846b7ef3d98d52a516a0868ebc&src=GD_JOB_VIEW&t=SR&vt=w&cs=1_26f71c58&cb=1668250810344&jobListingId=1008268790755&jrtk=3-0-1ghlntt0ijij6801-1ghlntt0ui171800-8c0cbcb8f87664bb-
"['Arizona State University', '4.2']",http://www.asu.edu/,Behavioral Health Referrals,"Elizabeth, WV",$12.00 - $18.00 Per Hour(Employer est.),"The College of Health Solutions seeks a highly-motivated and enthusiastic Administrative Specialist located at the Downtown Phoenix campus to perform a variety of administrative work requiring initiative and independent judgment. The incumbent will work independently under general direction providing support to the college's Faculty Success Hub. Provides logistical support for meetings and events, maintains official records, manages calendars, coordinates meetings and transcribes meeting notes, including tracking and following up on next steps and to dos. Handles problems and non-routine situations by determining the approach or action to take and interprets guidelines, procedures, policies and practices. The incumbent will have contact with high-level administrators requiring use of business vocabulary, tact, discretion and judgment.

The College of Health Solutions is committed to creating a positive culture of inclusion, wellness, and employee engagement. We exemplify this through our Staff Success Hub, whose Council membership is open to all CHS staff. The Council gives staff a voice in decision-making at the college level and reflects the college leadership’s commitment to attracting, developing, and retaining the best, most diverse talent in a safe and inclusive environment.",14d,www.glassdoor.com/partner/jobListing.htm?pos=105&ao=1136043&s=58&guid=000001846b7ef3d98d52a516a0868ebc&src=GD_JOB_VIEW&t=SR&vt=w&cs=1_1fa0d849&cb=1668250814310&jobListingId=1008241832409&jrtk=3-0-1ghlntt0ijij6801-1ghlntt0ui171800-83f839ea0757cb95-
"['Community Health Systems', '3.4']",http://www.chs.net/,Behavioral Health Referrals,"Elizabeth, WV",$12.00 - $18.00 Per Hour(Employer est.),"Community Health Systems is one of the nation’s leading healthcare providers. Developing and operating healthcare delivery systems in 48 distinct markets across 16 states, CHS is committed to helping people get well and live healthier. CHS affiliates 82 operate acute-care hospitals and more than 1,000 other sites of care, including physician practices, urgent care centers, freestanding emergency departments, occupational medicine clinics, imaging centers, cancer centers and ambulatory surgery centers.

Summary:
As a Network Security Specialist, this role reports to the Manager of Network Security. This role develops, engineers, and maintains the Network Security Program for the Cybersecurity Risk Management Department. This role is expected to have expert level knowledge of firewalls and network security technologies. The specialist will be responsible for identifying and remediating security gaps, the continued improvement of existing controls, mentoring and collaborating with other Cyber Security and Information Technology team members to secure the many information technology assets and data of Community Health Systems. The specialist will collaborate with architects to design and implement solutions that better protect CHS systems and data.",30d+,www.glassdoor.com/partner/jobListing.htm?pos=106&ao=1136043&s=58&guid=000001846b7ef3d98d52a516a0868ebc&src=GD_JOB_VIEW&t=SR&vt=w&cs=1_dd4da6b0&cb=1668250817415&jobListingId=1008182999487&jrtk=3-0-1ghlntt0ijij6801-1ghlntt0ui171800-035767e2860400c1-
,,Behavioral Health Referrals,"Elizabeth, WV",$12.00 - $18.00 Per Hour(Employer est.),,8d,
"['The State of Florida', '3.5']",http://www.myflorida.com/,Behavioral Health Referrals,"Elizabeth, WV",$12.00 - $18.00 Per Hour(Employer est.),"Requisition No: 760881
Agency: Department of Health
Working Title: ENGINEERING SPECIALIST I - 64029384
Position Number: 64029384
Salary: $36,000 - $39,000 annually
Posting Closing Date: 11/27/2022
Thank you for your interest in career opportunities with the Florida Department of Health in Polk County. If you are looking to establish a successful career in Public Health, you have come to the right place. Many of our innovative and successful health programs are recognized throughout Florida. We hope you decide to join our team! Applicants will be contacted directly if selected for an interview.",28d,www.glassdoor.com/partner/jobListing.htm?pos=108&ao=1136043&s=58&guid=000001846b7ef3d98d52a516a0868ebc&src=GD_JOB_VIEW&t=SR&vt=w&cs=1_735d5aec&cb=1668250823384&jobListingId=1008208459154&jrtk=3-0-1ghlntt0ijij6801-1ghlntt0ui171800-5768ff2730b6da4a-
