Company_Name,Company_Link,Title,Location,Estimated_Salary,Job_Description,Job_Age,Application_Link
"['Beckman Coulter Diagnostics', '4.0']",http://www.beckmancoulter.com/,Automation Solutions Engineer-USA Remote,"San Jose, CA",$95K - $137K (Glassdoor est.),"Wondering what’s within Beckman Coulter? Take a closer look.

Join a team where you can be heard, be supported, and always be yourself. At Beckman Coulter, a Danaher company, we’re building a culture that celebrates backgrounds, experiences, and perspectives of all our associates. At first glance, you’ll see we are dedicated to advancing and optimizing the laboratory to move science and health care forward for more than 80 years. Look again and see we are invested in you and the opportunity to create a meaningful career, be creative, and try new things.

We hope you’ll see yourself here, too. What you find at Beckman Coulter—and within yourself— might just change the world!

The position of Lead HFE / UX Engineer reports to the Senior Manager R&D, Clinical Informatics BU with the primary responsibility to support development and deployment of DxONE Portfolio :

An automated, end-to-end software application that increases operational efficiency by automatically recording†, tracking and optimizing your laboratory’s consumables.
Amplifies productivity and future-proofs a lab by incorporating the industry’s first cloud-based middleware solution.
Efficiently manages laboratory performance and productivity by establishing a centralized point of control connecting up to 18 instruments or automation systems across the network.
Identifies patterns and reduces inefficiencies with a cloud-based software solution that provides actionable insights and lab data analytics to streamline operations.


Collaborate with cross functional teams, coach, facilitate the use of UX best practices, tools, frameworks
Develop high-level and detailed wireframes, storyboards, and mockups as part of the DxONE HFE team.
Be part of design process as part of key development projects and perform workflow analysis and risk analysis activities such as task and use error analysis. Ensure traceability to design mitigations and requirements for risk areas
Plan and execute usability studies (Formative and Summative), analyze data, document results, and present recommendations to product teams.
Work closely with R&D teams across geographies to ensure accurate implementation, compliance of designs
Utilize UX best practices to create user centric solutions and workflow design
Influence adoption of ideas and solutions with key cross functional stakeholders across geographies
Identify and address usability issues while participating in Voice-Of-Customer studies
Use proven HFE methodologies and tools, recommend changes to improve the overall usability, user interfaces, and ensure a safe and reliable user experience.
Travel - domestic & international (less than 25%).


Bachelors/Master’s Degree in Human Factors, Human Computer Interaction, User Experience Design or other related fields
8+ years relevant experience in user experience design roles
Proficiency with Adobe Creative Cloud or other web design tools
Experience and expertise in the software design process, interaction design, user research, and usability
Proficiency with Microsoft Office applications (Word, Excel, PowerPoint, Visio), and Wireframe design and statistical analysis tools.
Ability to apply user-centered design and usability engineering principles to product research, development, and design.

Leadership Experience
Proactive communication
Ability to work with multi-functional and remote teams
Experience with Agile Scrum based Software Development.
Ability to conduct Style Guide compliance reviews and provide reports.


12+ years relevant experience in user/HFE experience design roles
Experience in healthcare domain
Advanced degree in Human Factors engineering or equivalent.
Exposure to Human Factors techniques and methodologies and application towards the design and development of medical device related software in compliance with FDA and other regulatory standards and guidelines. (e.g., FDA human Factors guidance, IEC 62366, AAMI HE75).
Experience developing medical devices and working with customers.
Well versed in the “human element” and able to empathize with a wide variety of users.
Self-starter with a sense of urgency to resolve issues and complete tasks.

Beckman Coulter offers a broad array of comprehensive, competitive benefit programs that add value to associates’ and their families’ lives. Whether it’s a health care program, 401K match or paid time off, our programs contribute to life beyond the job.

Beckman Coulter is a Danaher Operating Company. At Danaher, we’re driven by a sense of wonder for what we can create—and what we can become. Here, you’ll accelerate your career while driving innovation that improves lives. You’ll work hard and take risks, with guidance from committed leaders, powerful DBS tools, and the support of a global organization.

#LI-CM4
#LI-REMOTE

When you join us, you’ll also be joining Danaher’s global organization, where 69,000 people wake up every day determined to help our customers win. As an associate, you’ll try new things, work hard, and advance your skills with guidance from dedicated leaders, all with the support of powerful Danaher Business System tools and the stability of a tested organization.

Danaher Corporation and all Danaher Companies require all US and Puerto Rico employees to be vaccinated against COVID–19 as a condition of employment, subject to reasonable accommodation as required by law.

Danaher Corporation and all Danaher Companies are committed to equal opportunity regardless of race, color, national origin, religion, sex, age, marital status, disability, veteran status, sexual orientation, gender identity, or other characteristics protected by law. We value diversity and the existence of similarities and differences, both visible and not, found in our workforce, workplace and throughout the markets we serve. Our associates, customers and shareholders contribute unique and different perspectives as a result of these diverse attributes.

The EEO posters are available here .

We will ensure that individuals with disabilities are provided reasonable accommodation to participate in the job application or interview process, to perform crucial job functions, and to receive other benefits and privileges of employment. Please contact us at applyassistance@danaher.com to request accommodation.

If you’ve ever wondered what’s within you, there’s no better time to find out.
Minneapolis, Minnesota, United States
Chicago, Illinois, United States
Miami, Florida, United States
New York, New York, United States
Columbus, Ohio, United States
Madison, Wisconsin, United States
Dallas, Texas, United States
Boston, Massachusetts, United States
Nashville, Tennessee, United States
Detroit, Michigan, United States
Atlanta, Georgia, United States
Austin, Texas, United States
Houston, Texas, United States
Indianapolis, Indiana, United States
Baltimore, Maryland, United States
Charlotte, North Carolina, United States
Philadelphia, Pennsylvania, United States

When you join us, you’ll also be joining Danaher’s global organization, where 80,000 people wake up every day determined to help our customers win. As an associate, you’ll try new things, work hard, and advance your skills with guidance from dedicated leaders, all with the support of powerful Danaher Business System tools and the stability of a tested organization.

Given the essential job duties of this position, the employee is required to be fully vaccinated against COVID-19 as a condition of employment, subject to reasonable accommodation and applicable law.",24h,www.glassdoor.com/partner/jobListing.htm?pos=102&ao=1136043&s=58&guid=000001846a25bcd7a38d1e7b9797aff0&src=GD_JOB_VIEW&t=SR&vt=w&cs=1_f45f25e6&cb=1668228179248&jobListingId=1008275055233&jrtk=3-0-1ghl2bf8fkuia801-1ghl2bf91i7nt800-e5ecef70361de98d-
"['ESKO', '3.8']",http://www.esko.com/,Automation Solutions Engineer-USA Remote,"San Jose, CA",$95K - $137K (Glassdoor est.),"About Esko
Esko is a worldwide market leader with software and hardware products for packaging buyers, designers and manufacturers for the packaging, label and commercial print industries. Our hardware solutions include AVT print inspection vision solutions and Flexo laser platemaking systems. With headquarters in Belgium, Esko employs around 1,800 people worldwide. Our global sales and support organization covers Europe, the Americas, Asia-Pacific and Japan. Esko operates as a subsidiary of Danaher Corporation, one of the best performing Fortune 500 companies. See also https://www.esko.com/
This Job is an Unique Opportunity:
We are looking for a colleague to join our team as a field service technician. You will be helping our customers with all their hardware and software related service needs. You interact daily onsite or via phone and email with customers and other Esko staff. This job requires extensive travel throughout the US and some in Canada.",30d+,
"['Danaher Corporation', '4.0']",http://jobs.danaher.com/,Automation Solutions Engineer-USA Remote,"San Jose, CA",$95K - $137K (Glassdoor est.),"At first glance, you’ll see Danaher’s scale. Our 80,000 associates work across the globe at more than 20 unique operating companies within four platforms—life sciences, diagnostics, water quality, and product identification. Look again and you’ll see the opportunity to build a meaningful career, be creative, and take risks with the support you need to be successful. You’ll find associates who are as certain about their impact as they are about where they’re headed next. You’ll find the Danaher Business System, which makes everything possible. You’ll also see a company that investors trust—our culture of continuous improvement has helped us outperform the S&P 500 by more than 5,000% over the past 25 years.

And no matter where you look at Danaher, at the heart of what we do, you’ll witness our shared purpose—helping realize life’s potential—in action. Whether we’re enabling our customers to provide clean water, supporting a life-saving vaccine development, advancing a new instrument for cancer diagnosis, or ensuring product safety, our work helps improve millions of lives.

We hope you’ll see yourself here, too. What you find at Danaher—and within yourself— might just change the world.

Are you interested in an exciting opportunity to enhance enterprise threat identification and response capabilities using a leading technology solution, Splunk’s Enterprise Security (ES) SIEM? Would you love to translate your knowledge of cyber threats into detection logic that uses diverse data sources from across Danaher’s large global footprint? Work to further Danaher’s adoption and use of the ES feature set!

At Danaher we believe in designing a better, more sustainable workforce. We recognize the benefits of flexible, remote working arrangements for eligible roles and are committed to providing enriching careers, no matter the work arrangement. This position is eligible for a remote work arrangement in which you can work remotely from your home. Additional information about this remote work arrangement will be provided by your interview team. Explore the flexibility and challenge that working for Danaher can provide.

Responsibilities

Develop, maintain and enhance threat detection logic in Splunk ES

Evaluate new Splunk ES product features and their fitness for use in the environment. Execute and provide oversight of the Splunk ES currency plan and updates for related threat detection components.

Identify and lead continuous Splunk ES architectural, configuration, usage and other improvements

Define, implement and enhance threat detection related engineering standards and practices

Qualifications

5+ years of experience with Splunk search language (SPL), developing custom searches using macros, lookups and related features. Experienced with developing advanced correlation rules utilizing Splunk tstats and data models.

Experienced with applying search logic to common log formats and security identifiers from Windows, Linux and network security devices

Experienced with creating and maintaining Splunk data models and knowledge objects

Experienced creating regex for pattern matching

Preferred Qualifications

College or university degree or equivalent in computer science or similar discipline

Splunk Enterprise Certified Admin certification

Splunk Enterprise Security Admin certification

Prior experience working in a Security Operations Center or for a Managed Security Services Provider (MSSP)

Familiarity working with threat intelligence products for enrichment of detection and response alerts

Familiarity with Palo Alto Cortex XSOAR or similar enterprise SOAR solutions

#LI-SM1
#LI-Remote

When you join us, you’ll also be joining Danaher’s global organization, where 80,000 people wake up every day determined to help our customers win. As an associate, you’ll try new things, work hard, and advance your skills with guidance from dedicated leaders, all with the support of powerful Danaher Business System tools and the stability of a tested organization.",30d+,www.glassdoor.com/partner/jobListing.htm?pos=104&ao=1136043&s=58&guid=000001846a25bcd7a38d1e7b9797aff0&src=GD_JOB_VIEW&t=SR&vt=w&cs=1_42190276&cb=1668228184190&jobListingId=1008158906959&jrtk=3-0-1ghl2bf8fkuia801-1ghl2bf91i7nt800-2bc5463ba32b8a6b-
"['Nobel Biocare', '3.3']",http://www.envistaco.com/,IT Help Desk Specialist,"Madison, WI",$42K - $57K (Glassdoor est.),"At Orascoptic, our brand sits at the intersection of consumer eyewear and medical technology. Our expertise is in stunning innovation and precision custom manufacturing of surgical loupes, coaxial headlights, and associated products. Our mission is to enable healthcare providers around the world to see more and practice longer. We deliver clinical vision. Our innovative product portfolio, direct sales teams, optical expertise, and commitment to leading disruption have created a winning company and a trusted brand. As part of Envista’s portfolio of businesses, we combine the agility of a smaller, focused business with the resources of a large enterprise. We are an ambitious, high energy team intent on creating solutions to help medical professionals improve patient lives. Headquartered in Madison, Wisconsin, our teams and partners are located around the world. For more information about Orascoptic, visit www.orascoptic.com
Job Description:
Provides IT phone support for all internal employees at Envista locations globally and local support. Ensures that all phone support calls are logged, resolved, or are forwarded to the proper group for resolution. Responsible for PC configurations, imaging, ongoing system updates and maintenance. LAN/WAN network troubleshooting, and vendor coordination. This person will be responsible for supporting numerous other third-party applications, e.g., Microsoft Dynamics, SAP, Oracle, etc.",30d+,www.glassdoor.com/partner/jobListing.htm?pos=101&ao=1110586&s=58&guid=000001846a25ffe0a352fd09b7b5923e&src=GD_JOB_VIEW&t=SR&vt=w&cs=1_7480181f&cb=1668228196525&jobListingId=1007812583691&cpc=3BA4CE39D5B5DEF5&jrtk=3-0-1ghl2c006klt9801-1ghl2c00mi14k800-f88dc6451735ba99--6NYlbfkN0AOHwrLlyTXiG3HfdcLhaCVf3-H-RbPAVLFEo3oL0rfm3fE8m1zPVraZSUGq2CqPCnpWuzuvOQLMGGcnkUgxsidMlgpA6IQxjoCLVfO_tL4JoEgXlz_EvDNSYPjjYEUK_b3FZdQjtbr_nWzehMvcgGxpYWWJRrkxLR9KjstkH1EYt9nEV2EB3vpZbI6HIFjjIcEqJlZyObVKYSPp34JjtG9Xv3f8QiGM59BAb9NkxZDy-hD0DQ1uhS7cUDm4fAsCL3fyFJMCYoXKVuQFQzVnf8O86dsPAui_gil1d20MluGMJNUgv_iRAZuCUm84VQ5J5jipCSerlpdNdvHhmRmbaGGsYtQYDWOmAKxLlWW5Qaaw_ky7oDAjetx7l3c4flLwLCcAz4TEGDCmDMVYQ2yZEr6wIGlbrW-GPYhfeLyheIjaSkbrxzhg1aQrsD8gV-pmnbcHmBRFJQjm59fysOr7XIUyvosHawBzueTb7y4bKNk9q99pBAPquyhLSGlmqM_yUrh2dkw3neMnUUGlDDSsEDchVhMaRysR7jsyajGYxmOgTIFtTMA6rFfCavwv3IqrPqzDCrwXjAdrbjvs2Nj1e6d8ZeCyF2oTYlwznaloitW94JUdJShZbTtm-E31lwOdjM%3D
"['Beckman Coulter Diagnostics', '4.0']",http://www.beckmancoulter.com/,Staff Systems Integration Engineer,"West Sacramento, CA",$103K - $138K (Glassdoor est.),"Wondering what’s within Beckman Coulter Diagnostics? Take a closer look.

At first glance, you’ll see that for more than 80 years we’ve been dedicated to advancing and optimizing the laboratory to move science and healthcare forward. Join a team where you can be heard, be supported, and always be yourself. We’re building a culture that celebrates backgrounds, experiences, and perspectives of all our associates. Look again and you’ll see we are invested in you, providing the opportunity to build a meaningful career, be creative, and try new things with the support you need to be successful.

Beckman Coulter Diagnostics is proud to work alongside a community of six fellow Diagnostics Companies at Danaher. Together, we’re working at the pace of change to improve patient lives with diagnostic tools that address the world’s biggest health challenges.

The Staff Systems Integration Engineer will work as part of new product development for next generation Microbiology diagnostic instruments with a focus on executing characterization, verification and validation tasks. This position is based in Sacramento, CA and will be hybrid (mix of remote and on-site) work depending upon business needs. This is an exciting and challenging opportunity to be a part of a rapidly growing industry working on the cutting edge of medical diagnostic technologies in a research and development environment. You’ll have the opportunity to work directly with scientists and engineers to ensure we have the right solutions to meet the needs of a constantly evolving healthcare environment. If you thrive in a high-functioning matrixed environment and want to work to build a world-class R&D organization—read on.


Hands-on design and execution of complex test methods (including design and implementation of test fixtures) to assess hardware, software, and system performance per Design Input Requirements, in compliance with Quality and Regulatory requirements.
Work independently in a cross-disciplinary environment to plan and execute experiments, defining and using specialized test equipment, and perform experimental data analysis.
Analyze complex data via statistical methods and provide written and oral reports and updates to senior and executive management.
Write and execute systems verification protocols
Work with cross-functional team to quickly investigate and identify countermeasures for new product issues on new product development and legacy products
Conducts root cause investigations and Failure analyses to solve reliability and performance issues on legacy products
Analyze data to assess system performance
Drive continuous improvement projects
Plan projects, step action plans and manage/prioritize multiple tasks


Bachelor’s degree in Engineering, or a related technical discipline with 9+ years of experience as a hands-on systems or systems-integration engineer OR Master’s degree with 7+ years of experience of systems experience.
Experience developing complex instrumentation systems which incorporate LAN/Cloud-based computing, optical, mechanical, environmental, algorithm, firmware components with inter-system measures and measurement systems.
Experience with and ability to detail work per ISO9000/FDA regulation.
Excellent collaboration and communication skills to enable c oordinating and aligning system-level integration efforts between workstreams, throughout characterization and qualification; Includes aspects of:
System modeling, apportionment, and measurement system analysis of essential performance requirements between sub-systems.
System risk management and alignment of risk mitigations across the subsystems and requirements.
System reliability modeling and monitoring; Proposes Continuous improvement of the high-impact issues.
Human Factors and Usability to minimize system workflow errors, effort, and operator strain.
Statistics experience, including proficiency in Design of Experiments and the use of Excel or other tools such as JMP, Origin, Matlab, R, Python, Mathematica, or Minitab, etc.) for data analysis and interpretation.

At Beckman Coulter Diagnostics we believe in designing a better, more sustainable workforce. We recognize the benefits of flexible, hybrid working arrangements for eligible roles and are committed to providing enriching careers, no matter the work arrangement. This position is eligible for a hybrid work arrangement in which you can work part-time at the Company location identified above and part-time remotely from your home. Additional information about this hybrid work arrangement will be provided by your interview team. Explore the flexibility and challenge that working for Beckman Coulter Diagnostics can provide.

When you join us, you’ll also be joining Danaher’s global organization, where 80,000 people wake up every day determined to help our customers win. As an associate, you’ll try new things, work hard, and advance your skills with guidance from dedicated leaders, all with the support of powerful Danaher Business System tools and the stability of a tested organization.",4d,www.glassdoor.com/partner/jobListing.htm?pos=101&ao=1136043&s=58&guid=000001846a263295ae04a945920af0c5&src=GD_JOB_VIEW&t=SR&vt=w&cs=1_624657bf&cb=1668228206893&jobListingId=1008263697051&jrtk=3-0-1ghl2ccloma62801-1ghl2cco2ihlq800-f53e84a17feb77d1-
