Company_Name,Company_Link,Title,Location,Estimated_Salary,Job_Description,Job_Age,Application_Link
"['Beckman Coulter Diagnostics', '4.0']",http://www.beckmancoulter.com/,Bioinformatics Analyst II,"Sunnyvale, CA",$133K - $170K (Glassdoor est.),"Wondering what’s within Beckman Coulter? Take a closer look.

Join a team where you can be heard, be supported, and always be yourself. At Beckman Coulter, a Danaher company, we’re building a culture that celebrates backgrounds, experiences, and perspectives of all our associates. At first glance, you’ll see we are dedicated to advancing and optimizing the laboratory to move science and health care forward for more than 80 years. Look again and see we are invested in you and the opportunity to create a meaningful career, be creative, and try new things.

We hope you’ll see yourself here, too. What you find at Beckman Coulter—and within yourself— might just change the world!

The position of Lead HFE / UX Engineer reports to the Senior Manager R&D, Clinical Informatics BU with the primary responsibility to support development and deployment of DxONE Portfolio :

An automated, end-to-end software application that increases operational efficiency by automatically recording†, tracking and optimizing your laboratory’s consumables.
Amplifies productivity and future-proofs a lab by incorporating the industry’s first cloud-based middleware solution.
Efficiently manages laboratory performance and productivity by establishing a centralized point of control connecting up to 18 instruments or automation systems across the network.
Identifies patterns and reduces inefficiencies with a cloud-based software solution that provides actionable insights and lab data analytics to streamline operations.


Collaborate with cross functional teams, coach, facilitate the use of UX best practices, tools, frameworks
Develop high-level and detailed wireframes, storyboards, and mockups as part of the DxONE HFE team.
Be part of design process as part of key development projects and perform workflow analysis and risk analysis activities such as task and use error analysis. Ensure traceability to design mitigations and requirements for risk areas
Plan and execute usability studies (Formative and Summative), analyze data, document results, and present recommendations to product teams.
Work closely with R&D teams across geographies to ensure accurate implementation, compliance of designs
Utilize UX best practices to create user centric solutions and workflow design
Influence adoption of ideas and solutions with key cross functional stakeholders across geographies
Identify and address usability issues while participating in Voice-Of-Customer studies
Use proven HFE methodologies and tools, recommend changes to improve the overall usability, user interfaces, and ensure a safe and reliable user experience.
Travel - domestic & international (less than 25%).


Bachelors/Master’s Degree in Human Factors, Human Computer Interaction, User Experience Design or other related fields
8+ years relevant experience in user experience design roles
Proficiency with Adobe Creative Cloud or other web design tools
Experience and expertise in the software design process, interaction design, user research, and usability
Proficiency with Microsoft Office applications (Word, Excel, PowerPoint, Visio), and Wireframe design and statistical analysis tools.
Ability to apply user-centered design and usability engineering principles to product research, development, and design.

Leadership Experience
Proactive communication
Ability to work with multi-functional and remote teams
Experience with Agile Scrum based Software Development.
Ability to conduct Style Guide compliance reviews and provide reports.


12+ years relevant experience in user/HFE experience design roles
Experience in healthcare domain
Advanced degree in Human Factors engineering or equivalent.
Exposure to Human Factors techniques and methodologies and application towards the design and development of medical device related software in compliance with FDA and other regulatory standards and guidelines. (e.g., FDA human Factors guidance, IEC 62366, AAMI HE75).
Experience developing medical devices and working with customers.
Well versed in the “human element” and able to empathize with a wide variety of users.
Self-starter with a sense of urgency to resolve issues and complete tasks.

Beckman Coulter offers a broad array of comprehensive, competitive benefit programs that add value to associates’ and their families’ lives. Whether it’s a health care program, 401K match or paid time off, our programs contribute to life beyond the job.

Beckman Coulter is a Danaher Operating Company. At Danaher, we’re driven by a sense of wonder for what we can create—and what we can become. Here, you’ll accelerate your career while driving innovation that improves lives. You’ll work hard and take risks, with guidance from committed leaders, powerful DBS tools, and the support of a global organization.

#LI-CM4
#LI-REMOTE

When you join us, you’ll also be joining Danaher’s global organization, where 69,000 people wake up every day determined to help our customers win. As an associate, you’ll try new things, work hard, and advance your skills with guidance from dedicated leaders, all with the support of powerful Danaher Business System tools and the stability of a tested organization.

Danaher Corporation and all Danaher Companies require all US and Puerto Rico employees to be vaccinated against COVID–19 as a condition of employment, subject to reasonable accommodation as required by law.

Danaher Corporation and all Danaher Companies are committed to equal opportunity regardless of race, color, national origin, religion, sex, age, marital status, disability, veteran status, sexual orientation, gender identity, or other characteristics protected by law. We value diversity and the existence of similarities and differences, both visible and not, found in our workforce, workplace and throughout the markets we serve. Our associates, customers and shareholders contribute unique and different perspectives as a result of these diverse attributes.

The EEO posters are available here .

We will ensure that individuals with disabilities are provided reasonable accommodation to participate in the job application or interview process, to perform crucial job functions, and to receive other benefits and privileges of employment. Please contact us at applyassistance@danaher.com to request accommodation.

If you’ve ever wondered what’s within you, there’s no better time to find out.
Minneapolis, Minnesota, United States
Chicago, Illinois, United States
Miami, Florida, United States
New York, New York, United States
Columbus, Ohio, United States
Madison, Wisconsin, United States
Dallas, Texas, United States
Boston, Massachusetts, United States
Nashville, Tennessee, United States
Detroit, Michigan, United States
Atlanta, Georgia, United States
Austin, Texas, United States
Houston, Texas, United States
Indianapolis, Indiana, United States
Baltimore, Maryland, United States
Charlotte, North Carolina, United States
Philadelphia, Pennsylvania, United States

When you join us, you’ll also be joining Danaher’s global organization, where 80,000 people wake up every day determined to help our customers win. As an associate, you’ll try new things, work hard, and advance your skills with guidance from dedicated leaders, all with the support of powerful Danaher Business System tools and the stability of a tested organization.

Given the essential job duties of this position, the employee is required to be fully vaccinated against COVID-19 as a condition of employment, subject to reasonable accommodation and applicable law.",24h,www.glassdoor.com/partner/jobListing.htm?pos=108&ao=1136043&s=58&guid=000001846a284508b8719e5f05116f02&src=GD_JOB_VIEW&t=SR&vt=w&cs=1_c6164dff&cb=1668228376463&jobListingId=1008275055233&jrtk=3-0-1ghl2gh9qj4gm801-1ghl2ghaeg4es800-e5ecef70361de98d-
,,Bioinformatics Analyst II,"Sunnyvale, CA",$133K - $170K (Glassdoor est.),,2d,
"['Scope AR', '3.8']",http://www.scopear.com/,Bioinformatics Analyst II,"Sunnyvale, CA",$133K - $170K (Glassdoor est.),"Scope AR is the pioneer of enterprise-class augmented reality solutions, delivering the industry’s only cross-platform AR tools for getting workers the knowledge they need, when they need it. The company is revolutionizing the way enterprises work and collaborate by offering AR tools that provide more effective and efficient knowledge-sharing to conduct complex remote tasks, employee training, product and equipment assembly, maintenance and repair, field and customer support, and more.

The company’s device-agnostic technology supports smartphones, tablets and wearables, making it easy for leading organizations like Johnson & Johnson, Danaher, Lockheed Martin, Honeywell, and others to leverage AR as a new way to scale their organizations globally, with greater efficiency.

Working at Scope AR provides you the opportunity to have a real and major impact on the way products around the globe get created and how work gets done.",30d+,www.glassdoor.com/partner/jobListing.htm?pos=109&ao=1136043&s=58&guid=000001846a284508b8719e5f05116f02&src=GD_JOB_VIEW&t=SR&vt=w&cs=1_a8340724&cb=1668228380562&jobListingId=1008269369929&jrtk=3-0-1ghl2gh9qj4gm801-1ghl2ghaeg4es800-2b7c16c58cb0b92e-
"['Pall Corporation', '3.8']",http://www.pall.com/,Bioinformatics Analyst II,"Sunnyvale, CA",$133K - $170K (Glassdoor est.),"Find what drives you on a team with a more than 70-year history of discovery, determination, and innovation. As a global leader in high-tech filtration, separation, and purification, Pall Corporation thrives on helping our customers protect people. Our products serve a wide range of markets, so if your interests lie along the spectrum of Life Sciences to Industrial, you’ll find a rewarding role here. For the exponentially curious, Pall is a place you can thrive and amplify your impact on the world.
Pall is proud to work alongside a community of nine fellow Danaher Life Sciences companies. Together, we’re pioneering the future of science and medicine, developing products that enable researchers in the fight to save lives.
Position Summary:
Pall Industrial is seeking a highly motivated R&D leader for the position of Vice President of Membrane Research reporting directly to the Chief Technology Officer. The VP of Materials/Membrane Research will lead global teams engaged with research in materials to develop membranes and media that enables next generation filtration, separation, and purification applications for Pall Industrial business units – Aerospace, Microelectronics, Fluid Technologies and Asset Protection and Food & Beverage - with combined annual revenues >$1.5B.",30d+,www.glassdoor.com/partner/jobListing.htm?pos=111&ao=1136043&s=58&guid=000001846a284508b8719e5f05116f02&src=GD_JOB_VIEW&t=SR&vt=w&cs=1_ba21fe8d&cb=1668228386061&jobListingId=1007702243785&jrtk=3-0-1ghl2gh9qj4gm801-1ghl2ghaeg4es800-286c7b9c27d5d99c-
"['Pall', '3.8']",http://www.pall.com/,Bioinformatics Analyst II,"Sunnyvale, CA",$133K - $170K (Glassdoor est.),"Find what drives you on a team with a more than 70-year history of discovery, determination, and innovation. As a global leader in high-tech filtration, separation, and purification, Pall Corporation thrives on helping our customers protect people. Our products serve a wide range of markets, so if your interests lie along the spectrum of Life Sciences to Industrial, you’ll find a rewarding role here. For the exponentially curious, Pall is a place you can thrive and amplify your impact on the world.

Pall is proud to work alongside a community of nine fellow Danaher Life Sciences companies. Together, we’re pioneering the future of science and medicine, developing products that enable researchers in the fight to save lives.

Overview
Quality Engineer is responsible for Quality Assurance & Quality Control activities supporting quality, production, and process requirements for Pall Corporation DeLand. This includes product and process support starting from review of customer requirements, insuring flow down into drawings, routers, and purchase orders, to final shipment of product to customer and aftermarket support.


Knowledge of ISO 9001, (current rev) to aid in maintaining QMS
Administer and maintain databases in production areas to assist in product and process monitoring, traceability and automated data collection
Must be able to interface with internal and external suppliers and customers effectively
Works closely with Sales, R&D, and Manufacturing to optimize the company's products and relationships with our customers including presentations at customer sites.
Knowledge of customer quality inquires, investigate and perform root-cause analysis on customer issues and effectively resolve them (CAPA) (8D)
Continuous Improvement Activities, Lean Manufacturing Principles, 5S, Kaizen
Manage and perform Internal QMS Audits
Perform Contract Review
Perform Purchase Order Reviews
Material Review Board Quality Representative
Perform Drawing and Router Quality Reviews
Provide Manufacturing Quality Trend Charts/Analysis
Perform data collection & analysis; SPC and DOE analysis
Measurement system analysis (MSA) and Gauge R&R
Knowledge of process capability / improvement / Six Sigma techniques


B.S degree in Industrial Engineering or related technical discipline
Prefer 5 years experience in Quality Engineering
Technical QMS knowledge – Certified Quality Engineer or other ASQ Quality Certification preferred.
Automotive QMS experience preferred (APQP, PPAP, FMEA, Control Plans)
Microsoft Word, Excel, PowerPoint and SAP software
Exceptional communication skills, Ability to interact with all areas, Team player

#LI-ND19
#bestteamwins
#pallproud

When you join us, you’ll also be joining Danaher’s global organization, where 80,000 people wake up every day determined to help our customers win. As an associate, you’ll try new things, work hard, and advance your skills with guidance from dedicated leaders, all with the support of powerful Danaher Business System tools and the stability of a tested organization.",24h,www.glassdoor.com/partner/jobListing.htm?pos=112&ao=1136043&s=58&guid=000001846a284508b8719e5f05116f02&src=GD_JOB_VIEW&t=SR&vt=w&cs=1_af0a8ae1&cb=1668228388072&jobListingId=1008275056301&jrtk=3-0-1ghl2gh9qj4gm801-1ghl2ghaeg4es800-def645c1971c1c50-
"['Hach', '3.4']",http://www.hach.com/,Bioinformatics Analyst II,"Sunnyvale, CA",$133K - $170K (Glassdoor est.),"This position is located onsite at the company location in Bellevue, WA.

About Sea-Bird Scientific

A wholly owned subsidiary of Danaher Corporation (NYSE: DHR), Sea-Bird Scientific ( www.seabird.com ) is headquartered in Bellevue, Washington. Sea-Bird Scientific is the world’s largest developer and manufacturer of products for the measurement of salinity, temperature, pressure, dissolved oxygen, fluorescence, nutrients and related oceanographic parameters in marine waters. We offer products to support best-in-class oceanography and climate science. We offer an entrepreneurial environment that is team-centered, customer-driven, quality-focused, and growth-oriented.

Working at Sea-Bird Scientific gives you access to a robust career development process and challenging stretch opportunities. Sea-Bird Scientific is proud to be one of Danaher's Water Quality companies . Through strong customer partnerships, the water platform advances the quality and delivery of water. Want to help us in this mission?


This is an exciting opportunity to make a significant impact in improving and sustaining our oceanographic instruments that are vital to improving our understanding of the oceans and our climate! You will optimize the design, manufacturability, and testing processes for Sea-Bird Scientific’s products. These complex products are designed to be deployed in the ocean for a variety of uses and withstand harsh environments while maintaining accuracy in data collection to support oceanographic research and the scientific community.

We are looking for a smart, innovative, and high-energy mechanical engineer who is driven to continuously improve our ability to deliver market leading technology with a focus on quality, reliability, and performance.


Improve DFM in all points of production
Develop innovative solutions to existing design constraints through redesign efforts to capture VAVE/Scrap savings
Collect appropriate data to define, identify, analyze, and improve manufacturing throughput and product quality.
Support Manufacturing in optimizing the design of fixture/tools for the ease of manufacturing and cost optimization
Supports Engineering team to sustain existing products per program and resource needs.
Performs troubleshooting, diagnoses and resolves problems to component, module level, or system level.
Develop test plans and conduct in-house and field testing that cover the expected customer use environment and operation conditions.
Analyze and develop system and sub-system requirements and relationships with component specifications
Interact with machine shops and vendors throughout the design cycle for optimizing the design from manufacturability and cost stand points
Generation of Engineering Change Orders (change to the existing designs or introducing new designs plus V&V and release).
Generation of Verification and Validation test protocols (Software, Hardware and System) and the execution of the test cases.

Qualifications
Degree in Mechanical, Manufacturing, or Systems Engineering - (BS + 2 yrs exp, MS + 1 yrs exp).
1+ years’ experience in mechanical engineering or related manufacturing engineering field
Hands on experience with either Mechanical or Electrical testing
SolidWorks experience, modeling and GD&T (other computer-added design software tools)
Understanding of fabrication methods and design constraints
Proficient with Microsoft Office applications (mainly Word, Excel)


Electrical-mechanical, process improvement, machining, or DFM background
Some software/programming experience is a plus (C, C++, python, Matlab)

When you join us, you’ll also be joining Danaher’s global organization, where 80,000 people wake up every day determined to help our customers win. As an associate, you’ll try new things, work hard, and advance your skills with guidance from dedicated leaders, all with the support of powerful Danaher Business System tools and the stability of a tested organization.

Given the essential job duties of this position, the employee is required to be fully vaccinated against COVID-19 as a condition of employment, subject to reasonable accommodation and applicable law.",9d,www.glassdoor.com/partner/jobListing.htm?pos=113&ao=1136043&s=58&guid=000001846a284508b8719e5f05116f02&src=GD_JOB_VIEW&t=SR&vt=w&cs=1_a07fa929&cb=1668228391911&jobListingId=1008251345372&jrtk=3-0-1ghl2gh9qj4gm801-1ghl2ghaeg4es800-b397c713cef85de3-
"['Beckman Coulter Life Sciences', '4.0']",http://jobs.danaher.com/,Bioinformatics Analyst II,"Sunnyvale, CA",$133K - $170K (Glassdoor est.),"Beckman Coulter Life Sciences’ mission is to empower those seeking answers to life’s most important scientific and healthcare questions. With a legacy spanning 80+ years, we have long been a trusted partner to our customers, who are working to transform science and healthcare with the next groundbreaking discovery. As part of our team of more than 2,900 associates across 130 countries, you’ll help drive our vision of accelerating answers—and our commitment to excellence.

Beckman Coulter Life Sciences is proud to work alongside a community of nine fellow Danaher Life Sciences companies. Together, we’re pioneering the future of science and medicine, developing products that enable researchers in the fight to save lives.

As a Global Technical Support Engineer, you will collaborate with Global Service delivering product support for Life Science systems by supporting field service troubleshooting, providing escalation management, supporting product life cycle management for existing products, and driving design for serviceability!

International and domestic travel possible up to 25%.


Ability to influence decision making with or without authority, facilitate groups with diverse perspectives, bring teams to agreement. Works across the organization to set priorities and shift resources according to business demands.
Extensive knowledge in mechanical or electrical engineering. Drives technical excellence, especially the execution of defined product support initiatives.
Interpersonal skills that build positive relationships and influence others, both within the direct team and across functions. Ability to interact with all levels of the business (senior leaders to working teams), exceptionally good listening skills, able to present complex information with clarity and simplicity.
Able to identify problems; apply structured and disciplined methodology to identify root cause using data. Innovative and effective solution development, risk mitigation and execution.
Collaborate effectively with others in the spirit of common objectives.


Drive product support improvements, deploying creative and effective support strategies to deliver best-in-class customer service
Provide troubleshooting support to field service associates during on-site visits to promote customer up-time
Lead Technical and Product Line escalations of product related technical system issues
Develop expert level knowledge of existing systems from hardware perspective and acquire applications knowledge to aid in problem diagnosis.
Recommendations to development projects as a customer and service advocate
Recommendations to design and test methods for verification of all service procedures
Ensuring all safety, quality and regulatory requirements are in compliance with standards and agencies such as: ISO, GMP and FDA
Collaborate with all partners to utilize DBS for ongoing process improvement. Key Requirements:
Bachelor’s degree with 9+ years related work experience OR Master’s degree with 7+ years related work experience OR Doctoral degree with 4+ years related work experience. Degree in Systems Engineering, Mechanical Engineering, Electrical Engineering or similar engineering field preferred.
Experience working in product support environment preferred
Excellent troubleshooting and problem-solving skills
Exceptional communication (verbal and written)
Strong analytical skills
Proven track record in and commitment to continuous process improvement

When you join us, you’ll also be joining Danaher’s global organization, where 69,000 people wake up every day determined to help our customers win. As an associate, you’ll try new things, work hard, and advance your skills with guidance from dedicated leaders, all with the support of powerful Danaher Business System tools and the stability of a tested organization.

Danaher Corporation and all Danaher Companies are committed to equal opportunity regardless of race, color, national origin, religion, sex, age, marital status, disability, veteran status, sexual orientation, gender identity, or other characteristics protected by law. We value diversity and the existence of similarities and differences, both visible and not, found in our workforce, workplace and throughout the markets we serve. Our associates, customers and shareholders contribute unique and different perspectives as a result of these diverse attributes.

We will ensure that individuals with disabilities are provided reasonable accommodation to participate in the job application or interview process, to perform crucial job functions, and to receive other benefits and privileges of employment. Please contact us at 202.419.7762 or applyassistance@danaher.com to request accommodation.

If you’ve ever wondered what’s within you, there’s no better time to find out.

When you join us, you’ll also be joining Danaher’s global organization, where 80,000 people wake up every day determined to help our customers win. As an associate, you’ll try new things, work hard, and advance your skills with guidance from dedicated leaders, all with the support of powerful Danaher Business System tools and the stability of a tested organization.",10d,www.glassdoor.com/partner/jobListing.htm?pos=114&ao=1136043&s=58&guid=000001846a284508b8719e5f05116f02&src=GD_JOB_VIEW&t=SR&vt=w&cs=1_2328baff&cb=1668228394758&jobListingId=1008249981540&jrtk=3-0-1ghl2gh9qj4gm801-1ghl2ghaeg4es800-64d6555497c714ae-
