Company_Name,Company_Link,Title,Location,Estimated_Salary,Job_Description,Job_Age,Application_Link
"['Mammotome', '4.3']",http://www.mammotome.com/,Sr. Manager of Software Engineering,"Sunnyvale, CA",$145K - $165K (Employer est.),"Mammotome associates know that every moment matters when it comes to advancing breast cancer diagnostics and surgical solutions. When you come to work at Mammotome, you’re collaborating with a global team of engineers, designers, communicators, strategists, and specialists to improve patient outcomes. If you want to be inspired to grow every day, join our diverse, hardworking, high-performing team.

Be part of a company that’s a trusted leader in breast cancer diagnostics and support products you can feel passionate about!

Mammotome is proud to work alongside a community of six fellow Diagnostics Companies at Danaher. Together, we’re working at the pace of change to improve patient lives with diagnostic tools that address the world’s biggest health challenges.

As the Global Product Manager (GPM), you are the specialist on your portfolio to develop and implement product line marketing strategies in order to maximize sales and profitability for Mammotome. The GPM works upstream and downstream in handling products cradle to grave including product performance, product launches and strategies to differentiate Mammotome in the marketplace. This person will partner closely with cross-functional teams to create a comprehensive and integrated product and procedure strategy.

This position is part of the Global Product Management Team located in Cincinnati Ohio and will be a hybrid position. At Mammotome, our passion is driving innovative technologies that create efficiencies, while never forgetting that at the heart of every breast cancer journey is a patient.


Product Management & Strategy
Develop and drive achievement of annual sales goals and procedure growth.
Collaboration with global partners on development and implementation of marketing strategy (positioning, place, price and promotion).
Lead products throughout their lifecycle ensuring continuing commercial success of new products and End-of-Life for older products.
Drive marketing activities and development of sales tools to improve product revenues.
Support the commercial team with product training, evidence and sales tools.
Work with team members in Strategic Marketing, Selling Unit (geo focused) Marketing, MarCom, Sales, Service, Clinical, R&D, Engineering, Operations, Supply Chain, Finance, Legal, etc. with strategies to maximize revenue, profitability and procedure adoption.
Partner with Supply Chain & Operations to plan and communicate production and inventory needs based on annual product sales forecasts and monthly updates.
Provide appropriate product information, including technical date and product availability information, CAPA.
Develop and maintain knowledge of the market, direct and emerging competitors, and healthcare policy changes impacting relevant product and procedures.
Ensures Future Growth
Represent the “Voice of Customer” (VOC) as the commercial lead for new product development projects for the product line– partnering with commercial team to define customer requirements, product concept definition and overall value proposition
Understand customer needs and use cases leveraging Problem 2 Portfolio (P2P) process, collecting VOC through qualitative and quantitative methodologies.
Actively spend time with customers, internal and field visits, to ensure alignment of plans to meet customer and market needs and to ensure strong customer insights.
Leadership
Coordinate across teams to achieve objectives and timelines with visual action plans, daily management principles and kaizen events.
Participate in PPG discussions/presentations to align market needs with strategic resources, development runways and rationalized product roadmap.
Actively shares and collaborates with cross functional teams to ensure best practice sharing, efficiency and effectiveness of marketing resources.
Other duties as assigned.


Bachelor’s Degree in Business, Marketing or related field equivalent required.
MBA preferred but not required.
Minimum 2 years’ experience in product management (or similar customer facing role with technical product).
Minimum of 4 years’ B2B experience within a Marketing, Business Development, Engineering, Sales or Clinical role required.
Minimum of 4 years of industry experience in healthcare, medical device or pharmaceuticals preferred.
20% travel with a mix of domestic and international locations.

At Mammotome we believe in designing a better, more sustainable workforce. We recognize the benefits of flexible, hybrid working arrangements for eligible roles and are committed to providing enriching careers, no matter the work arrangement. This position is eligible for a hybrid work arrangement in which you can work part-time at the Company location identified above and part-time remotely from your home. Additional information about this hybrid work arrangement will be provided by your interview team. Explore the flexibility and challenge that working for Mammotome can provide.

#LI-CV1
#LI-Hybrid

When you join us, you’ll also be joining Danaher’s global organization, where 80,000 people wake up every day determined to help our customers win. As an associate, you’ll try new things, work hard, and advance your skills with guidance from dedicated leaders, all with the support of powerful Danaher Business System tools and the stability of a tested organization.",8d,www.glassdoor.com/partner/jobListing.htm?pos=127&ao=1136043&s=58&guid=000001846a210fd29db7e455438561bc&src=GD_JOB_VIEW&t=SR&vt=w&cs=1_03f19019&cb=1668227960369&jobListingId=1008134996455&jrtk=3-0-1ghl2240f2ape001-1ghl22411i150800-c0d2eb6ba6ddd665-
"['Beckman Coulter Diagnostics', '4.0']",http://www.beckmancoulter.com/,Sr. Manager of Software Engineering,"Sunnyvale, CA",$145K - $165K (Employer est.),"Wondering what’s within Beckman Coulter Diagnostics? Take a closer look.

At first glance, you’ll see that for more than 80 years we’ve been dedicated to advancing and optimizing the laboratory to move science and healthcare forward. Join a team where you can be heard, be supported, and always be yourself. We’re building a culture that celebrates backgrounds, experiences, and perspectives of all our associates. Look again and you’ll see we are invested in you, providing the opportunity to build a meaningful career, be creative, and try new things with the support you need to be successful.

Beckman Coulter Diagnostics is proud to work alongside a community of six fellow Diagnostics Companies at Danaher. Together, we’re working at the pace of change to improve patient lives with diagnostic tools that address the world’s biggest health challenges.

The Facilities Specialist II for Beckman Coulter Diagnostics is responsible for providing project coordination and services related to facilities projects of varying complexity, to include renovations, maintenance projects and preparation of design documents, specification, and estimates. Will also act as a Team Lead & provide direction to the facilities technicians.

This position is an integral part of the Facilities Organization located in Miami, Fl. and will be an onsite role. At Beckman Coulter, our vision is to relentlessly reimagine healthcare, one diagnosis at a time.

You will report to the Facilities Manager responsible for managing & coordinating all facilities related functions such as maintenance, custodial services, mail services in Kendall and Hialeah. If you thrive in a fast paced role and want to work to build a world-class facilities organization—read on.


Utilize strong leadership, analytical, organizational, and project management skills.
Take ownership of the Facilities Daily Management tools.
Manage the coordination and completion of approved Facilities capital projects
Build and maintains a team culture of Kaizen that improves the office and manufacturing environment from a standpoint of safety, efficiency, hygiene, sustainability.
Actively support EHS initiatives and champions 5-S and Safety for the site


Bachelors degree with 2+ years of experience in driving and managing projects.
Strong technical knowledge of HVAC, Plumbing, Electrical, Machine Control, EMS/BMS, Preventive Maintenance, Energy & Sustainability, and Building Management applications and systems.
Proven working understanding of Microsoft Office

It would be a plus if you also possess previous experience and/or certifications in:
HVAC/Plumbing
Electrical
Project Management Professional (PMP)

When you join us, you’ll also be joining Danaher’s global organization, where 80,000 people wake up every day determined to help our customers win. As an associate, you’ll try new things, work hard, and advance your skills with guidance from dedicated leaders, all with the support of powerful Danaher Business System tools and the stability of a tested organization.",30d+,www.glassdoor.com/partner/jobListing.htm?pos=129&ao=1136043&s=58&guid=000001846a210fd29db7e455438561bc&src=GD_JOB_VIEW&t=SR&vt=w&cs=1_1fdcf7d4&cb=1668227967107&jobListingId=1008104968664&jrtk=3-0-1ghl2240f2ape001-1ghl22411i150800-bca3004a31bcd486-
"['Beckman Coulter Diagnostics', '4.0']",http://www.beckmancoulter.com/,Sr. Manager of Software Engineering,"Sunnyvale, CA",$145K - $165K (Employer est.),"Wondering what’s within Beckman Coulter Diagnostics? Take a closer look.

At first glance, you’ll see that for more than 80 years we’ve been dedicated to advancing and optimizing the laboratory to move science and healthcare forward. Join a team where you can be heard, be supported, and always be yourself. We’re building a culture that celebrates backgrounds, experiences, and perspectives of all our associates. Look again and you’ll see we are invested in you, providing the opportunity to build a meaningful career, be creative, and try new things with the support you need to be successful.

Beckman Coulter Diagnostics is proud to work alongside a community of six fellow Diagnostics Companies at Danaher. Together, we’re working at the pace of change to improve patient lives with diagnostic tools that address the world’s biggest health challenges.

The Supplier Relationship Manager for Beckman Coulter Diagnostics is responsible for the strategic commodity management through supplier relationships, supplier risk mitigation, operating margin expansion, and driving optimal total cost of ownership. They will be responsible for creating relationship strategies and manage suppliers to simplify our supply base and reduce material cost by implementing negotiation strategies while ensuring product availability and support multiple stakeholders.

This position is part of the Strategic Procurement team located in Miami, FL, and will be a hybrid position.

You will be a part of the Strategic Procurement team and report to the Senior Manager, Strategic Procurement responsible for leading the Strategic Procurement for Electronics. If you thrive in a multifunctional, leadership, fast -paced role and want to work to build a Procurement world-class organization—read on.


Lead supply chain initiatives in a manufacturing operations environment and all aspects of selection and business transitions with overall project management for your assigned commodities.
Develop commodity strategies for the organization and Negotiate contracts/agreements with those suppliers and ensure effective ongoing relationships.
Partner with assigned suppliers, conducting regular business reviews with those having a high impact on the company.
Analyze and supervise corrective actions when supplier performance fails to meet expectations and address supplier performance or relationship issues that are raised by our manufacturing sites.
Lead requests for supplier pricing or information (RFP/RFI) and online auctions.


Bachelor’s degree with 5+ years’ experience, or Master’s degree with 3+ years’ experience, or Doctoral degree with 0+ years’ experience
2+ years’ experience in a procurement, strategic sourcing or a commodity management capacity in a manufacturing environment
Strong business acumen and ability to build strong business case to support sourcing decisions.
Demonstrated negotiation skills and demonstrated cost out accomplishments


Electronics procurement and strategic relationships within the industry
FDA regulated experience
Global procurement experience

At Beckman Coulter we believe in designing a better, more sustainable workforce. We recognize the benefits of flexible, hybrid working arrangements for eligible roles and are committed to providing enriching careers, no matter the work arrangement. This position is eligible for a hybrid work arrangement in which you can work part-time at the Company location identified above and part-time remotely from your home. Additional information about this hybrid work arrangement will be provided by your interview team. Explore the flexibility and challenge that working for Beckman Coulter can provide.

When you join us, you’ll also be joining Danaher’s global organization, where 80,000 people wake up every day determined to help our customers win. As an associate, you’ll try new things, work hard, and advance your skills with guidance from dedicated leaders, all with the support of powerful Danaher Business System tools and the stability of a tested organization.",8d,www.glassdoor.com/partner/jobListing.htm?pos=130&ao=1136043&s=58&guid=000001846a210fd29db7e455438561bc&src=GD_JOB_VIEW&t=SR&vt=w&cs=1_3284039b&cb=1668227970025&jobListingId=1008255075107&jrtk=3-0-1ghl2240f2ape001-1ghl22411i150800-a2ff26cd8967400f-
"['Corporate', '3.3']",http://www.envistaco.com/,"IT Operations Helpdesk Analyst (Sturtevant, WI)","Sturtevant, WI",$42K - $58K (Glassdoor est.),"We know that dental professionals do more than create healthy, beautiful smiles – they create confidence. To achieve their goals they need a champion. They need someone who will be there for them, side by side and end to end. At Envista, we’re uniquely positioned to be this champion. Our differentiated combination of commitment to our customers, innovative focus on the future, respect for each other, continuous improvement, and empowering, accountable leadership embolden us to champion dental professionals like no one else can. Our comprehensive product portfolio consisting of more than 30 industry leading brands, covers an estimated 90% of dentists’ clinical needs for diagnosing, treating, and preventing dental conditions as well as improving the aesthetics of the human smile. Envista companies partner with dental professionals to help them deliver the best possible patient care. We believe true champions lift each other up, and we are looking for new champions to join our team. If you believe champions do more than win – they stand for something bigger – you can build a meaningful career at Envista. Let’s talk. Learn more at envistaco.com.",8d,www.glassdoor.com/partner/jobListing.htm?pos=101&ao=1110586&s=58&guid=000001846a22bf61ac54d487aaa7068a&src=GD_JOB_VIEW&t=SR&vt=w&cs=1_da2c32ab&cb=1668227983229&jobListingId=1008254133572&jrtk=3-0-1ghl25fsdk639801-1ghl25fsvgriq800-9ce6ec311582a9bf--6NYlbfkN0AOHwrLlyTXiG3HfdcLhaCVf3-H-RbPAVLFEo3oL0rfm3fE8m1zPVraZSUGq2CqPCnNIucsZ2uHJKL2IyGk9MB8IgoG3c_Fmpp4Ed9lEVv_0ZSgJWXRj2VrRCVHJi8wdf6csCEj9zV0NXolAP3zd4yierHnps3_L3PRINbSzlcq3rR2iZLDAZgCBux6sIyd0HcS4kvpXO2ZjvCbR5MzHzVgLtpyphTT8XqOv6mNLhzhM86pYlVUjQTaTYMBlayQ0MUXQI3Njk1jQs3Tgr8S6wa_udgOpLSj4VPTodXndspjJqHEaxiYC6v6MRaY-seRfUx6c08TYKwXfWKzZJ5U_kTNtCTS_gHpNFSGrOEl5JsESMgJYz2aIWgF6lfHEpsUvupoK2qTfNclLo3riyrjQv5R1iRUKV6MgEjZIQkPRY2YCHip0esmiJ6eaDWtIfZfg9YrHSyjmobvonGEN0oXL7S4kWqqcGL-WHQG3bYzl0PTafq8vakU6Xlk76FVE9rQKUuEpKaafnavh0rLX1WCbaGuzOC-A63Yyi-uziPOExGwShin3-Vq8x4-b7myrTt83Vx5jiql-TJz5NQ76Wy9C44jegarX4kcranMAShNDasTVGKfUWONYmlqnatRiNCVDJk07VfmsZBCm1keaiM-VSyabluSXKy2pJNCHbVpIpuNjqqsdkT-u554
"['Beckman Coulter Diagnostics', '4.0']",http://www.beckmancoulter.com/,"IT Operations Helpdesk Analyst (Sturtevant, WI)","Sturtevant, WI",$42K - $58K (Glassdoor est.),"Wondering what’s within Beckman Coulter Diagnostics? Take a closer look.

At first glance, you’ll see that for more than 80 years we’ve been dedicated to advancing and optimizing the laboratory to move science and healthcare forward. Join a team where you can be heard, be supported, and always be yourself. We’re building a culture that celebrates backgrounds, experiences, and perspectives of all our associates. Look again and you’ll see we are invested in you, providing the opportunity to build a meaningful career, be creative, and try new things with the support you need to be successful.

Beckman Coulter Diagnostics is proud to work alongside a community of six fellow Diagnostics Companies at Danaher. Together, we’re working at the pace of change to improve patient lives with diagnostic tools that address the world’s biggest health challenges.

The Senior Vulnerability Management Analyst for Beckman Coulter Diagnostics is responsible for managing projects and initiatives focused on reducing cyber security risk associated with system vulnerabilities across the enterprise.

This position is part of the Global Information Security team within IT located in Brea and will be fully remote. At Beckman Coulter, our vision is to relentlessly reimagine healthcare, one diagnosis at a time.

You will be a part of the Global Information Security team and report to the Senior Manager of Global Information Security responsible for managing projects and initiatives. If you thrive in an amazing cyber role and want to work to build a world-class cyber security organization organization—read on.


Lead cross-functional teams in vulnerability management projects and initiatives to design sustainable remediation procedures and address vulnerable systems

Partner with Danaher Vulnerability Management Team to define and measure progress while embedding vulnerability management across business system lifecycle management processes

Serve as subject matter expert for IT and business teams, providing analysis to help them understand remediation steps, impact, and prioritization

Maintain enterprise vulnerability scanning infrastructure, ensuring daily operation of scans and reporting are occurring as required

Prepare reports and presentations communicating risks and status to a diverse audience of technical staff and both IT and business leadership


Bachelor’s degree in related field with 5+ years of experience in Vulnerability Management, Cyber Security, or related IT work OR Master’s Degree with 3+ years of experience OR Doctoral degree in field with 0+ years experience.

Demonstrated success leading Vulnerability Management programs or remediation efforts

Proficiency with enterprise vulnerability management platforms such as Rapid7 Nexpose, Tenable Nessus, or Qualys

Skilled at analyzing IT/VM data sets using tools such as Excel or Power BI and presenting in a meaningful, digestible format for leadership teams


CISSP, GIAC/SANS, or similar certifications

Expertise with attack surface management platforms such as Cycognito, Xpanse, or RiskIQ

Good project management skills including effective schedule, resource, and risk management

At Beckman Coulter Diagnostics we believe in designing a better, more sustainable workforce. We recognize the benefits of flexible, remote working arrangements for eligible roles and are committed to providing enriching careers, no matter the work arrangement. This position is eligible for a remote work arrangement in which you can work remotely from your home. Additional information about this remote work arrangement will be provided by your interview team. Explore the flexibility and challenge that working for Beckman Coulter Diagnostics can provide.

The salary range OR the hourly range for this role is $71,900-$125,900 yearly. This is the range that we in good faith believe is the range of possible compensation for this role at the time of this posting. We may ultimately pay more or less than the posted range. This range is only applicable for jobs to be performed in Colorado. This range may be modified in the future.

This job is also eligible for bonus/incentive pay.

When you join us, you’ll also be joining Danaher’s global organization, where 80,000 people wake up every day determined to help our customers win. As an associate, you’ll try new things, work hard, and advance your skills with guidance from dedicated leaders, all with the support of powerful Danaher Business System tools and the stability of a tested organization.",30d+,www.glassdoor.com/partner/jobListing.htm?pos=102&ao=1136043&s=58&guid=000001846a22bf61ac54d487aaa7068a&src=GD_JOB_VIEW&t=SR&vt=w&cs=1_a2e2431f&cb=1668227985183&jobListingId=1008140309174&jrtk=3-0-1ghl25fsdk639801-1ghl25fsvgriq800-e591403303f2552b-
"['Danaher Corporation', '4.0']",http://jobs.danaher.com/,"IT Operations Helpdesk Analyst (Sturtevant, WI)","Sturtevant, WI",$42K - $58K (Glassdoor est.),"At first glance, you’ll see Danaher’s scale. Our 80,000 associates work across the globe at more than 20 unique operating companies within four platforms—life sciences, diagnostics, water quality, and product identification. Look again and you’ll see the opportunity to build a meaningful career, be creative, and take risks with the support you need to be successful. You’ll find associates who are as certain about their impact as they are about where they’re headed next. You’ll find the Danaher Business System, which makes everything possible. You’ll also see a company that investors trust—our culture of continuous improvement has helped us outperform the S&P 500 by more than 5,000% over the past 25 years.

And no matter where you look at Danaher, at the heart of what we do, you’ll witness our shared purpose—helping realize life’s potential—in action. Whether we’re enabling our customers to provide clean water, supporting a life-saving vaccine development, advancing a new instrument for cancer diagnosis, or ensuring product safety, our work helps improve millions of lives.

We hope you’ll see yourself here, too. What you find at Danaher—and within yourself— might just change the world.

Are you a highly motivated and talented Senior Cyber Risk Quantification Analyst (CRQ) who would love to join the growing security organization at Danaher Corporation? Lead information security risk initiatives across 20+ globally diverse science and technology operating companies! By identifying and managing technology risk through quantitative and analytical practices, you will play a pivotal role in protecting Danaher’s sensitive data and other high value assets throughout the organization.

At Danaher we believe in designing a better, more sustainable workforce. We recognize the benefits of flexible, remote working arrangements for eligible roles and are committed to providing enriching careers, no matter the work arrangement. This position is eligible for a remote work arrangement in which you can work remotely from your home. Additional information about this remote work arrangement will be provided by your interview team. Explore the flexibility and challenge that working for Danaher can provide.

Primary Responsibilities

Lead risk management activities across Danaher’s operating companies, including implementation of a risk management framework and supporting cyber risk quantification functions based on Factor Analysis of Information Risk (FAIR)

Utilize information security risk expertise to develop loss event scenarios across operating companies, business units, projects, and products

Interpret internal or external cyber security risk analyses in business terms and recommend best practices

Continually monitor risk treatment activities to help ensure timely completion and risk reduction

Monitor and identify opportunities to improve the effectiveness of risk management processes

Qualifications

Bachelor’s degree or equivalent level of education and expertise

4+ years of experience in information security risk management, governance, or compliance related roles

Proven experience with cyber risk quantification methodologies and tools, such as Factor Analysis of Information Risk (FAIR) and RiskLens, or similar risk management experience

Understanding of security standards and frameworks such as ISO 27001/2, NIST 800-53, CIS Top 20 and similar

Excellent ability to communicate complex subjects effectively, especially at the executive level

Preferred Qualifications

Relevant certifications such as Factor Analysis of Information Risk (FAIR), Certified in Risk and Information Systems Control (CRISC), Certified Information Systems Auditor (CISA), Certified Information Systems Security Professional (CISSP) or similar

Experience using RiskLens and ServiceNow Integrated Risk Management platforms

#LI-SM1
#LI-Remote

When you join us, you’ll also be joining Danaher’s global organization, where 80,000 people wake up every day determined to help our customers win. As an associate, you’ll try new things, work hard, and advance your skills with guidance from dedicated leaders, all with the support of powerful Danaher Business System tools and the stability of a tested organization.",24d,www.glassdoor.com/partner/jobListing.htm?pos=103&ao=1136043&s=58&guid=000001846a22bf61ac54d487aaa7068a&src=GD_JOB_VIEW&t=SR&vt=w&cs=1_1235efec&cb=1668227988085&jobListingId=1008214399631&jrtk=3-0-1ghl25fsdk639801-1ghl25fsvgriq800-3a557161dad47977-
