Company_Name,Company_Link,Title,Location,Estimated_Salary,Job_Description,Job_Age,Application_Link
"['DXC Technology', '3.6']",http://www.dxc.com/,"Desktop MECM Engineer - On-Site Bath, Maine",Maine,,"Job Description:
Essential Job Functions
Assists in the design of, and develops integrated solutions in accordance with, corporate standards and products.
Provides basic technical support to customers by handling systems-related issues; may provide on-call technical support telephonically and/or electronically.
Assists in the analysis and resolves basic program support deficiencies and conducts testing to enhance performance.
Works on projects as assigned; assists in supporting the efforts of technical support staff in the performance of assigned projects.",15d,www.glassdoor.com/partner/jobListing.htm?pos=101&ao=1136043&s=58&guid=00000184693eda3b85bfc65a914afe8e&src=GD_JOB_VIEW&t=SR&vt=w&cs=1_b2cb6435&cb=1668213043031&jobListingId=1008236918574&jrtk=3-0-1ghkjtmjg2bms001-1ghkjtmk0i39u800-cb83df83e39c1dfd-
"['DXC Technology', '3.6']",http://www.dxc.com/,Junior Network Engineer,Maine,$72K - $102K (Glassdoor est.),"Job Description:
DXC Technology (NYSE: DXC) helps global companies run their mission critical systems and operations while modernizing IT, optimizing data architectures, and ensuring security and scalability across public, private and hybrid clouds. The world’s largest companies and public sector organizations trust DXC to deploy services across the Enterprise Technology Stack to drive new levels of performance, competitiveness, and customer experience. Learn more about how we deliver excellence for our customers and colleagues at DXC.com.
****This role requires working onsite in Bath ME*****
Essential Job Functions
Performs routine analyses of voice/data network needs. Gathers information and assists with integration and installations to include routers, switches, hubs, UPS, firewalls, wireless access points, etc.",30d+,www.glassdoor.com/partner/jobListing.htm?pos=101&ao=1136043&s=58&guid=00000184693f050fa3c5af7af859acfa&src=GD_JOB_VIEW&t=SR&vt=w&cs=1_733da078&cb=1668213057505&jobListingId=1008163569109&jrtk=3-0-1ghkju19rjcbv801-1ghkju1aci17g800-45c3ac64943a8ea0-
"['The Crox Group', '5.0']",http://www.thecroxgroup.com/,Junior Network Engineer,Maine,$72K - $102K (Glassdoor est.),"Role: - Network Engineer
Location: - Atlanta, GA
Job Description: -
Provide subject matter expert support to day-to-day network administration staff supporting the environment containing 200-300 network devices.
·Troubleshoot network environment and make recommendations for system findings and enhancements
·Support related project and change activity including network change activity, firewall updates, load balancer configuration changes, hardware failure mitigation, and repair, OS, firmware, and configurations upgrades/updates, and build-out of network equipment",16d,
"['Luxoft', '4.3']",http://www.luxoft.com/,Junior Network Engineer,Maine,$72K - $102K (Glassdoor est.),"Project Description
Ongoing day-to-day Network support for 200-300 devices.
Tech refresh project.
Project duration: 12 months.
Support the refresh and replacement of legacy Cisco and F5 network devices with new Dell hardware.
Installation of:
Dell Network routing and switching devices:
F5 load balancers

** Data center migration project:
Project duration: 9-12 months.
Support the migration of 1,500 Linux and Windows servers that are moving from the customer’s data center in Phoenix, AZ to the DXC data center in Suwanee, GA.
** Installation of:
** Assist platform, storage and application teams with the movement of equipment from old to new data center location.
** Troubleshoot any issues that occur as the result of migration activities.",30d+,www.glassdoor.com/partner/jobListing.htm?pos=103&ao=1136043&s=58&guid=00000184693f050fa3c5af7af859acfa&src=GD_JOB_VIEW&t=SR&vt=w&cs=1_3d046ebc&cb=1668213061240&jobListingId=1008110167984&jrtk=3-0-1ghkju19rjcbv801-1ghkju1aci17g800-f65c1af541275c3f-
"['DXC Technology', '3.6']",http://www.dxc.com/,Junior Network Engineer,Maine,$72K - $102K (Glassdoor est.),"Job Description:
About this Role:
As a Field Service Technician you will work onsite at our customer's office in Spring, TX. In this role you would typically work directly with Employee's at our customer location. Being a self-starter who is comfortable with minimal supervision is essential to success in this role.
What you will do:
Participates as a member of an IT technical team. Performs basic analysis of functional or service requirements using the fundamental understanding of IT Business processes or problems. Implements end-user or enterprise infrastructure or application services prepared by more senior Engineers.",30d+,www.glassdoor.com/partner/jobListing.htm?pos=104&ao=1136043&s=58&guid=00000184693f050fa3c5af7af859acfa&src=GD_JOB_VIEW&t=SR&vt=w&cs=1_9412f58b&cb=1668213063090&jobListingId=1008199939953&jrtk=3-0-1ghkju19rjcbv801-1ghkju1aci17g800-06698c3a5a623176-
"['DXC Technology', '3.6']",http://www.dxc.com/,Junior Network Engineer,Maine,$72K - $102K (Glassdoor est.),"Job Description:
What You'll Do
Develops risk-based mitigation strategies for networks, operating systems, and applications
Compiles and tracks vulnerabilities and mitigation results to quantify program effectiveness
Creates and maintains vulnerability management policies, procedures, and training
Review and define requirements for information security solutions
Organize network-based scans to identify possible network security attacks and host-based scans to identify vulnerabilities in workstations, servers, and other network hosts.",30d+,www.glassdoor.com/partner/jobListing.htm?pos=105&ao=1136043&s=58&guid=00000184693f050fa3c5af7af859acfa&src=GD_JOB_VIEW&t=SR&vt=w&cs=1_bf0273fb&cb=1668213066129&jobListingId=1008163569059&jrtk=3-0-1ghkju19rjcbv801-1ghkju1aci17g800-5a7a7b36f978da75-
"['DXC Technology', '3.6']",http://www.dxc.com/,Junior Network Engineer,Maine,$72K - $102K (Glassdoor est.),"Job Description:
At DXC we use the power of technology to deliver mission critical IT services that our customers need to modernize operations and drive innovation across their entire IT estate. We provide services across the Enterprise Technology Stack for business process outsourcing, analytics and engineering, applications, security, cloud, IT outsourcing and modern workplace.
Our DXC Modern Workplace services enables customers' employees to easily find, understand and engage with IT and their colleagues anytime, anywhere and on any device. We empower a personalized experience that enables employees to work seamlessly and securely.
What you will do:
3+ years of experience in a hands-on desk side support role required. Proficient with PC hardware repair and can troubleshoot/resolve Microsoft Office software and latest Windows operating system issues Windows 10, Windows 11.",30d+,www.glassdoor.com/partner/jobListing.htm?pos=106&ao=1136043&s=58&guid=00000184693f050fa3c5af7af859acfa&src=GD_JOB_VIEW&t=SR&vt=w&cs=1_cb4b9b0f&cb=1668213070096&jobListingId=1008189949519&jrtk=3-0-1ghkju19rjcbv801-1ghkju1aci17g800-80b9b7d9e51afee3-
"['VMware', '4.3']",https://www.vmware.com/,"Partner Solutions Architect - Americas DXC - Opportunity for Working Remotely Newark, NJ","Newark, NJ",$220K - $330K (Employer est.),"Partner Solution Architect - Strategic Partners
Job Description
The Elevator Pitch: Why will you enjoy this new opportunity?
A Partner Solutions Architect on the Strategic Partners team is responsible for leading the technical relationship with one of our top partners in North America. A VMware Partner Solutions Architect (PSA) works collaboratively with partner business managers (PBMs), solution specialists and other partner resources to empower our partners to sell and deliver VMware solutions.
Success in this role: What are the performance goals over the first 6-12 months you will work toward completing?







VMware Company Overview: At VMware, we believe that software has the power to unlock new opportunities for people and our planet. We look beyond the barriers of compromise to engineer new ways to make technologies work together seamlessly. Our cloud, mobility, and security software form a flexible, consistent digital foundation for securely delivering the apps, services and experiences that are transforming business innovation around the globe. At the core of what we do are our people who deeply value execution, passion, integrity, customers, and community. Shape what’s possible today at http://careers.vmware.com.

Equal Employment Opportunity Statement: VMware is an Equal Opportunity Employer and Prohibits Discrimination and Harassment of Any Kind: VMware is committed to the principle of equal employment opportunity for all employees and to providing employees with a work environment free of discrimination and harassment. All employment decisions at VMware are based on business needs, job requirements and individual qualifications, without regard to race, color, religion or belief, national, social or ethnic origin, sex (including pregnancy), age, physical, mental or sensory disability, HIV Status, sexual orientation, gender identity and/or expression, marital, civil union or domestic partnership status, past or present military service, family medical history or genetic information, family or parental status, or any other status protected by the laws or regulations in the locations where we operate. VMware will not tolerate discrimination or harassment based on any of these characteristics. VMware encourages applicants of all ages. Vmware will provide reasonable accommodation to employees who have protected disabilities consistent with local law.",21d,www.glassdoor.com/partner/jobListing.htm?pos=101&ao=1136043&s=58&guid=00000184693f69b986de2e68b86c28f5&src=GD_JOB_VIEW&t=SR&vt=w&cs=1_1bc3b32d&cb=1668213085342&jobListingId=1008223934463&jrtk=3-0-1ghkjuqfbkbnb801-1ghkjuqg3irkn800-74787a0e8bc7ecda-
"['Amcor', '3.5']",http://www.amcor.com/,"Partner Solutions Architect - Americas DXC - Opportunity for Working Remotely Newark, NJ","Newark, NJ",$220K - $330K (Employer est.),"Join Amcor and you can be part of the team that makes the packaging of the future better for people and our planet.
Here at Amcor, we work together every day to make a positive impact on the lives of millions of people across the globe by providing packaging for essential products, including food, beverages, pharmaceutical, medical, home and personal-care.
We are sustainability leaders in our industry. We are the first global packaging company to commit to make all our products recyclable or reusable by 2025.
Our products are vital to support the lives of millions of people across the globe every day.
We are always looking for talented and passionate individuals who are motivated to make a difference. Working at Amcor means you will have a unique opportunity to be a part of an organisation that is committed to innovating and driving new solutions to create more sustainable packaging solutions.
At Amcor Rigid Packaging (ARP), our teams are focused on developing and making plastic bottles and jars that create a unique experience and are better for the environment. Our bottles and jars are primarily made from PET (polyethylene terephthalate), which has rapidly become the world’s preferred packaging material. PET is lightweight, shatterproof, recloseable, resealable, reusable and infinitely recyclable*.*",30d+,
"['DXC Technology', '3.6']",http://www.dxc.com/,"Partner Solutions Architect - Americas DXC - Opportunity for Working Remotely Newark, NJ","Newark, NJ",$220K - $330K (Employer est.),"Job Description:
At DXC we use the power of technology to deliver mission critical IT services that our customers need to modernize operations and drive innovation across their entire IT estate. We provide services across the Enterprise Technology Stack for business process outsourcing, analytics and engineering, applications, security, cloud, IT outsourcing and modern workplace.
Our DXC Modern Workplace services enables customers' employees to easily find, understand and engage with IT and their colleagues anytime, anywhere and on any device. We empower a personalized experience that enables employees to work seamlessly and securely.
´About this role´
Within the family there is a range of technical and managerial customer on-site functions. The family of jobs is focused on managing the onsite delivering of software services, pre-sales, post-sales or service delivery support, installation and configuration for customer environments. The jobs solve various business systems, networking and applications problems for standard industry servers, specialized or complex clustered environments. Deliver reactive and proactive activities according to Service Level Agreement to ensure customer satisfaction and loyalty. Provides direct post-sales systems on site technical support for reactive and proactive customers. Each position maintains a high level of customer satisfaction by ensuring clear business and technical solution alignment, clarifying customer needs and ensuring that they are met. Jobs are responsible for company Total Customer Experience as well as the revenue growth, profitability, and account retention",24h,www.glassdoor.com/partner/jobListing.htm?pos=103&ao=1136043&s=58&guid=00000184693f69b986de2e68b86c28f5&src=GD_JOB_VIEW&t=SR&vt=w&cs=1_1ad78dbd&cb=1668213097401&jobListingId=1008273155322&jrtk=3-0-1ghkjuqfbkbnb801-1ghkjuqg3irkn800-12a02db32f401771-
"['DXC Technology', '3.6']",http://www.dxc.com/,"Partner Solutions Architect - Americas DXC - Opportunity for Working Remotely Newark, NJ","Newark, NJ",$220K - $330K (Employer est.),"DXC Technology (NYSE: DXC) helps global companies run their mission critical systems and operations while modernizing IT, optimizing data architectures, and ensuring security and scalability across public, private and hybrid clouds. The world’s largest companies and public sector organizations trust DXC to deploy services across the Enterprise Technology Stack to drive new levels of performance, competitiveness, and customer experience. Learn more about how we deliver excellence for our customers and colleagues at DXC.com.
Responsibilities include technical troubleshooting, warranty adjudication, product support and customer support related to contacts from the Customer’s clients and Customer personnel involving customer products, and processing product warranty claims. Representatives provide technical support and warranty adjudication on heavy truck systems for an industry leading customer assistance call center. This position is client facing and spends much time interacting with the client's North American Field Operations as well as providing specialized mechanical/technical support and warranty adjudication for the following product lines to repair facility networks throughout North America (U.S. and Canada). The position also includes the processing and verification of warranty claims. Training would be provided on all products and software used in daily tasks.",30d+,
"['DXC Technology', '3.6']",http://www.dxc.com/,Azure Data Engineer,Remote,$84K - $131K (Employer est.),"As a Data Engineer/Developer will work with multiple teams to deliver solutions on the Azure Cloud using core Azure cloud tools/languages. In addition will participate in building the next generation of application and/or data platforms and/or improving recent implementations.
(This is not an infrastructure position).
Essential Job Functions
Work as part of a team to develop Azure Cloud Applications, work with Big Data Cloud Data and Analytics solutions
Participate in development of cloud SQL data warehouses, data as a service, business intelligence solutions .",25d,
"['DXC Technology', '3.6']",http://www.dxc.com/,Senior Life Insurance Business Analyst (Remote in US),Remote,$80K - $130K (Employer est.),"DXC Technology (NYSE: DXC) helps global companies run their mission critical systems and operations while modernizing IT, optimizing data architectures, and ensuring security and scalability across public, private and hybrid clouds. The world’s largest companies and public sector organizations trust DXC to deploy services across the Enterprise Technology Stack to drive new levels of performance, competitiveness, and customer experience. Learn more about how we deliver excellence for our customers and colleagues at DXC.com
At DXC we use the power of technology to deliver mission critical IT services that our customers need to modernize operations and drive innovation across their entire IT estate. We provide services across the Enterprise Technology Stack for business process outsourcing, analytics and engineering, applications, security, cloud, IT outsourcing and modern workplace.
Our DXC Insurance BPaaS and BPO services help our customers optimize and transform operations, lower costs, increase agility and open new channels for growth. Our people, technology and best practices improve and automate highly complex business processes across front, middle, and back offices — while facilitating customer experience transformation.",30d+,
