Company_Name,Company_Link,Title,Location,Estimated_Salary,Job_Description,Job_Age,Application_Link
"['Motion Control Engineering', '3.6']",http://www.nidec-motor.com/,Embedded Software Engineer,"Charlottesville, VA",$74K - $99K (Glassdoor est.),"We begin with dreams. Dreams drive our motivation. Dreams are our future. The world's dreams, people's dreams, our dreams. Our passion creates ideas that make dreams come alive. Technology and products that were only dreams become reality.

All for dreams. Dreams challenge and the Nidec-Group will continue to meet the challenge. For the world's and people's tomorrows; the world's first, the world's best technologies and products; we will continue our part in creating a better society.
Job Summary
Job Description
Position Summary:
Provide on-site and remote support of standard and custom power conversion products, assemblies, and systems which include AC and DC Low Voltage Drives, Inverters for Battery Energy Storage & EV charging, Medium Voltage Drives, PLC’s, and HMI’s for both industrial and renewable energy applications. Conduct installation and commissioning, troubleshooting, repairs, and predictive/preventative maintenance of power conversion products/assemblies to support a variety of customer applications across North America.",30d+,www.glassdoor.com/partner/jobListing.htm?pos=107&ao=1136043&s=58&guid=000001846c671cfb8aa62a2a7e298b41&src=GD_JOB_VIEW&t=SR&vt=w&cs=1_b3a029d8&cb=1668266039705&jobListingId=1007942598439&jrtk=3-0-1ghm6e799k24k801-1ghm6e79rii3h800-70ea1da80b7d6297-
['Central Rivers Power'],,Embedded Software Engineer,"Charlottesville, VA",$74K - $99K (Glassdoor est.),"Overview:
CRP is seeking an experienced Process Controls Engineer who can join our Electrical & Controls team. This position requires the ability to work with Managers, Supervisors, Hydro Technicians, contractors, and equipment suppliers. In this role, you will analyze our current controls systems, contractors, and equipment, then recommend and implement solutions, as well as manage third party contractors. You will work with the Electrical Engineer/Project Manager as well as site Operations Management to develop a schedule to update/replace HMI’s, PLC’s, and other critical control equipment.
Responsibilities:
Develop technical knowledge on hydro-electric power generation equipment and processes",30d+,
"['Arclin USA', '2.9']",http://www.arclin.com/,Embedded Software Engineer,"Charlottesville, VA",$74K - $99K (Glassdoor est.),"Automation Engineer Job, Alpharetta, GA
BONUS*****BONUS****BONUS
One-time payout of $10,000, with appropriate withholding's, on your first paycheck
Benefits
Employee Incentive Program: position will come with a 10% target, 20% Stretch bonus, depending on company performance
Competitive, Flexible Paid Vacation & Company Paid Holidays (12 days)
Full Health Benefit Coverage offered:",30d+,
"['Jacobs', '4.0']",http://www.jacobs.com/,Embedded Software Engineer,"Charlottesville, VA",$74K - $99K (Glassdoor est.),"Challenging Today. Reinventing Tomorrow.
We're invested in you and your success. Everything we do is more than just a project. It's our challenge as human beings, too. That's why we bring a thoughtful and collaborative approach to every one of our partnerships.
At Jacobs, we challenge the status quo and redefine how to solve the world's greatest challenges, transforming big ideas into intelligent solutions for a more connected, sustainable world.
Design your career with a company that inspires and empowers you to deliver your best work so you can evolve, grow and succeed – today and into tomorrow

Your Impact:





Jacobs is an Equal Opportunity/Affirmative Action Employer. All qualified applicants will receive consideration for employment without regard to race, religion, creed, color, national origin, ancestry, sex (including pregnancy, childbirth, breastfeeding, or medical conditions related to pregnancy, childbirth, or breastfeeding), age, medical condition, marital or domestic partner status, sexual orientation, gender, gender identity, gender expression and transgender status, mental disability or physical disability, genetic information, military or veteran status, citizenship, low-income status or any other status or characteristic protected by applicable law. Learn more about your rights under Federal EEO laws and supplemental language.",30d+,www.glassdoor.com/partner/jobListing.htm?pos=110&ao=1136043&s=58&guid=000001846c671cfb8aa62a2a7e298b41&src=GD_JOB_VIEW&t=SR&vt=w&cs=1_ba99ec81&cb=1668266049415&jobListingId=1008153098321&jrtk=3-0-1ghm6e799k24k801-1ghm6e79rii3h800-21635af2fac64465-
"['Jacobs', '4.0']",http://www.jacobs.com/,Embedded Software Engineer,"Charlottesville, VA",$74K - $99K (Glassdoor est.),"Challenging Today. Reinventing Tomorrow.
We're invested in you and your success. Everything we do is more than just a project. It's our challenge as human beings, too. That's why we bring a thoughtful and collaborative approach to every one of our partnerships.
At Jacobs, we challenge the status quo and redefine how to solve the world's greatest challenges, transforming big ideas into intelligent solutions for a more connected, sustainable world.
Design your career with a company that inspires and empowers you to deliver your best work so you can evolve, grow and succeed – today and into tomorrow

Your Impact:



Jacobs is an Equal Opportunity/Affirmative Action Employer. All qualified applicants will receive consideration for employment without regard to race, religion, creed, color, national origin, ancestry, sex (including pregnancy, childbirth, breastfeeding, or medical conditions related to pregnancy, childbirth, or breastfeeding), age, medical condition, marital or domestic partner status, sexual orientation, gender, gender identity, gender expression and transgender status, mental disability or physical disability, genetic information, military or veteran status, citizenship, low-income status or any other status or characteristic protected by applicable law. Learn more about your rights under Federal EEO laws and supplemental language.",30d+,www.glassdoor.com/partner/jobListing.htm?pos=111&ao=1136043&s=58&guid=000001846c671cfb8aa62a2a7e298b41&src=GD_JOB_VIEW&t=SR&vt=w&cs=1_ad910b2e&cb=1668266051255&jobListingId=1008141706952&jrtk=3-0-1ghm6e799k24k801-1ghm6e79rii3h800-55db4733ce3b6827-
"['Targa Resources', '3.8']",http://www.targaresources.com/,Embedded Software Engineer,"Charlottesville, VA",$74K - $99K (Glassdoor est.),"POSITION SUMMARY
The Automation Data Specialist (ADS) is responsible for OT Data System design, implementation, upgrade, integration, operation, support and maintenance activities that include scripting (data analysis, display development, database configuration, verification, report development and documentation. Responsibilities also include managing the daily operations of the Targa OT Data Repository hardware, software systems, related process control systems, peripherals to ensure reliable communications and operations.


JOB FUNCTIONS AND KEY RESPONSIBILITIES:
Develop and maintain design standards, templates and tools for the OT Data Systems",29d,www.glassdoor.com/partner/jobListing.htm?pos=112&ao=1136043&s=58&guid=000001846c671cfb8aa62a2a7e298b41&src=GD_JOB_VIEW&t=SR&vt=w&cs=1_4eb3ec4e&cb=1668266055199&jobListingId=1008205418657&jrtk=3-0-1ghm6e799k24k801-1ghm6e79rii3h800-8d27149728089c30-
"['Lubrizol Corporation', '3.6']",http://www.lubrizol.com/,Embedded Software Engineer,"Charlottesville, VA",$74K - $99K (Glassdoor est.),"92424
The Lubrizol Corporation, a Berkshire Hathaway company, is a market-driven global company serving customers in more than 100 countries. We own and operate manufacturing facilities in 17 countries, as well as sales and technical offices around the world. Through our global sales and manufacturing networks, we are able to deliver the products and services our customers need, where and when they need them.

Maintenance Electrician & Instrumentation (E&I) Technician (Experienced, Technician IV, V +)

The Maintenance E&I Technician reports to the site's Maintenance Supervisor and will be responsible for predictive and preventive maintenance, troubleshooting, repair of existing, and installation of new electrical and process control equipment throughout the facility. In this role, you will directly impact the safety and reliability of an operating chemical plant. To accomplish this role, you will interact and consult with other employees like other Maintenance E&I Technicians, Multi-craft Maintenance Technicians, Maintenance Planners, Reliability / Process / Project Engineers, Chemical Operators, and all levels of plant supervision.",30d+,www.glassdoor.com/partner/jobListing.htm?pos=113&ao=1136043&s=58&guid=000001846c671cfb8aa62a2a7e298b41&src=GD_JOB_VIEW&t=SR&vt=w&cs=1_17ecac1c&cb=1668266057013&jobListingId=1008153771355&jrtk=3-0-1ghm6e799k24k801-1ghm6e79rii3h800-20ad09d512b0ebeb-
"['Tri-State Generation and Transmission Association Inc.', '3.7']",http://www.tristategt.org/,Generation Operational Technology Specialist I or II,"Westminster, CO",$76K - $96K (Employer est.),"Responsible for supporting, designing, and implementing Operational Technology (OT) solutions in support of Tri-State generation and mining operations. Ensures operational stability, security, and efficiency. Responsible for implementing and maintaining a supportive convergence of Information Technology (IT) and OT policies and technologies.
Note:
There is one position available and the position will be filled at one of two job grade levels: Generation Operational Technology Specialist I, job grade NB20 or Generation Operational Technology Specialist II, job grade NB22. This decision will be based on the qualifications and experience of the candidate selected, and Tri-State business needs at the time of hire.
Tri-State recognizes the value of a highly-engaged and committed workforce and provides an excellent benefits program that includes: Medical Insurance, Dental Insurance, Vision Insurance Health Savings Account (HSA), Flexible Spending Accounts (FSA), Tuition Reimbursement, Flexible Work Schedules including compressed work week and telecommuting opportunities to work remotely up to 50%, Life Insurance, 401K, Long Term Disability (LTD), Short Term Disability (STD), Employee Assistant Program (EAP) and Paid Leave Benefits.",30d+,www.glassdoor.com/partner/jobListing.htm?pos=101&ao=1136043&s=58&guid=000001846c67ec9286e6f709bbc21f7a&src=GD_JOB_VIEW&t=SR&vt=w&cs=1_0bc98278&cb=1668266066550&jobListingId=1008088806817&jrtk=3-0-1ghm6fr9tkuhq801-1ghm6fraii9iu800-83f87d0d7b0e1a1a-
