Company_Name,Company_Link,Title,Location,Estimated_Salary,Job_Description,Job_Age,Application_Link
"['Lincoln Financial', '3.6']",https://www.lincolnfinancial.com/public/individuals,Chief Financial Officer (CFO),"Cheshire, CT",$180K (Employer est.),"Date: Nov 6, 2022
Primary Location: Greensboro, NC, US
Company: Lincoln Financial
Alternate Locations: Work from Home; Atlanta, GA (Georgia); Austin, TX (Texas); Bakersfield, CA (California); Baltimore, MD (Maryland); Baton Rouge, LA (Louisiana); Birmingham, AL (Alabama); Boise, ID (Idaho); Boston, MA (Massachusetts); Buffalo, NY (New York); Canonsburg, PA (Pennsylvania); Charlotte, NC (North Carolina); Chicago, IL (Illinois); Cincinnati, OH (Ohio); Cleveland, OH (Ohio); Columbia, SC (South Carolina); Columbus, OH (Ohio); Concord, NH (New Hampshire); Dallas, TX (Texas); Deerfield Beach, FL (Florida); Denver, CO (Colorado); Detroit, MI (Michigan); Dover, NH (New Hampshire); Durham, NC (North Carolina); Edina, MN (Minnesota); Edison, NJ (New Jersey); Ellicott City, MD (Maryland); Fayetteville, SC (South Carolina); Florence, SC (South Carolina); Fort Lauderdale, FL (Florida); Fort Wayne, IN (Indiana); Fort Worth, TX (Texas); Gainsville, FL (Florida); Glen Allen, VA (Virginia); Glendale, CA (California); Greensboro, NC (North Carolina); Greenwood Village, CO (Colorado); Hartford, CT (Connecticut); Houston, TX (Texas); Huntsville, AL (Alabama); Indianapolis, IN (Indiana); Irvine, CA (California); Jacksonville, FL (Florida); Johnson City, TN (Tennessee); Kansas City, KS (Kansas); La Jolla, CA (California); Lexington, KY (Kentucky); Los Angeles, CA (California); Louisville, KY (Kentucky); Lutherville, MD (Maryland); Madison, WI (Wisconsin); Memphis, TN (Tennessee); Miami, FL (Florida); Milwaukee, WI (Wisconsin); Minneapolis, MN (Minnesota); Nashville, TN (Tennessee); New York, NY (New York); None; Norwood, OH (Ohio); Omaha, NE (Nebraska); Orlando, FL (Florida); Palm Desert, CA (California); Paramus, NJ (New Jersey); Parsippany, NJ (New Jersey); Philadelphia, PA (Pennsylvania); Phoenix, AZ (Arizona); Pittsburgh, PA (Pennsylvania); Plano, TX (Texas); Plymouth Meeting, PA (Pennsylvania); Portland, ME (Maine); Portland, OR (Oregon); Radnor, PA (Pennsylvania); Raleigh, NC (North Carolina); Richmond, VA (Virginia); Rochester, NY (New York); Rockville, MD (Maryland); Rolling Meadows, IL (Illinois); Rye Brook, NY (New York); Sacramento, CA (California); Salt Lake City, UT (Utah); San Antonio, TX (Texas); San Diego, CA (California); San Francisco, CA (California); San Ramon, CA (California); Schaumburg, IL (Illinois); Scottsdale, AZ (Arizona); Seattle, WA (Washington); Southfield, MI (Michigan); St. Louis, MO (Missouri); Syosset, NY (New York); Tampa, FL (Florida); Toledo, OH (Ohio); Tupelo, MS (Mississippi); US All Regions; US Midwest; US Northeast; US Southeast; US Southwest; US West; Vienna, VA (Virginia); Virginia Beach, VA (Virginia); Walnut Creek, CA (California); Washington, DC (District of Columbia); Westlake Village, CA (California); White Plains, NY (New York); Windsor, CT (Connecticut); Woodmere, OH (Ohio)",3d,www.glassdoor.com/partner/jobListing.htm?pos=126&ao=1136043&s=58&guid=000001846b3792359508f96647a0b4c0&src=GD_JOB_VIEW&t=SR&vt=w&cs=1_98bf4f22&cb=1668246213570&jobListingId=1008265349328&jrtk=3-0-1ghljf4j3mbhi801-1ghljf4jjimbd800-d7c93bdd4b9c758e-
"['Global Atlantic Financial Group Opportunities', '4.0']",http://www.globalatlantic.com/,Chief Financial Officer (CFO),"Cheshire, CT",$180K (Employer est.),"All offices are currently open, and our employees are back 4 or 5 days a week in Hudson Yards, NY and 3 days a week in all other offices. If you have questions on this policy or the application process, please contact recruiting@gafg.com.
Company policy requires all employees and visitors to the Hudson Yards, NY office to be vaccinated against the COVID-19 virus.
COMPANY OVERVIEW
Global Atlantic Financial Group is a leader in the U.S. life insurance and annuity industry, serving the needs of individuals and institutions. Global Atlantic is a majority-owned subsidiary of KKR, a leading global investment firm that offers alternative asset management across multiple strategies and capital markets solutions.

Global Atlantic is looking for a diverse team of talented individuals who reinforce our culture of collaboration and innovation. We are dedicated to the career development of our people because we know they are critical to our long-term success. Join our team and come grow with us.",9d,www.glassdoor.com/partner/jobListing.htm?pos=127&ao=1136043&s=58&guid=000001846b3792359508f96647a0b4c0&src=GD_JOB_VIEW&t=SR&vt=w&cs=1_99a5ec56&cb=1668246216540&jobListingId=1008252998981&jrtk=3-0-1ghljf4j3mbhi801-1ghljf4jjimbd800-96c3e4e5e212b673-
"['Global Atlantic Financial Group', '4.0']",http://www.globalatlantic.com/,Chief Financial Officer (CFO),"Cheshire, CT",$180K (Employer est.),"All offices are currently open, and our employees are back 4 or 5 days a week in Hudson Yards, NY and 3 days a week in all other offices. If you have questions on this policy or the application process, please contact recruiting@gafg.com.
Company policy requires all employees and visitors to the Hudson Yards, NY office to be vaccinated against the COVID-19 virus.
COMPANY OVERVIEW
Global Atlantic Financial Group is a leader in the U.S. life insurance and annuity industry, serving the needs of individuals and institutions. Global Atlantic is a majority-owned subsidiary of KKR, a leading global investment firm that offers alternative asset management across multiple strategies and capital markets solutions.

Global Atlantic is looking for a diverse team of talented individuals who reinforce our culture of collaboration and innovation. We are dedicated to the career development of our people because we know they are critical to our long-term success. Join our team and come grow with us.",9d,www.glassdoor.com/partner/jobListing.htm?pos=128&ao=1136043&s=58&guid=000001846b3792359508f96647a0b4c0&src=GD_JOB_VIEW&t=SR&vt=w&cs=1_08b6cf86&cb=1668246219507&jobListingId=1008252998958&jrtk=3-0-1ghljf4j3mbhi801-1ghljf4jjimbd800-bb119412b9d5073c-
"['Global Atlantic Financial Group Opportunities', '4.0']",http://www.globalatlantic.com/,Chief Financial Officer (CFO),"Cheshire, CT",$180K (Employer est.),"All offices are currently open, and our employees are back 4 or 5 days a week in Hudson Yards, NY and 3 days a week in all other offices. If you have questions on this policy or the application process, please contact recruiting@gafg.com.
Company policy requires all employees and visitors to the Hudson Yards, NY office to be vaccinated against the COVID-19 virus.
COMPANY OVERVIEW
Global Atlantic Financial Group is a leader in the U.S. life insurance and annuity industry, serving the needs of individuals and institutions. Global Atlantic is a majority-owned subsidiary of KKR, a leading global investment firm that offers alternative asset management across multiple strategies and capital markets solutions.

Global Atlantic is looking for a diverse team of talented individuals who reinforce our culture of collaboration and innovation. We are dedicated to the career development of our people because we know they are critical to our long-term success. Join our team and come grow with us.",11d,www.glassdoor.com/partner/jobListing.htm?pos=129&ao=1136043&s=58&guid=000001846b3792359508f96647a0b4c0&src=GD_JOB_VIEW&t=SR&vt=w&cs=1_064036d1&cb=1668246223577&jobListingId=1008245854187&jrtk=3-0-1ghljf4j3mbhi801-1ghljf4jjimbd800-6e2c5852ebd4583a-
"['State of Connecticut - Office of State Ethics', '3.5']",http://www.ct.gov/,Chief Financial Officer (CFO),"Cheshire, CT",$180K (Employer est.),"Do you have extensive communications and public speaking experience? Are you a communications, public relations and/or education professional and who would like to pursue such fields in public service? If so, we encourage you to apply!
The mission of the State of Connecticut, Office of State Ethics, is to encourage accountability and integrity throughout state government. We do this by providing legal advice, guidance and education to public officials, state employees and lobbyists; by sensibly interpreting and, when necessary, fairly and impartially enforcing applicable laws; and by ensuring required disclosure through the administration of the lobbyist and financial filing systems.
We are recruiting for a full-time, State Program Manager to function in the role of DIRECTOR OF EDUCATION and COMMUNICATIONS to direct agency education programs and activities and other related functions. This position works Monday - Friday, 8:30 a.m. to 5:00 p.m., and is located at 165 Capitol Avenue in Hartford, CT. The individual in this role:

We offer a comprehensive health and benefits package and encourage a great work-life balance. Watch the video below to see how can make an as a state employee:",14d,www.glassdoor.com/partner/jobListing.htm?pos=130&ao=1136043&s=58&guid=000001846b3792359508f96647a0b4c0&src=GD_JOB_VIEW&t=SR&vt=w&cs=1_eabf4fcf&cb=1668246227456&jobListingId=1008241466998&jrtk=3-0-1ghljf4j3mbhi801-1ghljf4jjimbd800-043858d2a0dd07d9-
"['Creative Financial Staffing', '4.8']",http://www.cfstaffing.com/,IT Auditor - Hybrid (On-site),"Providence, RI",$60K - $85K (Employer est.),"JOB DESCRIPTION
IT Auditor – highly visible, impactful role – Hybrid schedule – Hartford, CT
About the Company and Opportunity:
Our client is an established and growing professional services organization with 3 versatile locations in New England
Thriving group with a sizeable and growing footprint in their industry
Remote work schedule with no in-office requirement – 50% travel to client sites will be necessary
Overview of the Cybersecurity Analyst role:
Travel is required to client sites – you will be assessing and evaluating IT networks and security programs for our clients
For immediate and confidential consideration contact Matt Hughes mhughes@cfstaffing.com

#CFSNOV2022",12d,www.glassdoor.com/partner/jobListing.htm?pos=101&ao=1110586&s=58&guid=000001846b395690a22148271d67069d&src=GD_JOB_VIEW&t=SR&vt=w&cs=1_d3cc8714&cb=1668246236142&jobListingId=1008244842151&jrtk=3-0-1ghljilltmbhh801-1ghljilmfirl2800-52d6e29c7e53ecc3--6NYlbfkN0AyIsnDczwcVDFrYpf5kat3hxWjSi6qx3YGCfJB8v0u0sFq4kEYA-wgLSj5PNwKHza3mGtaM2VcGiPKIvuKzX18bKWNe3e8EFzscJLd5wNxmBqaPR5EwiWfoQCXwOPh7ms54dyqJCEhweN9ZN9LT7cpRYnp5_SszAzMdkBvnzdJJK3LsSO7JJ_4jQ5K0uWleQcFVPXY8eFPJPGN213aFYEnhzUjXqJ4zR4AVzpSDtbYA2Lg6Hq12kme8IW5tC2zg_Vu9L1h67wtFH3CRcGrjKF_5vHVCvQOLHR03cUPtWSjtTDpGXNqriJxaOXGe9Cmpr-Sc_4Hu6bgaQqyZqrhVqP-50mvVIXi3N7tzyeaaYbxGpAdnZyZBVEKvwFLPk0j_unCS5HnVCF_lRyhN0RyJ4BCpReUnSZDDvJA43Uguo0_F0feRspZfFoJonZZT9vRrABACuOkI1SslT6kaOGGWfyTm3wHKSxgE8ZppgqmLF2sw4o4iBYhjwigXfYCHwaFZLFtcB-AEJeqsOwSwR4IpL-HLxhvdE1ZHguBbEjrDG-jE8tOVpqnJp_HkOuF_teBV3bF-7-_nvFFm3QjhhkrH5NBwPkE8QbYh8M%3D
"['Hartford HealthCare Corp.', '3.5']",http://www.hartfordhealthcare.org/,IT Auditor - Hybrid (On-site),"Providence, RI",$60K - $85K (Employer est.),"Description
Job Schedule: Full Time
Standard Hours: 40
Job Shift: Shift 1
Shift Details:


Work where every moment matters.

Every day, approximately 30,000 Hartford HealthCare colleagues come to work with one thing in common: Pride in what we do, knowing every moment matters here. We invite you to become part of Connecticut's most comprehensive healthcare network.

The creation of the HHC System Support Office recognizes the work of a large and growing group of employees whose responsibilities are continually evolving so that we and our departments now work on behalf of the system as a whole, rather than a single member organization.
With the creation of our new umbrella organization we now have our own identity with a unique payroll, benefits, performance management system, service recognition programs and other common practices across the system.",22d,
"['Lincoln Financial', '3.6']",https://www.lincolnfinancial.com/public/individuals,IT Auditor - Hybrid (On-site),"Providence, RI",$60K - $85K (Employer est.),"Date: Nov 11, 2022
Primary Location: Radnor, PA, US
Company: Lincoln Financial
Alternate Locations: Work from Home; Atlanta, GA (Georgia); Austin, TX (Texas); Bakersfield, CA (California); Baltimore, MD (Maryland); Baton Rouge, LA (Louisiana); Birmingham, AL (Alabama); Boise, ID (Idaho); Boston, MA (Massachusetts); Buffalo, NY (New York); Canonsburg, PA (Pennsylvania); Charlotte, NC (North Carolina); Chicago, IL (Illinois); Cincinnati, OH (Ohio); Cleveland, OH (Ohio); Columbia, SC (South Carolina); Columbus, OH (Ohio); Concord, NH (New Hampshire); Dallas, TX (Texas); Deerfield Beach, FL (Florida); Denver, CO (Colorado); Detroit, MI (Michigan); Dover, NH (New Hampshire); Durham, NC (North Carolina); Edina, MN (Minnesota); Edison, NJ (New Jersey); Ellicott City, MD (Maryland); Fayetteville, SC (South Carolina); Florence, SC (South Carolina); Fort Lauderdale, FL (Florida); Fort Wayne, IN (Indiana); Fort Worth, TX (Texas); Gainsville, FL (Florida); Glen Allen, VA (Virginia); Glendale, CA (California); Greensboro, NC (North Carolina); Greenwood Village, CO (Colorado); Hartford, CT (Connecticut); Houston, TX (Texas); Huntsville, AL (Alabama); Indianapolis, IN (Indiana); Irvine, CA (California); Jacksonville, FL (Florida); Johnson City, TN (Tennessee); Kansas City, KS (Kansas); La Jolla, CA (California); Lexington, KY (Kentucky); Los Angeles, CA (California); Louisville, KY (Kentucky); Lutherville, MD (Maryland); Madison, WI (Wisconsin); Memphis, TN (Tennessee); Miami, FL (Florida); Milwaukee, WI (Wisconsin); Minneapolis, MN (Minnesota); Nashville, TN (Tennessee); New York, NY (New York); None; Norwood, OH (Ohio); Omaha, NE (Nebraska); Orlando, FL (Florida); Palm Desert, CA (California); Paramus, NJ (New Jersey); Parsippany, NJ (New Jersey); Philadelphia, PA (Pennsylvania); Phoenix, AZ (Arizona); Pittsburgh, PA (Pennsylvania); Plano, TX (Texas); Plymouth Meeting, PA (Pennsylvania); Portland, ME (Maine); Portland, OR (Oregon); Radnor, PA (Pennsylvania); Raleigh, NC (North Carolina); Richmond, VA (Virginia); Rochester, NY (New York); Rockville, MD (Maryland); Rolling Meadows, IL (Illinois); Rye Brook, NY (New York); Sacramento, CA (California); Salt Lake City, UT (Utah); San Antonio, TX (Texas); San Diego, CA (California); San Francisco, CA (California); San Ramon, CA (California); Schaumburg, IL (Illinois); Scottsdale, AZ (Arizona); Seattle, WA (Washington); Southfield, MI (Michigan); St. Louis, MO (Missouri); Syosset, NY (New York); Tampa, FL (Florida); Toledo, OH (Ohio); Tupelo, MS (Mississippi); US All Regions; US Midwest; US Northeast; US Southeast; US Southwest; US West; Vienna, VA (Virginia); Virginia Beach, VA (Virginia); Walnut Creek, CA (California); Washington, DC (District of Columbia); Westlake Village, CA (California); White Plains, NY (New York); Windsor, CT (Connecticut); Woodmere, OH (Ohio)",24h,www.glassdoor.com/partner/jobListing.htm?pos=103&ao=1136043&s=58&guid=000001846b395690a22148271d67069d&src=GD_JOB_VIEW&t=SR&vt=w&cs=1_f8f27934&cb=1668246241327&jobListingId=1008275358892&jrtk=3-0-1ghljilltmbhh801-1ghljilmfirl2800-39dd69250d616d5b-
"['Lincoln Financial', '3.6']",https://www.lincolnfinancial.com/public/individuals,IT Auditor - Hybrid (On-site),"Providence, RI",$60K - $85K (Employer est.),"Date: Nov 9, 2022
Primary Location: Greensboro, NC, US
Company: Lincoln Financial
Alternate Locations: Work from Home; Atlanta, GA (Georgia); Austin, TX (Texas); Bakersfield, CA (California); Baltimore, MD (Maryland); Baton Rouge, LA (Louisiana); Birmingham, AL (Alabama); Boise, ID (Idaho); Boston, MA (Massachusetts); Buffalo, NY (New York); Canonsburg, PA (Pennsylvania); Charlotte, NC (North Carolina); Chicago, IL (Illinois); Cincinnati, OH (Ohio); Cleveland, OH (Ohio); Columbia, SC (South Carolina); Columbus, OH (Ohio); Concord, NH (New Hampshire); Dallas, TX (Texas); Deerfield Beach, FL (Florida); Denver, CO (Colorado); Detroit, MI (Michigan); Dover, NH (New Hampshire); Durham, NC (North Carolina); Edina, MN (Minnesota); Edison, NJ (New Jersey); Ellicott City, MD (Maryland); Fayetteville, SC (South Carolina); Florence, SC (South Carolina); Fort Lauderdale, FL (Florida); Fort Wayne, IN (Indiana); Fort Worth, TX (Texas); Gainsville, FL (Florida); Glen Allen, VA (Virginia); Glendale, CA (California); Greensboro, NC (North Carolina); Greenwood Village, CO (Colorado); Hartford, CT (Connecticut); Houston, TX (Texas); Huntsville, AL (Alabama); Indianapolis, IN (Indiana); Irvine, CA (California); Jacksonville, FL (Florida); Johnson City, TN (Tennessee); Kansas City, KS (Kansas); La Jolla, CA (California); Lexington, KY (Kentucky); Los Angeles, CA (California); Louisville, KY (Kentucky); Lutherville, MD (Maryland); Madison, WI (Wisconsin); Memphis, TN (Tennessee); Miami, FL (Florida); Milwaukee, WI (Wisconsin); Minneapolis, MN (Minnesota); Nashville, TN (Tennessee); New York, NY (New York); None; Norwood, OH (Ohio); Omaha, NE (Nebraska); Orlando, FL (Florida); Palm Desert, CA (California); Paramus, NJ (New Jersey); Parsippany, NJ (New Jersey); Philadelphia, PA (Pennsylvania); Phoenix, AZ (Arizona); Pittsburgh, PA (Pennsylvania); Plano, TX (Texas); Plymouth Meeting, PA (Pennsylvania); Portland, ME (Maine); Portland, OR (Oregon); Radnor, PA (Pennsylvania); Raleigh, NC (North Carolina); Richmond, VA (Virginia); Rochester, NY (New York); Rockville, MD (Maryland); Rolling Meadows, IL (Illinois); Rye Brook, NY (New York); Sacramento, CA (California); Salt Lake City, UT (Utah); San Antonio, TX (Texas); San Diego, CA (California); San Francisco, CA (California); San Ramon, CA (California); Schaumburg, IL (Illinois); Scottsdale, AZ (Arizona); Seattle, WA (Washington); Southfield, MI (Michigan); St. Louis, MO (Missouri); Syosset, NY (New York); Tampa, FL (Florida); Toledo, OH (Ohio); Tupelo, MS (Mississippi); US All Regions; US Midwest; US Northeast; US Southeast; US Southwest; US West; Vienna, VA (Virginia); Virginia Beach, VA (Virginia); Walnut Creek, CA (California); Washington, DC (District of Columbia); Westlake Village, CA (California); White Plains, NY (New York); Windsor, CT (Connecticut); Woodmere, OH (Ohio)",2d,www.glassdoor.com/partner/jobListing.htm?pos=104&ao=1136043&s=58&guid=000001846b395690a22148271d67069d&src=GD_JOB_VIEW&t=SR&vt=w&cs=1_5ee6c397&cb=1668246243315&jobListingId=1008269748973&jrtk=3-0-1ghljilltmbhh801-1ghljilmfirl2800-e055fa8b2e94cbbe-
"['Lincoln Financial', '3.6']",https://www.lincolnfinancial.com/public/individuals,IT Auditor - Hybrid (On-site),"Providence, RI",$60K - $85K (Employer est.),"Date: Oct 20, 2022
Primary Location: Greensboro, NC, US
Company: Lincoln Financial
Alternate Locations: Work from Home; Atlanta, GA (Georgia); Austin, TX (Texas); Bakersfield, CA (California); Baltimore, MD (Maryland); Baton Rouge, LA (Louisiana); Birmingham, AL (Alabama); Boise, ID (Idaho); Boston, MA (Massachusetts); Buffalo, NY (New York); Canonsburg, PA (Pennsylvania); Charlotte, NC (North Carolina); Chicago, IL (Illinois); Cincinnati, OH (Ohio); Cleveland, OH (Ohio); Columbia, SC (South Carolina); Columbus, OH (Ohio); Concord, NH (New Hampshire); Dallas, TX (Texas); Deerfield Beach, FL (Florida); Denver, CO (Colorado); Detroit, MI (Michigan); Dover, NH (New Hampshire); Durham, NC (North Carolina); Edina, MN (Minnesota); Edison, NJ (New Jersey); Ellicott City, MD (Maryland); Fayetteville, SC (South Carolina); Florence, SC (South Carolina); Fort Lauderdale, FL (Florida); Fort Wayne, IN (Indiana); Fort Worth, TX (Texas); Gainsville, FL (Florida); Glen Allen, VA (Virginia); Glendale, CA (California); Greensboro, NC (North Carolina); Greenwood Village, CO (Colorado); Hartford, CT (Connecticut); Houston, TX (Texas); Huntsville, AL (Alabama); Indianapolis, IN (Indiana); Irvine, CA (California); Jacksonville, FL (Florida); Johnson City, TN (Tennessee); Kansas City, KS (Kansas); La Jolla, CA (California); Lexington, KY (Kentucky); Los Angeles, CA (California); Louisville, KY (Kentucky); Lutherville, MD (Maryland); Madison, WI (Wisconsin); Memphis, TN (Tennessee); Miami, FL (Florida); Milwaukee, WI (Wisconsin); Minneapolis, MN (Minnesota); Nashville, TN (Tennessee); New York, NY (New York); None; Norwood, OH (Ohio); Omaha, NE (Nebraska); Orlando, FL (Florida); Palm Desert, CA (California); Paramus, NJ (New Jersey); Parsippany, NJ (New Jersey); Philadelphia, PA (Pennsylvania); Phoenix, AZ (Arizona); Pittsburgh, PA (Pennsylvania); Plano, TX (Texas); Plymouth Meeting, PA (Pennsylvania); Portland, ME (Maine); Portland, OR (Oregon); Radnor, PA (Pennsylvania); Raleigh, NC (North Carolina); Richmond, VA (Virginia); Rochester, NY (New York); Rockville, MD (Maryland); Rolling Meadows, IL (Illinois); Rye Brook, NY (New York); Sacramento, CA (California); Salt Lake City, UT (Utah); San Antonio, TX (Texas); San Diego, CA (California); San Francisco, CA (California); San Ramon, CA (California); Schaumburg, IL (Illinois); Scottsdale, AZ (Arizona); Seattle, WA (Washington); Southfield, MI (Michigan); St. Louis, MO (Missouri); Syosset, NY (New York); Tampa, FL (Florida); Toledo, OH (Ohio); Tupelo, MS (Mississippi); US All Regions; US Midwest; US Northeast; US Southeast; US Southwest; US West; Vienna, VA (Virginia); Virginia Beach, VA (Virginia); Walnut Creek, CA (California); Washington, DC (District of Columbia); Westlake Village, CA (California); White Plains, NY (New York); Windsor, CT (Connecticut); Woodmere, OH (Ohio)",22d,www.glassdoor.com/partner/jobListing.htm?pos=105&ao=1136043&s=58&guid=000001846b395690a22148271d67069d&src=GD_JOB_VIEW&t=SR&vt=w&cs=1_295178a9&cb=1668246251681&jobListingId=1008222741516&jrtk=3-0-1ghljilltmbhh801-1ghljilmfirl2800-0a3164c3977a5d87-
"['Lincoln Financial', '3.6']",https://www.lincolnfinancial.com/public/individuals,IT Auditor - Hybrid (On-site),"Providence, RI",$60K - $85K (Employer est.),"Date: Nov 12, 2022
Primary Location: Hartford, CT, US
Company: Lincoln Financial
Alternate Locations: Work from Home

Work Arrangement: Work from Home

Relocation assistance:: is not available for this opportunity.

Pay Range: $63,100 - $137,900",26d,www.glassdoor.com/partner/jobListing.htm?pos=106&ao=1136043&s=58&guid=000001846b395690a22148271d67069d&src=GD_JOB_VIEW&t=SR&vt=w&cs=1_dbd5c8c9&cb=1668246255782&jobListingId=1008211244616&jrtk=3-0-1ghljilltmbhh801-1ghljilmfirl2800-da36719b7f679d86-
"['Lincoln Financial', '3.6']",https://www.lincolnfinancial.com/public/individuals,IT Auditor - Hybrid (On-site),"Providence, RI",$60K - $85K (Employer est.),"Date: Oct 28, 2022
Primary Location: Hartford, CT, US
Company: Lincoln Financial
Alternate Locations: Fort Worth, TX (Texas); Atlanta, GA (Georgia); Austin, TX (Texas); Bakersfield, CA (California); Baltimore, MD (Maryland); Baton Rouge, LA (Louisiana); Birmingham, AL (Alabama); Boise, ID (Idaho); Boston, MA (Massachusetts); Buffalo, NY (New York); Canonsburg, PA (Pennsylvania); Charlotte, NC (North Carolina); Chicago, IL (Illinois); Cincinnati, OH (Ohio); Cleveland, OH (Ohio); Columbia, SC (South Carolina); Columbus, OH (Ohio); Concord, NH (New Hampshire); Dallas, TX (Texas); Deerfield Beach, FL (Florida); Denver, CO (Colorado); Detroit, MI (Michigan); Dover, NH (New Hampshire); Durham, NC (North Carolina); Edina, MN (Minnesota); Edison, NJ (New Jersey); Ellicott City, MD (Maryland); Fayetteville, SC (South Carolina); Florence, SC (South Carolina); Fort Lauderdale, FL (Florida); Fort Wayne, IN (Indiana); Gainsville, FL (Florida); Glen Allen, VA (Virginia); Glendale, CA (California); Greensboro, NC (North Carolina); Greenwood Village, CO (Colorado); Hartford, CT (Connecticut); Houston, TX (Texas); Huntsville, AL (Alabama); Indianapolis, IN (Indiana); Irvine, CA (California); Jacksonville, FL (Florida); Johnson City, TN (Tennessee); Kansas City, KS (Kansas); La Jolla, CA (California); Lexington, KY (Kentucky); Los Angeles, CA (California); Louisville, KY (Kentucky); Lutherville, MD (Maryland); Madison, WI (Wisconsin); Memphis, TN (Tennessee); Miami, FL (Florida); Milwaukee, WI (Wisconsin); Minneapolis, MN (Minnesota); Nashville, TN (Tennessee); New York, NY (New York); None; Norwood, OH (Ohio); Omaha, NE (Nebraska); Orlando, FL (Florida); Palm Desert, CA (California); Paramus, NJ (New Jersey); Parsippany, NJ (New Jersey); Philadelphia, PA (Pennsylvania); Phoenix, AZ (Arizona); Pittsburgh, PA (Pennsylvania); Plano, TX (Texas); Plymouth Meeting, PA (Pennsylvania); Portland, ME (Maine); Portland, OR (Oregon); Radnor, PA (Pennsylvania); Raleigh, NC (North Carolina); Richmond, VA (Virginia); Rochester, NY (New York); Rockville, MD (Maryland); Rolling Meadows, IL (Illinois); Rye Brook, NY (New York); Sacramento, CA (California); Salt Lake City, UT (Utah); San Antonio, TX (Texas); San Diego, CA (California); San Francisco, CA (California); San Ramon, CA (California); Schaumburg, IL (Illinois); Scottsdale, AZ (Arizona); Seattle, WA (Washington); Southfield, MI (Michigan); St. Louis, MO (Missouri); Syosset, NY (New York); Tampa, FL (Florida); Toledo, OH (Ohio); Tupelo, MS (Mississippi); US All Regions; US Midwest; US Northeast; US Southeast; US Southwest; US West; Vienna, VA (Virginia); Virginia Beach, VA (Virginia); Walnut Creek, CA (California); Washington, DC (District of Columbia); Westlake Village, CA (California); White Plains, NY (New York); Windsor, CT (Connecticut); Woodmere, OH (Ohio); Work from Home",14d,www.glassdoor.com/partner/jobListing.htm?pos=107&ao=1136043&s=58&guid=000001846b395690a22148271d67069d&src=GD_JOB_VIEW&t=SR&vt=w&cs=1_858567d5&cb=1668246258598&jobListingId=1008241506864&jrtk=3-0-1ghljilltmbhh801-1ghljilmfirl2800-5c6edd5d3fdc698a-
