Company_Name,Company_Link,Title,Location,Estimated_Salary,Job_Description,Job_Age,Application_Link
"['CBRE', '3.9']",http://www.cbre.com/,Cybersecurity Specialist,"Hartford, CT",$100K - $125K (Employer est.),"Job ID

94146

Posted

08-Nov-2022

Service line

GWS Segment

Role type

Full-time

Areas of Interest

Building Management, Engineering/Maintenance, Facilities Management

Location(s)

Hartford - Connecticut - United States of America

GWS Local is a tailored facility management solution at a local level with access to the Global CBRE GWS platform. We manage soft services through trusted best in class partners, and self-delivery of hard services. Utilizing an AGILE delivery model with structure, governance, and accountability through employee empowerment. Partnership with Local also provides access to our ""Best in Class"" additional services: Sustainability and Energy Programs, Project Management, Moves & Changes, Security Consulting, Workplace Strategy, and Host Workplace Experience.
JOB SUMMARY
Utilizes advanced skills to perform complex preventive maintenance and corrective repair of buildings, industrial systems, vehicles, equipment and grounds. Working under limited supervision, monitors building system operations and performance. Utilizes several trade skills such as carpentry, plumbing, electrical, painting, roofing, heating and cooling.
ESSENTIAL DUTIES AND RESPONSIBILITIES
Complies with all applicable codes, regulations, governmental agency and Company directives related to building operations and work safety.
Inspects building systems including fire alarms, HVAC, and plumbing to ensure operation of equipment is within design capabilities and achieves environmental conditions prescribed by client.
Oversees and inspects the work performed by outside contractors. Contracted work includes landscaping, snow removal, remodeling, HVAC, plumbers, and cleaning.
Performs assigned repairs, emergency and preventive maintenance. Completes maintenance and repair records as required.
Reviews assigned work orders. Estimates time and materials needed to complete repair. Orders necessary materials and supplies to complete all tasks.
Maintains an energy management program to ensure measures are taken to operate all systems in the most efficient manner to keep operating costs at a minimum.
Maintains the building lighting system, including element and ballast repairs or replacements.
Performs welding, carpentry, furniture assembly and locksmith tasks as needed.
Responds quickly to emergency situations, summoning additional assistance as needed.
Performs other duties as assigned.
SUPERVISORY RESPONSIBILITIES
No formal supervisory responsibilities in this position. May provide informal assistance such as technical guidance and/or training to coworkers. May coordinate work and assign tasks.
QUALIFICATIONS
To perform this job successfully, an individual must be able to perform each essential duty satisfactorily. The requirements listed below are representative of the knowledge, skill, and/or ability required.
Reasonable accommodations may be made to enable individuals with disabilities to perform the essential functions.
EDUCATION and EXPERIENCE
High school diploma or general education degree (GED) and a minimum of four years of related experience and/or trade school training.
CERTIFICATES and/or LICENSES
Universal CFC certification preferred. Additional certification in one or more of the following: electrical, mechanical, HVAC and refrigeration systems, process controls, mechanical power transmissions, painting, plumbing, carpentry or engine repair. Certifications/licenses as may be required by local or state jurisdictions.
COMMUNICATION SKILLS
Ability to comprehend and interpret instructions, short correspondence, and memos and ask clarifying questions to ensure understanding. Ability to write routine reports and correspondence. Ability to respond to common inquiries or complaints from clients, co-workers, and/or supervisor. Ability to effectively present information to an internal department and/or large groups of employees.
FINANCIAL KNOWLEDGE
Requires basic knowledge of financial terms and principles. Ability to calculate simple figures such as percentages.
REASONING ABILITY
Ability to solve practical problems and deal with a variety of concrete variables in situation where only limited standardization exists. Requires intermediate analytical skills.
OTHER SKILLS and ABILITIES
Uses personal computer and / or PDA for work order system, email, ESS and training. Basic skills with Microsoft Office Outlook. Physical requirements include stooping, standing, walking, climbing stairs / ladders and ability to lift / carry heavy loads of 50 lbs. or more.
SCOPE OF RESPONSIBILITY
Decisions made with general understanding of procedures and company policies to achieve set results and deadlines. Errors in judgment may cause short-term impact to co-workers and supervisor.
SAFETY
Responsible for personal safety and the safety of those who are affected by your work. This includes but is not limited to:
Complete all required and assigned HSE training at a satisfactory level
Follow all activity policies and procedures, including all HSE-related requirements at all times
Participate in all HSE-related programs & activities as required, including incident investigations, interviews, auditing and assessment, etc.
Report any conditions which you feel could result in an accident or injury and / or stop work if required
CBRE is an equal opportunity/affirmative action employer with a long-standing commitment to providing equal employment opportunity to all qualified applicants regardless of race, color, religion, national origin, sex, sexual orientation, gender identity, pregnancy, age, citizenship, marital status, disability, veteran status, political belief, or any other basis protected by applicable law.

Some, but not all, of our positions may have an additional requirement to comply with COVID-19 health and safety protocols, including COVID-19 vaccination proof and/or rigorous testing. If you have questions about the requirement(s) for this position, please inform your Recruiter.

CBRE GWS

CBRE Global Workplace Solutions (GWS) works with clients to make real estate a meaningful contributor to organizational productivity and performance. Our account management model is at the heart of our client-centric approach to delivering integrated real estate solutions. Each client is entrusted with a dedicated leader and is supported by regional and global resources, leveraging the industry's most robust platform. CBRE GWS delivers consistent, measurably superior outcomes for our clients at every stage of the lifecycle, and across industries and geographies.
Find out more",24h,www.glassdoor.com/partner/jobListing.htm?pos=112&ao=1136043&s=58&guid=000001846b3a6d0588b947ed248af377&src=GD_JOB_VIEW&t=SR&vt=w&cs=1_b6d653c7&cb=1668246340729&jobListingId=1008273773290&jrtk=3-0-1ghljkr9pkugp801-1ghljkra6i9iu800-0826efdeec8bbc23-
"['Global Atlantic Financial Group Opportunities', '4.0']",http://www.globalatlantic.com/,Cybersecurity Specialist,"Hartford, CT",$100K - $125K (Employer est.),"All offices are currently open, and our employees are back 4 or 5 days a week in Hudson Yards, NY and 3 days a week in all other offices. If you have questions on this policy or the application process, please contact recruiting@gafg.com.
Company policy requires all employees and visitors to the Hudson Yards, NY office to be vaccinated against the COVID-19 virus.
COMPANY OVERVIEW
Global Atlantic Financial Group is a leader in the U.S. life insurance and annuity industry, serving the needs of individuals and institutions. Global Atlantic is a majority-owned subsidiary of KKR, a leading global investment firm that offers alternative asset management across multiple strategies and capital markets solutions.

Global Atlantic is looking for a diverse team of talented individuals who reinforce our culture of collaboration and innovation. We are dedicated to the career development of our people because we know they are critical to our long-term success. Join our team and come grow with us.",3d,www.glassdoor.com/partner/jobListing.htm?pos=113&ao=1136043&s=58&guid=000001846b3a6d0588b947ed248af377&src=GD_JOB_VIEW&t=SR&vt=w&cs=1_88f3e34e&cb=1668246342571&jobListingId=1008265486493&jrtk=3-0-1ghljkr9pkugp801-1ghljkra6i9iu800-d286fce8b39e9d77-
"['State of Connecticut - Department of Transportation', '3.5']",http://www.ct.gov/,Cybersecurity Specialist,"Hartford, CT",$100K - $125K (Employer est.),"Are you passionate about shaping the future of transportation in Connecticut? If so, come join our great team of engineering professionals and make an ImpaCT!


The State of Connecticut, Department of Transportation (DOT), is now accepting applications for Transportation Engineer Trainee positions throughout the State!


Current students who will be graduating with a Bachelor's degree in Engineering by the end of May 2023 are strongly encouraged to apply!

THE ROLE

Transportation Engineer Trainees work in many different capacities agency-wide. Transportation Engineer Trainee positions are available throughout the Bureau of Engineering and Construction and may be available in other program areas including the Office of State Traffic Administration, Bureau of Public Transportation, Bureau of Policy and Planning, and Bureau of Highway Operations. These positions are full-time, 40 hours per week.


Applicants must be available to travel for training, conferences, meetings, field reviews, etc. both within and outside of normal working hours, when necessary. A valid motor vehicle operator's license is required and must be maintained.",23d,www.glassdoor.com/partner/jobListing.htm?pos=114&ao=1136043&s=58&guid=000001846b3a6d0588b947ed248af377&src=GD_JOB_VIEW&t=SR&vt=w&cs=1_7f825bac&cb=1668246350388&jobListingId=1008220652695&jrtk=3-0-1ghljkr9pkugp801-1ghljkra6i9iu800-92f26a517e00ad18-
"['Global Atlantic Financial Group Opportunities', '4.0']",http://www.globalatlantic.com/,Cybersecurity Specialist,"Hartford, CT",$100K - $125K (Employer est.),"All offices are currently open, and our employees are back 4 or 5 days a week in Hudson Yards, NY and 3 days a week in all other offices. If you have questions on this policy or the application process, please contact recruiting@gafg.com.
Company policy requires all employees and visitors to the Hudson Yards, NY office to be vaccinated against the COVID-19 virus.
COMPANY OVERVIEW
Global Atlantic Financial Group is a leader in the U.S. life insurance and annuity industry, serving the needs of individuals and institutions. Global Atlantic is a majority-owned subsidiary of KKR, a leading global investment firm that offers alternative asset management across multiple strategies and capital markets solutions.

Global Atlantic is looking for a diverse team of talented individuals who reinforce our culture of collaboration and innovation. We are dedicated to the career development of our people because we know they are critical to our long-term success. Join our team and come grow with us.",3d,www.glassdoor.com/partner/jobListing.htm?pos=115&ao=1136043&s=58&guid=000001846b3a6d0588b947ed248af377&src=GD_JOB_VIEW&t=SR&vt=w&cs=1_10b07705&cb=1668246354344&jobListingId=1008265486491&jrtk=3-0-1ghljkr9pkugp801-1ghljkra6i9iu800-c0379c09aed8a352-
"['Eaton', '3.9']",http://www.eaton.com/,Cybersecurity Specialist,"Hartford, CT",$100K - $125K (Employer est.),"Eaton Corporation’s North America Electrical Sales Division has an immediate opening for a Field Applications Engineer, located in the Northeast Region of the United States. This position can be based remotely in Hartford CT, Albany NY or our Boston MA regions. Relocation will be provided if needed.
Position Overview:
The primary function of the Utility Application Engineer is to achieve acceptability of Eaton’s Cooper Power Systems products in the Utility Distribution and Substation marketplace, while providing technical leadership to sales engineers, Manufacturer’s reps, and external customers. This position will be familiar with competitive product offerings and be able to position Eaton products to best compete against competitive products.
The primary functions include the following: Pre-sale application and technical support to meet customer’s needs by providing directions, solutions, and recommendations; product value proposition and product line strategies; provide feedback on product development to the product line; provide feedback to product marketing and engineering regarding market needs and competitive product offering.",11d,www.glassdoor.com/partner/jobListing.htm?pos=116&ao=1136043&s=58&guid=000001846b3a6d0588b947ed248af377&src=GD_JOB_VIEW&t=SR&vt=w&cs=1_9a3d26e5&cb=1668246358137&jobListingId=1008245228497&jrtk=3-0-1ghljkr9pkugp801-1ghljkra6i9iu800-d79d97b195ddca15-
"['HSB', '3.7']",http://www.hsb.se/,Cybersecurity Specialist,"Hartford, CT",$100K - $125K (Employer est.),"Authorized Inspector Trainee - Chicago area/NW Indiana

WE OFFER
Chicago area/NW Indiana

The Hartford Steam Boiler Inspection and Insurance Company is looking for Inspectors to join our Engineering Team!

Global Inspection and Engineering Services is an inspection focused engineering division of HSBIIC with over 450 engineers, inspectors and auditors located in over 27 countries. The world’s largest ASME Authorized Inspection Agency, GIES Inspectors are instrumental in providing on location services that verify the quality and conformance of pressure equipment when it is being manufactured, erected and/or repaired. The work of our Global Inspection and Engineering Services personnel is focused on the beginning of the life cycle of the type of equipment insured by HSB and is an important part of HSB’s comprehensive understanding of the insured equipment. Services include:
This field based position is an integral part of our commitment to the quality and service we provide for our customers and to their equipment. The work is varied from day to day and is ideally suited to a self-motivated individual who can work independently. A successful inspector will have excellent communications skills and the ability to work with HSB clients and customers in a professional manor with high integrity.

The position has minimum qualifications of a high school diploma and work experience with boilers and pressure vessels or nuclear reactors. The required work experience can be reduced if you have an engineering degree.

Training is provided annually for all of our inspectors, which is developed and supported by our technical industry experts.

The Hartford Steam Boiler Inspection and Insurance Company has a long and respected reputation as the leader in our industry with a primary focus on workplace safety.",30d+,www.glassdoor.com/partner/jobListing.htm?pos=117&ao=1136043&s=58&guid=000001846b3a6d0588b947ed248af377&src=GD_JOB_VIEW&t=SR&vt=w&cs=1_3dbc33d7&cb=1668246360138&jobListingId=1008103821913&jrtk=3-0-1ghljkr9pkugp801-1ghljkra6i9iu800-7c5af6691d77b8ec-
"['Global Atlantic Financial Group', '4.0']",http://www.globalatlantic.com/,Cybersecurity Specialist,"Hartford, CT",$100K - $125K (Employer est.),"All offices are currently open, and our employees are back 4 or 5 days a week in Hudson Yards, NY and 3 days a week in all other offices. If you have questions on this policy or the application process, please contact recruiting@gafg.com.
Company policy requires all employees and visitors to the Hudson Yards, NY office to be vaccinated against the COVID-19 virus.
COMPANY OVERVIEW
Global Atlantic Financial Group is a leader in the U.S. life insurance and annuity industry, serving the needs of individuals and institutions. Global Atlantic is a majority-owned subsidiary of KKR, a leading global investment firm that offers alternative asset management across multiple strategies and capital markets solutions.

Global Atlantic is looking for a diverse team of talented individuals who reinforce our culture of collaboration and innovation. We are dedicated to the career development of our people because we know they are critical to our long-term success. Join our team and come grow with us.",30d+,www.glassdoor.com/partner/jobListing.htm?pos=118&ao=1136043&s=58&guid=000001846b3a6d0588b947ed248af377&src=GD_JOB_VIEW&t=SR&vt=w&cs=1_d24944ad&cb=1668246362411&jobListingId=1008094371782&jrtk=3-0-1ghljkr9pkugp801-1ghljkra6i9iu800-de8617485b9d8d9e-
"['New Britain General', '3.5']",http://www.hartfordhealthcare.org/,Cybersecurity Specialist,"Hartford, CT",$100K - $125K (Employer est.),"Description
Job Schedule: Full Time
Standard Hours: 40
Job Shift: Shift 1
Shift Details: Day shift


Work where every moment matters.
Every day, over 35,000 Hartford HealthCare colleagues come to work with one thing in common: Pride in what we do, knowing every moment matters here. We invite you to become part of Connecticut's most comprehensive healthcare network.",30d+,
"['Hartford HealthCare Corp.', '3.5']",http://www.hartfordhealthcare.org/,Cybersecurity Specialist,"Hartford, CT",$100K - $125K (Employer est.),"Description
Job Schedule: Full Time
Standard Hours: 40
Job Shift: Shift 1
Shift Details:


Workwhere every moment matters.

Every day, almost 20,000 Hartford HealthCareemployees come to work with one thing in common: Pride in what we do, knowingevery moment matters here. We invite you to become part of Connecticut’s mostcomprehensive healthcare network.

The creation of the HHC System Support Officerecognizes the work of a large and growing group of employees whoseresponsibilities are continually evolving so that we and our departments nowwork on behalf of the system as a whole, rather than a single memberorganization.
With the creation of our new umbrellaorganization we now have our own identity with a unique payroll, benefits,performance management system, service recognition programs and other commonpractices across the system.





















Bachelor’s degree with project management experience is required. Bachelor’s degree in engineering or design is preferred.

Minimum five (5) years of progressively responsible experience, preferably in healthcare sector.

Project Management or Construction Management certification a plus




With locations around the state, Hartford HealthCare offers exciting opportunities for career development and growth. Here, you are part of an organization on the cutting edge – helping to bring new technologies, breakthrough treatments and community education to countless men, women and children. We know that a thriving organization starts with thriving employees- we provide a competitive benefits program designed to ensure work/life balance. Every moment matters. And this is your moment.",30d+,
