Company_Name,Company_Link,Title,Location,Estimated_Salary,Job_Description,Job_Age,Application_Link
"['Crossmedia', '4.4']",http://www.xmedia.com/,Cloud Services Support Engineer - Government and Public Sector,"McLean, VA",$82K - $132K (Employer est.),"Company Description

Crossmedia is the global media independent. We’re committed to doing media and business the right way, guided by the principles of TRUST, REASON and the pursuit of HAPPINESS. Crossmedia US was founded in NY in 2000 and is one of the largest minority-owned full-service media planning & buying agencies in the nation. Together with our network partners in Germany and the UK, we are 600+ Crossmedians worldwide with big ambitions to continue to grow with soul.
We focus on what media agencies should do: create innovative connections between brands and people regardless of channel or budget. And, we do it in an honest way. We are and always have been a values-based organization. We earn our clients TRUST by ensuring media transparency in our business model and objectivity in decision-making. We apply REASON & logic to everything and have one of the leading analytics groups in the industry committed to uncovering data insights to drive solutions. The pursuit of HAPPINESS matters to us. Big time. We invest in each colleague’s professional & personal wellbeing and growth. It’s why we have countless initiatives, clubs & cultural events dedicated to our people and why we ‘ve been the top ranked media agency on Ad Age’s Best Places to Work for the past three years in a row.",2d,
"['Crossmedia', '4.4']",http://www.xmedia.com/,Cloud Services Support Engineer - Government and Public Sector,"McLean, VA",$82K - $132K (Employer est.),"Company Description

Crossmedia is a growing communications planning and media services agency with offices in Los Angeles, New York, Philadelphia, Dusseldorf, Hamburg, Berlin and London. Our client roster includes Hertz, New Era, US Bank, Home Away, White Castle, Mini Cooper, The Hartford, Nordstrom Rack, Capital Group, Realtor.com, Serta/Simmon/BeautyRest and more.

Job Description

We are a fast growing independent media agency and with growth comes a ton of opportunities to use data to solve problems, improve processes and simply make better decisions.",2d,
"['Global Atlantic Financial Group Opportunities', '4.0']",http://www.globalatlantic.com/,Cloud Services Support Engineer - Government and Public Sector,"McLean, VA",$82K - $132K (Employer est.),"All offices are currently open, and our employees are back 4 or 5 days a week in Hudson Yards, NY and 3 days a week in all other offices. If you have questions on this policy or the application process, please contact recruiting@gafg.com.
Company policy requires all employees and visitors to the Hudson Yards, NY office to be vaccinated against the COVID-19 virus.
COMPANY OVERVIEW
Global Atlantic Financial Group is a leader in the U.S. life insurance and annuity industry, serving the needs of individuals and institutions. Global Atlantic is a majority-owned subsidiary of KKR, a leading global investment firm that offers alternative asset management across multiple strategies and capital markets solutions.

Global Atlantic is looking for a diverse team of talented individuals who reinforce our culture of collaboration and innovation. We are dedicated to the career development of our people because we know they are critical to our long-term success. Join our team and come grow with us.",10d,www.glassdoor.com/partner/jobListing.htm?pos=104&ao=1136043&s=58&guid=000001846b3e226e924333a68a5c2e53&src=GD_JOB_VIEW&t=SR&vt=w&cs=1_ab16f6f2&cb=1668246566899&jobListingId=1008250607082&jrtk=3-0-1ghljs8l9jcbq801-1ghljs8lsim92800-d10b500422634cd9-
"['EY', '3.9']",,Cloud Services Support Engineer - Government and Public Sector,"McLean, VA",$82K - $132K (Employer est.),"At EY, you’ll have the chance to build a career as unique as you are, with the global scale, support, inclusive culture and technology to become the best version of you. And we’re counting on your unique voice and perspective to help EY become even better, too. Join us and build an exceptional experience for yourself, and a better working world for all.

Insurance Tech Consulting – Architecture - Manager

EY is the only professional services firm with a separate business unit (""FSO"") that is dedicated to the financial services marketplace. Our FSO teams have been at the forefront of every event that has reshaped and redefined the financial services industry. If you have a passion for rallying together to solve the most complex challenges in the financial services industry, come join our dynamic FSO team!",10d,www.glassdoor.com/partner/jobListing.htm?pos=105&ao=1136043&s=58&guid=000001846b3e226e924333a68a5c2e53&src=GD_JOB_VIEW&t=SR&vt=w&cs=1_781bb2fe&cb=1668246568463&jobListingId=1008250005450&jrtk=3-0-1ghljs8l9jcbq801-1ghljs8lsim92800-7aeeedf10031ba37-
"['EY', '3.9']",,Cloud Services Support Engineer - Government and Public Sector,"McLean, VA",$82K - $132K (Employer est.),"At EY, you’ll have the chance to build a career as unique as you are, with the global scale, support, inclusive culture and technology to become the best version of you. And we’re counting on your unique voice and perspective to help EY become even better, too. Join us and build an exceptional experience for yourself, and a better working world for all.

From strategy to execution, the Government & Public Sector (GPS) practice of Ernst & Young LLP provides a full range of consulting and audit services to help our Federal, State, Local and Education clients implement new ideas to help achieve their mission outcomes. We deliver real change and measurable results through our diverse, high-performing teams, quality work at the highest professional standards, operational know-how from across our global organization, and creative and bold ideas that drive innovation. We enable our government clients to achieve their mission of protecting the nation and serving the people; increasing public safety; improving healthcare for our military, veterans and citizens; delivering essential public services; and helping those in need. EY is ready to help our government build a better working world.",30d+,www.glassdoor.com/partner/jobListing.htm?pos=106&ao=1136043&s=58&guid=000001846b3e226e924333a68a5c2e53&src=GD_JOB_VIEW&t=SR&vt=w&cs=1_8c4d2b49&cb=1668246572443&jobListingId=1008007715485&jrtk=3-0-1ghljs8l9jcbq801-1ghljs8lsim92800-4654b07f5d291861-
"['EXL Services', '3.7']",http://www.exlservice.com/,Cloud Services Support Engineer - Government and Public Sector,"McLean, VA",$82K - $132K (Employer est.),"Company Overview and Culture
EXL (NASDAQ: EXLS) is a global analytics and digital solutions company that partners with clients to improve business outcomes and unlock growth. Bringing together deep domain expertise with robust data, powerful analytics, cloud, and AI, we create agile, scalable solutions and execute complex operations for the world’s leading corporations in industries including insurance, healthcare, banking and financial services, media, and retail, among others. Focused on creating value from data for driving faster decision-making and transforming operating models, EXL was founded on the core values of innovation, collaboration, excellence, integrity and respect. Headquartered in New York, our team is over 40,000 strong, with more than 50 offices spanning six continents. For information, visit www.exlservice.com.

For the past 20 years, EXL has worked as a strategic partner and won awards in its approach to helping its clients solve business challenges such as digital transformation, improving customer experience, streamlining business operations, taking products to market faster, improving corporate finance, building models to become compliant more quickly with new regulations, turning volumes of data into business opportunities, creating new channels for growth and better adapting to change. The business operates within four business units: Insurance, Health, Analytics, and Emerging businesses.

EXL is hiring a Data Engineer for its Data and Analytics business. This position is based out of our Hartford, CT office.


Knowledge in building data pipelines using SQL and Python.


Logical thinking, problem-solving, knowledge in statistical theories and analysis with excellent communication.



EEO/Minorities/Females/Vets/Disabilities

Please be aware that EXL requires all employees to be vaccinated for COVID-19. This position will require the successful candidate to obtain and show proof of a vaccination. EXL is an equal opportunity employer, and will provide reasonable accommodation to those individuals who are unable to be vaccinated consistent with federal, state, and local law.

The base salary range represents the low and high end of the EXL base salary range for this position. Actual salaries will vary depending on factors including but not limited to: location and experience. The base salary range listed is just one component of EXL's total compensation package for employees. Other rewards may include bonuses, as well as a Paid Time Off policy, and many region specific benefits.

Please also note that the data shared through the job application will be stored and processed by EXL in accordance with the EXL Privacy Policy.",30d+,
"['Munich Re America Services', '4.3']",http://www.munichre.com/,Cloud Services Support Engineer - Government and Public Sector,"McLean, VA",$82K - $132K (Employer est.),"Sr. Solution Architect - Data Analytics/ML Ops Engineer
Location
Hartford , United States
Your job
Munich Re America Services (MRAS) is a shared service organization that delivers services to all Munich Re US P&C Companies and other group entities.

We’re adding to our diverse team of experts and are looking to hire an employee committed to building a culture that enables the creation of innovative solutions for our business units and clients.

As a member of Munich Re's US operations, we offer the financial strength and stability that comes with being part of the world's preeminent insurance and reinsurance brand. Our risk experts work together to assemble the right mix of products and services to help our clients stay competitive – from traditional reinsurance coverages, to niche and specialty reinsurance and insurance products.

The section IT 1.6 Business Technology is responsible for successful consulting on, bundling, management and design of IT innovation solutions in close cooperation with the business divisional units and departments, and central divisions in Munich Re (Group), as well as with other IT units.

IT section1.6.4.1 in Munich and section 1.6.4.2 in Princeton is responsible for Munich Re’s “Big Data and Analytics Platform” and specific data and AI based solutions. This so-called BDAP platform builds the basis for the innovative digital solutions of Munich Re and needs permanent development.

We are looking for a highly motivated and passionate Data Analytics Architect Lead to drive high priority customer initiatives on the Microsoft Azure Platform in collaboration with customers. This is a customer facing role, owning overall technical relationship between customer and BDAP Data, Advanced Analytics and Artificial Intelligence Platform.

You will own the Data Platform & Advanced Analytics technical customer engagements within our North American Business Units including architectural design sessions, specific implementation projects and/or MVPs. The ideal candidate will have experience in customer-facing roles and success leading deep technical architecture discussions with senior customer executives, Enterprise Architects, IT Management and Developers to drive Data Platform and Advanced Analytics solutions to productions.
Key responsibilities include:




At Munich Re US, we see Diversity and Inclusion as a solution to the challenges and opportunities all around us. Our goal is to foster an inclusive culture and build a workforce that reflects the customers we serve and the communities in which we live and work. We strive to provide a workplace where all of our colleagues feel respected, valued and empowered to achieve their very best every day. We recruit and develop talent with a focus on providing our customers the most innovative products and services.

We are an equal opportunity employer. Reasonable accommodations may be made to enable individuals with disabilities to perform the essential functions.",30d,www.glassdoor.com/partner/jobListing.htm?pos=108&ao=1136043&s=58&guid=000001846b3e226e924333a68a5c2e53&src=GD_JOB_VIEW&t=SR&vt=w&cs=1_e9ecb427&cb=1668246580202&jobListingId=1008203490263&jrtk=3-0-1ghljs8l9jcbq801-1ghljs8lsim92800-cada9700c372b0e3-
"['State of Connecticut - Department of Transportation', '3.5']",http://www.ct.gov/,Cloud Services Support Engineer - Government and Public Sector,"McLean, VA",$82K - $132K (Employer est.),"Are you passionate about shaping the future of transportation in Connecticut? If so, come join our great team of engineering professionals and make an ImpaCT!


The State of Connecticut, Department of Transportation (DOT), is now accepting applications for Transportation Engineer Trainee positions throughout the State!


Current students who will be graduating with a Bachelor's degree in Engineering by the end of May 2023 are strongly encouraged to apply!

THE ROLE

Transportation Engineer Trainees work in many different capacities agency-wide. Transportation Engineer Trainee positions are available throughout the Bureau of Engineering and Construction and may be available in other program areas including the Office of State Traffic Administration, Bureau of Public Transportation, Bureau of Policy and Planning, and Bureau of Highway Operations. These positions are full-time, 40 hours per week.


Applicants must be available to travel for training, conferences, meetings, field reviews, etc. both within and outside of normal working hours, when necessary. A valid motor vehicle operator's license is required and must be maintained.",23d,www.glassdoor.com/partner/jobListing.htm?pos=109&ao=1136043&s=58&guid=000001846b3e226e924333a68a5c2e53&src=GD_JOB_VIEW&t=SR&vt=w&cs=1_62962aec&cb=1668246583976&jobListingId=1008220652695&jrtk=3-0-1ghljs8l9jcbq801-1ghljs8lsim92800-92f26a517e00ad18-
"['AXA', '4.0']",http://careers.axa.com/global/en,Cloud Services Support Engineer - Government and Public Sector,"McLean, VA",$82K - $132K (Employer est.),"Hartford, CT; Stamford, CT; Exton, PA | United States

AXA XL recognizes data and information as critical business assets, both in terms of managing risk and enabling new business opportunities. This data should not only be high quality, but also actionable – enabling AXA XL to maximize benefits and facilitate a sustained competitive advantage. Our Chief Data Office also known as our Data Intelligence & Analytics (DIA) is focused on driving innovation through optimizing how we leverage data to drive strategy and create a new business model – disrupting the insurance market.
As we develop and execute an enterprise-wide data and digital strategy that moves us toward greater focus on the use of data and data-driven insights, we are seeking a Delivery Lead for our Data Delivery Solutions team. The role sits across the DIA Department to ensure the delivery of data capabilities and insights to our customers. Success in the role will require focus on building disciplined Agile delivery teams that embody Agile principles and build partnerships across a diverse spectrum of other teams and stakeholder groups.",3d,www.glassdoor.com/partner/jobListing.htm?pos=110&ao=1136043&s=58&guid=000001846b3e226e924333a68a5c2e53&src=GD_JOB_VIEW&t=SR&vt=w&cs=1_36d4aad9&cb=1668246587992&jobListingId=1008266499330&jrtk=3-0-1ghljs8l9jcbq801-1ghljs8lsim92800-f95dd8d4603ddb1b-
"['CVS Health', '3.1']",http://jobs.cvshealth.com/,Cloud Services Support Engineer - Government and Public Sector,"McLean, VA",$82K - $132K (Employer est.),"Fortune 5 CVS Health has a dynamic opportunity for a Senior Data Engineer to join our dedicated Pharmacy Services Finance team.

You will be responsible for understanding, preparing, processing, and analyzing data. You will be tasked with making the data valuable and useful for operational and/or decision-making purposes.

You may need to team with either Business Intelligence, Data Governance, and data engineers to automate metrics and to create highly useful information. This position requires collaboration skills as it is necessary to work cross functionally and influence a wide range of Pharmacy Services finance departments. Ideal candidate will have good analytical and communication skills. In addition, the individual must be able to independently interact with and influence senior partners and demonstrate a proven track record of delivering results.
In this role you will design, model, document, and guide the logical and conceptual relationship of data for metrics and analytics. Analyze customer needs and investigate data available for analysis.

Position can sit in Cumberland-RI, Hartford-CT preferred. But, also open to Work from Home-Flexible.

Responsibilities:

Successful candidate will display:


The typical pay range for this role is:
Minimum: 60,300
Maximum: 126,600

Please keep in mind that this range represents the pay range for all positions in the job grade within which this position falls. The actual salary offer will take into account a wide range of factors, including location.


5 or more years’ of experience in financial or healthcare data analysis/management.





Bachelor's degree or equivalent work experience required.


Bring your heart to CVS Health
Every one of us at CVS Health shares a single, clear purpose: Bringing our heart to every moment of your health. This purpose guides our commitment to deliver enhanced human-centric health care for a rapidly changing world. Anchored in our brand — with heart at its center — our purpose sends a personal message that how we deliver our services is just as important as what we deliver.

Our Heart At Work Behaviors™ support this purpose. We want everyone who works at CVS Health to feel empowered by the role they play in transforming our culture and accelerating our ability to innovate and deliver solutions to make health care more personal, convenient and affordable.
We strive to promote and sustain a culture of diversity, inclusion and belonging every day.
CVS Health is an affirmative action employer, and is an equal opportunity employer, as are the physician-owned businesses for which CVS Health provides management services. We do not discriminate in recruiting, hiring, promotion, or any other personnel action based on race, ethnicity, color, national origin, sex/gender, sexual orientation, gender identity or expression, religion, age, disability, protected veteran status, or any other characteristic protected by applicable federal, state, or local law.",30d+,www.glassdoor.com/partner/jobListing.htm?pos=111&ao=1136043&s=58&guid=000001846b3e226e924333a68a5c2e53&src=GD_JOB_VIEW&t=SR&vt=w&cs=1_283def07&cb=1668246590711&jobListingId=1008139385065&jrtk=3-0-1ghljs8l9jcbq801-1ghljs8lsim92800-d8dbcf44428e43fd-
"['Global Atlantic Financial Group Opportunities', '4.0']",http://www.globalatlantic.com/,Cloud Services Support Engineer - Government and Public Sector,"McLean, VA",$82K - $132K (Employer est.),"All offices are currently open, and our employees are back 4 or 5 days a week in Hudson Yards, NY and 3 days a week in all other offices. If you have questions on this policy or the application process, please contact recruiting@gafg.com.
Company policy requires all employees and visitors to the Hudson Yards, NY office to be vaccinated against the COVID-19 virus.
COMPANY OVERVIEW
Global Atlantic Financial Group is a leader in the U.S. life insurance and annuity industry, serving the needs of individuals and institutions. Global Atlantic is a majority-owned subsidiary of KKR, a leading global investment firm that offers alternative asset management across multiple strategies and capital markets solutions.

Global Atlantic is looking for a diverse team of talented individuals who reinforce our culture of collaboration and innovation. We are dedicated to the career development of our people because we know they are critical to our long-term success. Join our team and come grow with us.",3d,www.glassdoor.com/partner/jobListing.htm?pos=112&ao=1136043&s=58&guid=000001846b3e226e924333a68a5c2e53&src=GD_JOB_VIEW&t=SR&vt=w&cs=1_96bf6e26&cb=1668246593597&jobListingId=1008265486489&jrtk=3-0-1ghljs8l9jcbq801-1ghljs8lsim92800-ae45f149b4ac5129-
"['EXL Services', '3.7']",http://www.exlservice.com/,Cloud Services Support Engineer - Government and Public Sector,"McLean, VA",$82K - $132K (Employer est.),"Company Overview and Culture
EXL (NASDAQ: EXLS) is a global analytics and digital solutions company that partners with clients to improve business outcomes and unlock growth. Bringing together deep domain expertise with robust data, powerful analytics, cloud, and AI, we create agile, scalable solutions and execute complex operations for the world’s leading corporations in industries including insurance, healthcare, banking and financial services, media, and retail, among others. Focused on creating value from data for driving faster decision-making and transforming operating models, EXL was founded on the core values of innovation, collaboration, excellence, integrity and respect. Headquartered in New York, our team is over 40,000 strong, with more than 50 offices spanning six continents. For information, visit www.exlservice.com.

For the past 20 years, EXL has worked as a strategic partner and won awards in its approach to helping its clients solve business challenges such as digital transformation, improving customer experience, streamlining business operations, taking products to market faster, improving corporate finance, building models to become compliant more quickly with new regulations, turning volumes of data into business opportunities, creating new channels for growth and better adapting to change. The business operates within four business units: Insurance, Health, Analytics, and Emerging businesses.

EXL Health is seeking a Software Engineer - Healthcare Analytics, this role will initially be remote but once Stay at Home orders are lifted, this role will be located in West Hartford, CT.

The Software Engineer will be responsible for working with the service design team to design, document, build, secure, and maintain software product development solutions.




EEO/Minorities/Females/Vets/Disabilities

Please be aware that EXL requires all employees to be vaccinated for COVID-19. This position will require the successful candidate to obtain and show proof of a vaccination. EXL is an equal opportunity employer, and will provide reasonable accommodation to those individuals who are unable to be vaccinated consistent with federal, state, and local law.

The base salary range represents the low and high end of the EXL base salary range for this position. Actual salaries will vary depending on factors including but not limited to: location and experience. The base salary range listed is just one component of EXL's total compensation package for employees. Other rewards may include bonuses, as well as a Paid Time Off policy, and many region specific benefits.

Please also note that the data shared through the job application will be stored and processed by EXL in accordance with the EXL Privacy Policy.",30d+,
