Company_Name,Company_Link,Title,Location,Estimated_Salary,Job_Description,Job_Age,Application_Link
"[""Land O'Lakes"", '4.0']",https://careers.landolakesinc.com/us/en,Database Developer,"Goldfield, IA",,"As part of an ever-growing ag community, we are uniquely positioned to address the challenges and seize the opportunities of a growing global population. We are dedicated to finding the most talented people to support the businesses of our member owners, local ag retails and cooperatives across North America. We strive to match people that share our passion for agriculture with sustainable careers in the communities in which our member owners operate. There is no better time to be part of the growing, dynamic world of agriculture – let’s help you find your fit.
Database Developer
A Land O'Lakes member owner cooperative in Goldfield, Iowa is adding a Database Developer to their team! This employee will assist the Information Technology team with software applications.",30d+,www.glassdoor.com/partner/jobListing.htm?pos=101&ao=1136043&s=58&guid=000001846a546201bf3451f2a05c3419&src=GD_JOB_VIEW&t=SR&vt=w&cs=1_d67663d4&cb=1668231232673&jobListingId=1008198604967&jrtk=3-0-1ghl58oht2ap8001-1ghl58oigg4es800-7c8ed01f00b7c5a9-
"[""Land O'Lakes"", '4.0']",https://careers.landolakesinc.com/us/en,Database Developer,"Goldfield, IA",,"As part of an ever-growing ag community, we are uniquely positioned to address the challenges and seize the opportunities of a growing global population. We are dedicated to finding the most talented people to support the businesses of our member owners, local ag retails and cooperatives across North America. We strive to match people that share our passion for agriculture with sustainable careers in the communities in which our member owners operate. There is no better time to be part of the growing, dynamic world of agriculture – let’s help you find your fit.
Database Developer
A Land O'Lakes member owner cooperative in Goldfield, Iowa is adding a Database Developer to their team! This employee will assist the Information Technology team with software applications.",30d+,www.glassdoor.com/partner/jobListing.htm?pos=101&ao=1136043&s=58&guid=000001846a54890a8e4f2701734ce1e0&src=GD_JOB_VIEW&t=SR&vt=w&cs=1_c102063b&cb=1668231240441&jobListingId=1008198604967&jrtk=3-0-1ghl592a2ma52801-1ghl592aggspa800-7c8ed01f00b7c5a9-
"['CBRE', '3.9']",http://www.cbre.com/,Sr Client Strat Conslt Analyst,"Tampa, FL",,"Sr Client Strat Conslt Analyst

Job ID

84611

Posted

30-Sep-2022

Service line

GWS Segment

Role type

Full-time

Areas of Interest

Data & Analytics

Location(s)

Charlotte - North Carolina - United States of America, Kansas City - Kansas - United States of America, Land O' Lakes - Florida - United States of America, Tampa - Florida - United States of America














To perform this job successfully, an individual must be able to perform each essential duty satisfactorily. The requirements listed below are representative of the knowledge, skill, and/or ability required.
Reasonable accommodations may be made to enable individuals with disabilities to perform the essential functions.

Bachelor's degree (BA/BS) from four-year college or university. Masters degree or MBA preferred. Minimum 5+ years of related experience.


CTS Certification is a plus.

Excellent written and verbal communication skills. Strong organizational and analytical skills. Ability to provide efficient, timely, reliable and courteous service to customers. Ability to effectively present information.

Requires advanced knowledge of financial terms and principles. Ability to calculate intermediate figures such as percentages, discounts, and commissions. Conducts advanced financial analysis.

Ability to comprehend, analyze, and interpret complex documents. Ability to solve problems involving several options in situations. Requires advanced analytical and quantitative skills.



Decisions made with thorough understanding of procedures, company policies, and business practices to achieve general results and deadlines. Responsible for setting work unit and/or project deadlines. Errors in judgment may cause short-term impact to department.
CBRE is an equal opportunity/affirmative action employer with a long-standing commitment to providing equal employment opportunity to all qualified applicants regardless of race, color, religion, national origin, sex, sexual orientation, gender identity, pregnancy, age, citizenship, marital status, disability, veteran status, political belief, or any other basis protected by applicable law.",30d+,www.glassdoor.com/partner/jobListing.htm?pos=101&ao=1136043&s=58&guid=000001846a54bde8b7f3df792547e71e&src=GD_JOB_VIEW&t=SR&vt=w&cs=1_7f81f127&cb=1668231263191&jobListingId=1008179066585&jrtk=3-0-1ghl59fgqj44t801-1ghl59fhei15p800-d7801bc06f85f71d-
"[""Land O'Lakes"", '4.0']",https://careers.landolakesinc.com/us/en,Senior Project Engineer,"Carlisle, PA",,"Join Land O’Lakes, Inc., and help us bring food from farmer to fork. We’re a global, Fortune 250 company and a farmer-owned cooperative. While benefits can vary by location and role, most offer:

Medical, dental, vision, life and AD&D; short- and long-term disability insurance
Retirement savings plan and profit-sharing plan, both with company match
Paid time off and paid holidays, plus paid benefits for maternity and parental leaves
Senior Project Engineer
Responsible for planning and execution of capital projects. Will handle up to 5MM of annual spend for the Carlisle, PA facility. May perform projects at other Dairy plants..",30d+,www.glassdoor.com/partner/jobListing.htm?pos=101&ao=1136043&s=58&guid=000001846a54ff179ab120f28a4f6333&src=GD_JOB_VIEW&t=SR&vt=w&cs=1_c5ccf505&cb=1668231270943&jobListingId=1008176502594&jrtk=3-0-1ghl59vq9is0s801-1ghl59vqph4f9801-4e460f6edf5e0352-
"[""Land O'Lakes"", '4.0']",https://careers.landolakesinc.com/us/en,Environmental Data Scientist,"Arden Hills, MN",$97K - $146K (Employer est.),"Join Land O’Lakes, Inc., and help us bring food from farmer to fork. We’re a global, Fortune 250 company and a farmer-owned cooperative. While benefits can vary by location and role, most offer:

Medical, dental, vision, life and AD&D; short- and long-term disability insurance
Retirement savings plan and profit-sharing plan, both with company match
Paid time off and paid holidays, plus paid benefits for maternity and parental leaves
Environmental Data Scientist
This position is in the IT department and supports the Truterra team in the development and delivery of advanced, precision insights related to soil health and ecosystem services markets.",3d,www.glassdoor.com/partner/jobListing.htm?pos=101&ao=1136043&s=58&guid=000001846a55558a91acb9f96d7f4fcd&src=GD_JOB_VIEW&t=SR&vt=w&cs=1_2ca25704&cb=1668231293815&jobListingId=1008266922367&jrtk=3-0-1ghl5aldvih7d801-1ghl5alejitnc800-0fd3e94500d4d90c-
