Company_Name,Company_Link,Title,Location,Estimated_Salary,Job_Description,Job_Age,Application_Link
"['Excite Health Partners', '3.6']",http://www.excitehealthpartners.com/,Clinical Research Associate,Remote,$100K (Employer est.),"Project Policy Analyst
100% Remote
Are you a Project Policy Analyst looking for a new opportunity?_ We’re looking to move quickly so apply NOW!_
QUALIFICATIONS
At Excite, we want you to succeed. We want to help you reach your goals and find a satisfying and challenging work environment. For the Project Policy Analyst position, you should meet the following criteria:
At least 3 years of relevant experience",4d,
"['Smart Biotech Solutions', '5.0']",http://www.smart-tek.net/,Clinical Research Associate,Remote,$100K (Employer est.),"We are looking for an experienced, motivated scientist with a background in protein display platforms and large-scale screen designs to join our growing team of passionate researchers focused on unlocking human immunology. This position requires the independent design and execution of experiments, flexibility to lead a diverse set of projects, and effective internal and external collaboration.
Job Responsibilities:
Responsible for assay development of phage display-based high throughput screening and antibody profiling from bio-banked and clinical human samples
Develop and introduce critical advancements to the existing platform immunoprecipitation methodologies to enhance performance, including robustness and scalability",28d,
"['UT Southwestern Medical Center', '3.9']",https://jobs.utsouthwestern.edu/,Clinical Research Associate,Remote,$100K (Employer est.),"Center Information:
The Quantitative Biomedical Research Center (QBRC) is a well-established research center at UT Southwestern Medical Center (UTSW). It aims to foster collaborations involving quantitative methods and technologies in any aspect of biomedical research, particularly for understanding disease etiologies and developing treatment and prevention strategies. Currently, the center has six faculty members, around 40 staff members, postdocs and student research assistants. We are actively recruiting new members to join this new and dynamic group.
Position Title: Data Scientist I, II, III, Computational biologist I, II, III or Postdoctoral Fellow (Bioinformatics/Biostatistics)
Duties & Responsibilities: For bioinformatics scientists, the projects include developing novel method for analysis and integration of multiple-omics data, and single cell genomics and transcriptome analysis. For data scientists, the projects include assembling and statistical analyses of big clinical data, and application of machine learning and deep learning methods on real medical problems.",24h,
"['Allstate', '3.5']",http://www.allstate.com/,"NOC Engineer Linux / Unix /Windows Server, Remote/Home Based Worker",Remote,$57K - $88K (Employer est.),"The world isn’t standing still, and neither is Allstate. We’re moving quickly, looking across our businesses and brands and taking bold steps to better serve customers’ evolving needs. That’s why now is an exciting time to join our team. You’ll have opportunities to take risks, challenge the status quo and shape the future for the greater good.
You’ll do all this in an environment of excellence and the highest ethical standards – a place where values such as integrity, inclusive diversity and accountability are paramount. We empower every employee to lead, drive change and give back where they work and live. Our people are our greatest strength, and we work as one team in service of our customers and communities.
Everything we do at Allstate is driven by a shared purpose: to protect people from life’s uncertainties so they can realize their hopes and dreams. For more than 89 years we’ve thrived by staying a step ahead of whatever’s coming next – to give customers peace of mind no matter what changes they face. We acted with conviction to advocate for seat belts, air bags and graduated driving laws. We help give survivors of domestic violence a voice through financial empowerment. We’ve been an industry leader in pricing sophistication, telematics, digital photo claims and, more recently, device and identity protection. We are the Good Hands. We don’t follow the trends. We set them. Job Summary:
The NOC Systems Engineer helps to manage and assists with the research, administration, and maintenance of new or existing UNIX, Windows, VMware, Storage and Cloud technologies. The NOC Systems Engineer utilizes proven systems scripting, and developer skills to execute on tasks related to onboarding technology, incident management, and problem management. The role also assists Sr. Engineers that are working closely with engineering teams to provide feedback that can help improve system availability.

The NOC Systems Engineer has a broad understanding of Enterprise Infrastructure systems including NAS, SAN, Windows Server 2012/2016, RedHat, AWS, and Azure, preferably in an operations role and can provide level 1 support following standard operating procedures (SOP). Candidate will also have a basic understanding of how automation and or orchestration initiates repairs in an operational environment Key Responsibilities:
Support with SOPs, Windows, UNIX, HDS, AWS, Azure and Rubrik enterprise-class platforms
Possesses a continuous improvement mindset with the team, embracing a DevOps culture and constantly finding ways to make our systems more reliable.
Be an active participant and assist with creating and managing problem follow ups with your team and engineering to help improvement system reliability in the future or teach others what you learned.
Utilizes existing tools and leverage open-source solutions to help automate tasks with an emphasis on scalability and reliability
Assists in creating automation that remediates areas of concern within the system we support
Provide feedback to Lead Engineers in the form of regular meetings, problem records documenting areas of improvements, and presenting back opportunities to improve availability and performance
Help identify trends in incidents and bring awareness to create problem records to improve our systems and automating patterns.
Provide feedback to the technical leaders for the department focusing on strategy, service integration, monitoring, documentation, and Automation opportunities
Learn supported technology integration with focus on service improvement to help grow to the next level.
Monitor key performance indicators to ensure risks are being managed and to help avoid future impact using Data analytics and AIOP’s
Work with Lead Consultants and global teams when troubleshooting incidents
Support all technology stacks working Incident and problem records received/created within the NOC Technical skills:
Ability to perform basic troubleshooting of Linux Red Hat or Oracle Linux, LVM, VERITAS (Cluster Services, File system, Volume manager), Oracle and HP Blades Hardware knowledge’, and Unified Computing Systems (UCS) hardware knowledge.
Ability to resolve incidents using strong troubleshooting methodologies and standard operating procedures.
Familiarity with AWS or Azure platforms.
Experience with one or more programming languages, (Power shell, Python, Yaml, or Groovy)
Knowledge of IT infrastructure DevOps tools such as, JSON, VXML, GitHub, Ansible, bash, & Jenkins
Ability to perform basic troubleshooting of and understand SAN and NAS Storage systems.
Ability to perform basic troubleshooting of and understand Windows and VMWare systems
Familiarity with data protection technologies, including backup and anti-virus systems.
Core Windows Server technologies (Active Directory, DHCP, DNS, WINS, IIS).
Familiarity with HP ProLiant rack-mount servers and HP ProLiant blade servers.
VMware VCP-DCV and Microsoft server certifications (MCSE/MCSA/MCITP) a plus
Familiarity with building and sustaining interconnected production services with APIs

Responsible for the following technology, (Skill scale 1-5, 5 being expert)

BS in Computer Science, or related technical field involving coding or equivalent technical experience
1-3 years of experience with in one or more technology areas.


Highly self-motivated and ability to work in a global team environment.
Excellent analytical , problem-solving, and decision-making skills
Great communication, presentation, and interpersonal skills
Active participant in incident calls or meetings


Compensation offered for this role is $56,600.00-$87,500.00 per year and is based on experience and qualifications.
The candidate(s) offered this position will be required to submit to a background investigation, which includes a drug screen.
Good Work. Good Life. Good Hands®.
As a Fortune 100 company and industry leader, we provide a competitive salary – but that’s just the beginning. Our Total Rewards package also offers benefits like tuition assistance, medical and dental insurance, as well as a robust pension and 401(k). Plus, you’ll have access to a wide variety of programs to help you balance your work and personal life -- including a generous paid time off policy. For a full description of Allstate’s benefits, visit allstate.jobs/benefits/
Learn more about life at Allstate. Connect with us on Twitter , Facebook , Instagram and LinkedIn or watch a video .
Allstate generally does not sponsor individuals for employment-based visas for this position.

Effective July 1, 2014, under Indiana House Enrolled Act (HEA) 1242, it is against public policy of the State of Indiana and a discriminatory practice for an employer to discriminate against a prospective employee on the basis of status as a veteran by refusing to employ an applicant on the basis that they are a veteran of the armed forces of the United States, a member of the Indiana National Guard or a member of a reserve component.

For jobs in San Francisco, please click “ here ” for information regarding the San Francisco Fair Chance Ordinance.
For jobs in Los Angeles, please click “ here ” for information regarding the Los Angeles Fair Chance Initiative for Hiring Ordinance.

To view the “EEO is the Law” poster click “ here ”. This poster provides information concerning the laws and procedures for filing complaints of violations of the laws with the Office of Federal Contract Compliance Programs

To view the FMLA poster, click “ here ”. This poster summarizing the major provisions of the Family and Medical Leave Act (FMLA) and telling employees how to file a complaint.

It is the Company’s policy to employ the best qualified individuals available for all jobs. Therefore, any discriminatory action taken on account of an employee’s ancestry, age, color, disability, genetic information, gender, gender identity, gender expression, sexual and reproductive health decision, marital status, medical condition, military or veteran status, national origin, race (include traits historically associated with race, including, but not limited to, hair texture and protective hairstyles), religion (including religious dress), sex, or sexual orientation that adversely affects an employee's terms or conditions of employment is prohibited. This policy applies to all aspects of the employment relationship, including, but not limited to, hiring, training, salary administration, promotion, job assignment, benefits, discipline, and separation of employment.",3d,www.glassdoor.com/partner/jobListing.htm?pos=101&ao=1110586&s=58&guid=000001846a0e5d02b5ccc8e09be21258&src=GD_JOB_VIEW&t=SR&vt=w&cs=1_0582896f&cb=1668226644089&jobListingId=1008265383401&jrtk=3-0-1ghl0sna8kcnq801-1ghl0snanimbd800-1ead1a9a8f509216--6NYlbfkN0BLH0BMQoDn-yw6Urt952hBm1JLFZ7WpBxND2cMIOjOqbFVk94wXfJol2fCSe2VsLyuf3O-oEwDpsphl8cZpQT0p2MPB7qDCawdtGqW_T6hnK3uUkQr8AFTMTZWApcrJ2_WFx6eGQjEspHySEhLHBtNK2o9jZAqKcJgTocfGG5_FvabdicxtFAJUaBjZfVZS23gyu0ZfzQ7Ayt_zhaM2ZptKUkh_DFyhXRX2kSQ6ic0NaWQI0cmeEq_Xn5woUFSJmo8K9UDqCUhGlMndJv8XQXJGxmsCQUQoKcjfGOP-9hzZgrJmv6BQ18PHXQh-WccGY37SNIuibWS6pC60uQ6iBWhGYfZt9oNGkQQLfz4gsOXfYBtGfT8pR99FDRrV7vBQjaT1KacU-3jukCCBjIaLyuwDEUNd6adZaNPnXEwl5Db7dkhDjq5n8INcJI3emSg9C4sog4S76Fp1z58UBTJfFlabHAWAAe39I9DL1JX_MhqQrV9gtzQlZC1WSNGHfYyPbatxRh9o2o3SD-U1-HgOCclOndceDhwu6vg9nWn9A50ci6ZDzWt_d50sqKp2BDhEyd86ym-3NW-QnoJKahfzt_YtOmtfEyBdDT6M_dCe2k51mzuBZINhKTjmlVx1SHvird8Irqp6RpXMtPQe0OojR1rHHs4YPC60FDGdrOKx7UrglbFRcTxQMW2ONuZ5a-mWW-GtQRN2okc2zHLwxtLJFICmBiGlaVkuSFBDJGin0z7eBdmtp7dxJ5dCALmjFroIOqAyoq1nhVRa2-hZQgbOi9nIpUyHbUQ4j_N3iYWgynr29lsn1soUoTlEkVEq78s0v5qzK9OF4A4MXcsBYowHED7h0a2cSyMAN-RiBFLzb8-eqLluPvMx0lBG79ZSZXuiIwUYa_43AhlDeuEUQQTtu8z1KYRA0CQGoRmyyaNDERbovnLeZczJylenVK1_VRGo077dPE8bcXm3JAJTaBL3-iZWHIt8-k-pL6ppt_96I0gFRaNNDfw9GHCgLpyCr4cmcWB7IFMGnqeGduLhIAP9LnLNhJfgZA-BCguLf2NR_17FxRYlDgKmadHlb_U_atKEUlvcuGHN3YoIV_W0gE-ozyZ1_3RnJc87lGiao5l2fj549J0SwOBY7pP0fBh4gJJGj4S5rtWNe6yCQ9WkE3l4rRTB5KeCNSU4AAIdEh5GFFLpFpmXWVYh0nNeXrY_OtgT4wGoEUic8X7xjxhiuQghsDwpjKf2I5F3QJUXtzE4beOtDvCWy56SofD386dSJwLioz2raNZjt6FbysSuhJoIawL5nOhMe8ZAOhpGTTrJaRDpg%3D%3D
"['Lumen', '3.4']",http://www.lumen.com/,"NOC Engineer Linux / Unix /Windows Server, Remote/Home Based Worker",Remote,$57K - $88K (Employer est.),"About Lumen
Lumen is guided by our belief that humanity is at its best when technology advances the way we live and work. With 450,000 route fiber miles serving customers in more than 60 countries, we deliver the fastest, most secure global platform for applications and data to help businesses, government and communities deliver amazing experiences. Learn more about Lumen’s network, edge cloud, security and communication and collaboration solutions and our purpose to further human progress through technology at news.lumen.com, LinkedIn: /lumentechnologies, Twitter: @lumentechco, Facebook: /lumentechnologies, Instagram: @lumentechnologies and YouTube: /lumentechnologies.
The Role
This Lead Network Engineer position requires extensive experience in engineering, software development, systems administration, testing, and managing distinct lab environments: Development, QA-Test, and Preproduction of Edge Compute platforms. The candidate will also perform software engineering, development, and automation of Virtualization OpenStack, and Kubernetes environments. This includes managing all aspects of engineering, automation, Continuous Delivery Pipeline (CE/CI/CD), which includes monitoring, resolution, administration, and engineering of multiple private Edge Compute bare metal and virtualization environments. This role includes designing high-performing, scalable software, geographically redundant, and system solutions that must handle a high volume of transactions, throughput, and sessions. The ideal Lead Network Engineer will be a great motivator who can thrive in a Lean-Agile environment, with a consistent drive to find ways to improve the process, technology, and fellow employees.",30d+,www.glassdoor.com/partner/jobListing.htm?pos=102&ao=1110586&s=58&guid=000001846a0e5d02b5ccc8e09be21258&src=GD_JOB_VIEW&t=SR&vt=w&cs=1_cd49e1f6&cb=1668226646059&jobListingId=1007989971322&cpc=9908D8D4413DBB8A&jrtk=3-0-1ghl0sna8kcnq801-1ghl0snanimbd800-706fe7dedc056d40--6NYlbfkN0BGKj2dVRoMy2japSZrYRM8IJNi6D13enLCCRY5KIhxiuh_sXSgGZCrHE3-yTlm2cvTRjFICopPvFFIme5rzt13TU2sYTD-gOq_HDCITz-MdQhtBV0A5wT0FWDHVdQ6pTOYaICkjrXMbaVMU_ryDUCLeplw2sYG08M-SMvAHQnmemsUjSwViIfbnOM1kriSKsmzwfZv_7v3g4UL16U-BstO9iQdUT8DmOlel4riI36j2H-h7XBxH44_T24ZLaNsWdtx1zzKvCXXAddZkTkoL5b_LQJD6jRWQV6evIHkiMPzSx0lOXFIzBprH1LXnLc4wBbUvrI0-kpOWwgmjNCosth_usL79Up3I2_sYg_1i5Z8PPSGXX-S4LGSvGghj6mYNtJbXHkufGkZfIiw9jn1B7b_SKvryjyUDfUcjy5SYLEdEv5UmOMczUaEuS4HbALWOHjHtWwgl95U_LGEABwzeYKTW9pPowyTxGfAqB6i_B_SR3aJatp9WeusJUmdUGtEcbKI3dTo-eREOQicpgzidpVMGKi0cQxPtd64sVa30yRlCjMOX5W4s5dy_yaZBYlh4eGKSyLhduG7PwGSDr1KHvkvvYQH0AAyYXtu1q45A_Bc2HCKSC8ruPxfudZVsPgiSL-PAAwEqY7GWQRAB6CF55oratPk5LbFN4khNZpS_sF2VXIKba_UI430J14YMxCEAG19r7x-GRnapa8bL82Vw3mpDUlEXobNuW3b93q7Kmi27Qy3TQ8yb_5hyRqULKOHKiVayoskW_gB15naM6V-jPlejciw5vdjXRzJg8__f2PcjURJg9X4tOtyhnsc188bSOuyvWtfS23h7LZDxPSlwj1yWjlEoHvHatvfr6TlKzXiOltxjtWAVb378azFrfGcOPBAYh6K02j6LDT5dbpIQ6gOfkxvDdCLVrjEsO-klXZiV7Ck3V4dJxpzjaMlK9qJNOfT2sy9vSjw7MvRn_KuBmgQwXjFyx4NKO_DJhqhdJ63yIdLhjOkRmTrmKRn6uYl1U6Sl0JW1DTsYt5FNehGmhfKlaDTXYiX0pI0VJyPuWqKZp-hrBZvtRavS9I2cU3sHsmnTfhHdLYkF5d40I35VEtQCtM_uQ7h6KPRgu7rMWCgwEezDGaIyjMd9cGHrNArmJbcLbJpLxmjooAKf1j2HM8MVrl_IKmFIc4%3D
,http://www.unitedhealthgroup.com/,"NOC Engineer Linux / Unix /Windows Server, Remote/Home Based Worker",Remote,$57K - $88K (Employer est.),"Combine two of the fastest-growing fields on the planet with a culture of performance, collaboration and opportunity and this is what you get. Leading edge technology in an industry that's improving the lives of millions. Here, innovation isn't about another gadget, it's about making health care data available wherever and whenever people need it, safely and reliably. There's no room for error. Join us and start doing your life's best work.(sm)

At Optum, we know the extraordinary happens when we value, include, and learn from diverse people and perspectives. That’s why we’re committed to building an innovative culture where every team member is empowered to do their best work, where our diversity fuels our performance, and where we leverage our collective power to help people live healthier lives and make the health system work better for everyone. We recognize and embrace the strengths of Neurodivergent individuals and are committed to creating an environment where all people will feel connected, safe, heard, respected, and valued.",4d,www.glassdoor.com/partner/jobListing.htm?pos=103&ao=1110586&s=58&guid=000001846a0e5d02b5ccc8e09be21258&src=GD_JOB_VIEW&t=SR&vt=w&cs=1_2af685a0&cb=1668226649954&jobListingId=1008261919851&cpc=3BA4CE39D5B5DEF5&jrtk=3-0-1ghl0sna8kcnq801-1ghl0snanimbd800-7e3b283b7b0d17a8--6NYlbfkN0C8O9VKdOj_1Zh75e9_CvYhSsWVxS1Pvi5WUWhsf4w7FHZnh79vXwAKgfp2bL6zrIb9yYTt2Rs03y_Y8g9-AQvmptlNmWMvYk1P_FC1EzGZ3xQ3DAjJtfJFFH4Eqx-PjweKLhcGWAuHuo3ORi8_i2rM_r3y-oVglRzHiv2LmFkqvGyihghSDZDOmJtWdsI9bjtFcGqYK-yAYWpf0C7CA1ylLo8l9RZvskYAcVSJ7sVqQgy9ggmQ7rn7Sv6WeFBdYIx8noJW_fvcw81vPqA1dFybMVEotyUjlX-4rSlwjvUUwGFDC68PAkQMGIwW_ESIye9PGA3h6vY3rQT-swEoke-iBOlDpr7eITdx_1FI7RnDkQgi8WMJHgfseyPUhgVd-e3c9K6APF-2EEwbtKtPPnl7PiJrEWxjN5CLr0Isp_7w71tMj161HDYJ
"['Guidehouse', '3.7']",https://guidehouse.com/,"NOC Engineer Linux / Unix /Windows Server, Remote/Home Based Worker",Remote,$57K - $88K (Employer est.),"Overview

Guidehouse is a leading global provider of consulting services to the public sector and commercial markets, with broad capabilities in management, technology, and risk consulting. By combining our public and private sector expertise, we help clients address their most complex challenges and navigate significant regulatory pressures focusing on transformational change, business resiliency, and technology-driven innovation. Across a range of advisory, consulting, outsourcing, and digital services, we create scalable, innovative solutions that help our clients outwit complexity and position them for future growth and success. The company has more than 12,000 professionals in over 50 locations globally. Guidehouse is a Veritas Capital portfolio company, led by seasoned professionals with proven and diverse expertise in traditional and emerging technologies, markets, and agenda-setting issues driving national and global economies. For more information, please visit www.guidehouse.com.",4d,www.glassdoor.com/partner/jobListing.htm?pos=104&ao=1110586&s=58&guid=000001846a0e5d02b5ccc8e09be21258&src=GD_JOB_VIEW&t=SR&vt=w&cs=1_41433823&cb=1668226652898&jobListingId=1008262304695&jrtk=3-0-1ghl0sna8kcnq801-1ghl0snanimbd800-8debee4d9fa9190f--6NYlbfkN0DOpfXD7aCvxSiR73RUZjyy6OuclKM9Xpb799vH3iY_yIa6z53gDnQhWpskdKX-KCW-rBt8tuzstIRviq0TqhlnpIF3sEFIvgs9WGSMOQEF8yJsoZWBq-qb08L5rwiDZZAtT-JOi1MJ7m6YWPjeA1ErSXKRQzeAoUOAyifO9ENA_RiM88Hmueo6ae3JYE8sbk5sy2gsgEAgKKVOzthYKLPzktoj1v1uJNR6EEhM8t0gBwKB6pxGxTC_lU5eRxj921GLF9LRrusYZx2aqusBpu0QYVGhXuXdiNCYSxoWcWNvK06jjT_8rpXUlszqr-9a20wFBm8oCAiS4ZU21uiIKHPOHZBwwyTiEEKUvza5U68dNFJpayYk-1InCfMnPp1kkNptpnFykwDAAi72d-aYqbrNt0i4NX7tWEkHhuw8pVPnDq9Bh6Lgv5n_
