Company_Name,Company_Link,Title,Location,Estimated_Salary,Job_Description,Job_Age,Application_Link
"['Progressive', '3.9']",http://www.progressive.com/,Computer Vision and Machine Learning Engineer,"Boulder, CO",$120K - $180K (Employer est.),"IT Network Engineer Senior
Job Number: 197842

As an IT network engineer senior, you'll be responsible for servicing and supporting assigned technical infrastructure, platforms and systems that support Progressive's business capabilities. You’ll work to evaluate, install, configure, develop, implement, and maintain complex operating systems, and hardware and software components.
Location: St. Petersburg, FL. This position is a hybrid role
Must-have qualifications
Associate's degree or higher in an Information Technology discipline, Math, or other related field of study and a minimum of four years of experience working with operating system hardware and/or software components in a large IT environment with many categories of devices, infrastructures and operating systems",30d+,www.glassdoor.com/partner/jobListing.htm?pos=118&ao=1110586&s=58&guid=000001846a0728a2a4e822751807e98a&src=GD_JOB_VIEW&t=SR&vt=w&cs=1_56e882a5&cb=1668226220912&jobListingId=1008035913456&cpc=3BA4CE39D5B5DEF5&jrtk=3-0-1ghl0ea6mma7k801-1ghl0ea76i39u800-960e24cb31c8d67d--6NYlbfkN0DL_Oi7Zazb0cXECPKtFH6-sT0XCOargTHyqbhc9QuGNesLcBQRyuYuZzGCIxmNDqTCzD8i3jLIZ_5JRDk0mM1sgZEJ4t-MWc5UOjPhnjSkJ7IHOcX980Wahfq3AHN4l_k9vbAqRXVvP1q-XGCihhqbI1DNszqcW9wCxI4Mqw3pMBcDutDnb0pZ0L38zekvjx1znFlijiwZu95E1N7esmC_R5cPyl5kb2IlHI9MlScD6SSnwfCATDZp0vihvIcecy-SM9pRV-63-TQ4FHvL4uIAc-ZH6oBNkm1Gb3VMreoYz55TFoX_hGXLZbzHGUIkm2tW-HzcCJrDvH04kKjFYjRoEzBDF2Fi-3xL9HyHnfJ0R5RKZkw7G7h0_Ln0Jmj_I5jbTsFBPysG-uNnHUbbfLYQMC4Lfsl6PWXe_RNmdlHJEVNC1JsUj9LGgfhI9i7_DlVrQq4M8akgsrplLSuvh6uskLvVSjmYXqf_SXxVklw9fnCTKyrEhUGdeDRtIzjTH7DSDznXmkVEi4o3psMXH9iCYDAxEJVLURvpnd92FkgUIHtwCKR_4AFtvRwn-w8LJDTeSahlzRvOzVtrJd5nD-JS
"['Lumen', '3.4']",http://www.lumen.com/,Computer Vision and Machine Learning Engineer,"Boulder, CO",$120K - $180K (Employer est.),"About Lumen
Lumen is guided by our belief that humanity is at its best when technology advances the way we live and work. With 450,000 route fiber miles serving customers in more than 60 countries, we deliver the fastest, most secure global platform for applications and data to help businesses, government and communities deliver amazing experiences. Learn more about Lumen’s network, edge cloud, security and communication and collaboration solutions and our purpose to further human progress through technology at news.lumen.com, LinkedIn: /lumentechnologies, Twitter: @lumentechco, Facebook: /lumentechnologies, Instagram: @lumentechnologies and YouTube: /lumentechnologies.
The Role
Lead the program effort to translate the client's business requirements into specific systems, applications or process designs and deliver innovative business consulting, business process design, systems integration, and support application design. Exercises latitude to translate the needs of the business into system capabilities in the form of system requirement specifications. Understand and support the architecture with the ability and expertise to develop overall solution to support the architectural direction. Perform research and development activities to support future IT business strategies. Lead the support of clients by consulting and recommending solutions.",3d,www.glassdoor.com/partner/jobListing.htm?pos=119&ao=1110586&s=58&guid=000001846a0728a2a4e822751807e98a&src=GD_JOB_VIEW&t=SR&vt=w&cs=1_a5f2f183&cb=1668226224785&jobListingId=1008265223733&cpc=3BA4CE39D5B5DEF5&jrtk=3-0-1ghl0ea6mma7k801-1ghl0ea76i39u800-1da81ce3235a01ca--6NYlbfkN0BGKj2dVRoMy2japSZrYRM8IJNi6D13enLCCRY5KIhxigb2ni9doBXKvQE18bqfvQJ1QxaIujZ8wbO6aoWAM00ixGMjV9pOChflk7FfAMyZfErqnoSlQXAedV73lOK28wO2hbTRV3Jgc6fznrdaBycBioVRdHaHiUclKZ_T2qCXWARnQW4vEwkes54PFoscSpOGmkztKw5r7sNDvaOLXOjMF537vxi0nkVP3PUf7_yFqDF0VjWhkZ7zOOlXd1f1i1RtQwP_tZvOyst-F8aQbM_M5XM_H15y5ZdcIH8qqEcT7uLEgYPl1xu6VxEYhR9_Ju3osjjK5B443gXwLhqpVWQcnzeMG0N5ScUPqt8aSdrXvVOT9NCv4etUdFAVnzy5QxBRA4mn3gQcQ_WbNzWJkAa17UTEFi3TUuPfIMuoFs1A_yi7gSQWM1eMvhJm6PUupVV8s2I13XDCzdmP4wRDz6xmTAZmeuFItjzFPOW5mItazxYVeKwFSrdvC_6_U4VJ_lQUDlcC6v3vLhLwObPiVj0XqshLLXCp4sQbrmsxjRYJIuv8ezF_g7Kp5s4srAM9UKjKj5nVMllw6yCXqTkEip9IvR8460V-eKsAl6KpBsIcATo8hAjFNOd2XonnfM5YggDDd0-6YYyRgN9b4X6CxyAdqwii5M655WdSlIHHiJRJKvs8yp8zDpn7SKwU87fXEoxBmvKkov7OOMS7ArUc-lday6F43N7P1QO9tYv1nqMPssAU9m_nILEZyQ6Py5rpJM0gGamu679CWW-OnmGnswBmlb9IOrfn8TbeUUK8DNcnCyYiFYkbGZS_L_FLEQcoqkpGGpApRn-fa83GJZAs-7-bg26ZYUrVZ-aVPNIyKHsmv947O5i0d-TSmgP2QeEIKgh593M-4xAJSjxatfXT893xdVwOVzFGoGZvzLkGh2zRptyYSDMVghb_HGloVl1qAb65aXTRlrweHNZXDseBjWIsjERMQZMoMY0hNHeo5CX9J92YeUNQZgWRefKYz3qFLW-Lc-w2c4MMr7mZlbmWC_uaOBmsHaqDmAA-TMsFOLkM2o23yPcp1C_5hYnCvPzBbUEmDYG9373cqg-QeA23erGM5iwzTGlGe8vDr_zN8-cxs1wfboaNei4G8sEhyRk_EbOGnresnHoVMw%3D%3D
"['Progressive', '3.9']",http://www.progressive.com/,Computer Vision and Machine Learning Engineer,"Boulder, CO",$120K - $180K (Employer est.),"Data DevOps Engineer Lead
Job Number: 201173

Join Forbes’ 2022 Best Employer for Diversity!
As a DevOps engineer lead on the Data Solutions team, you'll design and develop enterprise continuous integration, continuous delivery, and cloud solutions for all service types, such as Infrastructure as a Service (Iaas), Platform as a Service (PaaS), and Software as a Service (Saas), that support Progressive’s capabilities. In this role, you'll also be responsible for the automation and integration of various technology platforms; this includes developing, building, administering, and deploying self-service tools and frameworks that enable customers to build and deploy cloud ready and cloud native applications and infrastructure. In addition, you'll serve as an escalation point for public cloud internal customers.",16d,www.glassdoor.com/partner/jobListing.htm?pos=120&ao=1110586&s=58&guid=000001846a0728a2a4e822751807e98a&src=GD_JOB_VIEW&t=SR&vt=w&cs=1_890ad23d&cb=1668226228945&jobListingId=1008236159664&cpc=3BA4CE39D5B5DEF5&jrtk=3-0-1ghl0ea6mma7k801-1ghl0ea76i39u800-f8fb9fed3ded05c9--6NYlbfkN0DL_Oi7Zazb0cXECPKtFH6-sT0XCOargTHyqbhc9QuGNesLcBQRyuYuZzGCIxmNDqQAvBVoB4W-PBNVQhuAJfTRuJHZHksKbWwgKTXDEVe9NiBkSBiBC1tx436U6SV8rT3fHtk10MY3kv9Co4JdJ-7DVtLuoS9eevWCjniJYeFpETduTiWYLPbJfpt6Z8piNauMClzAX0afUVvmXINj2I6V9bnYg0vIlMGcIObMHJOB7GoqKpbRGCSIG9MUJ0xXd25m_ZkAL8q8yVlS6VBhgSdga7jVd-DYcJy7LB1c2JFtLUw_xdsdGo-3KyX2yhEFqihUwShh-TyJLqtEXYEQpUT65bgysV5857ewXXmoyFzGkF2flqWpPeCdKYgHEr6UQweSzdcrzgjKUsj5P79iVhmdkQAFaxdvcH61gu1p2Wf5AEGtJ2mW10rlWCVqnJsIMi0YxmvKP6xk9T6Q0_C6-8ftcPi9pLFkOOsQ67KcPrfYTy1HHXjylkuxQNs3dwRvotrBIC78GCf8Bf1gH1TRKGEYtpRG1Zvsjusj_UTue2RDLwxsH-HJ9uRRXuJ3p5NNEi4DxjK8xh7roSvuYXyzMQ9_
"['Aston Technologies Inc.', '4.1']",https://www.astontech.com/,Computer Vision and Machine Learning Engineer,"Boulder, CO",$120K - $180K (Employer est.),"Project Start Bonus:
Earn a $2,000 bonus on your first paycheck on project after completing our in-house training curriculum. For a limited time. Ask for more details.
Job Description:
Aston Technologies is seeking talented individuals that are highly motivated and eager to launch their career in the IT industry. This role begins with an on-site training paid program with curriculum designed to test and sharpen your technical abilities, develop strong professional skills, and familiarize you on the technologies you will be working with in the field. As a Network Engineer, you will be working on client network infrastructure and security projects nationwide to help assess, design, implement, troubleshoot, and maintain network hardware and software to ensure a successful project completion.",30d+,www.glassdoor.com/partner/jobListing.htm?pos=121&ao=1110586&s=58&guid=000001846a0728a2a4e822751807e98a&src=GD_JOB_VIEW&t=SR&vt=w&cs=1_3be5fed1&cb=1668226232667&jobListingId=1006999512785&cpc=3BA4CE39D5B5DEF5&jrtk=3-0-1ghl0ea6mma7k801-1ghl0ea76i39u800-db3197afcfafcb33--6NYlbfkN0Bkb-ytiGCNOKS17COaSWVQYZB8PE4Lo8kSq62CWsDFcX3pF_m6JceOzw53zeUkPZwivSv6w9CASDk8NCEAaWZvOTqAGUoPV5i6dkkWIZrNby2CeP1xPa9sRQdlZADzMCbYKK29uQekfD1XRxGKScvwRSLNPz7kAZeyIItRppjfH557U0fdltYcCrIUej9SxITwuRpWDIo8LMMDAie0WOudF8PJQwYYq8R_V1DeTzCitAgeEgPeBSuWFy0P3G7kQjKp2RhS_3cALv8u8ubVvy4H5CE3EOudv-asy2OVQLg_PCu7R6ASwxATEtrFbs5W5U0MqB5PGcYh1CmJDzVyF6J62dKXsnR7hIWWczKiUowJkq6AtIpCPjfSt7CKZjpDnA3XAtELZpg9HIfVpX_HZz6bMlfiVhvhYeVREMECJokNPYVp3_zKhichSyXEC9TnKSayOG1qKU2XoZ67lE0W-6eTkzQiwU8x5Fuvn_pRGGaA9WF9bnPinfm9qgtmek6AkYAWeWt7Fhjezvxxj5hs2Xqs
"['Nuance', '4.1']",http://www.nuance.com/,Computer Vision and Machine Learning Engineer,"Boulder, CO",$120K - $180K (Employer est.),"Summary:
Help onboard life-saving AI solutions into Nuance's radiology AI platform. Be on the vanguard of a successful and rapidly expanding product line. We are detecting and prioritizing life-threating conditions, generating findings, and helping radiologists do more with artificial intelligence.
Your role will be to provide backend system configuration, troubleshooting, technical trainings and support for external AI developers and our internal sales teams. You will work on a team of 4-6 integration engineers who support each other to deliver an outstanding experience to our partners. The ideal candidate has both a technical and customer-facing skills. Prior experience in sales engineering, customer technical support, software development or technical account management would all be applicable to this role.
Principal Duties and Responsibilities:
Configure and validate AI service integration across the suite of Nuance radiology products",30d+,www.glassdoor.com/partner/jobListing.htm?pos=122&ao=1110586&s=58&guid=000001846a0728a2a4e822751807e98a&src=GD_JOB_VIEW&t=SR&vt=w&cs=1_ae7e8815&cb=1668226234650&jobListingId=1008142235537&cpc=3BA4CE39D5B5DEF5&jrtk=3-0-1ghl0ea6mma7k801-1ghl0ea76i39u800-b1335c231866c374--6NYlbfkN0Bzin9QUkjw5S3uZgWvqXu5YKbu1M0ccIXCVaLi4ulGCvcijf-Lq6oTjGex2m__F-L3V5pKvkA4Xnv9dUBpUmGpCu5pHbqdw0SqvnzgOm6rhLl8HcDMECi3MNd_uAR8YeXbtHHCsz9mX3D8cdtSJmdBogye4Pqj9VOgKeMu4OZkNVkbwJlioqafBTs81Ften7ulIKgPPbhRC5c0XqIcagdS6OGgGEh6E7ih2naRBZvMvrN3cqyLRIkCnNodD5RjgSnIKj9uh5oIfkpiSg8IEkIRm_-m7wKjlwWVdiNH2C9EzZ2S35Il4QnFqUs4Jq26IAk6sBPmVDY7-j3HMeE-h3rK7fjB28DJsZqYdi97VfCQkDEnDYUM-aiT2-r6LrmdVL2aNh-aFmUXUQ5Q-qzeUkVjLQcJ-kTReQuSrTj0b1e6d_2sinJyWbOWAEADhd3WikdvFSkHE_qLVJhAFW0bJi5FKu7xuD6J_mPqINHv7Qkwcg912_pLqbFAm8P_peO-UWEoCp8l5bZJaJgNe0FFasVI41cqKapl4B6nS1y8BdlKRlYocz7V2NCwrBChSevwCWRmhMLjVlb-ntGtjkiVucUMRBJUBKc2-4nmI2nJa5RecGczPXSzy6WURstSLTwtOFmJS3S6f_w4Z6lYCEiirfSh6VBfLr5mqCM%3D
"['Aston Technologies Inc.', '4.1']",https://www.astontech.com/,Computer Vision and Machine Learning Engineer,"Boulder, CO",$120K - $180K (Employer est.),"Project Start Bonus:
Earn a $2,000 bonus on your first paycheck on project after completing our in-house training curriculum. For a limited time. Ask for more details.
Job Description:
Aston Technologies is seeking talented individuals that are highly motivated and eager to launch their career in the IT industry. This role begins with an on-site training paid program with curriculum designed to test and sharpen your technical abilities, develop strong professional skills, and familiarize you on the technologies you will be working with in the field. As a Network Engineer, you will be working on client network infrastructure and security projects nationwide to help assess, design, implement, troubleshoot, and maintain network hardware and software to ensure a successful project completion.",30d+,www.glassdoor.com/partner/jobListing.htm?pos=123&ao=1110586&s=58&guid=000001846a0728a2a4e822751807e98a&src=GD_JOB_VIEW&t=SR&vt=w&cs=1_28f96092&cb=1668226236503&jobListingId=1006999512783&cpc=3BA4CE39D5B5DEF5&jrtk=3-0-1ghl0ea6mma7k801-1ghl0ea76i39u800-16a599bf4bcce49d--6NYlbfkN0Bkb-ytiGCNOKS17COaSWVQYZB8PE4Lo8kSq62CWsDFcX3pF_m6JceOzw53zeUkPZwivSv6w9CASAEXNbC1yEWrZOwNG0rJFtl0EXyrA5idXdA_0v_M4Mkg9Sj0bkLkiXh5w47S3cx0r42MUf1gaAKa1p8FGksV5AZSfxEiB4eC4RAnTDK9ynI2A_cNtOrv0PHqHXjDwEZng9t0exF099ZNe-vndZsLLplL5uIPDF9pBYQfbGeLHDz_P6Xi1SPdBZlN0YhQCuD0f2pwqB2eVeSxteA4lZkjXuLhdIMyJ96--3Ppv0z-QjGMW0eLIh9btgJcCCCTcdyqy9K-3H-OdUNY6nndq-t2S15GQMokyN-8YIzsI3kn68KJRhYSgoWGjNRM1kPBEnm4W9tHoEY5isfs3OHyYo7fP3mvvFqRKUsVqySMyAR-dD_yDm5EYTTUl-Imvb10Gm3-CDsGdX_Mr4pc-Z0YwiKIyMa3eUxN_QLZEB_YzKvkBwfZmZImxIgKttALBPGj_SaQnYUS7pnKtdhk
['OmniForce Solutions'],http://www.omniforcesolutions.com/,Computer Vision and Machine Learning Engineer,"Boulder, CO",$120K - $180K (Employer est.),"Our client is a leading technology and telecommunications company with remote opportunities nationwide. With 450,000 route fiber miles serving customers in more than 60 countries, they deliver the fastest, most secure global platform for applications and data to help businesses, government and communities deliver amazing experiences. If you are prepared to take the next step in your career, we want to talk with you!

Summary
Potential flexibility needed for the first 4 weeks due to pilot and ramp up rollout. This position will be responsible for the testing of layer 1 and layer 2, implementation of services at layer 1, 2, and occasionally 3, including private line services; Ethernet, Multi-Protocol Label Switching (MPLS), Virtual Private Network (VPN), Dedicated Internet Access (DIA), Voice, Security, Managed Services and Meraki Software-Defined Wide Area Network (SD-WAN) suite of products. Responsibilities will also include product and systems knowledge related to the activated services, technical validations, pre-testing, troubleshooting, activation and post activation with customers.",2d,
"['Bowman Williams', '4.0']",http://www.bowmanwilliams.com/,Computer Vision and Machine Learning Engineer,"Boulder, CO",$120K - $180K (Employer est.),"Managed Services System Engineer / Solutions Architect Description
We are seeking a new crucial member for our Engineering team to support our clients’ infrastructure. We are looking for an experienced Managed Services System Engineer / Solutions Architect who loves learning on the job and relishes the opportunity to be inventive about spearheading innovation in the systems and tools that run our infrastructure.
The ideal team member will dive into learning the existing systems and apply their extensive technical knowledge in Active Directory, systems management, cloud (Microsoft Azure & O365) and automation to maintain the existing infrastructure on a small collaborative team as well as constructively recommend and implement improvements.
We are looking for a high-level Managed Services System Engineer / Solutions Architect who wishes to take their career to the next level by joining our Engineering team. Our unique culture allows employees to grow and develop technically while working at a company that encourages creativity, mentoring, knowledge sharing, and inclusion.",2d,
"['Visron Technical LLC', '2.5']",http://www.visrontechnical.com/,Computer Vision and Machine Learning Engineer,"Boulder, CO",$120K - $180K (Employer est.),"Our client small publicly traded technology company who is looking for an experienced, technology professional to join a growing team with a focus on the company's growth initiatives. Your background and experience will be called upon to help forge the company's new technical direction and will be challenged with developing and managing the deliverables that will make that direction a reality. Although technical proficiency in specific areas is important, the ideal candidate is adaptable and multifaceted who relies more on their solid engineering foundation vs syntactical mastery of a specific skill.
In return you will be given extensive creative freedom in your solutions, the ability to influence the company's firmware platform, the ability to participate in the growth of the company, and better than average compensation (commensurate with experience).
Nature and Scope",24h,
"['Jones Networking', '4.4']",http://www.jonesnet.com/,Computer Vision and Machine Learning Engineer,"Boulder, CO",$120K - $180K (Employer est.),"Position Title: Front End Developer
Location: Baltimore, MD
Industry: Education
Front End Developer Summary:
Our client is seeking a Front End Developer (Software Engineer) who will be responsible for the creation, implementation, maintenance, performance, production support and documentation of various departmental and enterprise-wide application systems. This includes but is not limited to the installation, modification, and testing of new and/or upgraded applications (packages or home grown), operating systems, file structures, hardware, communication devices, and productivity tools. Applies analysis techniques and procedures to gather and then translate business requirements into functional/technical specifications and designs. Using functional specifications and designs, produces all or part of the deliverables. Maintains databases and application system code.",25d,
"['Insight Global', '3.9']",http://www.insightglobal.com/,Computer Vision and Machine Learning Engineer,"Boulder, CO",$120K - $180K (Employer est.),"*This is a permananet position*
Desired Skills and Experience *
* Bachelor's Degree in Computer Engineering or other related fields
* A minimum of ten (10) years' experience in building systems/algorithms in one of the following domains: computer vision, deep learning, or machine learning (an equivalent combination of education and experience may be considered for this role)
* Experience working with deep learning frameworks such as PyTorch, TensorFlow, MxNet, ONNX, and Caffe
* Experience in simulations and verification methodologies
* Experience with ISO 26262, DO-178C, or other safety-related software and product development processes
* Strong background in feature/object tracking, VSLAM, or pose estimation using both classical and ML approaches
* Expertise in developing solutions for embedded systems and SoCs, a plus for low latency edge AI on a constrained environment
* Familiarity with dependencies between performance of vision algorithms and image processors
* Strong Python and C/C++ implementation experience on safety-critical real-time systems
* Strong knowledge of low-level graphics programming (i.e. OpenCL, CUDA, GLSL)
* Proficiency with Git, Linux and embedded RTOS(s)
* Excellent verbal and written communication skills
* Proactive delivery of communication and follow up
* Excellent organizational skills and attention to detail
* Must have the ability to independently prioritize and accomplish work within time constraints
* Self-motivated and forward-thinking personality",1d,
"['UL Solutions', '3.3']",http://www.ul.com/,Computer Vision and Machine Learning Engineer,"Boulder, CO",$120K - $180K (Employer est.),"At UL, we develop industry-standard benchmarking software for PCs and mobile devices. Our benchmarks are used throughout the industry to measure, compare, and manage hardware performance. Leading technology companies, hundreds of press publications, and millions of people around the world rely on 3DMark, PCMark, and VRMark benchmarks to make fair and accurate hardware comparisons.
We are looking for a Graphics Software Engineer to grow our 3DMark team. You will play a key role in developing new benchmark tests for 3DMark - our flagship benchmarking application that is used by millions of gamers around the world.

This is an opportunity unlike any other. The work we do is aimed for technology and hardware that will not exist for some time, and you will have the opportunity to witness first-hand the first stages of everything new in the world of 3D graphics. The challenges this introduces are unique and fascinating.





C++, APIsC++, Virtual Reality, APIs",24h,www.glassdoor.com/partner/jobListing.htm?pos=129&ao=1110586&s=58&guid=000001846a0728a2a4e822751807e98a&src=GD_JOB_VIEW&t=SR&vt=w&cs=1_2c0e8c1d&cb=1668226256138&jobListingId=1008274175117&cpc=3BA4CE39D5B5DEF5&jrtk=3-0-1ghl0ea6mma7k801-1ghl0ea76i39u800-cc1fbf7483080654--6NYlbfkN0DG4ntHtB_rMsnfhgmnSvK2brktLme1L4SiDeJjQ-izrVOLqRJ5-yjE7k3D6lhaa88eQZhGY9mg9B_bvErV_n_T-GoaVaGei_lyDolR12uaTX0H3OppdR7s3xzHebXv01OOiCoAJxPw0X2XwraqT0e1_cZD8tqIL07GuvXSw-W7YJTsFHwm10dZkQzcW_yVJxTktG4dSkIvCtYwVeytfQxT6-UMnsrNpI0Zt0ETrMXqKF9yuMEMgiGQI8eSoVl6cmDp-Bhs3lpx_iXJxwLGaUJH6gIGfZbJi4b8fzrmTaXyViNU88eaAbNbZx6HEJE4GpWPLzi8VKaqmv7hu1ZtXF70bzuHvilY6IcFp4NaNgIsHvFYlMlQoTShMvoU7dfgc6faBmnJeSlltT-lPkIqGeO1MBYSMaL2L-3Ao5IJNgeLZTBV2PCm-21Qg1evRE2obTY8pYjTNuEZxHbJWSJ75iiF9Ij428WtMFZD8IAvk8oVzXLe28aOsfhTHokYirG0-mQJOV2Sylwh-qhiDrQ_iDqCYlqXsMd5gUPuCxGyZRhhGV8WAg9iHzorTBTZHWi4Jw_cboQWKDDxt_YvbWkD6AdBmYjgCy_ANrBUL7xURgaGzUdMSnXl8l66fx_BED7T3gopEYs0z67TmNoBMM1fjEhKMN6GOWhs9c7D-hDXrHPIOqOYjPIoGZf6GlKZwZmIFfuLhmn_HjeI9zJlp4dvgEhM8KaLbIkYnjg91Oeq8-S1yj2oK2k2qYit_ETnv1uDVeHztqCMvpiFSrsWTkU9Rq_cO4e0DISrJ-o4_P85lmHSRH0l9IlX-JMPUx3GXhCOkXcTsb763f5HWsvfP8vpPLB0MUDg6eIDGDhJ-3Ns0P7U_cDQGTTlw5aR_OLVaAZmgdftNF8D0xhs1DJZs6YkL4wLIYBkNwJdHsoLmz30L2ufyBlvoLPDrKA-hXbDUWhObiTQFsT9Yglxwx9Vylzxh_PayrA-oAsBMyIcJuIj4mcifhRFpb1PjopXI4wBJrYQSVersz3hBWPKnimo6NMWeK2NMZRFCLRWodIWamYtkO465Q%3D%3D
"['Michael Page', '4.2']",http://www.pagegroupltd.com/,Computer Vision and Machine Learning Engineer,"Boulder, CO",$120K - $180K (Employer est.),"Maintain physical and virtual servers, managed by Puppet.
Full lifecycle support for systems and applications.
Validate migrations for legacy applications to containers or newer versions.
Assist in optimizing AWS storage and report on costs.
Implement and test backup and recovery procedures for various systems.
Troubleshoot issues related to systems, storage, performance, and network.
Maintain servers including patching, and hardware replacement or upgrades.

MPI does not discriminate on the basis of race, color, religion, sex, sexual orientation, gender identity or expression, national origin, age, disability, veteran status, marital status, or based on an individual's status in any group or class protected by applicable federal, state or local law. MPI encourages applications from minorities, women, the disabled, protected veterans and all other qualified applicants.",30d+,www.glassdoor.com/partner/jobListing.htm?pos=130&ao=1110586&s=58&guid=000001846a0728a2a4e822751807e98a&src=GD_JOB_VIEW&t=SR&vt=w&cs=1_91891f95&cb=1668226258956&jobListingId=1007926545669&cpc=3BA4CE39D5B5DEF5&jrtk=3-0-1ghl0ea6mma7k801-1ghl0ea76i39u800-a055902c2ab5a081--6NYlbfkN0BR3ykMnr3Vw97HK5IC0i9Uo32NXohanwqRY-CI8z69bl4xOa6Yve6w6NlWd53uNOeyLRcSpUKsBgHYVBX5e9txByoQ3R_ejCy-a-kt8sFvJjBomNvxN-eTBfoS3jkZDcqKdtu2hZo25HEug4Fifnfkwd-bQQUzDhuc4JAzUfS0OKNirRPtpY4xOQvuI0ssjTjoEO2hqMsT9BnH61-m8SOVF5SmIo5uuHl7472Fqa_fhtCK2wfVfon3BnpOMIELP-zTUSbIyyoyzaKYaSmJB_FuJPv5QR5nylyBcyQ-gttTx7_tr8A-O0fiZqUYtvPzbgW--IGEI_Z5nPSmkUarjOJGvqQN7iep8YDtVci_tHYp47K30Sp-QlGPdvM13MWTvav6EwHycNK4FQV2-7YkRX_o4ICcDGbOpiiShr_RxZCEj6A3RPsNgqb13G1bujZikAb4gGChboGCCRjqj5Ik_GXHmZ_M3oR-0wseS-Ss2pM22xDz1N9RIXBcif86LDz4HIthFZ2I5WZCrbrWwafCha4CjNsOCg3uo6KT0DwQr2eHq9hoap3InGG0pte6OK0r7BWa--9uSQjGbQQDJHgOthaw3TNBYd11pHELDCTj2VfpPiJbxoUgEnIn74cSelFNzTnfMFo-k20MOlDrVvum4sQMzD4C4MdW7dgDOaT1Bd0RecG61qsukSMJg9pUjAT0xsy4Lona3D1v2xR0Gtl93ofFtLeGX_5QWwEK9XPgCrwipcXWzY_E8Mv9kAeimnNtFw7mht0saVa03cvkqFFlASNrniS3r-Upr8aT3t3KHP0XbCSsh5IKVSUJV4kc46X9wR9fLugsP4QC1uiT3Iq70iH77BXFCR4oZjiD83eHBW-v2sTEjV8yR3jb4sQoLEksx1v0A7kRNAMnLjIkGIvT1rpfhwJqKn8LDGQsxXe6XepDfYWQgW9KquOtah76eSMqJW3cvHi1OapFTCH4hCpa3Lb5YbGMmLU3Y-KXyp4v7mwyrVcKpZmK3UfO5YDo2YU7vhFavn7TC32ET486jR8hUcDDIrXtJcXBTwwZDHbK7CfRrnv3zmtXR38ND4Sk5q3lxEyapFgqUfnhmA%3D%3D
"['CrowdStrike', '4.3']",http://www.crowdstrike.com/careers,"Engineering Program Manager, Detections Platform (Remote)",Remote,$120K - $190K (Employer est.),"#WeAreCrowdStrike and our mission is to stop breaches. As a global leader in cybersecurity, our team changed the game. Since our inception, our market leading cloud-native platform has offered unparalleled protection against the most sophisticated cyberattacks. We’re looking for people with limitless passion, a relentless focus on innovation and a fanatical commitment to the customer to join us in shaping the future of cybersecurity. Consistently recognized as a top workplace, CrowdStrike is committed to cultivating an inclusive, remote-first culture that offers people the autonomy and flexibility to balance the needs of work and life while taking their career to the next level. Interested in working for a company that sets the standard and leads with integrity? Join us on a mission that matters - one team, one fight.
About the Role:
As a Program Manager, you’ll be responsible for supporting Detections Platform whose mission is to support the CrowdStrike technology stack with security and detection-related services and components, ensuring the continuous evolution of our world-class Falcon product. Your primary focus will entail driving the scheduling, scoping and execution of projects for the teams, working directly with the Engineering Developers, the Product Managers, Dev Managers and Executive Leadership in order to ensure timely delivery against the roadmap. You’ll work closely across functional teams (UX, Cloud, Sensor) to collaborate and ensure dependencies are well known, critical issues are identified and driven to resolution.
CrowdStrike, Inc. is committed to fair and equitable compensation practices. For applicants in Ithaca - NY, New Jersey City - NJ, and Colorado, the salary range is $120,000 - $190,000 per year + bonus + equity + benefits. A candidate’s salary is determined by various factors including, but not limited to, relevant work experience, skills, and certifications. The salary range may differ in other states.",22d,www.glassdoor.com/partner/jobListing.htm?pos=101&ao=1136043&s=58&guid=000001846a08a1359c52b935df8ca6d3&src=GD_JOB_VIEW&t=SR&vt=w&cs=1_45006744&cb=1668226281394&jobListingId=1008221683807&jrtk=3-0-1ghl0h8bnkclu801-1ghl0h8c9im92800-62da88db059a4690-
