Company_Name,Company_Link,Title,Location,Estimated_Salary,Job_Description,Job_Age,Application_Link
"['IDEMIA', '3.8']",http://www.idemia.com/,Network Project Manager - II,"Cary, NC",$64K - $94K (Glassdoor est.),"Overview: IDEMIA is the global leader in identity and security. Our mission is to create a safe and simple future where identity verification is indisputable, and only you can assert your identity. We are a distributed company leveraging the latest technologies to deliver world-class products in the private and public sectors of finance, telecom, identity, security, retail, sports entertainment, commercial, government, and IoT. We use a variety of technologies and approaches to deliver quality product and services to government agencies and technology companies. IDEMIA is a made up of a group of 14,000 diverse people from different nationalities, speaking over 20 different languages. Together, our solutions impact the everyday lives of citizens and nations. In this ever-changing world, protecting your identity is paramount. Join the team that is ensuring one person- one identity. Responsibilities:
Collaborate with IT and client to manage capacity
Manage and influence stakeholders
Qualifications:",30d+,www.glassdoor.com/partner/jobListing.htm?pos=111&ao=1136043&s=58&guid=000001846a01f4009bb826e49577cc3a&src=GD_JOB_VIEW&t=SR&vt=w&cs=1_0b0b2016&cb=1668225861782&jobListingId=1008064267748&jrtk=3-0-1ghl03t1ujm7e801-1ghl03t2fi9iu800-2b01c9f3f8cf6ba8-
"['Susan G. Komen', '4.3']",http://www.komen.org/,Network Project Manager - II,"Cary, NC",$64K - $94K (Glassdoor est.),"Remote Product Strategist - Experiential Programs
Regular Full-Time
ID: 2262
Apply: https://workforcenow.adp.com/mascsr/default/mdf/recruitment/recruitment.html?cid=faa94825-da86-4895-b462-ba62627d3e78&ccId=19000101_000001&jobId=463795&source=CC2&lang=en_US
About Susan G. Komen
Susan G. Komen brings a 100% virtual working environment, and you can work anywhere within the U.S. We are a force united by a promise to end breast cancer forever. For over 30 years, we've led the way funding groundbreaking research, community health initiatives and advocacy programs in local communities across the U.S. and in more than 30 countries. Susan G. Komen is the ONLY organization that addresses breast cancer on multiple fronts such as research, community health, global outreach and public policy initiatives in order to make the biggest impact against this disease.",7d,
"['IDEMIA', '3.8']",http://www.idemia.com/,Network Project Manager - II,"Cary, NC",$64K - $94K (Glassdoor est.),"Overview: IDEMIA is the global leader in identity and security. Our mission is to create a safe and simple future where identity verification is indisputable, and only you can assert your identity. We are a distributed company leveraging the latest technologies to deliver world-class products in the private and public sectors of finance, telecom, identity, security, retail, sports entertainment, commercial, government, and IoT. We use a variety of technologies and approaches to deliver quality product and services to government agencies and technology companies. IDEMIA is a made up of a group of 14,000 diverse people from different nationalities, speaking over 20 different languages. Together, our solutions impact the everyday lives of citizens and nations. In this ever-changing world, protecting your identity is paramount. Join the team that is ensuring one person- one identity. Responsibilities:
Provide project management, cross-functional coordination, and inter/intra team communications to deliver outstanding program outcomes.
Lead requirements and early-stage concept development for technical projects and effectively transition concepts to engineering teams for development.
Qualifications:",8d,www.glassdoor.com/partner/jobListing.htm?pos=113&ao=1136043&s=58&guid=000001846a01f4009bb826e49577cc3a&src=GD_JOB_VIEW&t=SR&vt=w&cs=1_0ed053c0&cb=1668225868577&jobListingId=1008254487017&jrtk=3-0-1ghl03t1ujm7e801-1ghl03t2fi9iu800-193b2ae11e311714-
"['ImageX', '4.9']",http://www.imagexmedia.com/,Network Project Manager - II,"Cary, NC",$64K - $94K (Glassdoor est.),"ImageX has an immediate opportunity for a talented Marketing Operations Manager to join our team. At ImageX, you’ll work on exciting and challenging projects in a hybrid Agile environment where innovation and learning are prized and everyone’s voice is heard. Your colleagues are passionate about web design and development and advocates of open-source and delivering excellence.

This is a full-time position with a competitive compensation package; and plenty of opportunities to grow with an industry-leading web development agency that values people and work/life balance.

While we do still have a physical office located in beautiful Vancouver, BC we believe that adapting to the growing demand for flexibility in how and where we work should be paramount. As such, we are a distributed workforce that works predominantly remotely and embraces opportunities throughout the year for co-working days and retreats.",4d,
"['GSK', '4.0']",http://www.gsk.com/,Network Project Manager - II,"Cary, NC",$64K - $94K (Glassdoor est.),"Site Name: USA - Maryland - Rockville
Posted Date: Nov 10 2022

The Production Specialist Associate is an integral position for our Production Organization. The Associate reports directory to the Investigative Specialist Manager. The Associate manages cross-functional deviation investigations and corrective and preventative actions. This position is responsible for ensuring thorough investigations that lead to effective CAPAs while ensuring on-time closure for product lot release.
This role will provide YOU the opportunity to lead key activities to progress YOUR career. These responsibilities include some of the following:
Leads investigations into environmental monitoring excursions within the facility.",2d,www.glassdoor.com/partner/jobListing.htm?pos=115&ao=1136043&s=58&guid=000001846a01f4009bb826e49577cc3a&src=GD_JOB_VIEW&t=SR&vt=w&cs=1_8c4c72eb&cb=1668225872412&jobListingId=1008269816344&jrtk=3-0-1ghl03t1ujm7e801-1ghl03t2fi9iu800-ffca67d31d85a9a2-
"['Procter & Gamble', '4.2']",http://www.pg.com/,Network Project Manager - II,"Cary, NC",$64K - $94K (Glassdoor est.),"P&G is the largest consumer packaged goods company in the world. We have operations in over 75 countries, with 65 trusted brands that improve lives for 5 billion consumers worldwide. This brings many advantages, including the opportunity for our employees to enjoy a diverse and rewarding lifelong career filled with new and exciting challenges.
We are currently looking for a passionate and technically savvy individual to join our P&G Product Supply (PS) Technical Systems Group (TSG) as a Project Manager in our Fabric Care plant located in beautiful Central Louisiana. P&G’s Alexandria Plant is in Pineville, LA and is the 3rd largest plant globally.
We commit not only to driving value to the business but promoting an attentive safety and quality culture with a commitment of nothing we do is worth getting hurt and ensure we are positively impacting our customers and consumers 1st and 2nd moments of truth.",30d+,www.glassdoor.com/partner/jobListing.htm?pos=116&ao=1136043&s=58&guid=000001846a01f4009bb826e49577cc3a&src=GD_JOB_VIEW&t=SR&vt=w&cs=1_6dd68d1c&cb=1668225874322&jobListingId=1007807355186&jrtk=3-0-1ghl03t1ujm7e801-1ghl03t2fi9iu800-a95203b2d4b08a28-
"['United Talent Agency (UTA)', '3.9']",http://www.unitedtalent.com/,Network Project Manager - II,"Cary, NC",$64K - $94K (Glassdoor est.),"UTA’s agents and clients help shape entertainment and culture and this Manager role in UTA’s Corporate Communications supports the company’s many divisions, including television, film, audio, esports, digital, music, sports, news, publishing, Web3, theater, marketing, and more. The role encompasses all aspects of communications, including media relations, writing, panels, event publicity, working collaboratively with internal communications and media production, and more. Because the role touches all elements of the entertainment ecosystem, it requires someone who can be both a generalist and a specialist depending on the situation. The pace is fast, relationships with colleagues and press are essential, and attention to detail is vital.
You should be a strategic, creative, collaborative, and detail-oriented communications professional with a background in and passion for the entertainment industry.
The Manager role is based in Beverly Hills and will report to UTA’s VP’s of Communications based in Beverly Hills and New York.
What You’ll Do",2d,www.glassdoor.com/partner/jobListing.htm?pos=117&ao=1136043&s=58&guid=000001846a01f4009bb826e49577cc3a&src=GD_JOB_VIEW&t=SR&vt=w&cs=1_39533bf4&cb=1668225877190&jobListingId=1008269035547&jrtk=3-0-1ghl03t1ujm7e801-1ghl03t2fi9iu800-eae4c08e6e8d0a98-
"['Amplifon USA', '3.8']",http://www.amplifon.com/en,Network Project Manager - II,"Cary, NC",$64K - $94K (Glassdoor est.),"Role Overview:
Amplifon Americas, a world leader in hearing care, has a strong demand for diverse, authentic, creative, and dynamic talent for a IT Project Manager role. We are looking for an individual who is forward thinking to help us strive towards everyday excellence while focusing on customer devotion and personal impact to ensure we are acting responsibly in everything we do.
As the IT Project Manager, you’ll lead technical projects from start to finish and engage with global stakeholders to ensure success. You’ll also be a crucial partner supporting innovative technology and keeping Amplifon cutting edge as we focus on the customer journey.
Success Criteria:
A successful candidate needs to strike a balance between the “art” and “science” of project management. Strong leadership skills like communication and vision are critical as you look at the viability of new technology long term. Detailed knowledge of technology, strong analysis skills, and the ability to be immersed into the business process are also paramount to implement the project. The best part? You get to flex your skills in both.",24h,www.glassdoor.com/partner/jobListing.htm?pos=118&ao=1136043&s=58&guid=000001846a01f4009bb826e49577cc3a&src=GD_JOB_VIEW&t=SR&vt=w&cs=1_952a745f&cb=1668225880196&jobListingId=1008273497045&jrtk=3-0-1ghl03t1ujm7e801-1ghl03t2fi9iu800-d3def4f98a58b26c-
"['Paramount', '3.9']",http://www.paramount.com/,Network Project Manager - II,"Cary, NC",$64K - $94K (Glassdoor est.),"Paramount Global (NASDAQ: PARA, PARAA) is a leading global media and entertainment company that creates premium content and experiences for audiences worldwide. Driven by iconic studios, networks and streaming services, Paramount's portfolio of consumer brands includes CBS, Showtime Networks, Paramount Pictures, Nickelodeon, MTV, Comedy Central, BET, Paramount+, Pluto TV and Simon & Schuster, among others. Paramount delivers the largest share of the U.S. television audience and boasts one of the industry's most important and extensive libraries of TV and film titles. In addition to offering innovative streaming services and digital video products, the company provides powerful capabilities in production, distribution and advertising solutions.

Overview and Responsibilities

The Paramount Technology department supports our global content company through the delivery of a high-quality viewing experience, system infrastructure support, and creating innovative ways for our employees to collaborate. If you are interested in a strategy that has growth, transformation, and ongoing innovation where you can help “reinvent the broadcasting wheel” Paramount Tech has a role for you…


Paramount Tech is hiring a Senior Application Manager for the ServiceNow platform spanning ITSM, ITOM, ITAM, ITBM, Custom Applications Development, Core Platform, HR Service Delivery, Security Management...
This position is responsible for ensuring that the End Users of Paramount Global are well supported on the ServiceNow platform and be a subject matter expert on all business and system processes using the platform with a thorough understanding of ITIL/ITSM processes and have a solid technical background. The candidate will be part of a team that bridges the gap between the Business Partners (IT and Non-IT), requirements and the Applications Development team responsible for building and maintaining ServiceNow.




Paramount is an equal opportunity employer (EOE) including disability/vet.

At Paramount, the spirit of inclusion feeds into everything that we do, on-screen and off. From the programming and movies, we create to employee benefits/programs and social impact outreach initiatives, we believe that opportunity, access, resources and rewards should be available to and for the benefit of all. Paramount is proud to be an equal opportunity workplace and is an affirmative action employer. We are committed to equal employment opportunity regardless of race, color, ethnicity, ancestry, religion, creed, sex, national origin, sexual orientation, age, citizenship status, marital status, disability, gender identity, gender expression, and Veteran status.

If you are a qualified individual with a disability or a disabled veteran, you may request a reasonable accommodation if you are unable or limited in your ability to use or access www.viacbs.com/careers as a result of your disability. You can request reasonable accommodations by calling 212.846.5500 or by sending an email to viacomaccommodations@viacom.com. Only messages left for this purpose will be returned.",13d,www.glassdoor.com/partner/jobListing.htm?pos=119&ao=1136043&s=58&guid=000001846a01f4009bb826e49577cc3a&src=GD_JOB_VIEW&t=SR&vt=w&cs=1_ed478b09&cb=1668225882048&jobListingId=1008242587234&jrtk=3-0-1ghl03t1ujm7e801-1ghl03t2fi9iu800-a1593e27ee817581-
"['Paramount', '3.9']",http://www.paramount.com/,Network Project Manager - II,"Cary, NC",$64K - $94K (Glassdoor est.),"Hiring Salary Range: $135,000.00 - 150,000.00

Paramount Global (NASDAQ: PARA, PARAA) is a leading global media and entertainment company that creates premium content and experiences for audiences worldwide. Driven by iconic studios, networks and streaming services, Paramount's portfolio of consumer brands includes CBS, Showtime Networks, Paramount Pictures, Nickelodeon, MTV, Comedy Central, BET, Paramount+, Pluto TV and Simon & Schuster, among others. Paramount delivers the largest share of the U.S. television audience and boasts one of the industry's most important and extensive libraries of TV and film titles. In addition to offering innovative streaming services and digital video products, the company provides powerful capabilities in production, distribution and advertising solutions. Overview & Responsibilities

We at Paramount Global are hiring a Technical Delivery Manager (TDM) for the End User Technology & Experience (EUT) Group within Technology! The EUT Team focuses on delivering engaging and intuitive experiences to boost efficiency, partnership, transformation, and engagement at enterprise scale, while making sure adoption and change management provide continued improvements. By leading the delivery of numerous projects, the TDM is ultimately responsible for acting as a Scrum Master for multiple work streams to make sure all the different processes across the Software Development Lifecycle are being followed. You will own and drive the process across a cross-functional team!
Responsibilities

Working with Product Owners and making sure a balanced backlog and sprints are being maintained. At the same time, assuring all user-stories and epics are aligned in JIRA, and are then groomed by the Product Owner and the Technical Architect on the project.
Make sure Product & Engineering are aware of blockers, bug status, and releases.
Performing sprint rituals with all the teams involved in delivery, globally. Unblock dev teams on a regular basis by including the right people. Plan for QA, UAT (User Acceptance Testing), and Prod releases by sharing game plans.
Planning & collaboration across different app teams to handle technical dependencies of the solution.
Present program and project level status updates for different partners, including Scrum reports. Present release notes as items move to production for team awareness.
Highlight and plan upskilling requirements for the project/program team while handling risks related to technical delivery.
Planning for maintenance and updating of multiple environments, like Dev, QA, Stage and Production.
Orchestrate onboarding of new teammates at various positions (e.g., Dev, Team Lead, QA, and architects).
Build high level strategy for the Engineering group based on the current capacity and different initiatives in flight.
Coordinate with other teams across the business and various technology owners of different platforms.
Collaborate with vendors to ensure their resources are meeting development and QA deliverables across multiple workstreams, platforms, and roadmaps.
Basic Qualifications

Minimum 5 - 7 years of experience as a Delivery Manager and possess a Bachelor's degree in Computer Science, Engineering, or a similar domain.
Proficient communicator; can generate reports and updates for various partners with different technical skill levels. Need to have a deep understanding of Agile methodology and Project Management skills.
Technical understanding of collaborative platforms (O365, SharePoint, Teams, Power Automate), web development, and SaaS (Software as a Service) platforms.
Efficiency with Project Management tools like JIRA, Excel, Office Project, Asana, and Lucid charts.
Additional Qualifications

Familiarity with ServiceNow and Web content management.
Exposure to website migration via different platforms and tenants of Office 365.

#LI-IT
Paramount is an equal opportunity employer (EOE) including disability/vet.

At Paramount, the spirit of inclusion feeds into everything that we do, on-screen and off. From the programming and movies we create to employee benefits/programs and social impact outreach initiatives, we believe that opportunity, access, resources and rewards should be available to and for the benefit of all. Paramount is proud to be an equal opportunity workplace and is an affirmative action employer. We are committed to equal employment opportunity regardless of race, color, ethnicity, ancestry, religion, creed, sex, national origin, sexual orientation, age, citizenship status, marital status, disability, gender identity, gender expression, and Veteran status.

If you are a qualified individual with a disability or a disabled veteran, you may request a reasonable accommodation if you are unable or limited in your ability to use or access. https://www.paramount.com/careers as a result of your disability. You can request reasonable accommodations by calling 212.846.5500 or by sending an email to viacomaccommodations@viacom.com. Only messages left for this purpose will be returned.

ADDITIONAL INFORMATION
The hiring salary range for this position applies to New York City, California, Colorado, Washington state, and most other geographies. Starting pay for the successful applicant depends on a variety of job-related factors, including but not limited to geographic location, market demands, experience, training, and education. The benefits available for this position include medical, dental, vision, 401(k) plan, life insurance coverage, disability benefits, tuition assistance program and PTO or, if applicable, as otherwise dictated by the appropriate Collective Bargaining Agreement.",29d,www.glassdoor.com/partner/jobListing.htm?pos=120&ao=1136043&s=58&guid=000001846a01f4009bb826e49577cc3a&src=GD_JOB_VIEW&t=SR&vt=w&cs=1_14594b29&cb=1668225884881&jobListingId=1008205136520&jrtk=3-0-1ghl03t1ujm7e801-1ghl03t2fi9iu800-2c82b22720005629-
"['GSK', '4.0']",http://www.gsk.com/,Network Project Manager - II,"Cary, NC",$64K - $94K (Glassdoor est.),"Site Name: USA - Pennsylvania - Upper Providence
Posted Date: Oct 19 2022

The Global HCP/EE Hub is formed through several Regional Operations Centers and is an integral part of Commercial Practices with the objective to lead and provide HCP and External Expert Engagement subject matter expertise, supporting the delivery of Promotional and Non-Promotional external engagement programs. The Engagement Specialist is responsible for fulfilling the engagement process as part of the enterprise operational service hub model ensuring that GSK BioPharma (Pharma and Vaccines Business and R&D) engages HCPs and External Experts (EE) for cross border and within country activities (e.g. Speaker programs, Advisory boards, consultancies) efficiently and in compliance to all relevant global legal and regulatory requirements for contracting, payment and financial disclosure. Key Responsibilities",23d,www.glassdoor.com/partner/jobListing.htm?pos=121&ao=1136043&s=58&guid=000001846a01f4009bb826e49577cc3a&src=GD_JOB_VIEW&t=SR&vt=w&cs=1_7bda365a&cb=1668225888756&jobListingId=1008219769846&jrtk=3-0-1ghl03t1ujm7e801-1ghl03t2fi9iu800-26f937b25f3da5a1-
"['GSK', '4.0']",http://www.gsk.com/,Network Project Manager - II,"Cary, NC",$64K - $94K (Glassdoor est.),"Site Name: USA - Pennsylvania - King of Prussia
Posted Date: Nov 8 2022

We make and supply medicines and vaccines all around the globe and our teams own every production stage, from creating quality products at our manufacturing sites to designing effective supply forecasting and regulatory inspections; all powered by digital, data and analytics. We operate at impressive scale, producing over 1.7 billion packs of medicine and 767 vaccine doses in 2021.
We continue to modernize, so we can launch even more new products at speed whilst turbo-charging delivery across our entire portfolio through our relentless focus on quality, safety, and service. The way we work will change. For some, the shift in technology and products will be revolutionary. Our R&D pipeline demands a new kind of supply chain, and we need the very best minds and capability to help us on our journey to make more complex products, harnessing the power of automation and robotics so we can work smarter together.",3d,www.glassdoor.com/partner/jobListing.htm?pos=122&ao=1136043&s=58&guid=000001846a01f4009bb826e49577cc3a&src=GD_JOB_VIEW&t=SR&vt=w&cs=1_cc7b08dc&cb=1668225892604&jobListingId=1008266916991&jrtk=3-0-1ghl03t1ujm7e801-1ghl03t2fi9iu800-d5a0e0681b4a3380-
"['Rockwell Automation', '3.9']",http://www.rockwellautomation.com/,Network Project Manager - II,"Cary, NC",$64K - $94K (Glassdoor est.),"Rockwell Automation is a global technology leader focused on helping the world’s manufacturers be more productive, sustainable, and agile. With more than 25,000 employees who make the world better every day, we know we have something special. Behind our customers - amazing companies that help feed the world, provide life-saving medicine on a global scale, and focus on clean water and green mobility - our people are energized problem solvers that take pride in how the work we do changes the world for the better.
We welcome all makers, forward thinkers, and problem solvers who are looking for a place to do their best work. And if that’s you we would love to have you join us!
Job Description
In this role, you will follow a systematic approach to collaborate with cross functional teams to define, co-create, develop, and deliver content and competence development programs focused on customer business outcomes delivered by our solutions and the value our customer realized from consuming our services.",4d,www.glassdoor.com/partner/jobListing.htm?pos=123&ao=1136043&s=58&guid=000001846a01f4009bb826e49577cc3a&src=GD_JOB_VIEW&t=SR&vt=w&cs=1_c50b26cf&cb=1668225894487&jobListingId=1008263779292&jrtk=3-0-1ghl03t1ujm7e801-1ghl03t2fi9iu800-d8c8503047e78e86-
"['GSK', '4.0']",http://www.gsk.com/,Network Project Manager - II,"Cary, NC",$64K - $94K (Glassdoor est.),"Site Name: USA - Pennsylvania - King of Prussia
Posted Date: Oct 10 2022

We make and supply medicines and vaccines all around the globe and our teams own every production stage, from creating quality products at our manufacturing sites to designing effective supply forecasting and regulatory inspections; all powered by digital, data and analytics. We operate at impressive scale, producing over 1.7 billion packs of medicine and 767 vaccine doses in 2021.
We continue to modernize, so we can launch even more new products at speed whilst turbo-charging delivery across our entire portfolio through our relentless focus on quality, safety, and service. The way we work will change. For some, the shift in technology and products will be revolutionary. Our R&D pipeline demands a new kind of supply chain, and we need the very best minds and capability to help us on our journey to make more complex products, harnessing the power of automation and robotics so we can work smarter together.",30d+,www.glassdoor.com/partner/jobListing.htm?pos=124&ao=1136043&s=58&guid=000001846a01f4009bb826e49577cc3a&src=GD_JOB_VIEW&t=SR&vt=w&cs=1_610af4c5&cb=1668225898772&jobListingId=1008197817318&jrtk=3-0-1ghl03t1ujm7e801-1ghl03t2fi9iu800-0cb5b3ab83d75b07-
