Company_Name,Company_Link,Title,Location,Estimated_Salary,Job_Description,Job_Age,Application_Link
"['Zenith Electronics, LLC', '3.3']",http://www.zenith.com/,Software Developer (Engineer) I **Hybrid Work Schedule**,"Saint Louis, MO",$46K - $71K (Glassdoor est.),"Company:
Zenith Electronics, LLC (LGEZE)
Job Function:
Other
Company Background
At LG we make products and services that make lives better, easier, and happier through increased functionality and fun. Put simply, we offer the latest innovations to make “Life Good” – from home appliances, consumer electronics, vehicle components, and mobile communications to business innovations in digital signage, air conditioning, solar, and LED lighting. As a global leader, we strive for greatness in product leadership, market leadership, and people leadership to realize our growth strategies.
We offer an environment that enables colleagues to demonstrate their capabilities, focus on their work, and create value. At LG, you're encouraged to take a creative and individual approach to challenges with strong emphasis placed on performance and skill—and equal, merit-based opportunities across the board. We want our colleagues to grow with our global business. That's why we deliver sure rewards for exceptional performance and offer industry-leading benefits including 100% company paid premium medical, dental, and vision benefits, an employer matching 401K, eleven paid holidays per year, and paid-time off; Come join the team!",30d+,www.glassdoor.com/partner/jobListing.htm?pos=104&ao=1110586&s=58&guid=000001846a89c6c1ac31ba9dad85f78f&src=GD_JOB_VIEW&t=SR&vt=w&cs=1_08b8a1c4&cb=1668234743877&jobListingId=1007963386444&cpc=3BA4CE39D5B5DEF5&jrtk=3-0-1ghl8jhncma71801-1ghl8jho0jc8g800-79855487615fe61b--6NYlbfkN0A9atWhvSYGDXYsuIFniFeMUfyhfiKb1gamun_MyY1nlold7GTuQPjQR8xaSdlZCsOiLdLKzNL8AS0Whs_2Qfug0PzRPOVwSMeoZFRBFxxlcu5OlxvTfzh57DmlRO_OcS8h3SPNJ5Sn4GIEvH7Nchdn56xb1EQEDuNMEau372HM5q1mXLLTMPedByW5hjgOzuKhFZvt_zIIle_FfwcjHHWRNktgZc3g_lbrL3Po-ah0TK2pMRdrcu08bmcIQVL3Lt06vp8GCn3RdcII4X1fscxxhOMsAval98iZZLg8NorCim5E-aEoh555xrvDflxEpzSJjLUCkGB8LXxy79GDLASnwWIwrBRrGPPnO1vHPGtCdA0pKHikU5zS4VigcTjAK0V2BZJt0BX83Y2Io3Rl588njdZ06UJafQFePdgD308biOwPPbHWEe_sLCLUlzN6VS_R2beJeg0iQvw6U8sFVHiFnqv7ZSTEoAsgiNXZ5t4rrkLRmfCelc0BYFdAjp-uID_V_lKeBSCl-oaBAzc2cVXoaARu3A8wrV_1N78Z8Ai1Gi2R0A-dm5BJnJXN_P-rm1sNyY8hZGekgXxVAzPuNy0S
"['ikeGPS', '3.6']",http://www.ikegps.com/,Software Developer (Engineer) I **Hybrid Work Schedule**,"Saint Louis, MO",$46K - $71K (Glassdoor est.),"Location: Broomfield, Colorado (in-office role)
Salary: Estimated annual compensation will be $55,000 – $60,000 flexible based on relevant experience. This is a full-time opportunity that offers full benefits.
Applicants for this position must be eligible to work in the United States. We are not looking for contract (C2C) hires at this time.

Why ikeGPS?
Comprehensive benefits package that includes medical, dental, vision, 401K + match, 3 weeks starting Paid Time Off (PTO), and generous parental leave",30d+,
"['CorTech', '4.5']",http://www.cor-tech.net/,Software Developer (Engineer) I **Hybrid Work Schedule**,"Saint Louis, MO",$46K - $71K (Glassdoor est.),"Work Experience Requirement
1-2 years work experience preferably in maintaining an inventory custody and control program or similar tightly controlled environment.
Experience or knowledge in product hardware engineering development cycle for mobile electronics. Experience in Excel, SalesForce, PowerPoint, MS Word, and data modelling.

Education Requirement
Bachelor’s degree or equivalent experience is strongly preferred.

Key Words

Additional Requirements

Top 5 Required Skills
1. Teachable
a. Ability to receive and act on direction
b. Desire to learn and act on their own

2. Good communicator
a. Active listening
b. Ability to communicate with technical engineers, external customers
c. Friendly and positive

3. Organized
a. Tracking physical assets
b. Tasks prioritization

4. Computer proficiency
a. Uses Excel as a tool to perform data analysis, reports, audits, etc.
b. Uses Outlook as a tool to organize, communicate and respond to actionable items

5. Self-motivated
a. Seeks work on their own
b. Manages up (actively reports on accomplishments and struggles)

Physical Requirements

Job Description Overview",3d,www.glassdoor.com/partner/jobListing.htm?pos=106&ao=1110586&s=58&guid=000001846a89c6c1ac31ba9dad85f78f&src=GD_JOB_VIEW&t=SR&vt=w&cs=1_d2cfb761&cb=1668234750264&jobListingId=1008266114143&cpc=3BA4CE39D5B5DEF5&jrtk=3-0-1ghl8jhncma71801-1ghl8jho0jc8g800-3659827cf456b3fa--6NYlbfkN0ATCZlh4at3dJuJ3v9QYE_c1VOYF6jG6qQshNoY64OlFFfJ6Ge9uDdKmuFe2enCwz4XCU3uWyt6iycP5mhMxLx6ekJB8ASpIHxMQkOqoHmI4zzvGxOyDYAk8Taec8hNlR8y0Xmmz204v4JnESqD-AcBZ3csuTx8rhVWWRvNs-q2YgxK-tajUPFRoYZzEM2M5SxKvr9i6KWCJh7WzPpnDrAX6B9FlfZag0ueyjiBDFzhOZrEDufeqQvjadSHIerZK402pSTNZpMQRCmbd1fhGBEGqPip-DPdxAfLh_yKEnYc17fS7a5aKTxm04Av5lFX94IqSMeBiPKPvJah638rTnQMlGIZhzEpBsrCjJoehM3FpX0wWYLcQ3NIQwoDVfFxLZ-JvsWV9zaGYb7V3ixq5vy3sMW1f4up_7rAYdzNTJsXihyEGsGBKwIHcACRAQ8Tq2QET-sDz26ECFRbOHyJe2uWpzRLGjftStgSg4WBNLWHcnOZo5UQUTZcBjUUYmfaolW5xn6XaP3HmPt6l7XjYmDpPIXjxa8o_NjqnRXnz8k1UFp0G-qPLSKs4rCZJNWVZwSPyQhd_vywNC5xjACgWsG1pOvQC4I92zI%3D
"['BigCommerce', '4.0']",http://www.bigcommerce.com/,Software Developer (Engineer) I **Hybrid Work Schedule**,"Saint Louis, MO",$46K - $71K (Glassdoor est.),"BigCommerce's mission is to help merchants sell more at every stage of growth, from small startups, to mid-market businesses to large enterprises. We focus on being the best ecommerce platform so our customers can focus on what matters most: growing their businesses.
We are equally passionate about growing our employee's careers and providing them an incredible experience as we rapidly expand across the globe. We are proud to have been recognized numerous times for our product and workplace culture. We empower our people and customers to build, innovate and grow, so together we can redefine the ecommerce industry.
We are looking for a driven Helpdesk Service Engineer I to join our IT team to ensure that core IT operations are supported, maintained, and constantly improving. As a key member of our team, you will work with our IT Administrators & Infrastructure teams, and Key Stakeholders to provide world-class Desktop Support for our Austin HQ office.",3d,
"['ComTec', '4.5']",http://www.comtecinfo.com/,Software Developer (Engineer) I **Hybrid Work Schedule**,"Saint Louis, MO",$46K - $71K (Glassdoor est.),"Shift Schedule
M-F during normal business hours with some flexibility * May need to be physically present 5 days a week * Under rare circumstances, you may need to work to support engineering teams by working when they work (e.g., late at night or over the weekend)
Work Experience Requirement
1-2 years work experience preferably in maintaining an inventory custody and control program or similar tightly controlled environment.
Experience or knowledge in product hardware engineering development cycle for mobile electronics. Experience in Excel, SalesForce, PowerPoint, MS Word, and data modelling.",4d,
"['United Vein & Vascular Centers', '3.3']",http://www.unitedveincenters.com/,Software Developer (Engineer) I **Hybrid Work Schedule**,"Saint Louis, MO",$46K - $71K (Glassdoor est.),"Overview:
United Vein & Vascular Centers is a rapidly growing healthcare company headquartered in Tampa, Florida with numerous clinics throughout Florida, Colorado, Arizona, and Illinois. Our practices specialize in office-based, minimally invasive venous surgery. United Vein & Vascular Centers consistently values, recognizes and rewards their team members and has unprecedented organizational culture and leadership. Come join our growing team!
Responsibilities:
The IT Support Manager reports to the Senior Director of IT and will help ensure UVVC’s implementation and use of technology meets the business needs and supports the company mission. The IT Support Manager will oversee our IT Support team and will train, lead projects and support the IT Support team’s growth and innovation. This position is located onsite at our corporate office in Tampa. This position is NOT remote.

Work closely with Sr Director of IT to establish and enforce company IT standards regarding end user IT equipment such as laptops, desktops, iPads, printers, and other technology related equipment.
Qualifications:",17d,www.glassdoor.com/partner/jobListing.htm?pos=109&ao=1110586&s=58&guid=000001846a89c6c1ac31ba9dad85f78f&src=GD_JOB_VIEW&t=SR&vt=w&cs=1_52ca51a4&cb=1668234757730&jobListingId=1008233775869&cpc=3BA4CE39D5B5DEF5&jrtk=3-0-1ghl8jhncma71801-1ghl8jho0jc8g800-73f17e521360e9a0--6NYlbfkN0Aim5AdNOZ_VoWQuac_8Slq58pV73jTsMrGlCKDcViVrYFd23EaPlEbP_2AKmpBQQJ1anlOZ_OUu5TlDfqygP27EPqtaFNV4WDSS0D8tgkWMBJkj8uEsPPuBdK1Hy1E7FgOm1jw5jkXs7yQz1JjE1lNnIuEKw_b7Oq1lHuYQig0mUdekjriSRIFZtVn6ojeDZH7lQMplzs5YNg6wGiyUswf0CO4nid-oxXzjl8sWLG97b_4xnEs2-WplKFlSif9wIIiLQwnZkilWe-T7Q40ZgKe1wxlJh5cOy6mKy_5RJgc98TyJN_LCxC7TQqzxGMEx-0zHhRDPSRSpPwhojyrSkhAuHg4Fwa2w9Ijf5z8ZBnle7bIEYexsTsZ5e46hK_rwpDIqYjVaO9CJzv1YISYa3baOT0DYi3mUVZ5Y1GKutpkRcUEsEqwyROOqz3nysuTM9oKMLM-F30IkFrU-Ui7MR--kPma1j3nGobN5BnOYhYeSN0_sWA1vkylyJxiz2pPJDMnkDRTAH9S-sU61ubxXlNoOHknkdk7jRoqmezqBe0hRMrgf-nErxSyI56Inb8KV22a_guNd9j7vg4ssEBU4g9UahEifBR8RH0eMCY3BuJ6jqc00odDSM2iJ37-pCnvIns5N58bXvXVH1yaJNbp9p2UJCKMO3J-hLqJiPQBebq9GfjiwVZDes1dCfFcM29VnX23SXGJFjuPrjLbnjHpwUPBItw6rDOWHwlWYFH2tLuIEYcGge2DMKOZ
"['TopGun Staffing Inc', '3.2']",http://www.topgunstaffinginc.com/,Software Developer (Engineer) I **Hybrid Work Schedule**,"Saint Louis, MO",$46K - $71K (Glassdoor est.),"Full Job Description
Job Purpose:
The SW/System (HILS) Test Engineer is responsible to develop, maintain, execute, track, and report on validation testing for SW/System Integration testing and assuring Steering technologies meet internal and customer requirements.
Responsibilities: (other duties may be assigned as needed):
· Work closely with SW/System engineers to develop requirements based test cases and assure quality test cases
· Proactively working with Software Function Owners during the entire test and development process",30d+,
"['Forward', '3.4']",http://www.goforward.com/,Software Developer (Engineer) I **Hybrid Work Schedule**,"Saint Louis, MO",$46K - $71K (Glassdoor est.),"Forward is on a bold mission to make high quality healthcare available to a billion people across the globe. We’re building the world’s most advanced healthcare platform from the ground up, combining hardware, software and doctors under one roof. We are scaling our engineering team and looking for world-class engineers with experience and expertise in Computer Vision, Machine Learning and AI. As an early member of our engineering team, you’ll have a key role in building the future of healthcare from first principles.

Forward was founded in January 2016 by former executives and engineering leaders from Google and Uber. We are funded by some of the world's best investors and entrepreneurs including Founder's Fund, Khosla Ventures, First Round Capital, Eric Schmidt (Google/Alphabet Chairman), Marc Benioff (Salesforce Founder), Joe Lonsdale (Palantir Founder), Joshua Kushner (Oscar co-Founder) and Garrett Camp (Uber co-Founder).

You can read our story here or check out a quick YouTube video.",30d+,www.glassdoor.com/partner/jobListing.htm?pos=111&ao=1136043&s=58&guid=000001846a89c6c1ac31ba9dad85f78f&src=GD_JOB_VIEW&t=SR&vt=w&cs=1_45c8fae5&cb=1668234761496&jobListingId=1007906594245&jrtk=3-0-1ghl8jhncma71801-1ghl8jho0jc8g800-37bfa8bb48aa757d-
"['Forward', '3.4']",http://www.goforward.com/,Software Developer (Engineer) I **Hybrid Work Schedule**,"Saint Louis, MO",$46K - $71K (Glassdoor est.),"Forward is on a bold mission to make high quality healthcare available to a billion people across the globe. We’re building the world’s most advanced healthcare platform from the ground up, combining hardware, software and doctors under one roof. We are scaling our engineering team and looking for world-class engineers with experience and expertise in building intuitive web applications. As an early member of our engineering team, you’ll have a key role in building the future of healthcare from first principles.

Forward was founded in January 2016 by former executives and engineering leaders from Google and Uber. We are funded by some of the world's best investors and entrepreneurs including Founder's Fund, Khosla Ventures, First Round Capital, Eric Schmidt (Google/Alphabet Chairman), Marc Benioff (Salesforce Founder), Joe Lonsdale (Palantir Founder), and Garrett Camp (Uber co-Founder).

Press and Videos:",30d+,www.glassdoor.com/partner/jobListing.htm?pos=112&ao=1136043&s=58&guid=000001846a89c6c1ac31ba9dad85f78f&src=GD_JOB_VIEW&t=SR&vt=w&cs=1_d8416019&cb=1668234765558&jobListingId=1007805097879&jrtk=3-0-1ghl8jhncma71801-1ghl8jho0jc8g800-47010f7977c20749-
"['Forward', '3.4']",http://www.goforward.com/,Software Developer (Engineer) I **Hybrid Work Schedule**,"Saint Louis, MO",$46K - $71K (Glassdoor est.),"Forward is on a bold mission to make high quality healthcare available to a billion people across the globe. We’re building the world’s most advanced healthcare platform from the ground up, combining hardware, software and doctors under one roof. We are scaling our engineering team and looking for world-class engineers with experience and expertise in Data Science, Machine Learning and AI. As an early member of our engineering team, you’ll have a key role in building the future of healthcare from first principles.

Forward was founded in January 2016 by former executives and engineering leaders from Google and Uber. We are funded by some of the world's best investors and entrepreneurs including Founder's Fund, Khosla Ventures, First Round Capital, Eric Schmidt (Google/Alphabet Chairman), Marc Benioff (Salesforce Founder), Joe Lonsdale (Palantir Founder), Joshua Kushner (Oscar co-Founder) and Garrett Camp (Uber co-Founder).

You can read our story here or check out a quick YouTube video.",30d+,www.glassdoor.com/partner/jobListing.htm?pos=113&ao=1136043&s=58&guid=000001846a89c6c1ac31ba9dad85f78f&src=GD_JOB_VIEW&t=SR&vt=w&cs=1_7860a4c0&cb=1668234767287&jobListingId=1007940089739&jrtk=3-0-1ghl8jhncma71801-1ghl8jho0jc8g800-85962f31fd69681f-
"['Sunnova Energy Corp', '3.5']",http://www.sunnova.com/,Software Developer (Engineer) I **Hybrid Work Schedule**,"Saint Louis, MO",$46K - $71K (Glassdoor est.),"(IT) Systems Engineer

Brief Description of Sunnova
Sunnova is a different kind of Power Company, offering solar and storage services to homeowners within the United States and its territories through our network of local solar dealers and solar standard community homebuilders.",30d+,
"['Forward', '3.4']",http://www.goforward.com/,Software Developer (Engineer) I **Hybrid Work Schedule**,"Saint Louis, MO",$46K - $71K (Glassdoor est.),"Forward is on a bold mission to make high quality healthcare available to a billion people across the globe. We’re building the world’s most advanced healthcare platform from the ground up, combining hardware, software and doctors under one roof. We are building our IT team and looking for a world-class IT Engineer with expertise in improving and scaling IT systems and infrastructure. As an early member of our IT team, you’ll have a key role in building the future of healthcare from first principles.

Forward was founded in January 2016 by former executives and engineering leaders from Google and Uber. We are funded by some of the world's best investors and entrepreneurs including Founder's Fund, Khosla Ventures, First Round Capital, Eric Schmidt (Google/Alphabet Chairman), Marc Benioff (Salesforce Founder), Joe Lonsdale (Palantir Founder), Joshua Kushner (Oscar co-Founder) and Garrett Camp (Uber co-Founder).

Press and Videos:",30d+,www.glassdoor.com/partner/jobListing.htm?pos=115&ao=1136043&s=58&guid=000001846a89c6c1ac31ba9dad85f78f&src=GD_JOB_VIEW&t=SR&vt=w&cs=1_ee30b322&cb=1668234772175&jobListingId=1007940089655&jrtk=3-0-1ghl8jhncma71801-1ghl8jho0jc8g800-dd0c36b9f7804cf8-
"['Hope Global', '3.1']",http://www.hopeglobal.com/,Software Developer (Engineer) I **Hybrid Work Schedule**,"Saint Louis, MO",$46K - $71K (Glassdoor est.),"JOB SUMMARY:
If you are interested in working in a creative, high paced, and dynamically changing environment where you will have a meaningful impact on the future of the global company this is the ideal job for you.

The IT Infrastructure & User Support Engineer monitors, identifies, and proactively maintains data center, network, and user technology. This strategic and hands-on job role is an essential position supporting technology operating within the plant, end user computing, cloud-based applications, and participates as a member of a global service desk. Maintains adequate knowledge of hardware, software, scan & print, and data center infrastructure aligned with the manufacturing process so to maximize efficiency and availability of critical systems. Provides written documentation for procedural improvement and participates as a key contributing member with business divisions.",24d,
"['Siemens', '4.1']",http://www.siemens.com/,Software Developer (Engineer) I **Hybrid Work Schedule**,"Saint Louis, MO",$46K - $71K (Glassdoor est.),"At SIEMENS, we live and foster an ownership culture, in which every employee takes personal responsibility for our company’s success. We utilize lean principles to continually improve our processes and customers’ experience. We trust and empower our employees to act as owners, make decisions and innovate to succeed. We communicate openly and honestly to learn from our failures and celebrate our successes. We recognize individual and team achievements frequently. We invest in our team members, offering a wide variety of internal and external development opportunities.
Overview:

Change the world of tomorrow with us.

Become part of our factory team at the medium-voltage switches plant in Heber Springs (AR).
Together with various partners, you will help shape the move into the future by supportting the use of our IT infrastructure, designing and introducing new digitization solutions that will help to continue producing efficiently.",30d+,www.glassdoor.com/partner/jobListing.htm?pos=117&ao=1136043&s=58&guid=000001846a89c6c1ac31ba9dad85f78f&src=GD_JOB_VIEW&t=SR&vt=w&cs=1_4b71afcc&cb=1668234777033&jobListingId=1008090219330&jrtk=3-0-1ghl8jhncma71801-1ghl8jho0jc8g800-df60d457997cf17f-
"['Forward', '3.4']",http://www.goforward.com/,Software Developer (Engineer) I **Hybrid Work Schedule**,"Saint Louis, MO",$46K - $71K (Glassdoor est.),"Forward is on a bold mission to make high quality healthcare available to a billion people across the globe. We’re building the world’s most advanced healthcare platform from the ground up, combining hardware, software and doctors under one roof.

Forward was founded in January 2016 by former executives and engineering leaders from Google and Uber. We are funded by some of the world's best investors and entrepreneurs including Founder's Fund, Khosla Ventures, First Round Capital, Eric Schmidt (Google/Alphabet Chairman), Marc Benioff (Salesforce Founder), Joe Lonsdale (Palantir Founder), and Garrett Camp (Uber co-Founder).

Feel free to read our story, view a Forward Tour with our Medical Lead, learn how Forward is combatting COVID-19, and check out some press: New Yorker, TIME, USA Today, Forbes, WIRED, TechCrunch.",30d+,www.glassdoor.com/partner/jobListing.htm?pos=118&ao=1136043&s=58&guid=000001846a89c6c1ac31ba9dad85f78f&src=GD_JOB_VIEW&t=SR&vt=w&cs=1_45011bd5&cb=1668234779895&jobListingId=1007717975867&jrtk=3-0-1ghl8jhncma71801-1ghl8jho0jc8g800-53853bcc93480f2f-
"['Eargo', '4.3']",http://www.eargo.com/,Software Developer (Engineer) I **Hybrid Work Schedule**,"Saint Louis, MO",$46K - $71K (Glassdoor est.),"We’re Eargo and we’re on a mission to disrupt, innovate, and reimage the hearing industry. If you believe fun at work is non-negotiable and want to experience the joy of being a part of helping someone hear life to the fullest again— expect tears of joy— then this is the place for you! Our passionate, fast-paced, energetic team is driven by the belief that people shouldn’t feel like they need a hearing aid—they should want one. So, if working with some of the coolest, most talented folks around and making an impact every single day sounds like a dream gig, then we want to hear from you!

The Director, Systems Engineering and Test will be responsible for all aspects of Eargo’s Systems Engineering and testing activities. This is a hands-on position where the Director will be responsible for leading the development of processes related to end-to-end systems engineering, the verification and test efforts providing technical direction, strategy, and mentoring to the systems engineering and test
group.",16d,www.glassdoor.com/partner/jobListing.htm?pos=119&ao=1136043&s=58&guid=000001846a89c6c1ac31ba9dad85f78f&src=GD_JOB_VIEW&t=SR&vt=w&cs=1_b5fb5ffd&cb=1668234782031&jobListingId=1008236158921&jrtk=3-0-1ghl8jhncma71801-1ghl8jho0jc8g800-0bc906001e9245b6-
"['Forward', '3.4']",http://www.goforward.com/,Software Developer (Engineer) I **Hybrid Work Schedule**,"Saint Louis, MO",$46K - $71K (Glassdoor est.),"Forward is on a bold mission to make high quality healthcare available to a billion people across the globe. We’re building the world’s most advanced healthcare platform from the ground up, combining hardware, software and doctors under one roof. We are scaling our engineering team and looking for world-class engineers with expertise in building secure systems and infrastructure. As an early member of our security engineering team, you’ll have a key role in building the future of healthcare from first principles.

Forward was founded in January 2016 by former executives and engineering leaders from Google and Uber. We are funded by some of the world's best investors and entrepreneurs including Founder's Fund, Khosla Ventures, First Round Capital, Eric Schmidt (Google/Alphabet Chairman), Marc Benioff (Salesforce Founder), Joe Lonsdale (Palantir Founder), and Garrett Camp (Uber co-Founder).

Press and Videos:",30d+,www.glassdoor.com/partner/jobListing.htm?pos=120&ao=1136043&s=58&guid=000001846a89c6c1ac31ba9dad85f78f&src=GD_JOB_VIEW&t=SR&vt=w&cs=1_bb611445&cb=1668234784851&jobListingId=1007906594216&jrtk=3-0-1ghl8jhncma71801-1ghl8jho0jc8g800-a95e06561d9d8979-
"['Forward', '3.4']",http://www.goforward.com/,Software Developer (Engineer) I **Hybrid Work Schedule**,"Saint Louis, MO",$46K - $71K (Glassdoor est.),"Forward is on a bold mission to make high quality healthcare available to a billion people across the globe. We’re building the world’s most advanced healthcare platform from the ground up, combining hardware, software and doctors under one roof. We are scaling our engineering team and looking for world-class engineers with experience and expertise in building intuitive web applications. As an early member of our engineering team, you’ll have a key role in building the future of healthcare from first principles.

Forward was founded in January 2016 by former executives and engineering leaders from Google and Uber. We are funded by some of the world's best investors and entrepreneurs including Founder's Fund, Khosla Ventures, First Round Capital, Eric Schmidt (Google/Alphabet Chairman), Marc Benioff (Salesforce Founder), and Garrett Camp (Uber co-Founder).

Press and Videos:
Virtual Tour of Forward [YouTube]",30d+,www.glassdoor.com/partner/jobListing.htm?pos=121&ao=1136043&s=58&guid=000001846a89c6c1ac31ba9dad85f78f&src=GD_JOB_VIEW&t=SR&vt=w&cs=1_c0d1cdaa&cb=1668234787791&jobListingId=1007563686376&jrtk=3-0-1ghl8jhncma71801-1ghl8jho0jc8g800-b0a994464abbede9-
"['Element Science', '3.8']",http://www.elementscience.com/,Software Developer (Engineer) I **Hybrid Work Schedule**,"Saint Louis, MO",$46K - $71K (Glassdoor est.),"RESPONSIBILITIES:
Plan and execute projects to select, install, and validate systems and applications to support R&D, QA, Operations, Finance, Project Management Office, Customer Service, and production environments while developing deployment processes and monitoring to ensure high reliability production systems.
Work with stakeholders to refine business processes and translate needs to application requirements
Provide strategic input and guidance on acquisition, configuration, and deployment of third-party software applications and platforms, in addition to applications that are built inhouse.
Lead and build a qualified team of engineers and specialists that can help in all phases of the multiple IT projects and support our employees.",1d,www.glassdoor.com/partner/jobListing.htm?pos=122&ao=1136043&s=58&guid=000001846a89c6c1ac31ba9dad85f78f&src=GD_JOB_VIEW&t=SR&vt=w&cs=1_93da9b98&cb=1668234790705&jobListingId=1008271122080&jrtk=3-0-1ghl8jhncma71801-1ghl8jho0jc8g800-22b6bef92243561d-
