Company_Name,Company_Link,Title,Location,Estimated_Salary,Job_Description,Job_Age,Application_Link
"['Salesforce', '4.4']",http://www.salesforce.com/,Salesforce Integration Engineer,Remote,$90.00 - $100.00 Per Hour(Employer est.),"To get the best candidate experience, please consider applying for a maximum of 3 roles within 12 months to ensure you are not duplicating efforts.
Job Category
Products and Technology
Job Details
ob Category
Products and Technology



























Pursuant to the San Francisco Fair Chance Ordinance and the Los Angeles Fair Chance Initiative for Hiring, Salesforce will consider for employment qualified applicants with arrest and conviction records.",30d+,www.glassdoor.com/partner/jobListing.htm?pos=124&ao=1136043&s=58&guid=000001846a8fb8db8aa166ef3c9ae4ad&src=GD_JOB_VIEW&t=SR&vt=w&cs=1_e17fdde1&cb=1668235188117&jobListingId=1008074176238&jrtk=3-0-1ghl8ve81kuie801-1ghl8ve8gi17g800-3589a734a6e39f6a-
"['Perficient, Inc', '4.0']",https://www.perficient.com/,Salesforce Integration Engineer,Remote,$90.00 - $100.00 Per Hour(Employer est.),"Overview:

At Perficient you’ll deliver mission-critical technology and business solutions to Fortune 500 companies and some of the most recognized brands on the planet. And you’ll do it with cutting-edge technologies, thanks to our close partnerships with the world’s biggest vendors. Our network of offices across North America, as well as locations in India and China, will give you the opportunity to spread your wings, too.

We’re proud to be publicly recognized as a “Top Workplace” year after year. This is due, in no small part, to our entrepreneurial attitude and collaborative spirit that sets us apart and keeps our colleagues impassioned, driven, and fulfilled.

About Our Salesforce Practice




Responsibilities:
Qualifications:",30d+,www.glassdoor.com/partner/jobListing.htm?pos=125&ao=1136043&s=58&guid=000001846a8fb8db8aa166ef3c9ae4ad&src=GD_JOB_VIEW&t=SR&vt=w&cs=1_0443c4d3&cb=1668235191037&jobListingId=1008181804498&jrtk=3-0-1ghl8ve81kuie801-1ghl8ve8gi17g800-b28826d0b24959ab-
"['Deloitte', '4.0']",http://www.deloitte.com/,Salesforce Integration Engineer,Remote,$90.00 - $100.00 Per Hour(Employer est.),"Cloud Infrastructure Architect

We're looking for exceptional problem-solvers to help address our clients' most compelling Cloud needs. You will work alongside top engineers and technical thought leaders building Cloud solutions helping shape the future of global enterprises. You will be at the heart of technical solutions and leading-edge product development.

Work you'll do

Lead/support technical teams to architect, build, and deploy cloud solutions across public, private and hybrid cloud environments to support enterprise clients. Cloud Infrastructure Architects are responsible for designing, maintaining and troubleshooting the client's infrastructure, cloud services, network, and infrastructure security. Architects will work closely with other cloud teams, project managers, engineers, and other functions.









Cloud Engineering

Our Cloud Engineering team focuses on enabling our client's end-to-end journey from On-Premise to Cloud, with opportunities in the areas of: Cloud Strategy, Op Model Transformation, Cloud Development, Cloud Integration & APIs, Cloud Migration, Cloud Infrastructure & Engineering, and Cloud Managed Services. We help our clients see the transformational capabilities of Cloud as an opportunity for business enablement and competitive advantage.

Cloud Engineering supports our clients as they improve agility and resilience, and identifies opportunities to reduce IT operations spend through automation by enabling Cloud. We accelerate our clients towards a technology-driven future, leveraging vendor solutions and Deloitte-developed software products, tools, and accelerators.",30d+,www.glassdoor.com/partner/jobListing.htm?pos=126&ao=1136043&s=58&guid=000001846a8fb8db8aa166ef3c9ae4ad&src=GD_JOB_VIEW&t=SR&vt=w&cs=1_52a30ff0&cb=1668235195012&jobListingId=1007549551811&jrtk=3-0-1ghl8ve81kuie801-1ghl8ve8gi17g800-c30dff0da495c005-
"['Airtable', '4.4']",http://www.airtable.com/,Salesforce Integration Engineer,Remote,$90.00 - $100.00 Per Hour(Employer est.),"At Airtable, we are passionate about how our product democratizes software creation and empowers anyone to ""create anything."" We believe well-designed, integrated business systems are critical to our teams' executing on this vision. As a Senior Salesforce Engineer, you will be responsible for developing and delivering world class solutions for our GTM teams.
We're looking for folks who know what good looks like, but who are flexible, resourceful, collaborative and really excited to join us on our adventure to figure out both the right long term vision and the right next steps for tomorrow.
What you'll do
Design, develop and support business capabilities on the Salesforce platform and third-party systems & integrations
Partner with business analysts and business teams to understand requirements and implement scalable, reliable and secure solutions",16d,
"['Johnson & Johnson', '4.2']",http://www.jnj.com/,Salesforce Integration Engineer,Remote,$90.00 - $100.00 Per Hour(Employer est.),"Johnson & Johnson is recruiting for an IT Manager, Quality Systems Engineer. This position has a preferred location in Raritan NJ. Consideration will be granted for remote work within the US.
Caring for the world, one person at a time has inspired and united the people of Johnson & Johnson for over 125 years. We embrace research and science - bringing innovative ideas, products, and services to advance the health and well-being of people.
With $82.1 billion in 2020 sales, Johnson & Johnson is the world's most comprehensive and broadly based manufacturer of health care products, as well as a provider of related services, for the consumer, pharmaceutical, and medical devices markets. Employees of the Johnson & Johnson Family of Companies work with partners in health care to touch the lives of over a billion people every day, throughout the world. Do you have the talent and desire to touch the world? Johnson & Johnson has the career opportunities to help make it happen!







United States-New Jersey-Raritan-1003 US HIghway 202

North America-United States

Johnson & Johnson Services Inc. (6090)

Info Technology

2206071700W",30d+,www.glassdoor.com/partner/jobListing.htm?pos=128&ao=1136043&s=58&guid=000001846a8fb8db8aa166ef3c9ae4ad&src=GD_JOB_VIEW&t=SR&vt=w&cs=1_d9c2b900&cb=1668235199932&jobListingId=1008150356030&jrtk=3-0-1ghl8ve81kuie801-1ghl8ve8gi17g800-494716be26014473-
"['Baptist Health South Florida', '3.9']",https://careers.baptisthealth.net/us/en,Salesforce Integration Engineer,Remote,$90.00 - $100.00 Per Hour(Employer est.),"Baptist Health South Florida is the largest healthcare organization in the region, with 12 hospitals, more than 24,000 employees, 4,000 physicians and 100 outpatient centers, urgent care facilities and physician practices spanning across Miami-Dade, Monroe, Broward and Palm Beach counties. Baptist Health has internationally renowned centers of excellence in cancer, cardiovascular care, orthopedics and sports medicine, and neurosciences. A not-for-profit organization supported by philanthropy and committed to its faith-based charitable mission of medical excellence, Baptist Health has been recognized by Fortune as one of the 100 Best Companies to Work For in America and by Ethisphere as one of the World’s Most Ethical Companies.
Everything we do at Baptist Health, we do to the best of our ability. That includes supporting our team with extensive training programs, millions of dollars in tuition assistance, comprehensive benefits and more. Working within our award-winning culture means getting the respect and support you need to do your best work ever. Find out why we’re all in for helping you be your best.",30d+,www.glassdoor.com/partner/jobListing.htm?pos=129&ao=1136043&s=58&guid=000001846a8fb8db8aa166ef3c9ae4ad&src=GD_JOB_VIEW&t=SR&vt=w&cs=1_4f13ef58&cb=1668235203660&jobListingId=1008151743006&jrtk=3-0-1ghl8ve81kuie801-1ghl8ve8gi17g800-7b77d494d43414fb-
"['DigitalOcean', '4.5']",http://www.digitalocean.com/,Salesforce Integration Engineer,Remote,$90.00 - $100.00 Per Hour(Employer est.),"Do you ever wonder what happens inside the cloud?
DigitalOcean (NYSE: DOCN) simplifies cloud computing so builders can spend more time creating software that changes the world. With our mission-critical infrastructure and fully managed offerings, DigitalOcean enables startups and small and medium-sized businesses (SMBs) to rapidly deploy and scale modern applications. As a remote-first organization, our employees, like our customers, are based around the world.
What You'll Be Doing:
Configure and optimize Salesforce using standard declarative capabilities such as workflow and object creation, reporting, user/role/profile administration, marketplace apps and much more",30d,
['First 5 Alameda'],,Data & Policy Analyst,"Alameda, CA",$82K - $116K (Employer est.),"First 5 Alameda County helps young children grow up healthy and ready to learn during the most important time in their development. We have more than two decades of experience funding innovative programs and advocating for policies that produce better futures for our children. Our Vision is that every child in Alameda County will have optimal health, development and wellbeing to reach their greatest potential.
In support of quality early care and education (ECE) in the county, First 5 provides coaching and professional development to child care sites participating in Quality Counts. The agency also supports Oakland Unified School District’s summer pre-K program for children without previous ECE experience. Join our amazing mission-driven team that in partnership with the community, supports a county-wide continuous prevention and early intervention system that promotes optimal health and development, narrows disparities and improves the lives of children 0 to 5 and their families.",30d+,www.glassdoor.com/partner/jobListing.htm?pos=101&ao=1110586&s=58&guid=000001846a912c79918cab58077fd125&src=GD_JOB_VIEW&t=SR&vt=w&cs=1_40689640&cb=1668235219331&jobListingId=1008193449840&cpc=FDA93C03AE7AED37&jrtk=3-0-1ghl92b56k6f0801-1ghl92b5pgajs800-4fb0ecc31f198852--6NYlbfkN0Dr2zmVnt-P8A5nteV3xJnQcFc4ChXMEDWVvdFHW6KOsNM6wHex8QLgegvFGfeGvW_n42Ahqoh6ETjKspi1XiD8vrtFn31ZdIT94kMAFrulZohjGU38DkkfAfGEe_pAjB6mUNPVHxqVoKX2aPdszDulxkhH-OuKIze02lKXoHkH4LfklRofvZlSBLp8LiZK6s_TH7dpbUS2KzQoH1J7O6ukRc57-4qwlt9O9eic6vNqKBt7QcD8RRnDSsrJPhOUAOxEKHL5MLEOaUYUTUrcScEdTmuOvZdwZVPjZNq0JRY6gA6USYHKkjHiS2xdcmPU587md1RWLXjNinmo6vvQTZAlFkwQbGV3IxCLsLSs7E9Kz-XDwhmOgTeTMt26vBuRiPm1T6HkkOirR7hA9aM27COnq0pzMgErrfh95hlSoNphVq7CV9f8BROtFJcc_qEkbJx67snqi9IECYW1yVGBGjbBMrJVJF5K7X8y5dMzXQOXeWAltdfjqmJJM2wHV92mxjg16bRJBcX5gzgcuBR3r-C25WwhfKiVKG1hfnVJ6Tl2vNLa3p-9Mep1yrV5MwVxJm5garOHxcXbIxdpexar0vMVnFVHrZBTY5dtMR9LkbnnRBlx3LF8uoJuRJr9cB0ad03LtBS7ErbugljCVe2dbq9W
['Henrico Economic Development Authority'],,Data & Policy Analyst,"Alameda, CA",$82K - $116K (Employer est.),"GIS, RESEARCH, & REAL ESTATE ANALYST
Economic Development Authority, Henrico, Virginia
***PLEASE NOTE: DO NOT APPLY THROUGH INDEED. PLEASE FOLLOW THE INSTRUCTIONS LISTED AT THE BOTTOM OF THIS POST TO APPLY.***
If you love helping others succeed and are passionate about a career that contributes to the vitality of your community, look no further. Whether we’re assisting our more than 25,000 small businesses, six Fortune 1000 companies, or more than 330,000 residents, the Henrico EDA makes it our mission to promote a vibrant business climate and outstanding quality of life. Be a part of our team and discover the benefits of working for a bustling community in the Top State for Business with one of the best average commute times in the nation (22 minutes!). From a visionary eco-district to a booming data infrastructure, there are a wide variety of extraordinary projects that you can help advance in Henrico right now – with a lot more in store. Come join us in growing Henrico’s economy for all.",10d,
['Ethics & Compliance Initiative'],,Data & Policy Analyst,"Alameda, CA",$82K - $116K (Employer est.),"The Senior Survey Researcher is responsible for 1) developing research content, both in terms of surveys/assessments and reporting of survey results, and 2) utilizing technology to automate and advance the use of data analytics for ECI thought leadership research and fee-for-service client engagements. This position works closely with senior leadership and other team members to identify research strategies, trends, and opportunities within the research and Advisory Services functions. The Senior Survey Researcher has a strong background in research methodologies and processes, advanced data analysis, data visualization, and data science tools and techniques.
Essential Duties and Responsibilities:
Determine the appropriate research protocols for thought leadership research and client-based work, including, but not limited to, assessing suitable methods to collect quantitative and qualitative data.",10d,
"['HCH Enterprises, LLC', '3.5']",http://www.hchent.com/,Data & Policy Analyst,"Alameda, CA",$82K - $116K (Employer est.),"HCH Enterprises, LLC is seeking a Health Equity Senior Epidemiologist in support ofThe Rhode Island Department of Health (RIDOH). The Health Equity Senior Epidemiologist will support the state’s COVID-19 response and recovery activities. The purpose of this classification is to support health equity analysis and insights. RIDOH recognizes that there are health inequities in COVID outcomes related to race, ethnicity, and other demographics as well as geographical difference, and seeks to proactively address disparities using data in this role. This position will provide services relevant to health equity and data analytics to support the epidemiology and surveillance activities of across the state’s COVID-19 Unit. This position will have access to RIDOH COVID data and is expected to bring knowledge of health disparities and data nuances to the team to better understand which communities are disproportionately being impacted and how to improve health outcomes.
This is a remote position, but local candidates are encouraged to apply. Candidate must have the ability to work off-hour shifts, weekends, and holidays as needed to support COVID-19 Unit response requirements.",9d,
"['HCH Enterprises, LLC', '3.5']",http://www.hchent.com/,Data & Policy Analyst,"Alameda, CA",$82K - $116K (Employer est.),"Full-time, contract
Benefits offered: medical, dental, vision, 401K with company match, paid time off
**This is a remote position**. Local candidates encouraged to apply. Must also be able to work off-hour shifts, weekends, and holidays as needed to support COVID-19 Unit response requirements.
HCH Enterprises, LLC is seeking an Epidemiologist/Data Analyst in support of The Rhode Island Department of Health (RIDOH). This position will support the state’s COVID-19 Unit emergency response and recovery activities.
This position will serve as a general epidemiologist/data analyst focused on an assigned subgroup (ex. school or congregate care populations) or data component (ex. variant data, hospitalizations, wastewater data, etc.) of COVID-19 surveillance.",30d+,
"['QIAGEN', '3.8']",http://www.qiagen.com/,Data & Policy Analyst,"Alameda, CA",$82K - $116K (Employer est.),"At the heart of QIAGEN’s business is a vision to make improvements in life possible.
We are on an exciting mission to make a real difference in science and healthcare. We are still the entrepreneurial company we started out as and have today achieved a size where we can bring our full power to many initiatives and to our presence across the globe.
Our most valuable asset are our employees – more than 6000 in over 35 locations around the world. Our ambition is to ensure we have outstanding and passionate people working in the best teams and we are constantly looking for new talent to join us.
There are few players who have shaped the world of modern science and healthcare as much as QIAGEN, and we have only just started.
If you are looking to advance your career, are seeking new challenges and opportunities, enjoy working in dynamic and international, diverse teams and want to make a real impact on people’s lives, then QIAGEN is where you need to be.",4d,
"['Bristol Myers Squibb', '3.9']",http://www.bms.com/,Data & Policy Analyst,"Alameda, CA",$82K - $116K (Employer est.),"At Bristol Myers Squibb, we are inspired by a single vision – transforming patients’ lives through science. In oncology, hematology, immunology and cardiovascular disease – and one of the most diverse and promising pipelines in the industry – each of our passionate colleagues contribute to innovations that drive meaningful change. We bring a human touch to every treatment we pioneer. Join us and make a difference.
At Bristol Myers Squibb, we are inspired by a single vision – transforming patients’ lives through science. In oncology, hematology, immunology and cardiovascular disease – and one of the most diverse and promising pipelines in the industry – each of our passionate colleagues contribute to innovations that drive meaningful change. We bring a human touch to every treatment we pioneer. Join us and make a difference.
Cell Therapy is one of the most groundbreaking new forms of cancer treatments being studied today. With therapies only in their infancy and BMS’s continued investment in our Cell Therapy capabilities, the growth potential of this science, your career, and the ability to help patients are incredible.",9d,www.glassdoor.com/partner/jobListing.htm?pos=107&ao=1110586&s=58&guid=000001846a912c79918cab58077fd125&src=GD_JOB_VIEW&t=SR&vt=w&cs=1_44ad0033&cb=1668235238059&jobListingId=1008253104039&cpc=3BA4CE39D5B5DEF5&jrtk=3-0-1ghl92b56k6f0801-1ghl92b5pgajs800-6aa3459a4184f520--6NYlbfkN0C8DhssTksZ4tAWhh8LVIFF2qionQVVpONm6qYGpiaOiSpwvtn5hOcEHNb_nW2l88ZgVntj9IzHfreVRMjwnwm9pRWAHXAIiFOOQgejk6n_3deZFHRDJb5gphHzfKBFmkXJD82ij2xtPKjI5DraPIhFugzG3VVheF-Lw3LNCW1MCI2j6OLy1Yh-66sd7-RuJfRsYaBfQOfY0_HD3wkhYF9sIT9ZPipf5eXrWLlSLzqVndDX18NIr44V9MhVIeoOqT9aunApGPQnZgIexJtT6tceT7dtsCg_7-LAjim7XhOhqKw8wRZ6DoVWtsMezsRz-MsoWZIrN4iBzEBsYYIaJ5xa3lAspRLARWLczQMW253s8eJ6BJxLtHQ0q8-q0f3MMmXV5vsgVh-nf9mG8_y_F753Jmm4ABz3_rLl7Y7dy_tYWufFj_G1D6qy2ayryi6Gi1kykLdQxLDuU6wDjOpQYESasjNp_DhoA-KNzX9DKjf821pn_-Q4xsfj19XD2UsqPugz-wC6b40J4GnaJMMf-P8PprtwS2Tuh9RTc-8cNovvt33hoQYl-9AyQdQEN7B7AFGveCRPHYsciSTXJdTXnNRDYuyisqEwBgA-vjlniRwBTg%3D%3D
"['Seneca Resources', '4.2']",http://www.senecahq.com/,Data & Policy Analyst,"Alameda, CA",$82K - $116K (Employer est.),"Position Title: Senior Research Analyst
Location: New York, Chicago, or Tampa
Position Status: Full Time, Direct-Hire
Position Description:
The Insight Center is the rapidly growing research and benchmarking arm of our company. The mission of The Insight Center is to provide our professionals and our client executives with highly relevant, industry specific, actionable, fact-based insights derived through our proprietary benchmark and research studies on a global basis.
The Insight Center is looking for a Senior Research Analyst to join our growing team in either of our New York, Chicago, Tampa, or Houston offices. You will provide a range of research support functions across the whole firm. The role involves working directly with client facing staff to deliver financial benchmarking, market and industry research, company research as well as macro-economic research and analysis. This research supports thought leadership, business development and on occasions in-depth client work. This role requires the keen ability to multi-task to deliver a wide range of research requests, manage research pipelines for yourself and other third-party research providers that we use, and help with research product evaluations and train staff on research techniques and best practice.",4d,
"['Apex Systems', '3.9']",http://www.apexsystems.com/,Data & Policy Analyst,"Alameda, CA",$82K - $116K (Employer est.),"Job#: 1308451

Job Description:
Research Assistant

12 Month Contract

On-Site @ Redmond

This includes conducting research studies with human subject. RAs will be responsible for the set-up, implementation and data collection for the studies. They will need to work with our Technologies staff to ensure that the study equipment set up and the study conduct follows all applicable safety plans. Additional responsibilities include:

i. Assist principal investigators with experiments involving human subjects.
ii. RAs may help with experimental design and provide useful feedback prior to study
iii. Stage and set up equipment for the study. Study set-up may involve engaging with engineering, external equipment vendors, internal and external safety evaluators, and the research study team to ensure the equipment is set up properly.
iv. RAs may pilot experiments, make observations, and give feedback to the Technologies team study team to optimize study procedures.
v. RAS may assist the study project manager and external recruiting services in participant recruiting and scheduling activities
vi. Conduct the study. This includes any or all of the following: screening participants, obtaining participant consent, assuring the privacy and confidentiality of participants and their data, instructing study participants and guiding them through study procedures, running the study procedures, collecting the data per study design, formatting and annotating the data, and creating basic reports regarding the data.
vii. RAs are expected to follow procedures related to maintaining confidential information and handling of confidential data.
viii. Study support services. Support research and development in various areas including data collection, onsite handling, tracking of participant compensation and tracking of equipment and procedures.
ix. RAs may conduct and summarize literature reviews
x. RAs may purchase research papers

Minimum Qualifications
Preferred Qualifications
EEO Employer

Apex Systems is an equal opportunity employer. We do not discriminate or allow discrimination on the basis of race, color, religion, creed, sex (including pregnancy, childbirth, breastfeeding, or related medical conditions), age, sexual orientation, gender identity, national origin, ancestry, citizenship, genetic information, registered domestic partner status, marital status, disability, status as a crime victim, protected veteran status, political affiliation, union membership, or any other characteristic protected by law. Apex will consider qualified applicants with criminal histories in a manner consistent with the requirements of applicable law. If you have visited our website in search of information on employment opportunities or to apply for a position, and you require an accommodation in using our website for a search or application, please contact our Employee Services Department at employeeservices@apexsystems.com or 844-463-6178.


Contract


Redmond, WA, US



November 2, 2022",9d,www.glassdoor.com/partner/jobListing.htm?pos=109&ao=1110586&s=58&guid=000001846a912c79918cab58077fd125&src=GD_JOB_VIEW&t=SR&vt=w&cs=1_ea1e4deb&cb=1668235245061&jobListingId=1008253628637&cpc=3BA4CE39D5B5DEF5&jrtk=3-0-1ghl92b56k6f0801-1ghl92b5pgajs800-9c36cac43adb315b--6NYlbfkN0DqWjE27Bj7wQp7zwejGyju2OyxUuq4SEucXSyN07WCWejYvQmJsgF2DYF8Y-TYieBSANaqbKMRGyxylAUZ0N0KRYQYq5bAqrJqeklIw6A9uSYl8MW_a2WpLD2LZkUlKx22vuS-7g3BcqaSHsj23q2C4rCPA1dsOEzatMJLSX_pBWjMhQmq0d70mA2cMdg-uUt-nWvrH7ZKYfiHP69PG8sN1Am0sO-lxUtOjhdTJXB7xsOLLa9wdM88Q7OKPGA-ZwL-QciKMH5A5gmI2GlG1wjSgQ9mFZVeS7jmfPBCGRtUvY90DZvLne173D8pVKfqVQT8p7A1OcOTbQdkH-JnD7uHJjfApX-sn6s-9AalcmZ6kGCuB66QzHruD30S3EB2ZNUzxrzkXdTb-G3BnHSxiqBT7EMPW6u0m94wL-4-_Q6ktGZzpIi3_jROChMzTr655nw82jgGMgmmiSjcuqtY0qEFk1UBVfHL3_KnKqhhNL9-folqtoLmlbf-6LkDrzTHm_A%3D
"['DCG Group, LLC (dba Boulo Solutions)', '3.7']",http://www.boulosolutions.com/,Data & Policy Analyst,"Alameda, CA",$82K - $116K (Employer est.),"Boulo Client Seeking: Research Analyst

HYBRID | FULL TIME | Birmingham, AL

$50,000 to $70,000/year negotiable depending on experience.

Work from home Wednesdays and Fridays

1-3 years experience but are also open to more entry level and recent graduates who have had internship experience. This person MUST have some sort of INVESTMENT RESEARCH experience. Marketing or Economics would be helpful. This is NOT just Data work. This person should be able to think critically about data. Be coachable and teachable and self sufficient. Can function on deadline and get research done and written up and memorialized in spread sheet and/or presentation. (This is NOT a Healthcare Analytics position.)

A go-getter is more important than experience! Need a 'Swiss Army Knife"" person.




:
The analyst position will directly support the Executive Director with all Organizations activities. This role will represent the organization as a partner and thought-leader in economic development throughout the state.

Initiatives that the analyst will support include the following:


Future initiatives:

Job Duties & Responsibilities:

The following research resources may be used:

Education:


Experience:


Knowledge, Skills, & Abilities:

Behavioral Attributes:


https://app.boulosolutions.com/signup/member",30d+,
