Company_Name,Company_Link,Title,Location,Estimated_Salary,Job_Description,Job_Age,Application_Link
"['Affinity', '5.0']",http://www.affinitymaine.org/,Sr. Informatica/MDM Developer,Remote,$45K (Employer est.),"With our growing customer base and our expansion into new markets and use cases, we have more to build than ever at Affinity as we execute on our vision to put relationship intelligence at every professional's fingertips.
We are looking for enthusiastic candidates with enough critical thinking and outstanding abilities for self-guided learning. As we scale, we're looking for a new Software Engineer in Test who is passionate about quality and automation to join our rapidly growing team within Affinity.
In this role, you will be responsible for building automation test frameworks, implementing, maintaining automation solutions, monitoring, analyzing, and reporting test automation results. You'll have the opportunity to own the entire product or an app lifecycle by identifying the right toolset and building cost-effective and seamless integration strategies. The ideal candidate will be highly technical, detail-oriented, creative, motivated and focused on achieving results.",2d,www.glassdoor.com/partner/jobListing.htm?pos=128&ao=1136043&s=58&guid=000001846a824522863943245d77bebd&src=GD_JOB_VIEW&t=SR&vt=w&cs=1_6817f03a&cb=1668234329508&jobListingId=1008268498689&jrtk=3-0-1ghl84ha7jii7801-1ghl84haoihlq800-c87baaddb01b443d-
"['Modernizing Medicine, Inc.', '4.1']",https://www.modmed.com/,Sr. Informatica/MDM Developer,Remote,$45K (Employer est.),"At Modernizing Medicine, we look for passionate, innovative, creative Rock Stars!
South Florida Business Journal, Business of the Year 2022
BIG Awards for Business, Company of the Year 2021
Best in Biz Award (Silver), Fastest-Growing Company of the Year 2021
South Florida Business Journal, Best Places to Work 2021
Inc. Magazine Best Workplaces of 2020
Modernizing Medicine delivers truly disruptive and transformative products and services that will impact the healthcare industry. The work we do makes a difference.",30d+,
"['Devcare Solutions', '3.6']",https://www.devcare.com/,Sr. Informatica/MDM Developer,Remote,$45K (Employer est.),"Job Title: Salesforce Developer (Health Cloud)**
Location: Denver, Colorado
Duration: 6+Months
Interview Mode: Skype
Project site: Remote
Note:
Candidates must have experience in Health Cloud as well in Lightning Components!
Candidates can apply who had strong experience in Health cloud!",30d+,
['VForce InfoTech'],,Jr. Salesforce Developer (Train & Transfer),"Edison, NJ",$60K - $120K (Employer est.),"About the Company: -
The mission of VForce InfoTech is to provide world-class technology solutions to our clients. VForce Infotech provides exceptional, experienced individuals to our clients at great value. What differentiates VForce Infotech from our competitors is our focus on developing strong and lasting relationships with our clients.
Benefits Of Joining V-force: -
We have an upcoming project & we are in the hiring process, 0-5 Years of experience as a Python/Angular
Free Training is Provided On Python on the current projects.
We accept all work authorization categories. (OPT, EAD'S, GC, Citizen)",30d+,
"['Quality Leasing Co., Inc.', '3.9']",https://www.tomwood.com/,Jr. Salesforce Developer (Train & Transfer),"Edison, NJ",$60K - $120K (Employer est.),"Quality Leasing Co., a Tom Wood Company, is currently searching for a Salesforce Administrator / Developer with a comprehensive understanding of the Salesforce CRM. The ideal candidate will be well versed in the software and have experience training and implementing new technology for a sales team. This is a pivotal role that will take our operation to the next level.
Candidates must have work/visa authorization.
Pay Range: $85,000 - $100,000 per year
Responsibilities:
Expand and optimize organizational adoption of Salesforce and other software programs that will drive accuracy and efficiency
Serve as liaison between Operations Team and Salesforce vendors",11d,
['Tech Intellectuals'],http://www.techintellectuals.com/,Jr. Salesforce Developer (Train & Transfer),"Edison, NJ",$60K - $120K (Employer est.),"Role: Customer Experience Technology Manager
Experience: 5-10 years
Location: Remote, but East Coast / Midwest preferred. BTG client city strongly preferred.
Compensation : 140 k - 220k (DOE) + Bonus
The Customer Experience Technology Manager is a leader who will work with largest clients to provide analysis, recommendations and implementation plans for to improve our client’s customers experience and drive their business results. CX Technology Managers lead consulting teams with accountability for project delivery, client relationships and business development. A deep understanding of the technology and business processes that powers customer experience is required in at least one of the areas of Sales, Marketing, Service and Commerce. will lead technical consulting teams in the areas of strategy, process improvement, technical and data evaluation, planning and implementation. The must have a strong understanding of and platforms, agile methods, customer data, and technical program management. The will work closely with broader technical, delivery and consulting teams from across our clients to provide both best practice market insights and practical implementation direction to clients.",3d,
"['National Press Club', '4.4']",http://www.press.org/career-opportunities,Jr. Salesforce Developer (Train & Transfer),"Edison, NJ",$60K - $120K (Employer est.),"The National Press Club is seeking a qualified and motivated professional to join the Events Team. Our ideal candidate is a driven, results-oriented self-starter who can build relationships and generate revenue.
The Event Manager is responsible for providing outstanding customer service to our existing and new clients by executing successful events (roughly 250 per year) that meet or exceed our client’s expectations while at the same time helping the company maximize its full revenue potential and profitability.
The National Press Club is a 114-year-old, world-renowned institution that hosts over 2,000 events per year that include heads of state, politicians, sports figures, entertainers, and champions of business. It contains over 14,000 sq. ft of meeting space.
Responsibilities:",2d,
"['Toyo Tires', '3.8']",http://www.toyoindia.com/,Jr. Salesforce Developer (Train & Transfer),"Edison, NJ",$60K - $120K (Employer est.),"Join the Toyo Tires Team!
GREAT PEOPLE. GREAT PRODUCTS. GREAT FUTURE.
Toyo Tire Corporation develops, manufactures, and sells automotive tires and parts. Celebrating 75 years in business, their global sales and distribution footprint includes more than 100 countries and regions. The Company also has manufacturing facilities in Japan, the United States of America, Malaysia, and China.
Toyo Tires has built a reputation for delivering innovation, quality, performance, and excellent service.
We offer a complete selection of premium replacement tires for nearly every make and model vehicle and commercial truck. Many tires are built here in the United States at our state-of-the-art factory in Georgia.",11d,
"['Caresfield, LLC']",,Jr. Salesforce Developer (Train & Transfer),"Edison, NJ",$60K - $120K (Employer est.),"ABOUT CARESFIELD:
Founded in 1990, this family-owned business has grown from one to 65 and counting. We are proud to serve the healthcare industry by offering high-quality healthcare consumables to hospitals and other healthcare facilities across the United States. With our patient ID solutions and disposable tourniquets, we strive every day to enhance communication and improve the safety of healthcare employees and patients.
SUMMARY
We are looking for a data & analytics manager to join our growing team and manage the processes and people responsible for accurate data collection, processing, analysis, and reporting. This role will work closely with leaders across sales, marketing, product management, and operations to support and implement high-quality, data-driven decisions. They will ensure data accuracy and consistency by maintaining, designing, and optimizing processes and procedures for data analysis and reporting. They will use data modeling, predictive modeling, and analytical techniques to interpret key findings from company data and leverage these insights into initiatives that will support business outcomes. This role requires a high-energy, successful achiever with a positive, optimistic attitude who wants to work with other energetic successful A-players.",7d,
['Alphaeon Credit'],,Jr. Salesforce Developer (Train & Transfer),"Edison, NJ",$60K - $120K (Employer est.),"Alphaeon Credit is expanding and we are seeking a Digital Marketing Manager to join our team.
We provide patient financing solutions for dermatologists, dentists, ophthalmologists, and plastic surgeons nationwide.
In this role, you’ll:
· Develop the organizations digital marketing strategy, including SEM, SEO, and PPC for both practices and patients including tracking competitor(s) activity and taking action to outperform
· Identify social media advertising opportunities for both practices and patients and collaborate with the Social Media Marketing Manager to implement campaigns
· Research keywords regularly and collaborate with marketing team to improve B2B and B2C websites rankings",2d,
"['Spark Energy, L.P.', '3.5']",http://www.sparkenergy.com/,Jr. Salesforce Developer (Train & Transfer),"Edison, NJ",$60K - $120K (Employer est.),"Systems Analyst
Company: TexEx Energy Operating
Title: Systems Analyst
Department: Houston Sales General & Admin
Reports to: Manager, Business Systems
FLSA Status: Exempt
JOB SUMMARY
The Systems Analyst will ensure that our data and insights are actionable to drive decisions across the business and communicate growth opportunities through data analytics and reporting. The Systems Analyst will need an eye for detail, great communication, and keenness for problem-solving to meet goals established by the organization for sales growth, quality, and operational efficiencies. Overall, the Systems Analyst will present a data driven narrative to elevate its pervasive function as a business decision making instrument.",1d,www.glassdoor.com/partner/jobListing.htm?pos=108&ao=1110586&s=58&guid=000001846a83d9cda3eb3fb243642f7b&src=GD_JOB_VIEW&t=SR&vt=w&cs=1_e30ba4b7&cb=1668234364552&jobListingId=1008271478508&cpc=334ABAF5D42DC775&jrtk=3-0-1ghl87mfri4mg801-1ghl87mgfghpk800-0d8e98a3bb3cbb7e--6NYlbfkN0Dq4QokKvpo5_8ynZEY6SSsprBf8Z2FZ6OOL62Gs-k_HYdlHw8qR0T6ON5x54PGJQ3nBhdoQ_jpPTtamBwEozxJSztHyKQvkzRWz84zPw0C3AOgQBtkTLW2IfvQ6MyJIDevkshwM58_GqxgnbUxLwW66M_6sYvJpGoKnXwHhfj0tfXaHnGcZsSmkvKfKzXpPPQdVej-MHj-7HC_meplUO0_MtsZatBOfn9jXI3cocmdVaRFUoZiX7uBTs-8xI5XXV_6rcGx3lvVIHKPipgztqRZ_3n0qyWVd0-Y12zPen369GPNaJEAcqWyy7N1XW2DZrpqns4jfS3eKFeaudjlzrVl-2oc0hCp0Ir2jahJxywnL33azGRebOfR8Da_sk8ItrzZ_8GYfyyfeKORSMuYa7sVft-q4oi0aFPOvIt9Hat5QH2zSAGtYHpg0HHKazQIzQ_FqfkYX0f8y36lcjJbbTEUTp2tOVJwk0n5-NuhFTHifwKrm3kfpobUcWCE4rwfoq57jPtE74ZycUV2-5quARMln8XEz_8Z8lZFIfo_-4yiNA%3D%3D
['Leadership Louisville Center'],,Jr. Salesforce Developer (Train & Transfer),"Edison, NJ",$60K - $120K (Employer est.),"The Leadership Louisville Center (LLC) is the region’s most valuable resource for leadership development and civic engagement. With a purpose to inspire and equip leaders to be better and do better, we have graduated over 15,000 through our civic programs since 1979. We are recognized as a national best practice and known for dynamic programming and strong community connections. Programming includes five community leadership programs (Leadership Louisville, Focus Louisville, Ignite Louisville, Bingham Fellows and Encore Louisville), leadership skills training courses presented through the LeadingBetter™ partner brand, and events designed to connect leaders and motivate positive change.
The Salesforce and Technology Administrator is a key member of thesupport team for the Center, responsible for database administration as well as managing vendors and hardware/software for IT. LLC uses Salesforce as its CRM and this position will manage the daily operational tasks, continuous improvements for increased operational efficiency and effectiveness, and successful adoption of processes among the team. This role is the organization’s in-house expert and Salesforce champion and works closely with all departments to ensure data integrity and improve business processes, as well as training and education for all staff regarding the use of the system. The successful candidate will have strong technical acumen and a record of success in configuring, maintaining, improving, and supporting the Salesforce platform, which is utilized for all programs and functions of the organization.",30d+,
"['Trane Technologies', '3.9']",http://www.tranetechnologies.com/,Jr. Salesforce Developer (Train & Transfer),"Edison, NJ",$60K - $120K (Employer est.),"At Trane TechnologiesTM and through our businesses including Trane® and Thermo King®, we create innovative climate solutions for buildings, homes, and transportation that challenge what’s possible for a sustainable world. We're a team that dares to look at the world's challenges and see impactful possibilities. We believe in a better future when we uplift others and enable our people to thrive at work and at home. We boldly go.

Job Summary：The Senior IT Product Analyst will partner with the business Product Owner(s) to design the technical tools to execute against a given set of capabilities. This individual will be responsible for providing a technical roadmap (including involvement in activities for LRP and AOP), orchestration of the development delivery process, and oversight of the stabilization and support of these business-critical applications. This is an ideal opportunity for a “techno-functional” individual who has a knack for understanding / perceiving business needs and creating unique high-level technical solutions for the same.


We offer competitive compensation and comprehensive benefits and programs. We are an equal opportunity employer; all qualified applicants will receive consideration for employment without regard to race, color, religion, sex, sexual orientation, gender identity, national origin, pregnancy, age, marital status, disability, status as a protected veteran, or any legally protected status.",24h,www.glassdoor.com/partner/jobListing.htm?pos=110&ao=1110586&s=58&guid=000001846a83d9cda3eb3fb243642f7b&src=GD_JOB_VIEW&t=SR&vt=w&cs=1_5e2b3a4d&cb=1668234368324&jobListingId=1008274034843&cpc=9908D8D4413DBB8A&jrtk=3-0-1ghl87mfri4mg801-1ghl87mgfghpk800-da8d767f14bf60f7--6NYlbfkN0Da44vtOp6gikr8DZH0EXuV_TqGL9GOBsYLC_HWBST2HHQE6ZuzaTGDEXu8_Ke6egek7WCXfc6cw3iTS9d6wrKLutTk60DyW5Elon01FPrAShE-_noLIta1RT9-E_USzQasLoO0Z7OCeNhauMzDdea3VeWAiesOOx5inrhRZVzN4NsrXako1fV-maO7f8WLiFaa7hiNgk9NwEFkocKPLsTUu_POx_OUUvmfNiA3LCIRkl0GUJ5QS1THVWMu0DBYBO_SbU4E9hS1Oqh9lLRb17x3mrbpsixA8Elh5f3H42mQ4kyRYVJ-TSJnWG91FZwzcNU5pElpG6Qdu_Tmyl0jU251s6CPJT8cq8uNtsC4fUnkIIHqhj0eSxt_DhyoB1N8-AXyEkewOgzAzURI4jVH_rjwgIoBzMTffZ7025bDV4gRwxCN8RmpoIfKvkIxL5oQNlYWzcr3aRR3O24qa_bIebDTiIaFHCcQW9mBetNNPKhI9vVSP4kcXBwvoToL3BPlOUjwZdfFTuzmObO1WQkTyDh18gNbqHadw13uuT7Akwmrfpd4niwzw-0AgXRqw63ADblBhRkCPqEftvU4D0RPNSMzfnZVSD_2Bp4kl_icQWG6Y-yeIJwXhpkwWcB3HVyBWBVIaF7HMeCjG9R1RqeiX--2UKnhe63u0pfGa4YfPvNonMR-oSI7aytO65_vCj-HPhEVglGngKXcjFpqk5R3kKPr5JCzBUpJbrB0X5vJrpXQXNm2U1_QGQQIpZFEuCUbrQqaEOVm3hJUZr4QHD20F2RtYHfygtkI794c_Jm73yRXNDxHrdiBDvVNo3bwlYTfJVeuu6BujM8fXPvav_cY5PrEOKt0tmjpReUSE5IWNUMhASP13nRhJ3mlcEPOy5dgjbSAhvQAvJlKAnG7QXCKvrFyBYBaV-ecijm4_miSQUYcgEF8apMXOQDPQjXvIYqdwb4I6tH88H0NIhTVfimQq6wKqHB20JPI4jAPWFTk0isQTmts5AEztlVi9BiwQYxB0oCJFdsGbZwgP1xlzeOpqyX3hQ1H2rDrvUFObPBBy4cl4pTY6CcW961cZByZ_E2T6GYbHIVNccF1z67QLuXHwUuY_-yRHWL57vBuotPxYEEfNfs1sqdRnmATrPTc63nXRqU9e9WUEmG2ptb-paO5m3Lr3ghKHXwMMtvBOXw7FNP7OB77IcmDkE9TSP2PcPYtC--RTOz4DKboYgG9FKW3hFccQFJusSv9PWxh4s4-l4ZdTFDOv43AY54ULKVwZVL9D-GtjG8dgEM73REvZQK71roBSIzQfcJFbVYCJmc8GU68REimkbOlr91zjrNLC5eji8RPDccnKW0jXg%3D%3D
"['Simpler Media Group, Inc.', '4.5']",https://www.simplermedia.com/,Jr. Salesforce Developer (Train & Transfer),"Edison, NJ",$60K - $120K (Employer est.),"Events Operations Specialist - Remote
Salary: $60,000 - $70,000 a year - Full-time
Accelerate your events career by joining this quickly growing B2B technology focused media and research firm.
Simpler Media Group (“SMG”) is looking for an enthusiastic, entrepreneurial and collaborative team member to work with our stellar Events team and help drive a best-in-class events product line to further success.
SMG Events is a growing and strategic part of the company that is experiencing continued success in its virtual model. We are presently looking for our next integral team player who can make an immediate impact on the team as well as the clients and communities that we serve.",15d,
"['University of Massachusetts Amherst', '4.3']",http://www.umass.edu/,Jr. Salesforce Developer (Train & Transfer),"Edison, NJ",$60K - $120K (Employer est.),"Job no: 515740
Work type: Staff Full Time
Location: UMass Amherst
Department: IT Operations
Union: PSU
Categories: Computer & Information Technology
About UMass Amherst
UMass Amherst, the Commonwealth's flagship campus, is a nationally ranked public research university offering a full range of undergraduate, graduate and professional degrees. The University sits on nearly 1,450-acres in the scenic Pioneer Valley of Western Massachusetts, and offers a rich cultural environment in a bucolic setting close to major urban centers. In addition, the University is part of the Five Colleges (including Amherst College, Hampshire College, Mount Holyoke College, and Smith College), which adds to the intellectual energy of the region.",30d+,www.glassdoor.com/partner/jobListing.htm?pos=112&ao=1110586&s=58&guid=000001846a83d9cda3eb3fb243642f7b&src=GD_JOB_VIEW&t=SR&vt=w&cs=1_80f76997&cb=1668234374095&jobListingId=1008097502923&cpc=F41FEAB56D215062&jrtk=3-0-1ghl87mfri4mg801-1ghl87mgfghpk800-87f81826b74113bc--6NYlbfkN0DAS1ElGKZK3TCl-hEbY107Z2KEyDNy9BU8-ZhmASgy9kNqUPT0mrddrDIh4ccSxME7VwaYE85a8X8soReoCWiywIEPyO4Pe__T7RLMJ7b-12bSawoKUYu90Qx7ks6IvI-gkVr7-1QQQWIOEzVxcSR4HJOcHewYl2rc3GlQwJ1K7Vn9kV7YBDpI8AbktsurMk3wMDjnidQKcye6gG8uMMcEDkX-s6Tu-ufAKceCT6uB1NF2jgjFU6kMgX-Ke2h9qnUWFrV7fOUkJ0bwh7Fd6OPWwSjfQ2afEZaDKb8fit4_mvxTn43sSMZweil4Uap1S3C7RhxZ8wiHII9U7KMDXxwCKXV9TnYL8XmFU7QY4CF1zh1AsrT1sjlAmvFLelYWdROUW85wyR63agDGhKf-1QKaYWJPbiSLfbCBEJ7esGRfS_SLbK5kBxa9I-O49ukfMtMxql-w6Y_uInRzvoZChvHnTVSAFBUAfvpyu3B6tFKsTIU7Jx_5cKxvOi6HddRAXXxV6EV7tv1TrHBYq-AfCO548ZUI-Y07RHygPc1G4_3ED3-Py1RY2ph3baqNssbY1Ub0qbJvdPrVYA%3D%3D
,,Jr. Salesforce Developer (Train & Transfer),"Edison, NJ",$60K - $120K (Employer est.),,30d+,
"['Patton Logistics', '3.4']",http://www.pattonlogistics.com/,Jr. Salesforce Developer (Train & Transfer),"Edison, NJ",$60K - $120K (Employer est.),"Job Summary for Salesforce Administrator
As a Salesforce Administrator, you will be a part of an agile team, working closely with other Salesforce Admins as well as Project Managers to deliver projects that meet our stakeholder's requirements. This position will mainly focus on Salesforce builds and needs to have a deep understanding of fundamentals, Flows and integrations.
We are looking for someone who is proactive, a problem-solver, detail-oriented and focused on growth. Since this is a project-oriented team, clear communication, being able to prioritize and the ability to meet deadlines are important skills. We utilize VS Code to migrate metadata between our orgs. A candidate with VS Code experience will stand out. If you do not have VS Code experience, it will be vital to quickly learn basic migration skills in VS Code. The Salesforce Project Team is a fun, fast-paced team that enjoys pushing boundaries.",16d,
"['West Shore Home', '3.4']",http://www.westshorehome.com/,Jr. Salesforce Developer (Train & Transfer),"Edison, NJ",$60K - $120K (Employer est.),"As our nationwide growth accelerates as, our remote Business Systems team plays a key role in driving forward our mission of Bringing Happiness to Every Home® by aggressively implementing new systems and custom applications to achieve unparalleled success in serving our customers and optimizing our business.
As a Salesforce Business Analyst at West Shore Home®,you will contribute to this mission by analyzing and understanding business processes, functional requirements, and system capabilities. You will report directly to the Business Systems Project Team Manager and be accountable to our Business Systems Product Management Team.
What You’ll Contribute
In this role, you can expect to:",2d,
"['DB Services', '4.3']",http://dbservices.com/,Jr. Salesforce Developer (Train & Transfer),"Edison, NJ",$60K - $120K (Employer est.),"Are you the person that people always ask to help them figure out technical problems? Built your own website? Maybe have some computer science background but more importantly are comfortable with technology and interested in what it can do for you? Do you have an eye for detail and design, and are you always trying to figure out how things can work better?
This is what we do every day, and we're looking for energetic, creative individuals to train to help us build custom database solutions for our clients. As a small company, our team enjoys a great deal of responsibility, independence and variety. We work with companies large and small, and we are good at juggling deadlines and priorities to keep a wide portfolio of clients happy.
RESPONSIBILITIES
Develop full stack applications in the FileMaker platform.",1d,
"['Lumen', '3.4']",http://www.lumen.com/,Jr. Salesforce Developer (Train & Transfer),"Edison, NJ",$60K - $120K (Employer est.),"About Lumen
Lumen is guided by our belief that humanity is at its best when technology advances the way we live and work. With 450,000 route fiber miles serving customers in more than 60 countries, we deliver the fastest, most secure global platform for applications and data to help businesses, government and communities deliver amazing experiences. Learn more about Lumen’s network, edge cloud, security and communication and collaboration solutions and our purpose to further human progress through technology at news.lumen.com, LinkedIn: /lumentechnologies, Twitter: @lumentechco, Facebook: /lumentechnologies, Instagram: @lumentechnologies and YouTube: /lumentechnologies.
The Role
The Sr Manager, Software Engineering is responsible for Order fulfillment in delivering premier fiber-based connectivity to residents and small businesses. They will have the opportunity to work on top-class SaaS platforms like SalesForce.com, Vlocity & Zuora. This role requires a love of learning and problem solving, and the ability to guide a team towards implementing architectures and solutions.",30d+,www.glassdoor.com/partner/jobListing.htm?pos=117&ao=1110586&s=58&guid=000001846a83d9cda3eb3fb243642f7b&src=GD_JOB_VIEW&t=SR&vt=w&cs=1_96df3ee2&cb=1668234388879&jobListingId=1008087766103&cpc=3BA4CE39D5B5DEF5&jrtk=3-0-1ghl87mfri4mg801-1ghl87mgfghpk800-246d5789459baff6--6NYlbfkN0BGKj2dVRoMy2japSZrYRM8IJNi6D13enLCCRY5KIhxivFFZS-RDhnzHo57RfGwWo6hSkMSpEqNlbob69-31zYhDFuFtWYmBs-U11dY5D8ZMM1muh3CL3zXVdcrhK66t_zDOpIWbPRhfsrNy2a1P5gEYyv-fjHB2bCF2tza9nO647hSVDyP2OdGee59uQOeZlWac6LUw8I2VXt-bWjSozkxrNEZfqYKi2jn6b4zYhVwrE6TyfXsYM4xvnIbFTTa4CiH2Bf8Afg9WDXEmBdNQE4JUkxDhqiUj7Ri-vtjJSMgL4ya7UT5gcYuGPwV9NwU2ijWIDo5-7FE_dRriRFLCBijYrkwZfGsB51SaJYlSU86xhe7ldejYldxiiplEwd_7P3fjTTZ_jtAJFUUAVkvMZPrRrXUReU60tUsQmDdpy9uXTjsCsHSeIY8OX4OSGWCc7hXk8L5T8AsXrZaxYJFmzlAXZE46AdPsW8GvArBQM1wo1OkDdQdsoTxBFZ135gIJkxoJS3YfHCrEuoIYCuZwTuNgSJy6awrnfE49JrFH6tV7CWrod7GJpUXln45PYoDGE-Sg5b5LnDnqzzU8a1zENF6bn-N34VcNap5TV9jmRMf6Y6hfq5p2C72zjwRDx-7FhfLq0wsnqhNCWCwBJk9fPJiASPVoy3SaAAlrDeduDljwo_RVlcFqgcRS_yta53vXYhgQWCWWBLouW8kX3H1dSxT4HpM4Lv1p5kWEWyNqUxn8DOMpNaizyKHqi60IrfhpXc5s9g8l31_lrqgHj-eABqviEaKUxFmjSB1wpD_wezT30l73NQW0d1wJGBctDQazGx5lpmQ9Tap35wWXR_4Pv-R5ic_-ciZGloMxF52HcaAocG1EJbYEX6ptTlzxpDGPvShCHSNPFBjgqle02c-4fPUhei7TKAGe3ZnmvwaoMjGvlyKMry8_FMcLHtlbZ5vpNYMq3ZNaXoMOgY3l1LSHb2U8ChTjFIiOTx1MD3f5ECOVsi8GpgePCratoJniFDojCqF2dTHIbCi2f8zjWYI3SBSmFaDU6qGiUdELMYsyZCyTFVl4VdVRkHz_Ap0X-xk_naYK3alu9_yagnooOjLlAKFZkwN7wROplvNa8nqOC2gVHkWlAgyKUkSKbDjK00PR75wMZ0EBPnFzg%3D%3D
