Company_Name,Company_Link,Title,Location,Estimated_Salary,Job_Description,Job_Age,Application_Link
"['ePayPolicy', '4.3']",http://www.epaypolicy.com/,Integration Specialist,"Austin, TX",$53K - $75K (Employer est.),"ePayPolicy is the leader in e-payments for the P&C insurance industry. We’ve built a payments platform to enable all our market segments to easily track, report, and send /receive payments to anyone at any time. Our clients include independent agents, premium finance companies, wholesalers, and carriers. By way of our cool inventions, we empower our clients to speed up receivables and bind business faster throughout the insurance purchasing process. By integrating with over twelve different industry management systems, our clients immediately notice the ease-of-use purchasing experience and boosted productivity. Trusted by over 5,500 clients nationwide, ePayPolicy makes insurance payments super easy.
We’re based in Austin, TX and have clients in the US and Canada. Founded in 2014, we have the support and backing of Serent Capital, one of the top private equity firms in the US that invests in high-growth software and services firms and manages over $2B in committed capital.
We’re looking for an who is obsessed with delivering world-class service to join our vibrant company that’s growing fast. This role will be a key-player on our support staff and tasked with responding to customer inquiries lighting fast while being available at a moment’s notice when customers call for help.",30d+,
,,Integration Specialist,"Austin, TX",$53K - $75K (Employer est.),,11d,
['VForce InfoTech'],,Integration Specialist,"Austin, TX",$53K - $75K (Employer est.),"About the Company: -
The mission of VForce InfoTech is to provide world-class technology solutions to our clients. VForce Infotech provides exceptional, experienced individuals to our clients at great value. What differentiates VForce Infotech from our competitors is our focus on developing strong and lasting relationships with our clients.
Benefits Of Joining V-force: -
We have an upcoming project & we are in the hiring process, 0-5 Years of experience as a Python/Angular
Free Training is Provided On Python on the current projects.
We accept all work authorization categories. (OPT, EAD'S, GC, Citizen)",30d+,
"['The Salvation Army', '3.4']",http://www.salvationarmy.org/,Integration Specialist,"Austin, TX",$53K - $75K (Employer est.),"Do you want to use your skills and talents to make a lasting difference in the world? The Salvation Army Central Territory Headquarters is seeking a motivated and experienced professional to join our Community Relations & Development Department as a Salesforce Developer. The Salvation Army is one of the largest charities in the United States and is an international organization based on Biblical principles created to help people in need. We are mission-driven, diverse, collaborative, and focused on positive results for people. Join our team to help support our mission by Doing the Most Good!
Central Territory Headquarters LI
The Salesforce Developer will develop customized solutions within the Salesforce platform including analyzing project objectives, creating customer workflows, and troubleshooting errors. Must create dynamic and scalable Salesforce applications that meet the changing needs of the organization.",7d,www.glassdoor.com/partner/jobListing.htm?pos=104&ao=1110586&s=58&guid=000001846a7de4e2a6cde87dbe6664c7&src=GD_JOB_VIEW&t=SR&vt=w&cs=1_d2796ad2&cb=1668233962984&jobListingId=1008258266397&cpc=7F6F94E2229B3AB5&jrtk=3-0-1ghl7rp8umbgs801-1ghl7rp9jghqn800-6b024ba835ea2c32--6NYlbfkN0A2tbi2cDMXla_72nFEMMu16PytJh_I7TY0l-JiQC6Z4TeTwD191Z-GdBzG9p8M1bTxBEhz04TsX32ZZWlzc5ZhlQRWzsuvQNgTVxhzQzyXTSO-C2aboB8rtUxwR610JOVws3sswb4YkCM04gZ52tbVYdBlDWwioDpuwPQC-ZVD1sOOEBCCUeXOhf-ZN2v1TD5QU0sgJmUS-xVRwBoSGTSKCvD-fhjrxu_UHmeVodzm9IHbnOHz1nycjFwiHuK3cHEtwoP7jmSXH1Uco67iTpGw_hHP5S8kbE5UDM3FeYXXw0SDZJ2LUXbbrvyMIKoM1iW_Z1LhRbRX3_PndP55VG43GuK9sclGZHFcBOAnEj8X-luEuQSCapgEpYkkyjBGIGXVt39DRpX__REKPirASPrqa7SkQPEbjuOZkLhoPir2QwcUPTPxBNC84rLqKdq3eLtiRCb-JWBgQQz9Z9qkKGHdh6OnevnVzx88HaTifKICnbKdD4D_32pmxLhaj0u5IyyV3Fc4q4GnNqY9gM-0mHo8yUKieJK8Az27fTEo5ccfebKvzR5BM_OzKmr8Pz0RG6Cyx89ZfZHv9VUMshlnMycrxsfDhGlFL-Txh5HPta49fw%3D%3D
"['The Computer Company, Inc']",,Integration Specialist,"Austin, TX",$53K - $75K (Employer est.),"Full Stack Programmer
We are looking for an outstanding Web Developer to be responsible for the coding, innovative design and layout of our website. Web developer responsibilities include building our website from concept all the way to completion from the bottom up, fashioning everything from the home page to site layout and function.
Responsibilities
Write well designed, testable, efficient code by using best software development practices
Create website layout/user interface by using standard HTML/CSS practices
Integrate data from various back-end services and databases",10d,
['10X Health System'],,Integration Specialist,"Austin, TX",$53K - $75K (Employer est.),"POSITION SUMMARY
The Director of Technology will streamline the deployment of critical systems that will transform and automate 10X Health’s processes. The role will serve as the lead architect for our Technology team. The ideal candidate will have at least 3 years’ experience in designing and implementing new systems, and work alongside the Operations team to ensure a smooth transition and anticipate any potential roadblocks. The Director of Technology will have the opportunity to recruit and develop an engineering team. This position is challenging due to the highly-regulated nature of healthcare, and more specifically high-volume, e-commerce focused nature of a Grant Cardone business. Selling healthcare services to groups of tens-of-thousands of physical, in-person customers or virtually to millions of Grant’s followers poses really unique challenges to a healthcare technology health stack.",4d,
"['KEY', '4.0']",http://key.co/,Integration Specialist,"Austin, TX",$53K - $75K (Employer est.),"KEY is leading a third wave in the travel industry by developing technology designed to revolutionize the delivery of local, curated experiences around the world. With KEY, concierge service with local knowledge is readily available at your fingertips wherever you stay, making travel effortless. With our proprietary recommendation engine, advanced technology platform and with our growing global concierge network, we help traveler’s make memories, not plans.
Your Role:
In your role, you will be responsible for developing business features and technical capabilities within KEY's Salesforce Service Cloud and Marketing Cloud instances and related data, services, and applications. You are highly familiar with our core data models and APIs in Salesforce and internal data systems and how Leads, Opportunities, Accounts, and Contacts map to key business processes in our Concierge Operation and Business Development groups. You will partner with Sales and Operations Leadership to identify, prioritize and execute the strategic roadmap of systems enhancements to drive scalability and operation efficiency in the business.",8d,
"['Resource Innovations', '3.8']",http://www.resource-innovations.com/,Integration Specialist,"Austin, TX",$53K - $75K (Employer est.),"Resource Innovations is seeking to hire a Software / Web Developer to join our growing team that is focused on delivering solutions to increase the adoption of energy efficiency and clean energy technologies. As a Software / Web Developer, you will build systems for data intake and develop integrations with internal and external (partner-facing) software systems. This is a unique opportunity to utilize your IT skills to have a meaningful impact in the clean energy space that will help solve climate change issues, while working for a great company.
Resource Innovations, with recently acquired Nexant, is a substantially woman-owned and woman-led energy consulting firm dedicated to creating equal access to clean resources through diverse partnerships. The company’s deep roots and broad expertise in resource efficiency, policy development, coalition & partnership building, and market-based technology support enable the delivery of highly successful energy programs. Nexant brings over 20 years of expertise in demand-side management, grid management and renewables as well as a comprehensive suite of software designed to support these initiatives.",9d,
"['DB Services', '4.3']",http://dbservices.com/,Integration Specialist,"Austin, TX",$53K - $75K (Employer est.),"Are you the person that people always ask to help them figure out technical problems? Built your own website? Maybe have some computer science background but more importantly are comfortable with technology and interested in what it can do for you? Do you have an eye for detail and design, and are you always trying to figure out how things can work better?
This is what we do every day, and we're looking for energetic, creative individuals to train to help us build custom database solutions for our clients. As a small company, our team enjoys a great deal of responsibility, independence and variety. We work with companies large and small, and we are good at juggling deadlines and priorities to keep a wide portfolio of clients happy.
RESPONSIBILITIES
Develop full stack applications in the FileMaker platform.",1d,
"['Capital One', '4.2']",http://www.capitalonecareers.com/,Integration Specialist,"Austin, TX",$53K - $75K (Employer est.),"Locations: US Remote, United States of America
Lead Software Engineer, Salesforce - Financial Services Technology (Remote)
Do you love building and pioneering in the technology space? Do you enjoy solving complex business problems in a fast-paced, collaborative, inclusive, and iterative delivery environment? At Capital One, you'll be part of a big group of makers, breakers, doers and disruptors, who love to solve real problems and meet real customer needs. We are seeking Salesforce Software Engineers who are passionate about marrying data with emerging technologies. As a Capital One Software Engineer, you’ll have the opportunity to be on the forefront of driving a major transformation within Capital One.

What You’ll Do:


Location is New York City
Location is Colorado
No agencies please. Capital One is an Equal Opportunity Employer committed to diversity and inclusion in the workplace. All qualified applicants will receive consideration for employment without regard to sex, race, color, age, national origin, religion, physical and mental disability, genetic information, marital status, sexual orientation, gender identity/assignment, citizenship, pregnancy or maternity, protected veteran status, or any other status prohibited by applicable national, federal, state or local law. Capital One promotes a drug-free workplace. Capital One will consider for employment qualified applicants with a criminal history in a manner consistent with the requirements of applicable laws regarding criminal background inquiries, including, to the extent applicable, Article 23-A of the New York Correction Law; San Francisco, California Police Code Article 49, Sections 4901-4920; New York City’s Fair Chance Act; Philadelphia’s Fair Criminal Records Screening Act; and other applicable federal, state, and local laws and regulations regarding criminal background inquiries.",24h,www.glassdoor.com/partner/jobListing.htm?pos=110&ao=1110586&s=58&guid=000001846a7de4e2a6cde87dbe6664c7&src=GD_JOB_VIEW&t=SR&vt=w&cs=1_fbd673f1&cb=1668233983456&jobListingId=1008275077788&cpc=F41FEAB56D215062&jrtk=3-0-1ghl7rp8umbgs801-1ghl7rp9jghqn800-78340e981aa21d3f--6NYlbfkN0C3j_zLGvpMLCdiZ0WC46XqVTA1VMZzOzKXPhAXwYlrNb9EbKZEg8x0tL4Jn_n-27VH1zKRpsA2uyvrxM8R0_EsfpVlSrh1BgLivpWzmHap9xzqUUoNahMJGkK85GjMKIBwBez8tn5O0rPPW74JHNhKO6T9NpFTDJNCeSODMhNVj-4W5vfN7MDpyOZkh6n7zR5Bq_KokQe-JqNuhrsKcBhUeoqfUcVt5t_f-zLrfeRDDnFDD94xOHzkUlfAE1QiY2dCmkdH5Dcl4YKdHMnawklDu6xTbG60YYfpGWi-Y9XSWh-sDy5trzqbZGzsV66_JCVU0GYuvqoXGIDmHV0SDSYrLt7YC9HoUoWcu8Z8s4TIOYv2qSVYKo6hnRtXGurI753IOLasQ4S2J8j3328knJUHxuHpGJVnr_TDExo_S3uzScPVqgCHX4SI5yFwn3lQUDY%3D
"['National Kidney Foundation', '2.9']",http://www.kidney.org/,Integration Specialist,"Austin, TX",$53K - $75K (Employer est.),"GENERAL SUMMARY
Want a career where your work matters? Where your skills make a real impact on an important problem? Where you change people's lives for the better?
For more than 60 years, the National Kidney Foundation (NKF) has been the leading health organization dedicated to fighting kidney disease. From patients and their families to those at risk, we take pride knowing that our mission is positively impacting the lives of millions of people affected by kidney disease.
As a Drupal Developer at NKF, you will partner with a variety of stakeholders to translate ideas into impactful digital experiences. You will build and maintain high-quality digital products to support NKF’s mission and constituents.",15d,
"['Mecum Auctions Inc.', '5.0']",http://www.mecum.com/,Integration Specialist,"Austin, TX",$53K - $75K (Employer est.),"Full Stack Developer
What can Mecum offer you?
A place where your work can have an impact - working closely with a tightly-knit team to build meaningful and engaging products seen and used by millions of people around the world.
A place where you can stay up to date on the latest technologies - exploring new protocols, platforms and architectures.
An organization that will give you a great work/life balance, an opportunity to level up your skills and the chance to increase the visibility of your portfolio of projects.
Our Team Culture",30d+,
"['West Shore Home', '3.4']",http://www.westshorehome.com/,Integration Specialist,"Austin, TX",$53K - $75K (Employer est.),"As our nationwide growth accelerates as, our remote Business Systems team plays a key role in driving forward our mission of Bringing Happiness to Every Home® by aggressively implementing new systems and custom applications to achieve unparalleled success in serving our customers and optimizing our business.
As a Salesforce Developer at West Shore Home®, you will contribute to this mission by leveraging technology and data to help deliver projects and tasks from the Business Systems Development roadmap with speed and quality across every line of business.You will report directly to the Sr. Business Systems Developerand work closely with a team of Salesforce Administrators, Salesforce Developers, and Project Managers, as well as over 2,000 end users and internal stakeholders.
What You’ll Contribute",7d,
['Vale Group'],http://www.valegroupco.com/,Integration Specialist,"Austin, TX",$53K - $75K (Employer est.),"Vale Group has partnered with a publicly traded company in the commercial real estate industry, based in New York, NY, who is actively searching for an experienced Business Intelligence Developer to work HYBRID (4 Days in Office, 1 from home) - New York, 10018
Candidates must reside in NY and be eligible to work in the United States (no C2C or sponsorship available)
The ideal Business Intelligence Developer candidate will have experience in the software development life cycle on an enterprise-level scale and be able to use project management and analysis skills to design and implement data management and analysis solutions.
This Business Intelligence Developer opportunity pays up to $120k and includes an annual bonus and full benefits.",17d,
"['Fidelity Investments', '4.3']",http://www.fidelitycareers.com/,Integration Specialist,"Austin, TX",$53K - $75K (Employer est.),"Job Description:
The Role
We are looking for a highly motivated, Salesforce developer to join the Fidelity Charitable Digital Technology’s CRM Engineering team. The candidate will provide critical support to 400+ Salesforce.com users and will be responsible for developing/automating business processes that will drive scale and efficiency.
The Expertise and Skills You Bring
Work closely with Salesforce team and business partners to translate the vision of business partners into solutions on the Salesforce Sales Cloud platform",1d,www.glassdoor.com/partner/jobListing.htm?pos=115&ao=1110586&s=58&guid=000001846a7de4e2a6cde87dbe6664c7&src=GD_JOB_VIEW&t=SR&vt=w&cs=1_b1f7dfbc&cb=1668233995196&jobListingId=1008272402985&cpc=9908D8D4413DBB8A&jrtk=3-0-1ghl7rp8umbgs801-1ghl7rp9jghqn800-73b17a545dda5902--6NYlbfkN0BW1y-sVf2FbT16t_Bu2BTFedSVw5nPA7tBe60hU8fhWRtLLFIMdNt0kG-6d7WgBOkdcnkZS4KJNrtJ8Kq6YUd3etERqEvDpEbBbqGBLIGIGBm0LBrEWQl2PA299U8wPV4c9KBiOGVuYnimp4iS-JNfphFX3C_rE75jhpgXDP5CnCKDIYFvRrLNXrPO_xVr-PfqPUiFhN57lyT_HyAqgTT5EJEk9xCcjejtPfmxLjjS5bcC4tBVQwtnw-HkRiybvAHyBpjdpSfwSRZOmib53dR3m3TFB4crTQr82lyk7p0zh2GrWOfST60v4G2CkR412f2Bl6rZtyB7PXdgoDPbODfGLd7OzEcfXCOetxbmz9Lw51jqBG3XJFOk7VjqshAkTFXlicwe4Na1BU-aTyNXssBTZ7c2cmis4pZu0g0zqzn8ymFd-Ycck5_fKPBRNyo8lGo%3D
"['Zillow', '3.9']",https://www.zillow.com/,Integration Specialist,"Austin, TX",$53K - $75K (Employer est.),"About the team
Zillow’s Salesforce team supports our growing business lines by working closely with operations, sales, and other product teams to develop creative and sustainable solutions. We are a group of Salesforce experts that understands the pros and cons of the platform and are eager to use the right tool when tackling a problem. We have the ability to think out of the box and challenge the status quo not by building on what we already have, but coming up with new ideas that spark innovation and creativity. We operate in scrum teams, strive for collaboration, and keep our users in mind while tackling enterprise challenges.
We believe in autonomy – Our Core Values include “Own it” and “Move Fast, Think Big.”
About the role
This role has been categorized as a Remote position. “Remote” employees do not have a permanent corporate office workplace and, instead, work from a physical location of their choice which must be identified to the Company. Employees may live in any of the 50 US States, with limited exceptions. In certain cases, an employee in a remote-designated job may need to live in a specific region or time zone to support customers or clients as part of their role.
In addition to a competitive base salary this position is also eligible for equity awards based on factors such as experience, performance and location. Actual amounts will vary depending on experience, performance and location.",30d+,www.glassdoor.com/partner/jobListing.htm?pos=116&ao=1110586&s=58&guid=000001846a7de4e2a6cde87dbe6664c7&src=GD_JOB_VIEW&t=SR&vt=w&cs=1_114d466b&cb=1668233998126&jobListingId=1007943786883&cpc=3BA4CE39D5B5DEF5&jrtk=3-0-1ghl7rp8umbgs801-1ghl7rp9jghqn800-5bc4bd13aed52f2f--6NYlbfkN0ANMurRYyPEXg08u6OamUd1Mvhk-zhFSGYIZgoJR86UvQ_x0FKK8TrZPiQOr9Yn9As2IJdQZAH_AnYVOP9a7MTTYatg1UelNFWNL_qSzQBiJvz0y2KZyTciy26HiaTSLkQPI2RiE9Hzi5tdIxyBaxnxrXMq3WZmA_yE1ym79GC__f8xNUGbjmStWQrkshkNwPvuYP0q_cUkl5QlfjDgC6tyKPvGMKy1RPxbLzibvN8z9xIrC9a4XgBDFiMBQ9Di6ugYpsX9kSxBT8eTMdkeTbFIaokKCt-wv2GgIiJqHoGBgNPGBV27pDUGatAyuITEdMwfvwyGNcI4yS83I0YuT3yXlG3mKicJyCrbSDtmyoFuzGaSKsyIdwr9rCG3ORYXhROyzna1WOUHm5tFhYsXFXFG6h_0dEGacSYF3tkpB8yCtSgjCf2yEkTKUqYFqz1LAKd8y1uIaqtojaBgzOriHnDR_SqyFa1VMPSTqsoQl5RJfsyexCP-Q6uY79mkpEhxQN2plwCPX1fO2qSh3vYzqUH9y8WaBxLO_SC2uPZkqh-boZWoTm7A-Yyooq5EeLrlUoa-vQsfHx7qiOvDmKKXUbc0iSZ6SJObCIRe0lYHJ8mOclqdyAb6XHVzbElz8h9mHe-kky9Tkk_EPrCh9ymXX-zPxw92kVsc7tJEByPiWfHgoMtHWmVgeE_j_escYVFuVNJq75I_5YoDCcrKnyZk5OtDOKtksmSOT29_XFxZF13v3c6PhH-FmgIQiyDxgdVHxb7vvIt2ZRhLd-tLwd6N0HK9ev8l-zlixdxqTYSMKDGkshX9PkUflH2_b7KRHU0vwKytgVwKgPr7lfAfhR8WFIiwsUSSqrf2_LU2R-atg1Ew7g_pl963cedVH7OgweleVlbrK6iEuR80WyEWzK3nNZZUUxAFWMxqjnUZ1W809BS1OyWrTnF9zGJrgfiQXYCkMqAgirJOTbRxN8UfSlcLKaaTxk16H_V-VbY%3D
"['Lumen', '3.4']",http://www.lumen.com/,Integration Specialist,"Austin, TX",$53K - $75K (Employer est.),"About Lumen
Lumen is guided by our belief that humanity is at its best when technology advances the way we live and work. With 450,000 route fiber miles serving customers in more than 60 countries, we deliver the fastest, most secure global platform for applications and data to help businesses, government and communities deliver amazing experiences. Learn more about Lumen’s network, edge cloud, security and communication and collaboration solutions and our purpose to further human progress through technology at news.lumen.com, LinkedIn: /lumentechnologies, Twitter: @lumentechco, Facebook: /lumentechnologies, Instagram: @lumentechnologies and YouTube: /lumentechnologies.
The Role
The Sr Lead DevOps Engineer understands the software development lifecycle (from coding to support) and has the understanding of various automation tools for developing digital pipelines. This role will shape how Lumen combines the latest technologies and services to automate all aspects of software deployment and instance lifecycle management. He/She is passionate about software automation and quality is always a priority. This role will collaborate with key stakeholders across the organization including but not limited to executive leadership, product owners, developers, and testers to plan, develop, and implement solutions to optimize and automate business and technical processes. This role will have responsibility for translating product vision and turning requirements into reality.",8d,www.glassdoor.com/partner/jobListing.htm?pos=117&ao=1110586&s=58&guid=000001846a7de4e2a6cde87dbe6664c7&src=GD_JOB_VIEW&t=SR&vt=w&cs=1_b8963f86&cb=1668234000215&jobListingId=1008254407402&cpc=9908D8D4413DBB8A&jrtk=3-0-1ghl7rp8umbgs801-1ghl7rp9jghqn800-90a4f70289cadafd--6NYlbfkN0BGKj2dVRoMy2japSZrYRM8IJNi6D13enLCCRY5KIhxivFFZS-RDhnzHo57RfGwWo5SgZOH03UewI64fVIM73jMt3ssL-Tvjr4HBZ-bjxgZiScV_TCl8Q2kiVPUqKY8HS2QkxOgtUcNFJ-v855W4u9iUBhQUCRv9VwAx3lYpIgIiNsUWuqaMxEpP2GRLTK4YOmZpukQvDScwaT4iYpYC20TXdGw1EgubBYNBGikBCJPC3LgxySBOpqOMBOKasIIiTURck0rYaFHIKwdED54JyMG7O13TuRdHw9SCWKw-0JWUPmsRZSuBs62iAqE_haZy_T-5njB23-OqdX_nXnERtuc4oxZAoQJqk9RW3rFw6tf3X9r68mY6dXoJyAzsGAQIoDkHVrA7x55wexPa2xwiMS5-dQIMSP6l-A_zo4jRESNM1QFTzjLNyPCbQD-BHd2BjsCYchDs2G2JcopKcvTHLOAGpWQKsXVTY9Nx59KDXxj1o-QnwhsujM4jNeEjFEfK6HTNjmLH76JT0KmzzeY8sup8P_uWJBvsxtWyXI1iy5W2PApSDVC1fLfzrNYAb3Zlzs-mqI7sz4TJSIjio5Hc0TV8g0It_gtNZawyIP0CtL4L60aLmYDI1lt4-ZZT1zC1KWlGyzOOCsvZcz40bOvktmng5KFwq0gkF2hyWwlOQzlP_OKrVOnuZD-s2LNWUQnxTIpKX_olovRCC2TNmMbYdePtz6QZwHP8FRLkwr6e9CW_tmp4tVik_olrqjiR0J2NthhHSiHb8-mlFzaMQvQxMheVVInqzLmHI_wo1S8S-XCnh3OZk3-JDcTyQOB-mFXGtskFBzSKRWPqDIGssykdyEQRGahPtG5gmnyHmsDFj_H1LCQO1-mkBOMEctCdlTNkml54sBAAX-tx2rkIrBsyivs9dGpMPOuHl_pF5UkH0etea817NSLgIGMdVy4bVLzzl1lvgoeLtUb3HQfY6La4EApZHsDHAvJLRyqyDMjMV1sXfDZuD71vGy_ZST3Pli9qibA0ffOBgkn3ZgULl9X757FJNzxld5qZAv73ctmfsxV4nEmA-f2hNqPSxjJyR5lWaXuaybn6Gl6L0TEbZ5qai5LnRA2xWFNpJShwNb0QgxQ-F36pe1CxvRMQskdHWqRw0s%3D
"['Lumen', '3.4']",http://www.lumen.com/,Integration Specialist,"Austin, TX",$53K - $75K (Employer est.),"About Lumen
Lumen is guided by our belief that humanity is at its best when technology advances the way we live and work. With 450,000 route fiber miles serving customers in more than 60 countries, we deliver the fastest, most secure global platform for applications and data to help businesses, government and communities deliver amazing experiences. Learn more about Lumen’s network, edge cloud, security and communication and collaboration solutions and our purpose to further human progress through technology at news.lumen.com, LinkedIn: /lumentechnologies, Twitter: @lumentechco, Facebook: /lumentechnologies, Instagram: @lumentechnologies and YouTube: /lumentechnologies.
The Role
This position is an individual contibutor role in developing tools to support Planning and Engineering groups in the management of key company initiatives and strategies. Includes partnering in a team environment or be able to independently design, develop, code, test, debug and implement database applications to accommodate user needs of moderate to complex scope and difficulty including graphical user interfaces and interfaces with other systems.",8d,www.glassdoor.com/partner/jobListing.htm?pos=118&ao=1110586&s=58&guid=000001846a7de4e2a6cde87dbe6664c7&src=GD_JOB_VIEW&t=SR&vt=w&cs=1_ea442a0a&cb=1668234002067&jobListingId=1008254778688&cpc=3BA4CE39D5B5DEF5&jrtk=3-0-1ghl7rp8umbgs801-1ghl7rp9jghqn800-436040525408e14a--6NYlbfkN0BGKj2dVRoMy2japSZrYRM8IJNi6D13enLCCRY5KIhxiqDWzAuo1mcQH2KXrzaN_GnD1_4iVLFRQ5jLF1eHs9f0qt2jdHmrosFKDbwOdGc3xabAG7WGHelCpCJ12t8mL4N3CGf3WPKuWApsAdmPC-Y1bk0Q9kZADjW5KJtXMXCe7Gg3l5jcj_WE5QXBv6v6c5eiLPprOtWUB8umlJDRynPhGBy55mltIYkw-16kgp93D0cjlEbmdnJ1o5nDlYq732rTYLiO8TizkebHkjDZObyVmsgom4Zw3aDQ5OseKn0sDpxJ9-9y4ykei8ZahQFAPVfyANTjmhDclbYN6fz-WS8nVIGJwuxWiXtzwtLIZYPJFk-QmNjq1lUrBVhZvVzIlsoKlrTLXbrVgKq50dWsyjXERTNnQBK2w0L4dc9QB7NcowrYrGe_iBnvy9I1vGkwQbJ5fxAYlvgS_SCsfga1c5TQ59jry7vi_suDjXviQ5fQd-bA6mk6gfax0-CwA--YPn8FkwH5ewlDLKT54wwSkFtuGOfvLkf9336qmIwsHQZx4efkC-sqtxyvn9WT0IdWa9itWdNI02uvGKubdZVGWNUDKJcvW87JLDPyxeeGvMVIgOiPlpBIqSt-nPE2WF79oN9-ocKaNg9rmrOgoHQ6uzKzCyDhFknvQABW2ODFEKzi4dDl7KckLuCmRf8goBr3DLNQM9_uXly1t1JyjeEWBccJXYy4dw1xdZcIAFONmb78Kr76TOwI4RA0_q28TlTTNIHlnpAA8_gFp5gHYbLDsFBSnCUjyzxkTL2eAo6UXpFE2RES0Xd6fkVVEKJuQdgPuw3aJsJINq7zAvbULwpiirVdfsiu8ZjzV-81PZflo0gLYNL3E8hSZUpHfYjRYYyx37kX-ssMSPuXE3DxDgpgqSh9EsqxJMn5-QEXQc26pnOjYdKxm8KJ-lpejo3tkOAMyfSK2V05NlDBlOg4KchBwU302xqtv04Rl4auFKn-doZf7cHuG3SqKuEwaS6jOO-YGjsIEAyLK6IUz94hKljGfffBjyvu4Q_GA5GR4ev3EysFcxyoYLPUBWuzeZdD_J-Do4yVjcCPGH1jebhQCw1K9KORsVhHqFqgSNuSsLJnhmmKWmTqZjLanHhu
