Company_Name,Company_Link,Title,Location,Estimated_Salary,Job_Description,Job_Age,Application_Link
"['Amazon.com Services LLC', '3.8']",http://www.amazon.jobs/,Senior Chemical Engineer,"Louisville, KY",$111K - $166K (Employer est.),"1+ years of experience contributing to the system design or architecture (architecture, design patterns, reliability and scaling) of new and current systems.
2+ years of non-internship professional software development experience
Programming experience with at least one software programming language.

Job summary
The Supply Chain Optimization Technology (SCOT) manages inventory under uncertainty of demand, pricing, promotions, supply, vendor lead times, and product life cycle. We optimize tradeoffs among customer promise, Fast Track in-stock, sourcing cost, transportation cost, holding cost, inventory obsolescence, FC capacity, and FC location. In addition, SCOT automates and optimizes Amazon's global supply chain for physical goods.

Automated Inventory Management (AIM): AIM’s primary objective is to maximize long-term free cash flow (LTFCF) improvements for Amazon by auditing SCOT systems and improving inventory outcomes. We drive improved supply chain outcomes through automated mechanisms and tools that inspect across the supply chain and identify defects and improvement opportunities. We are auditing the gap between successful team specific SCOT enterprise metrics and changes in desired business outcomes that are not necessarily defect based. We scale our defect repairs through fixing root causes with functional owners first and then moving to direct automated short-term repair where possible. Some defects may need an application change to be planned with the source team for the long-term repair, and in this instance, our automated repairs will provide interim support until the change is implemented.

Forecasting: Topline Forecasting enables and drives decision making on Amazon’s long-term business growth investment. We provide the aggregate forecasts, insights, and decision support products, in the form of automated solutions and strategic guidance. Topline Forecasting is used to drive hands-off-the-wheel financial planning and operations planning processes, producing long-term predictions of Prime membership, Prime Member Ordered Product Sales (PMOPS), ASIN selection, Average Selling Price (ASP), and ultimately shipped units and GMS at a daily grain over a five-year time horizon. Topline is a primary input into Consumer-wide OP1 and OP2 plans, the monthly/quarterly Finance R&O process, Consumer’s annual long-range plan (LRP), Operation’s medium and long-term topology and capacity planning, and Transportation planning. The forecast covers Retail, FBA, and Marketplace Fulfillment Network (MFN) channels across nine marketplaces, 60 unique product groups, 1000+ unique categories, and various segments related to Prime status (e.g., Free Trial versus Paid), customer tenure and B2B/B2C customers.

The ASIN Forecasting team produces ASIN-level probabilistic forecasts of unconstrained customer demand for up to 1 year in the future for 400M ASINs WW sold through the retail and FBA channel as well as stores such as Prime Now and Whole Foods. For a specific ASIN, start date and end date combination, a cumulative distribution function (CDF) of forecasted total demand units in that period is produced. Forecasts are produced at multiple region grains (country, zip2, stores and aggregation of countries). In addition to production forecasting models, the team owns the Forecasting Distribution Service (FDS), a Tier-1 service with a P90 SLA of 40 milliseconds, which can be called over 4 billion times on a single day. This service has over 50 unique customers, made up of various teams and business groups within and outside of SCOT such as Inventory Buying, Optimal Inventory Health, Inventory Placement, Selection Economics, FBA and S&OP. One of these customers, SCOT Continuous Buying, uses these forecasts to trigger the buys of over 4 billion units WW.

Fulfillment optimization: Fulfillment Optimization focuses on delivering items to customers quickly, efficiently, and reliably. We own a suite of Supply Chain products and services that forecast the need for transportation resources, optimize the network set-up/configuration, determine the operational capability (warehouse, fulfillment and transportation), map the inventory and transportation resource capacity/availability, and accordingly provide the best delivery promises to customers. Once the promises are made, we identify the cost optimal fulfillment plan and orchestrate the shipments making sure that the promises are met and CX is preserved.

Inventory planning and control: The Inventory Planning & Control group determines how much of a given product is needed at each location in our network in order to ensure product availability, while maintaining minimal inventory levels at each storage location. This includes strategically placing vendor orders and moving inventory between nodes of our network to serve customer demand at the lowest cost. The network topology plan will include locations for capabilities such as fulfillment, sortation, customer returns, inbound prep, cross dock, vendor flex and drop ship.

Optimal sourcing systems: Optimal Sourcing Systems (OSS) designs and builds systems that measure and manage Amazon’s supplier capabilities, identify and react to supply disruptions, and prioritizes inbound freight for our global network. OSS software is used by every country Amazon services, and is a critical link to ensuring Amazon offers the products our customers want, at the lowest possible cost.

SCOT science: SCOT Science provides the science behind SCOT systems. Our community is a diverse group of scientists spanning a wide range of disciplines (applied math, operations research, statistics, economics, computer science) and job families (data scientists, applied scientists, research scientists) - all working on the most complex challenges in supply chain optimization. We work closely with our SCOT cross-functional partners, collaborate with other scientist throughout Amazon and are actively engaged with the external scientific research community.

· 3+ years’ full-time experience in software design and development. · 2+ years’ experience as a lead developer on at least one project. · 2+ years’ experience mentoring and coaching others. · Experience with distributed systems, relational databases, map-reduce solutions. · Ability to effectively articulate technical challenges and solutions to non-technical audiences. Amazon is committed to a diverse and inclusive workplace. Amazon is an equal opportunity employer and does not discriminate on the basis of race, national origin, gender, gender identity, sexual orientation, protected veteran status, disability, age, or other legally protected status. For individuals with disabilities who would like to request an accommodation, please visit https://www.amazon.jobs/en/disability/us.",30d+,www.glassdoor.com/partner/jobListing.htm?pos=103&ao=1136043&s=58&guid=000001846a19348aa4614b41a144879b&src=GD_JOB_VIEW&t=SR&vt=w&cs=1_4d205ccd&cb=1668227362988&jobListingId=1007880315861&jrtk=3-0-1ghl1id6njiis801-1ghl1id79j4hn800-7deed8b708963e55-
"['Seagull Scientific', '4.0']",http://www.seagullscientific.com/,Senior Chemical Engineer,"Louisville, KY",$111K - $166K (Employer est.),"WHO WE ARE
You know BarTender software’s customers. They’re the ones pioneering commercial space flight, developing and delivering vaccines to every continent, manufacturing energy-efficient cars, providing clean water to the world, putting wholesome food on your table and groceries in your cart — and they use our software to create the labels, barcodes and RFID that keep their supply chains moving, traceable and safe.
Our global, talented and diverse teams are passionate about what they do and its impact on everyone, everywhere. Join us and help shape the way the world works.
We are headquartered in Bellevue, Washington, with branch offices in Madrid, Taipei, and Tokyo. For more information about Seagull Scientific, please visit https://www.seagullscientific.com/.",14d,
"['Crown Holdings', '3.8']",https://careers.eur.crowncork.com/,Senior Chemical Engineer,"Louisville, KY",$111K - $166K (Employer est.),"Job Accountabilities
About Crown:
CROWN Cork & Seal USA, Inc., a wholly owned company of Crown Holdings, Inc. is a global leader in the design, manufacture, and sale of packaging products for consumer goods. At Crown, we are passionate about helping our customers build their brands and connect with consumers around the world. We do this by delivering innovative packaging that offers significant value for brand owners, retailers, and consumers alike. With operations in 39 countries employing over 29,000 people and net sales of over $11 billion, we are uniquely positioned to bring best practices in quality and manufacturing to our customers to drive their businesses locally and globally. Sustaining a leadership position requires us to build a team of highly talented, dedicated, and driven individuals.",15d,www.glassdoor.com/partner/jobListing.htm?pos=105&ao=1136043&s=58&guid=000001846a19348aa4614b41a144879b&src=GD_JOB_VIEW&t=SR&vt=w&cs=1_e52bbf39&cb=1668227369781&jobListingId=1008238957994&jrtk=3-0-1ghl1id6njiis801-1ghl1id79j4hn800-f3a5aaf75f072f1c-
"['JLL', '3.9']",http://www.jll.com/,Senior Chemical Engineer,"Louisville, KY",$111K - $166K (Employer est.),"About JLL –
We’re JLL—a leading professional services and investment management firm specializing in real estate. We have operations in over 80 countries and a workforce of over 91,000 individuals around the world who help real estate owners, occupiers and investors achieve their business ambitions. As a global Fortune 500 company, we also have an inherent responsibility to drive sustainability and corporate social responsibility. That’s why we’re committed to our purpose to shape the future of real estate for a better world. We’re using the most advanced technology to create rewarding opportunities, amazing spaces and sustainable real estate solutions for our clients, our people and our communities.
Our core values of teamwork, ethics and excellence are also fundamental to everything we do and we’re honored to be recognized with awards for our success by organizations both globally and locally.
Creating a diverse and inclusive culture where we all feel welcomed, valued and empowered to achieve our full potential is important to who we are today and where we’re headed in the future. And we know that unique backgrounds, experiences and perspectives help us think bigger, spark innovation and succeed together.
If this job description resonates with you, we encourage you to apply even if you don’t meet all of the requirements below. We’re interested in getting to know you and what you bring to the table!
ME/CST Field Supervisor – JLL Meijer
Job Description The ME/CST-Field Supervisor is a medium to senior role and coordinates work duties and takes a hands-on role in operating, maintaining, troubleshooting, and repairing facility equipment on all systems. The FS will assist the Ops Manager with administrative duties and training the Mobile Engineer, CST & Maintenance Mechanic. Responsible for sustaining operations support for facilities systems and will oversee multiple facility service-related work orders to provide guidance and expertise, drive continuous improvements, savings, and best practices. FS will work within a 24x7 supermarket/logistics environment providing operations and maintenance services to controls, focusing on equipment troubleshooting and maintaining equipment such as scanners, cameras, printers,, scales, networks, complex computer repairs, restaging computers, replacing drives in servers, UPS equipment, IBM servers, battery packs, power modules and general maintenance including but not limited to meat saws, meat grinders, chicken rotisserie, deli slicers, and cardboard balers.
Responsibilities will include




Dedicated to supporting production the client by working in a safe, customer focused manner. Must be highly self-motivated.
What you can expect from us
We succeed together and believe the best inspire the best, so we invest in supporting each other, learning together and celebrating our success.
Our Total Rewards program reflects our commitment to helping you achieve your career ambitions, recognizing your contributions, investing in your well-being and providing competitive benefits and pay.
We can’t wait to see where your ambitions take you at JLL. Apply today!",30d+,www.glassdoor.com/partner/jobListing.htm?pos=106&ao=1136043&s=58&guid=000001846a19348aa4614b41a144879b&src=GD_JOB_VIEW&t=SR&vt=w&cs=1_d033ae80&cb=1668227372653&jobListingId=1007947838774&jrtk=3-0-1ghl1id6njiis801-1ghl1id79j4hn800-d7af428c2d63b104-
,http://www.grubhub.com/,Senior Chemical Engineer,"Louisville, KY",$111K - $166K (Employer est.),"About The Opportunity:
We’re all about connecting hungry diners with our network of over 300,000 restaurants nationwide. Innovative technology, user-friendly platforms and streamlined delivery capabilities set us apart and make us an industry leader in the world of online food ordering. When you join our team, you become part of a community that works together to innovate, solve problems, grow, work hard and have a ton of fun in the process!

Grubhub is looking for a Machine Learning Manager to join us and own the Personalization team in our Search & Discovery org. and to help us offer high quality recommendations to diners who are exploring restaurants as well as those searching for something specific. Our team is a talented group of smart, humble data scientists who are passionate about creating amazing products through innovation and strong engineering. With leadership of this team you will be responsible for shaping the team, providing guidance on career growth, mentoring, designing ML algorithms and architecture, and influencing our product vision. Within grubhub, you will be directly involved with building new features to benefit existing and potential users in a highly collaborative environment of other ML teams, backend engineers, and product managers.

The Impact You Will Make:

What You Bring to the Table:


And Of Course, Perks!:",30d+,www.glassdoor.com/partner/jobListing.htm?pos=107&ao=1136043&s=58&guid=000001846a19348aa4614b41a144879b&src=GD_JOB_VIEW&t=SR&vt=w&cs=1_6a2cba43&cb=1668227376714&jobListingId=1008185640395&jrtk=3-0-1ghl1id6njiis801-1ghl1id79j4hn800-41030add77043c83-
"['Bumble Bee Foods, LLC', '3.9']",http://www.thebumblebeecompany.com/,Senior Chemical Engineer,"Louisville, KY",$111K - $166K (Employer est.),"LOCATION
San Diego, CA
DEPARTMENT
Information Technology
About the job
Cloud technology continues to evolve at a rapid pace. We are looking for a rockstar (aka IT ninja) that embraces all the changes, has a forward-thinking approach, loves to research new solutions, and can hit the ground running as business requests and technical challenges are presented.",23d,www.glassdoor.com/partner/jobListing.htm?pos=108&ao=1136043&s=58&guid=000001846a19348aa4614b41a144879b&src=GD_JOB_VIEW&t=SR&vt=w&cs=1_27d2c312&cb=1668227378373&jobListingId=1008218690750&jrtk=3-0-1ghl1id6njiis801-1ghl1id79j4hn800-c3e3371eba3457d0-
"['7-Eleven, Inc.', '3.3']",http://www.7-eleven.com/,Senior Chemical Engineer,"Louisville, KY",$111K - $166K (Employer est.),"Overview:
Who we are
Imagine working in a place where continuous improvement and innovation is celebrated and rewarded; where fast-paced, high-impact teams come together to positively drive results for one of the largest & most iconic brands in the world.

As the only rapidly growing retailer, you may know us as your friendly neighborhood store. You probably know our familiar name, have seen our pervasive logo, and have tried our highly sought-after products, such as Slurpee® and Big Bite®. “Brain Freeze” is a 7-Eleven registered trademark for our 53-year old Slurpee® and with over 77,000 stores globally (more than any other retailer or food service provider), we sell over 14 million a month.








Responsibilities:
Qualifications:",30d+,www.glassdoor.com/partner/jobListing.htm?pos=109&ao=1136043&s=58&guid=000001846a19348aa4614b41a144879b&src=GD_JOB_VIEW&t=SR&vt=w&cs=1_65813ffd&cb=1668227382112&jobListingId=1008197458680&jrtk=3-0-1ghl1id6njiis801-1ghl1id79j4hn800-0a66a6d7fc2c21dc-
,http://www.grubhub.com/,Senior Chemical Engineer,"Louisville, KY",$111K - $166K (Employer est.),"About The Opportunity:
We're all about connecting hungry diners with our network of over 300,000 restaurants nationwide. User-friendly platforms and streamlined delivery capabilities set us apart in the world of online food ordering. Grubhub is a place where authentically fun culture meets innovation and teamwork. We believe in empowering people and opening doors for new opportunities. If you're looking for a place that values relationships, embraces diverse ideas–all while having fun together–then Grubhub is the place for you!

We are looking for an Identity Engineer II to build and support our identity platform. You will design and support all areas of the platform and the business process/rules that move it. Experience with the identity lifecycle is required.
The Impact You Will Make:
Expand the identity platform at Grubhub, adopt new features, and add value
What You Bring to the Table:


And Of Course, Perks!:",30d+,www.glassdoor.com/partner/jobListing.htm?pos=110&ao=1136043&s=58&guid=000001846a19348aa4614b41a144879b&src=GD_JOB_VIEW&t=SR&vt=w&cs=1_5090af2d&cb=1668227383976&jobListingId=1007602276168&jrtk=3-0-1ghl1id6njiis801-1ghl1id79j4hn800-1b615b0da409997d-
"['TechStar', '3.8']",http://www.techstar.fr/,Senior Chemical Engineer,"Louisville, KY",$111K - $166K (Employer est.),"Job Description
Territory Sales Managers are expected to consult with existing and new clients to determine the best
solutions for their client’s individual needs. They are responsible for a group of complimentary
product lines, solutions, services and training that the company offers. Territory Managers will use
those products, services and training courses to develop solutions that meet clients’ needs and
generate business for the company.
The Territory Sales Manager position involves:
Selling a wide range of products to customers in a variety of industries, including oil and
gas, food and beverage, water|wastewater, power and EPC firms
cooperation with internal sales support staff
in accordance with our business plans",30d+,www.glassdoor.com/partner/jobListing.htm?pos=111&ao=1136043&s=58&guid=000001846a19348aa4614b41a144879b&src=GD_JOB_VIEW&t=SR&vt=w&cs=1_7fded3ad&cb=1668227387293&jobListingId=1007655973706&jrtk=3-0-1ghl1id6njiis801-1ghl1id79j4hn800-6dd44e80cc2dd924-
"['C&i Engineering', '3.8']",https://www.cieng.com/,Senior Chemical Engineer,"Louisville, KY",$111K - $166K (Employer est.),"C&I Engineering looking for a talented driven individual to join our team in Louisville, KY!
If you love solving complex engineering problems while providing quality service and developing meaningful networks with clients then C&I Engineering may be the place for you!
About the opportunity:
C&I is an employee-owned, full service engineering design firm providing engineering/design/project management and procurement services to various clients. We are currently seeking a full-time Instrumentation and Controls Engineer in our Louisville, KY office to help us achieve our company mission. This person will be part of the Power & Controls team which is responsible for developing designs for electrical, instrument and control systems and performing a variety of computer-based modeling, design, engineering and planning tasks on projects.",10d,
"['Macquarie Group Limited', '4.1']",http://www.macquarie.com/,Credit Analyst - Distressed and Special Situations,"Philadelphia, PA",$17.00 Per Hour(Employer est.),"Join Macquarie Asset Management, a world-class asset management firm, as a Credit Analyst focusing on Distressed/ Special Situations. You will report to the Head of Fixed-Income research and work with our Distressed Team and have a key role in the management of the firm’s distressed assets platform.
Your responsibilities will include:
Assisting portfolio managers and analysts in managing distressed debt workouts and investments
Participating in and leading time-intensive processes in conjunction with the existing distressed workout professional
Engaging market participants and restructuring advisor/attorney community to assist with existing situations and uncover new opportunities—deep relationship set is vital.",23d,www.glassdoor.com/partner/jobListing.htm?pos=101&ao=1110586&s=58&guid=000001846a19e5cdbd93e3b6e294df83&src=GD_JOB_VIEW&t=SR&vt=w&cs=1_71f83691&cb=1668227402765&jobListingId=1008218395866&cpc=3BA4CE39D5B5DEF5&jrtk=3-0-1ghl1jpg1kuhi801-1ghl1jpgh209v000-b01ece7f2717966d--6NYlbfkN0Buby3bM6xh3PvoctOm6nU0sG10uZOdQYvMWxvRDCBuHZP9gZtXeKBRcHmbm9hxuXAiFOGsRkuiwb2X1WUZDltP_SX8zBDqJlYemxeapWUCIckCrk-OhjJLNgzh8qKjCJfvusDmN3GM5jxtlA8nuyLNvs0xyLxQHhaGi_LhaIuW-TuXA01Qu8OqKsiSLTWsuuik2Fwl4wyTYnIopzXKujM3plmdrlZdM0rgCU7XQH2RKXbiu-3CWMy_ck3sRKBaJ3j0VG5qLuTQ5TXS3dRmsmfRDtB_yHQuLodsYYrc9Jjc-Q0AArt6laJ13VpGIuh3CeRoK_TMkEJAqiMsIidS18bbV7PegH9gIwg5QVxE507uwkx6Yz7sNk2gsP25jFOmS47IqbMSF7KT8sztq4fiAZDe7H9Hsb5fZ0AUhBgd-SOMWdoq_86m02jOEU1WlMwibW6mlARNWISAara3HZiFBgMMTJ9XV73EGI0mzCta8uGHm4vIU5mznw2bQ02kNvoBIRUlXYD42fLdetQ_y90Sgn4lNnwkgVW-rqkvmHQYpZeGvqDN2iKqWLxoaVRv4RNbdDA%3D
"['Elwyn', '3.1']",http://www.elwyn.org/,Credit Analyst - Distressed and Special Situations,"Philadelphia, PA",$17.00 Per Hour(Employer est.),"For approximately 165 years, Elwyn has been helping people with a wide range of disabilities and disadvantages build independent and meaningful lives. Today, Elwyn is nationally recognized as a pioneer in developing groundbreaking programs for children and adults with disabilities and disadvantages. Our innovative culture and dedicated staff enable us to help more than 12,000 people each year to build more independent, productive lives.
POSITION SUMMARY: The Applied Behavior Specialist (ABS) provides intensive on-going behavioral assessment/behavior support plan implementation to individuals diagnosed with Prader-Willi Syndrome (PWS) or other genetic/behaviorally complicated disorders who live in a Community Residential Services (CRS). Individuals admitted to CRS' specialized behavioral programs for placement will receive supports within a highly structured setting, including behavioral interventions. The ABS will be responsible for participating in the continued behavioral assessment across settings, as well as the application of strategies derived from an applied behavior analysis (ABA) model. The ABS will work closely with the clinical team to implement individually designed behavior plans to decrease problem behavior while increasing adaptive more appropriate responses.",30d+,
"['Seagull Scientific', '4.0']",http://www.seagullscientific.com/,Credit Analyst - Distressed and Special Situations,"Philadelphia, PA",$17.00 Per Hour(Employer est.),"WHO WE ARE
You know BarTender software’s customers. They’re the ones pioneering commercial space flight, developing and delivering vaccines to every continent, manufacturing energy-efficient cars, providing clean water to the world, putting wholesome food on your table and groceries in your cart — and they use our software to create the labels, barcodes and RFID that keep their supply chains moving, traceable and safe.
Our global, talented and diverse teams are passionate about what they do and its impact on everyone, everywhere. Join us and help shape the way the world works.
We are headquartered in Bellevue, Washington, with branch offices in Madrid, Taipei, and Tokyo. For more information about Seagull Scientific, please visit https://www.seagullscientific.com/.",14d,
"['Sally Beauty Holdings', '3.1']",http://www.sallybeautyholdings.com/,Credit Analyst - Distressed and Special Situations,"Philadelphia, PA",$17.00 Per Hour(Employer est.),"Overview
Sally Beauty Holdings, Inc. (NYSE:SBH) is a global distributor and retailer of professional beauty products Through the Sally Beauty Supply and Beauty Systems Group businesses, we sell and distribute through over 5,000 stores throughout the United States and Puerto Rico, the United Kingdom, Belgium, Chile, France, Canada, Mexico, Peru, Ireland, the Netherlands, Spain, and Germany.
“At Sally Beauty Holdings, we find beauty in diversity. Our inclusivity and self-expression are what fuel our innovation and growth. You are welcome here, and you can thrive here. We find beauty in YOU. Join us.”
As a Technical Support Specialist I in the Help Desk, you will be the first point of contact for stores and iPad users. You will document and log incidents and address immediate issues to insure quick resolutions to reduce lapse of service to customers.",8d,www.glassdoor.com/partner/jobListing.htm?pos=104&ao=1136043&s=58&guid=000001846a19e5cdbd93e3b6e294df83&src=GD_JOB_VIEW&t=SR&vt=w&cs=1_49bfbfe3&cb=1668227410086&jobListingId=1008255811985&jrtk=3-0-1ghl1jpg1kuhi801-1ghl1jpgh209v000-b3bd7a1a90eee6ec-
