Company_Name,Company_Link,Title,Location,Estimated_Salary,Job_Description,Job_Age,Application_Link
"['Black & Veatch Corporation', '4.2']",http://www.bv.com/,Senior Data Scientist,"New York, NY",$171K - $235K (Employer est.),"At Black & Veatch, our employee-owners go beyond the project. For over a century, we have been breaking down social, economic and geographic barriers by making life's critical resources accessible to all. Working with us, you will help provide critical expertise as we, along with our valued clients, deliver solutions that positively impact communities around the world. Our professionals are our greatest asset, and we believe nothing is more important than the health, happiness and professional growth of our employee-owners. With a focus on flexible work-life balance options, an expanding and diverse workforce, and limitless career growth opportunities, we will give you our best to help you give us your best, and together we can build a world of difference.

Company : Black & Veatch Corporation",3d,www.glassdoor.com/partner/jobListing.htm?pos=118&ao=1136043&s=58&guid=000001846a1b360793dd074156b055f1&src=GD_JOB_VIEW&t=SR&vt=w&cs=1_3e75f20b&cb=1668227534248&jobListingId=1008266161024&jrtk=3-0-1ghl1mdhrjrrj801-1ghl1mdicgsqm800-2c8ebbbf6df4fee4-
"['Shell Recharge Solutions', '3.7']",http://shellrecharge.com/en-us/solutions,"Director, Software Quality Assurance",Remote,$94K - $137K (Glassdoor est.),"Director, Software Quality Assurance
Shell Recharge Solutions is a leader in delivering the new electric mobility future through innovative software, infrastructure, and professional services that empower utilities, cities, fleets, transit agencies, and automakers to deploy EV charging infrastructure at scale. Our technology is connecting EV infrastructure solutions with public and private charging needs in a safer, cleaner, and smarter way. Headquartered in Los Angeles, CA, the company’s global footprint spans across three continents with deployments in 13 different countries.
At Shell Recharge Solutions, we are looking for candidates who want to be a part of something bigger than themselves – passionate, purpose-driven individuals who believe having a career means making a meaningful impact on our business and the world. We believe in creating and doing ‘the right thing’ through responsible and sustainable EV deployment. We are looking for the innovative, driven to find a solution in a complex and dynamically evolving marketplace and look at “no” as just a challenge to find the next “yes”.
Shell Recharge Solutions is seeking a
Shell Recharge Solutions is looking for a to join our team to help us as we embark to sustain our “Best in Class” SaasS platform. The Director, Quality Assurance will oversee the international Quality Assurance organization. The role will report to the Senior Director, of Software Infrastructure and Quality Engineering and work across the engineering and Product teams, to ensure a consistent and reliable platform for Shell Recharge Solutions and our partners.",23d,
"['Berkley', '4.0']",http://www.goberkley.com/,"Director, Software Quality Assurance",Remote,$94K - $137K (Glassdoor est.),"Company Details:
Berkley Alternative Markets Tech, also known as bamtech, is in the business of insurtech. We’re a technology company that blends startup culture with a mission to drive forward five insurance brands within one of the nation’s premier insurance holding companies, W. R. Berkley Corporation. We promote the idea of “best idea wins,” through a process of build, break, and rebuild better. People think insurance is too complex, we don’t. Help us make it simpler.
Responsibilities:
Berkley Alternative Markets Tech, also known as bamtech, is in the business of insurtech. We’re a technology company that blends startup culture with a mission to drive forward five insurance brands within one of the nation’s premier insurance holding companies, W. R. Berkley Corporation. We promote the idea of “best idea wins,” through a process of build, break, and rebuild better. People think insurance is too complex, we don’t. Help us make it simpler.

Assisting the team with developing, testing and implementing projects with internal stakeholders across the organization, including trouble shooting and issue resolution, new application reviews, project development and overall leadership in the SDLC.
Qualifications:",21d,www.glassdoor.com/partner/jobListing.htm?pos=102&ao=1136043&s=58&guid=000001846a1c1e4c8d738aa8a5042551&src=GD_JOB_VIEW&t=SR&vt=w&cs=1_14329a21&cb=1668227552896&jobListingId=1008223573871&jrtk=3-0-1ghl1o7k72bms001-1ghl1o7ksg2ec801-c0ecbfa5a176ab66-
"['Safeway', '3.2']",http://www.safeway.com/,"Director, Software Quality Assurance",Remote,$94K - $137K (Glassdoor est.),"About the company
Albertsons Companies is one of the largest food and drug retailers with 2,300+ stores. The Albertsons Companies family of brands includes some of the most prominent brands in food retailing, with a growing base of loyal shoppers. Thanks to the professionalism, diversity, spirit, and friendliness of our people, we have locations across the U.S.
We’re looking for a Senior Attack Surface Security Engineer, reporting to the Directory of Security Engineering, to define and implement our cataloguing and reporting on our attack surface in collaboration with our Cloud, DevOps, Portfolio Information Security Officers, and application teams.
This position is based at an Albertsons office (Pleasanton CA, Boise ID, Phoenix AZ, Dallas TX) or remote in an Albertsons market area.",3d,www.glassdoor.com/partner/jobListing.htm?pos=103&ao=1136043&s=58&guid=000001846a1c1e4c8d738aa8a5042551&src=GD_JOB_VIEW&t=SR&vt=w&cs=1_ca43a1de&cb=1668227554759&jobListingId=1008266043018&jrtk=3-0-1ghl1o7k72bms001-1ghl1o7ksg2ec801-8c0d761454df5695-
"['ControlExpert Inc', '3.9']",http://www.controlexpert.com/,"Director, Software Quality Assurance",Remote,$94K - $137K (Glassdoor est.),"Do you want to change the world for generations to come? Join ControlExpert! Creating culture and innovation to transform the industry
We are exploding in the US market to disrupt and deliver a digital ecosystem of products focused on transforming the interactive experiences for Insurance Claims industry. We have chosen the Silicon Beach as our home offering a great place to work and an even greater place to enjoy life.
We are seeking startup / agile minded Senior Full Stack Engineers / Architects who are passionate about changing the world positively via technology. The roles will work with our web/platform/mobile applications including existing technologies and innovations still-to-be-created.
This is both a “ground up” and “reboot” position, so a unique combination of early stage startup and mature but evolving business. The candidate needs to be entrepreneurial, a self-starter, great at working with others and leading by example with best practices in digital full-stack development engineering.",30d+,
"[""Hudson's Bay"", '4.1']",http://www.hbc.com/,"Director, Software Quality Assurance",Remote,$94K - $137K (Glassdoor est.),"Location: , , United States
Category: Technology
Job Opened: November 8th, 2022
Education: Bachelor's Degree
Job Number: 220005SP
Job Type: Full Time
Remote: Yes
job description
Day in the Life:
The Senior Security Engineer will help define, build and support security solutions. You will be working with a strong team to help transform the way systems are built, secured, authorized and securely operated for continuous compliance and risk mitigation; partnering with other engineers, legal, and compliance leaders to prioritize various requirements and define solutions that secure our product without sacrificing velocity. Specifically, you will help lead efforts to exploit security patterns and practices with orchestration and automation tools to automate the secure configuration, verification, compliance and authorization of systems. They will be a member of a team with experience maturing organizations software development and security practices. You will be a security champion with experience maturing organizations software development and security practices, who will make data-driven decisions to steer the security posture of the company.
The Salary Range for this position is: $130,000 to $150,000, annually",3d,www.glassdoor.com/partner/jobListing.htm?pos=105&ao=1136043&s=58&guid=000001846a1c1e4c8d738aa8a5042551&src=GD_JOB_VIEW&t=SR&vt=w&cs=1_2cf8e6ac&cb=1668227561453&jobListingId=1008266135976&jrtk=3-0-1ghl1o7k72bms001-1ghl1o7ksg2ec801-6d43f5cc0bf382fc-
"['Reyes Coca-Cola Bottling', '3.3']",http://www.reyescocacola.com/,Blow Mold Machine Operator,"Saint Paul, MN",$24.70 Per Hour(Employer est.),"Shifts: 2nd (2pm Start)
Position Summary:
The role of the Blow Molding Machine Operator is to operate and monitor performance of the machinery, perform quality inspections, detect and correct defects in bottles, changeover machine parts and service the machine per the Total Productive Maintenance/Autonomous Maintenance standards set forth by the company. This role conducts quality tests, isolates equipment issues, removes/replaces failed machine components and determines failure modes by studying worn/failed components and/or machine reports. The Operator adheres to all safety standards and identifies and reports any unsafe conditions.
Position Responsibilities may include, but not limited to:",22d,
"['Amazon.com Services LLC', '3.8']",http://www.amazon.jobs/,Blow Mold Machine Operator,"Saint Paul, MN",$24.70 Per Hour(Employer est.),"1+ years of experience contributing to the system design or architecture (architecture, design patterns, reliability and scaling) of new and current systems.
2+ years of non-internship professional software development experience
Programming experience with at least one software programming language.

Job summary
The Supply Chain Optimization Technology (SCOT) manages inventory under uncertainty of demand, pricing, promotions, supply, vendor lead times, and product life cycle. We optimize tradeoffs among customer promise, Fast Track in-stock, sourcing cost, transportation cost, holding cost, inventory obsolescence, FC capacity, and FC location. In addition, SCOT automates and optimizes Amazon's global supply chain for physical goods.

Automated Inventory Management (AIM): AIM’s primary objective is to maximize long-term free cash flow (LTFCF) improvements for Amazon by auditing SCOT systems and improving inventory outcomes. We drive improved supply chain outcomes through automated mechanisms and tools that inspect across the supply chain and identify defects and improvement opportunities. We are auditing the gap between successful team specific SCOT enterprise metrics and changes in desired business outcomes that are not necessarily defect based. We scale our defect repairs through fixing root causes with functional owners first and then moving to direct automated short-term repair where possible. Some defects may need an application change to be planned with the source team for the long-term repair, and in this instance, our automated repairs will provide interim support until the change is implemented.

Forecasting: Topline Forecasting enables and drives decision making on Amazon’s long-term business growth investment. We provide the aggregate forecasts, insights, and decision support products, in the form of automated solutions and strategic guidance. Topline Forecasting is used to drive hands-off-the-wheel financial planning and operations planning processes, producing long-term predictions of Prime membership, Prime Member Ordered Product Sales (PMOPS), ASIN selection, Average Selling Price (ASP), and ultimately shipped units and GMS at a daily grain over a five-year time horizon. Topline is a primary input into Consumer-wide OP1 and OP2 plans, the monthly/quarterly Finance R&O process, Consumer’s annual long-range plan (LRP), Operation’s medium and long-term topology and capacity planning, and Transportation planning. The forecast covers Retail, FBA, and Marketplace Fulfillment Network (MFN) channels across nine marketplaces, 60 unique product groups, 1000+ unique categories, and various segments related to Prime status (e.g., Free Trial versus Paid), customer tenure and B2B/B2C customers.

The ASIN Forecasting team produces ASIN-level probabilistic forecasts of unconstrained customer demand for up to 1 year in the future for 400M ASINs WW sold through the retail and FBA channel as well as stores such as Prime Now and Whole Foods. For a specific ASIN, start date and end date combination, a cumulative distribution function (CDF) of forecasted total demand units in that period is produced. Forecasts are produced at multiple region grains (country, zip2, stores and aggregation of countries). In addition to production forecasting models, the team owns the Forecasting Distribution Service (FDS), a Tier-1 service with a P90 SLA of 40 milliseconds, which can be called over 4 billion times on a single day. This service has over 50 unique customers, made up of various teams and business groups within and outside of SCOT such as Inventory Buying, Optimal Inventory Health, Inventory Placement, Selection Economics, FBA and S&OP. One of these customers, SCOT Continuous Buying, uses these forecasts to trigger the buys of over 4 billion units WW.

Fulfillment optimization: Fulfillment Optimization focuses on delivering items to customers quickly, efficiently, and reliably. We own a suite of Supply Chain products and services that forecast the need for transportation resources, optimize the network set-up/configuration, determine the operational capability (warehouse, fulfillment and transportation), map the inventory and transportation resource capacity/availability, and accordingly provide the best delivery promises to customers. Once the promises are made, we identify the cost optimal fulfillment plan and orchestrate the shipments making sure that the promises are met and CX is preserved.

Inventory planning and control: The Inventory Planning & Control group determines how much of a given product is needed at each location in our network in order to ensure product availability, while maintaining minimal inventory levels at each storage location. This includes strategically placing vendor orders and moving inventory between nodes of our network to serve customer demand at the lowest cost. The network topology plan will include locations for capabilities such as fulfillment, sortation, customer returns, inbound prep, cross dock, vendor flex and drop ship.

Optimal sourcing systems: Optimal Sourcing Systems (OSS) designs and builds systems that measure and manage Amazon’s supplier capabilities, identify and react to supply disruptions, and prioritizes inbound freight for our global network. OSS software is used by every country Amazon services, and is a critical link to ensuring Amazon offers the products our customers want, at the lowest possible cost.

SCOT science: SCOT Science provides the science behind SCOT systems. Our community is a diverse group of scientists spanning a wide range of disciplines (applied math, operations research, statistics, economics, computer science) and job families (data scientists, applied scientists, research scientists) - all working on the most complex challenges in supply chain optimization. We work closely with our SCOT cross-functional partners, collaborate with other scientist throughout Amazon and are actively engaged with the external scientific research community.

· 3+ years’ full-time experience in software design and development. · 2+ years’ experience as a lead developer on at least one project. · 2+ years’ experience mentoring and coaching others. · Experience with distributed systems, relational databases, map-reduce solutions. · Ability to effectively articulate technical challenges and solutions to non-technical audiences. Amazon is committed to a diverse and inclusive workplace. Amazon is an equal opportunity employer and does not discriminate on the basis of race, national origin, gender, gender identity, sexual orientation, protected veteran status, disability, age, or other legally protected status. For individuals with disabilities who would like to request an accommodation, please visit https://www.amazon.jobs/en/disability/us.",30d+,www.glassdoor.com/partner/jobListing.htm?pos=102&ao=1136043&s=58&guid=000001846a1c91a2b28fbffbead95c88&src=GD_JOB_VIEW&t=SR&vt=w&cs=1_329d23bf&cb=1668227586737&jobListingId=1007880315861&jrtk=3-0-1ghl1p4l0j47j801-1ghl1p4loi150800-7deed8b708963e55-
"['Seagull Scientific', '4.0']",http://www.seagullscientific.com/,Blow Mold Machine Operator,"Saint Paul, MN",$24.70 Per Hour(Employer est.),"WHO WE ARE
You know BarTender software’s customers. They’re the ones pioneering commercial space flight, developing and delivering vaccines to every continent, manufacturing energy-efficient cars, providing clean water to the world, putting wholesome food on your table and groceries in your cart — and they use our software to create the labels, barcodes and RFID that keep their supply chains moving, traceable and safe.
Our global, talented and diverse teams are passionate about what they do and its impact on everyone, everywhere. Join us and help shape the way the world works.
We are headquartered in Bellevue, Washington, with branch offices in Madrid, Taipei, and Tokyo. For more information about Seagull Scientific, please visit https://www.seagullscientific.com/.",14d,
"[""Welch's"", '2.8']",http://www.welchs.com/,Blow Mold Machine Operator,"Saint Paul, MN",$24.70 Per Hour(Employer est.),"CRUSH IT HERE!
We're not just about grapes. Our bold ambition is to be the leading company of convenient, good for you, fruit-based food and beverage globally. To make this happen, we need talented, agile, and innovative people who want to help us grow something special together. At Welch's we are more than $1 Billion in global retail sales across core and license products, and you can find us in more than 1 in 3 US households!
Our culture is authentic, and we are building an inclusive environment where you belong and can be the best version of yourself. We're growing our brand management team that's already begun to modernize the Welch's brand & drive growth through product innovation!

Position Summary:",30d+,
"['Analog Devices', '4.1']",http://www.analog.com/,Blow Mold Machine Operator,"Saint Paul, MN",$24.70 Per Hour(Employer est.),"Come join Analog Devices (ADI) – a place where Innovation meets Impact. For more than 55 years, Analog Devices has been inventing new breakthrough technologies that transform lives. At ADI you will work alongside the brightest minds to collaborate on solving complex problems that matter from autonomous vehicles, drones and factories to augmented reality and remote healthcare.

ADI fosters a culture that focuses on employees through beneficial programs, aligned goals, continuous learning opportunities, and practices that create a more sustainable future.

ADI At A Glance",25d,www.glassdoor.com/partner/jobListing.htm?pos=105&ao=1136043&s=58&guid=000001846a1c91a2b28fbffbead95c88&src=GD_JOB_VIEW&t=SR&vt=w&cs=1_952367fb&cb=1668227594444&jobListingId=1008213175685&jrtk=3-0-1ghl1p4l0j47j801-1ghl1p4loi150800-f17b54470ccd1ea1-
,http://www.grubhub.com/,Blow Mold Machine Operator,"Saint Paul, MN",$24.70 Per Hour(Employer est.),"About The Opportunity:
We're all about connecting hungry diners with our network of over 300,000 restaurants nationwide. User-friendly platforms and streamlined delivery capabilities set us apart in the world of online food ordering. Grubhub is a place where authentically fun culture meets innovation and teamwork. We believe in empowering people and opening doors for new opportunities. If you're looking for a place that values relationships, embraces diverse ideas–all while having fun together–then Grubhub is the place for you!

More About the Role

We are looking for a Site Reliability Engineer to join our Runtime Engineering organization. At Grubhub the Runtime Engineering organization owns the top-level reliability, observability, and availability of the runtime platform. This team contributes to projects, services, designs, and processes with the aim to steward good architecture and provide tools and services to enable software engineering teams to measure and meet reliability agreements.

The Impact You Will Make:
What You Bring to the Table:


And Of Course, Perks!:",2d,www.glassdoor.com/partner/jobListing.htm?pos=106&ao=1136043&s=58&guid=000001846a1c91a2b28fbffbead95c88&src=GD_JOB_VIEW&t=SR&vt=w&cs=1_91253211&cb=1668227596336&jobListingId=1008269602169&jrtk=3-0-1ghl1p4l0j47j801-1ghl1p4loi150800-ddbee3be8b75211b-
"['Crop One Holdings Inc.', '4.3']",http://www.cropone.ag/,Blow Mold Machine Operator,"Saint Paul, MN",$24.70 Per Hour(Employer est.),"You will be joining a dynamic team of team of farmers, plant scientists, data analysts, engineers, researchers and be one of seeking an energetic and hardworking individual to serve as a production crew member who will participate in all aspects of plant production including sowing, harvesting, packing and associated tasks. The individual must possess the ability to become proficient in detail-oriented work and be able to interact and work well with others. This individual will perform plant growth, maintenance and harvest duties as outlined below.

Responsibilities:
Perform a variety of daily plant production tasks, which can be physically demanding and require great attention to detail including but not limited to the following:
Sow seeds into germination trays while taking great care in precision and executing all steps correctly",22d,
"['Brightseed', '4.2']",http://www.brightseedbio.com/,Blow Mold Machine Operator,"Saint Paul, MN",$24.70 Per Hour(Employer est.),"ABOUT BRIGHTSEED
Brightseed is a pioneer in biosciences and artificial intelligence that illuminates nature to restore human health. Through Forager® A.I. and clinical evaluation, Brightseed helps companies gain the deepest insight into bioactives and their innovation potential. Forager A.I. accelerates bioactive discovery and biological validation from years to months – and is rapidly revealing new connections between nature and humanity. Brightseed partners with companies across the consumer health continuum to provide novel insights and science-backed health solutions.

ABOUT BIOACTIVES
Bioactives are small molecule compounds produced by plants, fungi, and microbes that grow in and adapt to environments that present a wide range of challenges to their survival. Bioactives also benefit the health of humans – they are the enlivening caffeine in tea, the powerful antioxidant lycopene in tomatoes, and they inform active ingredients in medicines like Taxol, Aspirin and Metformin, a first-line treatment for Type 2 diabetes, derived from the French lilac flower. Science has long known that bioactives are critical to human health, yet the vast majority remain unknown and uncharted. Brightseed’s A.I., Forager®, discovers bioactives in nature and maps them to human health outcomes at a rate and accuracy that was previously impossible.",30d+,www.glassdoor.com/partner/jobListing.htm?pos=108&ao=1136043&s=58&guid=000001846a1c91a2b28fbffbead95c88&src=GD_JOB_VIEW&t=SR&vt=w&cs=1_96f77019&cb=1668227601330&jobListingId=1007784762940&jrtk=3-0-1ghl1p4l0j47j801-1ghl1p4loi150800-cc65501946799bcf-
"['ButcherBox', '4.1']",http://www.butcherbox.com/,Blow Mold Machine Operator,"Saint Paul, MN",$24.70 Per Hour(Employer est.),"Who We Are
ButcherBox is a fast-paced, rapidly-growing company headquartered in Boston, MA. At ButcherBox, we believe in better. That’s why we deliver 100% grass-fed, grass-finished beef, free-range organic chicken, pork raised crate-free, and wild-caught seafood directly to our members’ doors. All of our products are humanely raised or wild-caught and never given antibiotics or added hormones ever.

We’re working to build a world that’s better for all, and we’re inviting everyone to come along. For us, better means treating our planet with respect. It means improving the lives of animals and the livelihoods of farmers. It means never cutting corners when it comes to doing business. Ultimately, it means better meals, enjoyed together. Our team is made up of people who collaborate and support one another. We’re always looking for outstanding people to join our mission!",30d+,www.glassdoor.com/partner/jobListing.htm?pos=109&ao=1136043&s=58&guid=000001846a1c91a2b28fbffbead95c88&src=GD_JOB_VIEW&t=SR&vt=w&cs=1_c44d4576&cb=1668227604168&jobListingId=1008112426646&jrtk=3-0-1ghl1p4l0j47j801-1ghl1p4loi150800-a8a64bcf5ed319e5-
