Company_Name,Company_Link,Title,Location,Estimated_Salary,Job_Description,Job_Age,Application_Link
"['Invidi Technologies Corporation', '3.9']",http://www.invidi.com/,Network Engineer,"Charleston, WV",$70K (Employer est.),"Associate Software Developer
Princeton, NJ

Who we are:
INVIDI Technologies Corporation is the world's leading developer of software transforming television all over the world. Our two-time Emmy® Award-winning technology is widely deployed by cable, satellite, and telco operators. We provide a device-agnostic solution delivering ads to the right household no matter what program or network you’re watching, how you're watching, or whether you’re in front of your TV, laptop, cell phone or any other device. INVIDI created the multi-billion-dollar addressable television business that today is growing rapidly globally.",15d,
"['Special Service for Groups, Inc- HOPICS', '3.5']",http://www.ssg.org/,Network Engineer,"Charleston, WV",$70K (Employer est.),"Special for Service Groups
Job Announcement
_____________________________________________________________________________________
Title: IT Manager Division: HOPICS
FLSA: Exempt/Full Time Supervisor: Division Director
Pay Range or Rate: TBD Revised: 10.24.2022
_____________________________________________________________________________________
Summary
Under the supervision of the Division Director, the IT Manager will be responsible for the oversight of all information technology for the entire Division, including but not limited to: acquisition of equipment and setup; troubleshooting for software and hardware failures; maintain and secure company data; maintain and secure email system; data and voice servers, and voicemail system; IT coordination of Office relocations & build-out; and outsource resources and applicable vendor relationships; and directly manages a local workforce of IT support team.
The IT manager is also responsible for administering, managing, and supporting IT services, such as: identify network problems related to company-owned or leased equipment; installation, repair, and preventative maintenance of technology equipment; and related web-based electronic systems for the department programs. S/he coordinates the implementation of hardware and software rollout to achieve industry standards.
The IT Manager provides support to all program data systems, including SAGE, Leader Replacement System (LRS), HOPICS Kiosk, LAHSA Clarity (HMIS), CHAMP system, EXYM, and Encryption for data and email systems. S/he provides timely attention to all internal IT Helpdesk requests, for local and remote based users. In addition, provide initial incident response for unplanned system outages or security threats, and sends out update notifications to all staff.
Essential Functions
The IT Manager is responsible for the following essential functions:
o 350+ Verizon Mobile/Data equipment
o Modify, Monitor and Manage Network software & Hardware o Modify, Monitor and Manage, and Update Network Firewall and Antivirus Protection o Modify, Monitor and Manage Network’s shared folders o Monitor, Manage and Update Network Securities & Permissions o Maintain and update Network’s Operating System o Assigning User’s computer names and Network’s IP address o Backup Entire Network and User Files (Daily and Weekly backups) o Install and remove software
o Maintain and clean-up desktop computers and other office equipment o Maintain and update computers and other equipment o Troubleshoot Software & Hardware o Install and remove software o Monitor, Manage and Maintain Anti-Virus Protection o Upgrade software o Diagnose and repair hardware and software
o Workstation data encryption as required by subcontract
Secondary Functions
Minimum Qualifications - Knowledge, Skills and Abilities Required
Certified Professional/Systems Engineer, Certified Information Systems Security Professional,
ITIL, Comp TIA Network+/Security+, Cisco Certified Network Professional)
Mandatory Covid19 Vaccination Requirement
Supervisory Responsibilities:
This position is responsible for supervising the IT team staff.
Environmental Conditions (Working Conditions)
The environment for this position is an office environment. Must be able to work in an environment with many priorities, busy and fast paced. Must be able to problem solve and adapt to changes that are unpredictable.
Physical Requirements
The IT Manager typically spends time sitting, standing, typing, thinking, writing, walking, bending, squatting, carrying (max. 60 lbs.), listening, speaking, and driving.
Mental Requirements
This position will require the individual to be able to handle any/all the following: constant
distractions, interruptions, uncontrollable changes in priorities/work schedules be able to process information, think and conceptualize.

Special Service for Groups is an Equal Opportunity/Affirmative Action Employer",16d,
['Volkswagen Group of America - Chattanooga Operations'],,Network Engineer,"Charleston, WV",$70K (Employer est.),"Mgr, Workplace Technologies & IAM Svcs
- TEC000081 - Hybrid
Primary Location United States-Michigan-Auburn Hills
Role Summary:
Under the general supervision of the Senior Director, IT Infrastructure & Workplace Technology Services, the Manager of Workplace Technologies & IAM Services is responsible for ensuring effective control of Identity and Access Management systems and processes at VWGoA/VGCA. Including the consistent and reliable delivery of IT Services, Asset Management, Service Desk, Deskside support, Desktop Engineering, Identity and Access Management and Cyber Security for VWGoA, VGCA, Dealers (1,000+), Affiliate sites, Electrify America, and some of those services to VCI, VWAC, Navistar and the plant in Chattanooga.",30d+,www.glassdoor.com/partner/jobListing.htm?pos=115&ao=1136043&s=58&guid=000001846a615594889890b3413c9071&src=GD_JOB_VIEW&t=SR&vt=w&cs=1_925ac690&cb=1668232123512&jobListingId=1007973728704&jrtk=3-0-1ghl62le9kbms801-1ghl62lesjc8g800-67f2f167e04f833b-
"['Invidi Technologies Corporation', '3.9']",http://www.invidi.com/,Network Engineer,"Charleston, WV",$70K (Employer est.),"Senior Software Developer
Location: Princeton, NJ (Telecommuting acceptable)

Who we are:
INVIDI Technologies Corporation is the world's leading developer of software transforming television all over the world. Our two-time Emmy® Award-winning technology is widely deployed by cable, satellite, and telco operators. We provide a device-agnostic solution delivering ads to the right household no matter what program or network you’re watching, how you're watching, or whether you’re in front of your TV, laptop, cell phone or any other device. INVIDI created the multi-billion-dollar addressable television business that today is growing rapidly globally.",18d,
"['Aerospike', '4.2']",http://www.aerospike.com/,Network Engineer,"Charleston, WV",$70K (Employer est.),"About Aerospike
At Aerospike, we dream big. Our focus is helping companies tackle seemingly insurmountable problems and doing what's never been done before. That is why we developed the world's leading real-time data platform that powers mission-critical applications at the world's most innovative, category disrupting companies. Aerospike companies have deployed extreme scale real-time applications to fight fraud, dramatically increase shopping cart size, enable global digital payments, and deliver hyper-personalized user experiences to tens of millions of customers.
Customers like Airtel, Experian, Nielsen, PayPal, Snap, Verizon Media and Wayfair rely on Aerospike as the data foundation for the future to help them act in the microsecond moments that matter. Headquartered in Mountain View, California, Aerospike also has a global presence with offices in London, Bangalore and Tel Aviv.",30d+,
"['Volkswagen Group of America', '3.8']",http://www.volkswagengroupamerica.com/,Network Engineer,"Charleston, WV",$70K (Employer est.),"United States-Michigan-Auburn Hills
Role Summary:
Under the general supervision of the Senior Director, IT Infrastructure & Workplace Technology Services, the Manager of Workplace Technologies & IAM Services is responsible for ensuring effective control of Identity and Access Management systems and processes at VWGoA/VGCA. Including the consistent and reliable delivery of IT Services, Asset Management, Service Desk, Deskside support, Desktop Engineering, Identity and Access Management and Cyber Security for VWGoA, VGCA, Dealers (1,000+), Affiliate sites, Electrify America, and some of those services to VCI, VWAC, Navistar and the plant in Chattanooga.
This role manages six teams/functions: 1) Identity and Access Management 2) IT Services (Request Management, IT Services Catalog, Mobile), 3) IT Service Desk 4) Desktop Support (Deskside Services, Print Services) 5) Asset Management, 6) Desktop Engineering.",30d+,www.glassdoor.com/partner/jobListing.htm?pos=118&ao=1136043&s=58&guid=000001846a615594889890b3413c9071&src=GD_JOB_VIEW&t=SR&vt=w&cs=1_ad8aa46a&cb=1668232133275&jobListingId=1007973736341&jrtk=3-0-1ghl62le9kbms801-1ghl62lesjc8g800-44e4cabf71727ebc-
"['Verizon', '3.9']",http://verizon.com/jobs,"Principal Engineer - Data Science - Irving, TX","Irving, TX",$38K - $62K (Glassdoor est.),"When you join Verizon

Verizon is one of the world’s leading providers of technology and communications services, transforming the way we connect across the globe. We’re a diverse network of people driven by our shared ambition to shape a better future. Here, we have the ability to learn and grow at the speed of technology, and the space to create within every role. Together, we are moving the world forward – and you can too. Dream it. Build it. Do it here.


What you’ll be doing...

As a Fraud Data scientist, you will be working with a passionate group of professionals who apply cutting edge AI/ML technology to protect Verizon customer accounts from account takeovers, illegal SIM Swaps, Port Outs etc as well as prevent financial losses resulting from fraudulent activity.




This hybrid role will have a defined work location that includes work from home and assigned office days as set by the manager.




You’ll need to have


Even better if you have


#VZIT




Verizon will consider qualified applicants with criminal histories in a manner consistent with the requirements of the San Francisco Fair Chance Ordinance.




We're proud to be an equal opportunity employer - and celebrate our employees' differences, including race, color, religion, sex, sexual orientation, gender identity, national origin, age, disability, and Veteran status. At Verizon, we know that diversity makes us stronger. We are committed to a collaborative, inclusive environment that encourages authenticity and fosters a sense of belonging. We strive for everyone to feel valued, connected, and empowered to reach their potential and contribute their best. Check out our diversity and inclusion page to learn more.",22d,www.glassdoor.com/partner/jobListing.htm?pos=101&ao=1110586&s=58&guid=000001846a624a2abc0b64c7af479c9b&src=GD_JOB_VIEW&t=SR&vt=w&cs=1_562a15dd&cb=1668232147286&jobListingId=1008221590873&cpc=3BA4CE39D5B5DEF5&jrtk=3-0-1ghl64iijm6qq801-1ghl64ij7g4es800-684029354836f241--6NYlbfkN0BCNs6bE--Mn_ADd0RyzMq18ZUxdybwefWV8heO_C7Y93WSfGMHAxRcDUKtua4h-13-B7csMPvmB2AxjdfeuKD0ZPG6-Fdq4LBlO8UU37fCH9UgpLP66cjMBmEjBlxUTqM3b6rf8LTTfdZLvFJniAIZgb0a_NJJmGI24rrc1GWU8kh0gOIjlux-DX9xJF0TPoNqAFqsfq1EXfcPnA6D4up1teYpsVn4Vcp8BLbc7KBFgyCBLZr7FWVEZwAnR0TdTdjhrsFF9JZueROHCyeB2gH6Mp_Qo6Sub_-JfbHQDXtVs9ynU5q8MQLhPVygzSpHKNOul7dOSIkhDoP4t4Y8Sgz_bmDxRkEqh1wHyqIDY4xXWkNZgSsk204aHUPVcFdWvHfdKGd5i2AjDYVIhkoaOgSp43sP_YXUPOYV1a_1vcyffi00Df6GNfOcJLhndVIeJRsg1tFkLT_94ScZc81qWUBb5DUpvHr1llmo8TwnUaSXqr8Id4PVb_nIwbAwbwq9fY2AbCOkRdGex28QlM27t7MNgu0ovm19LBFVP-zCyznby6kvEB94mkBAErMDGs-XGgnLNuT2TqRW6Ytj7G_CCke9JlzISytI6DJUE84EyVtbAUh_pr6tG-zDKupf9yt8YqvIZIItSfk7ywMS7KG3tA_h0gMpZeLs1UJSz-mYC-gcvVu7B5zDhAvd1ld8n6f50R_cz5lXdFv9NO6leHqpfJ3HqhJP1m2ivd_-Op84dBvozDLueDfFZ2IC
"['Verizon', '3.9']",http://verizon.com/jobs,"Principal Engineer - Data Science - Irving, TX","Irving, TX",$38K - $62K (Glassdoor est.),"When you join Verizon

Verizon is one of the world’s leading providers of technology and communications services, transforming the way we connect across the globe. We’re a diverse network of people driven by our shared ambition to shape a better future. Here, we have the ability to learn and grow at the speed of technology, and the space to create within every role. Together, we are moving the world forward – and you can too. Dream it. Build it. Do it here.


What you’ll be doing...

As the Senior Manager - Immersive Experiences Product Area Tech Lead, you will be responsible for developing and executing a strategy to accelerate and catalyze the Corporate Systems Group (CSG) Innovation Ecosystem delivering value to our corporate partners, employees, and Verizon. You will take the long-term view to identify where CSG can be constructively disruptive through strategic partnerships and investment in emergent technologies that will provide future ready solutions to complex corporate problems.

Comprised of passionate and forward-thinking leaders, the CSG Emerging Technology & Digital Innovation (ET&I) team you will join includes ecosystem builders and industry experts in hyperautomation, process mining, Blockchain, digital twins, industrial IoT, AI, ML and other emergent technologies. With a belief that the autonomous future sits at the intersection of intelligent networking, devices and software, the team is working to shepherd internal corporate business partners through their digitization journeys to enable the connection, management and operation of physical and digital elements needed for future ready enterprise operations. The combination of these technologies will transform corporate enterprise landscapes to deliver new levels of efficiency, intelligence and business outcomes in productivity, experiences and compliance.

You will be working across various teams within CSG and broader Verizon to ensure our strategy is well understood and aligned with Verizon’s growth initiatives. You will collaborate with other strategists, researchers, product managers, engineers, and our Global Technology Solutions team to craft these end-to-end investment strategies that position CSG to capitalize on new ecosystems, whether through applied research, proof of concept development, incubation of disruptive ideas, internal and external partnerships, or internal IP creation and federation.

The innovation process is never a straight line though, so you will need to continuously learn, analyze, and refine the Immersive Experience opportunity through progressive strategy iterations and taking ownership over the path to getting a return on investment.




In this hybrid role, you'll have a defined work location that includes work from home and assigned office days set by your manager




You'll need to have:


Even better if you have one or more of the following:


If Verizon and this role sound like a fit for you, we encourage you to apply even if you don’t meet every “even better” qualification listed above.




We're proud to be an equal opportunity employer - and celebrate our employees' differences, including race, color, religion, sex, sexual orientation, gender identity, national origin, age, disability, and Veteran status. At Verizon, we know that diversity makes us stronger. We are committed to a collaborative, inclusive environment that encourages authenticity and fosters a sense of belonging. We strive for everyone to feel valued, connected, and empowered to reach their potential and contribute their best. Check out our diversity and inclusion page to learn more.",10d,www.glassdoor.com/partner/jobListing.htm?pos=102&ao=1110586&s=58&guid=000001846a624a2abc0b64c7af479c9b&src=GD_JOB_VIEW&t=SR&vt=w&cs=1_e2449abc&cb=1668232150436&jobListingId=1008249386558&cpc=3BA4CE39D5B5DEF5&jrtk=3-0-1ghl64iijm6qq801-1ghl64ij7g4es800-9fbbfcd1ae116081--6NYlbfkN0BCNs6bE--Mn_ADd0RyzMq18ZUxdybwefWV8heO_C7Y93WSfGMHAxRcPMkC0WMj4oltq8mQw0PMJ24U5n3reMCjFZdBn0RYqzFCFZhAQj0G9MnP1lsdDyH6y83DHa3W3bHnritLx5LSAdeQhQny1SpYX-sWh392_2DsZ5NMoHSo2qIH5EPbsZJ1XKAHc8FIeRjMNXSV4seVKMitOUO-9l7BeLtZmKpEzxuWaBuHlBpzU_6PEwhKd_JSwu7EdKvkF5DI_30AWUGAp_dXBDVxAY4ZDLvpsO1nttp-pN71z_uwcjZMllvn1bbwK328tE1ESaHmrIukqMjapSELXFwVQxnHfD0iy1E5-banwGcBlJqOdhnA5sYCCEYBW2-DByiqhtrQqIPGbDkDfCZvCqYj5XB2czH5bN3XsKxuaaKslxHZZgYqKluzoUehrjEG2xMVqOrTgPm0AJKLBT5XqFwWdZRDl_K39xQZ4WaHKnBNH0_FY0TR9lBvrHci93MVincvz4QrZrktx_sAxA6rgwqG6ZCZQNxKQC1I5eIvpLdtZOijB_Wczof8L39b2z5hKJfOj3jkY67REv-kwrcCJicqr1yTRC5l6izbDCy0EUOGxrcJSk3tSDAltfoQQdEsEq_DTFgvFqFEV6SEGN_RdkIjwkISzKFPD0gJMJOc3y79x8NptZtAaEU0m4ZLDArlqgETFQInllUO14u7__N_Bu_cvmgRBK-524MWS1QQU5oQC2MmUMVpzuH2dZAh
"['ikeGPS', '3.6']",http://www.ikegps.com/,"Principal Engineer - Data Science - Irving, TX","Irving, TX",$38K - $62K (Glassdoor est.),"Location: Broomfield, Colorado (in-office role)
Salary: Estimated annual compensation will be $55,000 – $60,000 flexible based on relevant experience. This is a full-time opportunity that offers full benefits.
Applicants for this position must be eligible to work in the United States. We are not looking for contract (C2C) hires at this time.

Why ikeGPS?
Comprehensive benefits package that includes medical, dental, vision, 401K + match, 3 weeks starting Paid Time Off (PTO), and generous parental leave",30d+,
"['Hinge Health', '3.5']",http://www.hingehealth.com/,"Principal Engineer - Data Science - Irving, TX","Irving, TX",$38K - $62K (Glassdoor est.),"One in two people experience debilitating back, neck, shoulder, or joint pain — but traditional treatments have failed to meet their needs. Physical therapy can be expensive and hard to access; appointments often involve long commutes and missed work. Making matters worse, unresolved pain can trigger the overuse of opioids and surgeries.

Join us in reimagining healthcare from the ground up. We’re making high-quality care accessible by pairing wearable sensors and computer vision with a world-class clinical team. Hinge Health puts a digital clinic in every member's pocket. Now millions of people can access personalized digital care from a physical therapist, guidance on behavior change from a health coach, and expert consultations with an orthopedic surgeon. With a single app and wearable technology like our Enso device, we’re helping to reduce pain, surgeries, and opioid use.

Work From Anywhere
Hinge Health employees have the flexibility to work remotely in hubs across the US, Canada, and Latin America or work from our offices in San Francisco, Portland, and Montreal.",1d,www.glassdoor.com/partner/jobListing.htm?pos=104&ao=1136043&s=58&guid=000001846a624a2abc0b64c7af479c9b&src=GD_JOB_VIEW&t=SR&vt=w&cs=1_1552e98c&cb=1668232157018&jobListingId=1008273227441&jrtk=3-0-1ghl64iijm6qq801-1ghl64ij7g4es800-f8ce5aa11a916e77-
"['Hinge Health', '3.5']",http://www.hingehealth.com/,"Principal Engineer - Data Science - Irving, TX","Irving, TX",$38K - $62K (Glassdoor est.),"One in two people experience debilitating back, neck, shoulder, or joint pain — but traditional treatments have failed to meet their needs. Physical therapy can be expensive and hard to access; appointments often involve long commutes and missed work. Making matters worse, unresolved pain can trigger the overuse of opioids and surgeries.

Join us in reimagining healthcare from the ground up. We’re making high-quality care accessible by pairing wearable sensors and computer vision with a world-class clinical team. Hinge Health puts a digital clinic in every member's pocket. Now millions of people can access personalized digital care from a physical therapist, guidance on behavior change from a health coach, and expert consultations with an orthopedic surgeon. With a single app and wearable technology like our Enso device, we’re helping to reduce pain, surgeries, and opioid use.

We’re looking for an individual, who is eager to learn, to join us towards building out our data pipeline - this is a ground floor opportunity where you can learn and develop into a project management type role. This person will be a leader to our external vendors, communicating goals and tasks planned with the help of our Research and Development Team to external annotation partners.",4d,www.glassdoor.com/partner/jobListing.htm?pos=105&ao=1136043&s=58&guid=000001846a624a2abc0b64c7af479c9b&src=GD_JOB_VIEW&t=SR&vt=w&cs=1_ab3f5389&cb=1668232160906&jobListingId=1008263654872&jrtk=3-0-1ghl64iijm6qq801-1ghl64ij7g4es800-a80dcf7eae824cce-
"['Verizon', '3.9']",http://verizon.com/jobs,"Principal Engineer - Data Science - Irving, TX","Irving, TX",$38K - $62K (Glassdoor est.),"When you join Verizon
Verizon is one of the world’s leading providers of technology and communications services, transforming the way we connect across the globe. We’re a diverse network of people driven by our shared ambition to shape a better future. Here, we have the ability to learn and grow at the speed of technology, and the space to create within every role. Together, we are moving the world forward – and you can too. Dream it. Build it. Do it here.
What you’ll be doing...
This candidate will perform analytics, create predictive models, and/or apply machine learning techniques for high-visibility projects, as a member of a collaborative and open team that prides themselves on innovative solutions. The data scientist will explore information from multiple sources in order to gain maximum insight and provide a competitive advantage. The “data science” tasks may include statistical analyses, knowledge discovery, data mining, machine learning, and predictive modeling.",13d,www.glassdoor.com/partner/jobListing.htm?pos=106&ao=1136043&s=58&guid=000001846a624a2abc0b64c7af479c9b&src=GD_JOB_VIEW&t=SR&vt=w&cs=1_97dfe29e&cb=1668232162835&jobListingId=1008242989043&jrtk=3-0-1ghl64iijm6qq801-1ghl64ij7g4es800-7ccf251a1ed36548-
['Stellar Inc.'],http://stellar.com/,"Principal Engineer - Data Science - Irving, TX","Irving, TX",$38K - $62K (Glassdoor est.),"Position Title: Data Scientist
Location: Remote
Contract Dur: 2+ Year Contract
Direct Client: Verizon Wireless
Job Description:
You are an accomplished Senior Data Scientist, a recognized machine learning expert, and a thought leader in AI technology and business innovation. You are a master at analyzing big data.
Required:
Formal education: Bachelor’s degree with six or more years of relevant work experience as a Data Scientist practicing model development for business applications; Or a Master's Degree in Computer Science, Statistics, Math, Economics, Engineering, or Data Science related fields with two or more years of relevant experience as a data scientist or machine learning engineer.
Hands-on experience in building machine learning and statistical models using Python, PySpark, Machine Learning libraries, SQL.
Experience in computing/programming skills; proficiency in Python, R, and Linux shell script.
Experience in data management and data analysis in a relational database, Hadoop and Spark.
Experience with Cloud computing platform such as GCP or AWS
Strong communication and interpersonal influencing skills.
Excellent problem solving and critical thinking capabilities.",30d+,
"['Strivr', '4.0']",http://www.strivr.com/,"Principal Engineer - Data Science - Irving, TX","Irving, TX",$38K - $62K (Glassdoor est.),"About the company
At the intersection of technology, science, business, and sports, Strivr offers the leading VR-based immersive learning platform that is changing the way employees train, learn, and perform. With a mission to elevate performance through immersive experience, we are redefining an industry and shaping the future of workforce development.
Strivr was founded in 2015 out of Stanford University’s Virtual Human Interaction Lab, using the football field as our proving ground. Since then, we have expanded from the athlete to the enterprise, partnering with leading Fortune 1000 companies including Bank of America, MGM Resorts, Sprouts, Verizon, and Walmart to innovate and elevate employee learning and development at scale.
More than just content inside a headset, Immersive Learning is a groundbreaking training methodology that combines the sense of presence in Virtual Reality with advanced learning theory, data science, and spatial design. It provides realistic, high-impact experiences driven by best practices across L&D, instructional design, immersive content development, data science, product design, and user experience. As the leading VR-based Immersive Learning solution for enterprises on the market today, Strivr’s platform enables the deployment of VR training at scale while serving as the bridge to the connected immersive worlds of tomorrow.
As a Data Scientist at Strivr, your day to day work includes designing and implementing
methods to capture user behavior, diving deep into user training data to deliver impactful
customer takeaways, building tools to scale our analytics, and partnering with content creation
teams for data collection.
Data Science output feeds into new product features and drives customer
presentations. Analytic insights delivered to our customers by the Data Science team has
directly led to expansions, contract renewals, and customer business decisions. It is considered
an integral part of our business.",30d+,
