Company_Name,Company_Link,Title,Location,Estimated_Salary,Job_Description,Job_Age,Application_Link
"['Lavi Industries', '3.6']",http://www.lavi.com/,Chief Operating Officer,"Valencia, CA",$31.00 Per Hour(Employer est.),"LAVI INDUSTRIES
Products for People and the Places they go®
www.lavi.com
Lavi is looking for an experienced Chief Operating Officer to lead and oversee our organization’s ongoing operations and procedures.
Lavi Industries’ mission is to innovate the customer journey, increase efficiency, and capitalize on ROI- boosting opportunities. We accomplish providing these solutions with our three different segments of products: public guidance, architectural railings, and our Qtrac® virtual queueing system.
You have more than likely been queued by a Lavi Industries product, and we welcome you to join the journey of queuing people and the places they go today!",8d,
"['Enhance IT', '3.8']",https://www.enhanceit.com/,Chief Operating Officer,"Valencia, CA",$31.00 Per Hour(Employer est.),"iOS DeveloperIt’s All About YOU
Are you seeking to grow and enhance your technical career to new heights, in a full-time, W-2 opportunity?
What if an organization existed solely for the purpose of investing in YOU, being
of service to YOU, showing you how, and supporting you every step of the way?
Is a customized and personalized approach to your learning journey, career development, and overall ability to maximize your earning potential important to you?
Let’s make it happen – together!
What’s In It For YOU",4d,
"['Verizon', '3.9']",http://verizon.com/jobs,Chief Operating Officer,"Valencia, CA",$31.00 Per Hour(Employer est.),"When you join Verizon

Verizon is one of the world’s leading providers of technology and communications services, transforming the way we connect across the globe. We’re a diverse network of people driven by our shared ambition to shape a better future. Here, we have the ability to learn and grow at the speed of technology, and the space to create within every role. Together, we are moving the world forward – and you can too. Dream it. Build it. Do it here.


What you’ll be doing...

The Visible Engineering Team is seeking a Senior Software Engineer. Visible is building a next generation cloud mobile network platform, pushing the boundaries of the traditional mobile carrier. We're looking for innovative engineers who are passionate about writing code and unafraid of solving problems. The position is for a Lead Engineer on our Member Growth engineering team, contributing to the design and development of the platform and services that keep our customers happy. You will bring creative ideas and energy to the team, take calculated risks and challenge our thinking.




In this hybrid role, you'll have a defined work location that includes work from home and assigned office days set by your manager.




You'll need to have:


Even better if you have one or more of the following:


If Verizon and this role sound like a fit for you, we encourage you to apply even if you don’t meet every “even better” qualification listed above.




Our benefits are designed to help you move forward in your career, and in areas of your life outside of Verizon. From health and wellness benefits, short term incentives, 401 (k) Savings Plan, stock incentive programs, paid time off, parental leave, adoption assistance and tuition assistance, plus other incentives,we’ve got you covered with our award-winning total rewards package. For part-timers, your coverage will vary as you may be eligible for some of these benefits depending on your individual circumstances.

If you are hired into a Colorado or New York work location, the compensation range for this position is between based on a full-time schedule. The salary will vary depending on your location and confirmed job-related skills and experience. This is an based position with the potential to earn more. For part-time roles, your compensation will be adjusted to reflect your hours.




We're proud to be an equal opportunity employer - and celebrate our employees' differences, including race, color, religion, sex, sexual orientation, gender identity, national origin, age, disability, and Veteran status. At Verizon, we know that diversity makes us stronger. We are committed to a collaborative, inclusive environment that encourages authenticity and fosters a sense of belonging. We strive for everyone to feel valued, connected, and empowered to reach their potential and contribute their best. Check out our diversity and inclusion page to learn more.",9d,www.glassdoor.com/partner/jobListing.htm?pos=103&ao=1110586&s=58&guid=000001846a530ca391fb6175ab5df036&src=GD_JOB_VIEW&t=SR&vt=w&cs=1_38d0bc94&cb=1668231152512&jobListingId=1008253194976&cpc=3BA4CE39D5B5DEF5&jrtk=3-0-1ghl56374m6qp801-1ghl5637pj45o800-f36507eaf6baffe7--6NYlbfkN0BCNs6bE--Mn_ADd0RyzMq18ZUxdybwefWV8heO_C7Y93WSfGMHAxRcPMkC0WMj4on5YrtT_eQzAjEwVmeiCeRvAfrKzpF8qduPTRqNWZmveuPSBP-vXBJJ38NYSCFLV_g0yNsr5k22IfPK1sFyP43srEXMgj_2YuFDrupjoW5eaFOSpIOn3vtVxNbK8PtcAjCpwllLXlAIYpNmVswDCpFzBAS1GtxI46ZreOm5QHISE3JNBmcHfjYvzeeSPmAa3qHvbgF4y0LI28jW6tacFy7Soqd8dqgilM4xoNnad_PFv9u3MKysilcJwaJFvudW_2OSRxntoyzJsHWecsWyaEOHSglCCYCtrRdz9_cBk8mqmPWMTh3i7qYmnEU9daCmYdoUEUR0fU-VtiB9jAvVU7dSvhdEx3UPtGZmLLxzvqDALY2tQE2IcP1KsIN4UHA-eWiViTnYv7UVkAIiB60IjidNCZXXgQF3vg2_dOhcNIL3dBw1AkJPkQvQ3Q2A9EdmKwAR1Dc4Re8M80yMVKsAAb0jplgphs5nwm25UCrUowlx3U8zQs6MF3TZbRYT6Bni1XzJOHVPRYk5VqNVfoU2B6GMs7fH6YsWGuc6KGx0Jh1kZN7IjEidDFQyVgbrF891X_6FVtDFMzHC9mPBTgl2t3PmORNiXHLxjaThF3AGQdviQZjEJRkcnBfMY5NGe4nzzP7Kcx5Gxu4eLWUUNtqZXy-_60FGmES5h9zcrl1bXILcbrYHqYbt26t0
"['Verizon', '3.9']",http://verizon.com/jobs,Chief Operating Officer,"Valencia, CA",$31.00 Per Hour(Employer est.),"When you join Verizon

Verizon is one of the world’s leading providers of technology and communications services, transforming the way we connect across the globe. We’re a diverse network of people driven by our shared ambition to shape a better future. Here, we have the ability to learn and grow at the speed of technology, and the space to create within every role. Together, we are moving the world forward – and you can too. Dream it. Build it. Do it here.


What you’ll be doing...

The Application Security team is responsible for maintaining our security posture across our systems and infrastructure. We are also responsible for educating the GTS work force about implementation of security protocols in our applications. Our mission is to protect our applications from vulnerabilities and prevent applications from being exposed to potential exploitation, such as zero-day exploits. Our runtime application self-protection solution enables defense-in-depth by helping to reduce risk and fill security gaps that leave applications vulnerable at runtime.




In this hybrid role, you'll have a defined work location that includes work from home and assigned office days set by your manager.




You’ll need to have:


Even better if you have one or more of the following:


If Verizon and this role sound like a fit for you, we encourage you to apply even if you don’t meet every “even better” qualification listed above.




We're proud to be an equal opportunity employer - and celebrate our employees' differences, including race, color, religion, sex, sexual orientation, gender identity, national origin, age, disability, and Veteran status. At Verizon, we know that diversity makes us stronger. We are committed to a collaborative, inclusive environment that encourages authenticity and fosters a sense of belonging. We strive for everyone to feel valued, connected, and empowered to reach their potential and contribute their best. Check out our diversity and inclusion page to learn more.",9d,www.glassdoor.com/partner/jobListing.htm?pos=104&ao=1110586&s=58&guid=000001846a530ca391fb6175ab5df036&src=GD_JOB_VIEW&t=SR&vt=w&cs=1_6966efae&cb=1668231154515&jobListingId=1008253194258&cpc=3BA4CE39D5B5DEF5&jrtk=3-0-1ghl56374m6qp801-1ghl5637pj45o800-91b73d2b87935d32--6NYlbfkN0BCNs6bE--Mn_ADd0RyzMq18ZUxdybwefWV8heO_C7Y93WSfGMHAxRcPMkC0WMj4on5YrtT_eQzAlGTipTbuJrURz8tSvNq8EDC0NGwwz1w5WsurgdOvLIANZthuJSiLv71vgkTDeEySQnU1VeYNkuhljxN8uAhNQkbUfCpdliitjAVVPBDOWSDjJHeyPhO_59idFAuCctqE0UOSiMn5CREkvrUw9tzaRj5nHAzym8w8XNJNOOlYhiHKMrZX-iuxHKEadmyULLRacAo4zkwhrHki4WqSegcd49pegIlYIU6FS9NIfDbQRd7D9-GxFIt_tr68YlxCgk8whdPyGmfD9SI5Q_KMRS5nl8AKGs1qcyHUPcA8VOQp8Ru9pp4P4e9tlaCZmkaes27xvv_Lcnq4z_TWmcywewDWlf_ymERsY9V_pXnXeyvKJiqvrFRekP7reHgLAKak7jxGaUyXWg8nIyt5-57z_QKcOY0VG7fK5ifgmmWk81zM_RJzAXG2b_PaS91lk1EuHTMSR03jXjqW8MRrDlbXWJYSh8Ul7cJVG4OonwtF9jdouxDa27708bHkQmrlgApNtvSgM8iL6uCc5XIcKDoeBP_theftref7aqfa_LxFpfInbYlo8urUdkNhE3KqY_ryookUWDYI7pHc71ZZ7dAfnxBE4o-3JF0bbALIyfSb4z1GQCTd1r_smJqHD4oCiO7W_IwGsz_gebMpq7_o8oUh6YsMNLLFh41zh805wVqA55qeIYl
"['Verizon', '3.9']",http://verizon.com/jobs,Chief Operating Officer,"Valencia, CA",$31.00 Per Hour(Employer est.),"When you join Verizon

Verizon is one of the world’s leading providers of technology and communications services, transforming the way we connect across the globe. We’re a diverse network of people driven by our shared ambition to shape a better future. Here, we have the ability to learn and grow at the speed of technology, and the space to create within every role. Together, we are moving the world forward – and you can too. Dream it. Build it. Do it here.


What you’ll be doing...

As a Software developer in the Verizon Business Group - Global Technology Solutions team, you will be responsible for designing and delivering solutions for our Digital Sales and Service Systems, Compensation Planning, and Commercial Operations to drive revenue and reduce costs for VBG. As part of these programs, you will leverage the System of Insights (SOI), Simplified Workflows, Systems of Engagement (SOE) and Digital Operating Environment to transform the customer and employee experience to eliminate manual processes, reduce costs, and increase revenue. You will be part of several VBG Transformation initiatives, partnering with the business leaders and workstream owners to transform our sales operations, compensation management and back office support systems for each segment of VBG: Enterprise, Business Markets, Public Sector and Wholesale.

In addition, you will contribute and support the development of new and existing platforms required to maintain and operate our core business, ensure our systems remain secure and compliant, improve systems performance, all while delivering innovative solutions aligned to the VBG North Star architecture. You will be responsible for identifying emerging technologies to support the platforms, building strong partnerships across GTS as we simplify our architecture and transform our systems. Your role on the team will be a critical part of the VBG transformation journey - increasing revenue, reducing costs and generating significant EBITDA benefits for Verizon.




In this hybrid role, you'll have a defined work location that includes work from home and assigned office days set by your manager.




You'll need to have:


Even better if you have one or more of the following:


If Verizon and this role sound like a fit for you, we encourage you to apply even if you don’t meet every “even better” qualification listed above.




We're proud to be an equal opportunity employer - and celebrate our employees' differences, including race, color, religion, sex, sexual orientation, gender identity, national origin, age, disability, and Veteran status. At Verizon, we know that diversity makes us stronger. We are committed to a collaborative, inclusive environment that encourages authenticity and fosters a sense of belonging. We strive for everyone to feel valued, connected, and empowered to reach their potential and contribute their best. Check out our diversity and inclusion page to learn more.",9d,www.glassdoor.com/partner/jobListing.htm?pos=105&ao=1110586&s=58&guid=000001846a530ca391fb6175ab5df036&src=GD_JOB_VIEW&t=SR&vt=w&cs=1_502653af&cb=1668231157226&jobListingId=1008253193822&cpc=3BA4CE39D5B5DEF5&jrtk=3-0-1ghl56374m6qp801-1ghl5637pj45o800-6470f31c99e542eb--6NYlbfkN0BCNs6bE--Mn_ADd0RyzMq18ZUxdybwefWV8heO_C7Y93WSfGMHAxRcPMkC0WMj4on5YrtT_eQzAvRhDTCDeZlIRW_raRHADGo1srpDKIZsiWgsydm5youUv8G6yUw8dx4mQmx28AzaofQWsxsCz5BJO77GAlGj52XmK3e5vJ2JqiFVenMBaqBCwafA5gkjwHBqtiGRX9Hzqh3rNzVYImmJIK2ng22ft0YMfSmFgiqWuWpe0Ubaw5f8AJnp_Lb7jqmeG_6QYcEzy-plyjAH2Zq3p1B1egNOynOHN-HIDSJaoBJ9yuwlbQ1yDtOcaflkKi2qyOxjcex7_x5hhE_f4E7uZGvxko4jY5iA7OePejSlyWvJuuQVo97A2Ajff_IRbaqkKqSJxbUaSmzM44kRHFrDIQv_7tjwtLEZiiLV9aoZco0KcQKyrmT2lYUfen3Y48Vw28_qLLVt-A2sR1jrliGUt6-hvYJTNBsNYoPi0JI5G1vv_wAgDibLthw7DnqCYNkh80elF4MSMKEKRVydHp-BaTFE7nncB5uybxKoZFAaYmC998-1bq_-1ftrnBYmjF-8O0P9aTOpCrYVV7UHoyJdugByoOl4B0tPno94iznQad2v0XzbrTI0NiCIOzzMuX4MLGseG9F7s15SWaB54eWUelm6HxBMOnZ6OGNiedy1xuCzOOQ8AzBdwcglLOlLhr5Go5gDXu0rcAgmVQVeVThZljCh1XBmGN5IAF0riy-BQz2-YJdAkGyW
"['Verizon', '3.9']",http://verizon.com/jobs,Chief Operating Officer,"Valencia, CA",$31.00 Per Hour(Employer est.),"When you join Verizon

Verizon is one of the world’s leading providers of technology and communications services, transforming the way we connect across the globe. We’re a diverse network of people driven by our shared ambition to shape a better future. Here, we have the ability to learn and grow at the speed of technology, and the space to create within every role. Together, we are moving the world forward – and you can too. Dream it. Build it. Do it here.


What you’ll be doing...

We are looking for a Sr Full Stack developer for the Verizon e-commerce Information Technology team where you will work on new technologies and find ways to meet our customers’ needs and make it easy for them to do business with us. You will be responsible for developing the application which takes care of the sales flows on the www.verizon.com and MVA-Sales. You should be willing to challenge designs when efficiencies or errors are found to ensure the code is delivered adhering to the industry standards.


This role will be based out of one of the locations listed in the posting.



In this hybrid role, you'll have a defined work location that includes work from home and assigned office days set by your manager.




You’ll need to have:


Even better if you have one or more of the following:


If Verizon and this role sound like a fit for you, we encourage you to apply even if you don’t meet every “even better” qualification listed above.




We're proud to be an equal opportunity employer - and celebrate our employees' differences, including race, color, religion, sex, sexual orientation, gender identity, national origin, age, disability, and Veteran status. At Verizon, we know that diversity makes us stronger. We are committed to a collaborative, inclusive environment that encourages authenticity and fosters a sense of belonging. We strive for everyone to feel valued, connected, and empowered to reach their potential and contribute their best. Check out our diversity and inclusion page to learn more.",10d,www.glassdoor.com/partner/jobListing.htm?pos=106&ao=1110586&s=58&guid=000001846a530ca391fb6175ab5df036&src=GD_JOB_VIEW&t=SR&vt=w&cs=1_c4cbd2f7&cb=1668231160263&jobListingId=1008249384695&cpc=3BA4CE39D5B5DEF5&jrtk=3-0-1ghl56374m6qp801-1ghl5637pj45o800-0a748d1933e2a973--6NYlbfkN0BCNs6bE--Mn_ADd0RyzMq18ZUxdybwefWV8heO_C7Y93WSfGMHAxRcPMkC0WMj4oltq8mQw0PMJ-rzJzgR7-Tn4krncujm24I5Vd-WJdLh_Wddqci82c9pdp7ukEegy1ThkZYU2v_Dfx5Yilk4fwlijpTLPG4_foeV8DBaS2Ru2K0eBsbX2Mkrkh8wutxchDSYSWGO2dWqZfAoh3ktYAjbcIqBI6e_gDWSHDBdoRamps5au1863YsSon_zpdQoMsxifplZ-NB8Pt0J4joINsi9bj76-UALfFO9-3A3dn1SCEEMsU25fMRFrfqneC1omn_hooIcWqmxHCKYH4uA-ZqCyOc0z1AOaD21Gsh75ESsS7X85WlPNLDCjqF3EBAjaljb0IAXSLRh2X050XSpxJwLDN1tSO2CBs65EhYJB4cxexK5VwOgWb9pBwVdYb0k8DhS5ijfplENaPVYMbnH3WVnOI5z9TugXC8boToU3YiUW4zBRDuEXrOkYMlC6FibqFA3Pu0-9rUB-FZ9Z206T79kbdwMei87YD90qRRAx_MT1mnFirZWiD_nkOoEXlh18wglAJewfcX0tHlNPHBOvv84QiV1NOMT9Az34xyedOfcAJA06f3vIh13KvefQVqGf2or1OCPjHCf6ZiCeJq4aMn6Ysuz8l38ZByig5FcH3RrVU631LnlyYqNqZIJOgLSFOD9yxAZMFYneaQZUD1GvHKvYEPr7Xiap_WpWKady0bZHe-7Z0xXwCgy
,,Chief Operating Officer,"Valencia, CA",$31.00 Per Hour(Employer est.),,9d,
