Company_Name,Company_Link,Title,Location,Estimated_Salary,Job_Description,Job_Age,Application_Link
"['Target', '3.6']",http://www.target.com/,Lead Software Engineer - Site Reliability Engineering(Remote Or Hybrid),"Minneapolis, MN",$106K - $190K (Employer est.),"Location: 1000 Nicollet Mall, Minneapolis, Minnesota, United States, 55403-2542
About Us:
Target is an iconic brand, a Fortune 50 company, and one of America’s leading retailers.
Target as a tech company? Absolutely. We’re the behind-the-scenes powerhouse that fuels Target’s passion and commitment to cutting-edge innovation. We anchor every aspect of being America’s most loved retailer with cutting-edge technology, and the smartest engineers in retail technology! Site Reliability Engineering (SRE) at Target is an engineering discipline that combines software and systems engineering to build and run large-scale, massively distributed, and fault-tolerant systems.
As a Lead Engineer in SRE, you are someone who has demonstrated experience building highly scalable platforms and fault-tolerant systems across a range of technologies, including Linux, Apache, MongoDB, Python, Oracle RDBMS, Redis, Postgres, and Hadoop. We use a combination of Google Computing Platform and our own server farms operating out of Target Data Centers, and therefore, experience managing application stacks in a Hybrid cloud is preferred. You are a thought leader and mentor for internal and external technical talent and actively contribute to the external technical community.

This position may be considered for a Remote or Hybrid work arrangement based on Target’s needs. A Hybrid work arrangement means the team members core role will be a blend of virtual and onsite at a Target location. A Remote work arrangement means the team member works full-time from home or an alternate location that’s not a Target location, does not have a desk at their primary HQ work location and may travel to HQ up to 4 times a year. Work duties cannot be performed outside of the country of the primary work location, unless otherwise prescribed by Target. The salary range is :$105,800.00 USD - $190,400.00 USD. Pay is based on several factors which may include, but are not limited to education, work experience, certifications, labor markets, etc. In addition to your salary, Target cares about and invests in you as a team member, so that you can take care of yourself and your family. Find competitive benefits from financial and education to well-being and beyond at https://corporate.target.com/careers/benefits.",2d,www.glassdoor.com/partner/jobListing.htm?pos=101&ao=1110586&s=58&guid=0000018469c25e8fbf2a1ab252e69ae1&src=GD_JOB_VIEW&t=SR&vt=w&cs=1_e5fe5f4e&cb=1668221665736&jobListingId=1008267068712&cpc=3BA4CE39D5B5DEF5&jrtk=3-0-1ghks4nmbi6jk801-1ghks4nn4i150800-78d73c2badb7642a--6NYlbfkN0AgONBeCfCTVljpwzR96jFX3mtyFC--n153CYnqiKkqIX_9jcboxCHu9xR05732Qjnls8LGO4bXWXjMByY3zRoGgnI_XSmrg1ilJSUuFPi_D0wVBjzaANabY37FCi3vcZ8g69ZJf33lkI0JXRsNYTO7RwQaSbaGMKlcNceK_1J_HzMmPi0rpHGqbLVfDv_ry92LpRt9LlNp1D1BpOzmsMpD1h_ggrWwDz4-Plrlrr4tRGWLWkbJprpkVVWk6Y-JN0zyldqoJqMmYhOVj82_b1DCSWO6AyEdbC89ysPdev54QagMLfqPkraL8NPLJsG9u43CaqptIdCMTepQl6z2jHooJ7IFx7VWiG-dh-GGpMNtoonIpS22PipppSAL6gSDts5np_sPfCIjfzmQEyDp-Q109tuIRuPlWfg2xIBsohIvYoh2mTgVz8FA
"['Target', '3.6']",http://www.target.com/,Lead Software Engineer - Site Reliability Engineering(Remote Or Hybrid),"Minneapolis, MN",$106K - $190K (Employer est.),"Location: 7000 Target Pkwy N, Brooklyn Park, Minnesota, United States, 55445
About Us:
Target is an iconic brand, a Fortune 50 company, and one of America’s leading retailers.
Target as a tech company? Absolutely. We’re the behind-the-scenes powerhouse that fuels Target’s passion and commitment to cutting-edge innovation. We anchor every aspect of being America’s most loved retailer with cutting-edge technology, and the smartest engineers in retail technology! Site Reliability Engineering (SRE) at Target is an engineering discipline that combines software and systems engineering to build and run large-scale, massively distributed, and fault-tolerant systems.
As a Senior Engineer in SRE, you are someone who has demonstrated experience building highly scalable platforms and fault-tolerant systems across a range of technologies, including Linux, Apache, MongoDB, Python, Oracle RDBMS, Redis, Postgres, and Hadoop. We use a combination of Google Computing Platform and our own server farms operating out of Target Data Centers, and therefore, experience managing application stacks in a Hybrid cloud is preferred. You are a thought leader and mentor for internal and external technical talent and actively contribute to the external technical community.

This position may be considered for a Remote or Hybrid work arrangement based on Target’s needs. A Hybrid work arrangement means the team members core role will be a blend of virtual and onsite at a Target location. A Remote work arrangement means the team member works full-time from home or an alternate location that’s not a Target location, does not have a desk at their primary HQ work location and may travel to HQ up to 4 times a year. Work duties cannot be performed outside of the country of the primary work location, unless otherwise prescribed by Target. The salary range is :$81,400.00 USD - $146,500.00 USD. Pay is based on several factors which may include, but are not limited to education, work experience, certifications, labor markets, etc. In addition to your salary, Target cares about and invests in you as a team member, so that you can take care of yourself and your family. Find competitive benefits from financial and education to well-being and beyond at https://corporate.target.com/careers/benefits.",2d,www.glassdoor.com/partner/jobListing.htm?pos=102&ao=1110586&s=58&guid=0000018469c25e8fbf2a1ab252e69ae1&src=GD_JOB_VIEW&t=SR&vt=w&cs=1_ad923224&cb=1668221669645&jobListingId=1008267068698&cpc=3BA4CE39D5B5DEF5&jrtk=3-0-1ghks4nmbi6jk801-1ghks4nn4i150800-282cc396f6a89df8--6NYlbfkN0AgONBeCfCTVljpwzR96jFX3mtyFC--n153CYnqiKkqIX_9jcboxCHu9xR05732Qjnls8LGO4bXWWicKm8U-yrCFEKEgqBMu9dQqQABM5RMrtztJdrXwYr0QDFgSX2u2ebMJmVJMfvh8-4JRRndyFdRrzXK5zf3sCHzu_TO4bMrJuaTwGCxheDtDLiCci124sKDIFSocZ6jXQuTpbGUs8smNX31OQ9ZHtpssPJR3vT-taPsf6qtwRnAep97EqszCmat3-N0v5Q-qMtH7AVn7j2kRnYK-Ah0BlxZV1dU8-RS5Ah-46kVZcZsH5A_nu4Q6nNSKUyQxK2NoEmJSeUX0pennknuEJvb_zMZInP6424N-sVph-UrQNkOaTZVaYUVX_scrBnsN6ts5lxEQ8I2VJUzPTzXAEEl4xzwetUSVgleklI9Q5z-rAe8
"['Cox Automotive', '4.1']",http://jobs.coxenterprises.com/,Lead Software Engineer - Site Reliability Engineering(Remote Or Hybrid),"Minneapolis, MN",$106K - $190K (Employer est.),"Cox Automotive, a subsidiary of Cox Enterprises, is seeking a Senior Site Reliability Engineer , Site Reliability Engineering to join our team!
Cox Enterprises is a family-run operation that began nearly 120 years ago. As part of this great family business, we treat our team members and clients like they’re just that — family. This atmosphere has been instrumental to our success and has shaped our willingness to fuel epic innovation, drive unprecedented growth and deliver the mind-blowing, needle-moving, connected experience we promise.
About the Position
As a member of the SRE team, you will bring a collaborative style in leading efforts that raise the maturity levels of the engineering practices across all agile teams delivering our products. The tools and use-cases are diverse, and our challenge is to increase the development velocity by optimizing various parts of the pipeline and increase application stability. Much of our software development focuses on optimizing existing systems by measuring elasticity and saturation, building infrastructure through IAC, and eliminating /reducing toil through automation. We also look to instill core SRE practices into the engineering teams including measuring SLIs/SLOs, increasing visibility/observability through monitoring tools, guide chaos engineering efforts to improve overall resiliency, and lead Gameday/Production Readiness reviews across all engineering disciplines. We’re experts in AWS and use cutting edge tools developed in-house and open-source software and enable teams to deploy faster with zero downtime.",10d,www.glassdoor.com/partner/jobListing.htm?pos=103&ao=1110586&s=58&guid=0000018469c25e8fbf2a1ab252e69ae1&src=GD_JOB_VIEW&t=SR&vt=w&cs=1_b5642a71&cb=1668221673702&jobListingId=1008250092819&cpc=9908D8D4413DBB8A&jrtk=3-0-1ghks4nmbi6jk801-1ghks4nn4i150800-6931fb7e3fb48b23--6NYlbfkN0CNTaigg53tgKMQQsjdGlhApYl6RSsbpQl6QWYzGuod7-bTY1RMAoc8WFq_oZTNX25ZD8NaX3mfix2Qx4waw1Flbbbh4L9SHO5xWyLFeoOtb3T5jyU7fpMUrC-ST1mos-nXwNKczplLtvTrMnfaVjEAXMrkuGsFEpaGIbnHICtXVrRpFJWdO-3NgrZxKSuPWELTLqIxZIYcetWSmzlsXVSHUmThTDufr1NlfS7vy7pYyduJHs9hk3-2Kg-935k5An7oFOgwg30vVccg-Tgv-1Kxk6u-gzALm-jR_eI24A4kGEUfbBLFQHLBRVaYgjVUviQ2tpxhbWcCxUz9vr2GbvuW9hEgDyvxMF_oXoWvb1f20d2bWqLd-nUxLb9w08MF7I68cEFz0eEdmiiPi9i2-dinnpdxp3KQTSzEDOKjh3kvWamxyDggsUTHrdGO76LcrST-94Ykwu1nF6G-YfCG4J_3TD3TBAILTEX5bXcTP9ZZkfmr406rhBEMvTms9wM1_he_p_x09PVK3qWWmTmV6c3lFLxqLyC27OMWjl6lTw-BmrQOxbfhF_GTsag5G-pcO0afr4FBQ6T5I5oi0ptu1tOx8JBcpV5f_6dmXgO_wV-h-BbKHHXsqi3gPaAU6EQBV95d_PJIXAIfMPpQjIq-1hZONgFSziHtT1BON08i0Ysa1X1_XKm5KRMCYdrA788zrUSanGd4DpxZkXd_vdEi5cYj9iH85i9ameRHLR4HuUeJVNMv2zg8YO1e_oiOLiKhPaRHQIlkqm_MU5upyfe-Uv_Z3fg6qPx8vxBnvErdyjG7pmfYPdiY_r8cEx_6qdUGnWNoNuP6NjiLy7iUl53S5DUol0AGrLRlQZFPYTP4NNj48hiKHZd5AvPmY5c5gwzQ_qHtoJ8GKqNV3md-W7PeSErcaqoU371e7vpepp66s5YXhX15Bf4VsM0QGaSxMmpjzy7Kc2rtZ3Z0Z7hTtC8WICCqjcUipraRBSAVcsLLoPAGQ7RgbypNGNdxxVLe0uZ3vto5N8jDrRkVRHjX51wpdQNSGO_lQxg1v92EiFbOFBIhcCFE8yV3vO-6CjlSjx_hZeoiLnI9Pm1sayg21d1rez3dngDs3ZZMn0lhl9aHZJAwB3O3cxkgaLPSq_64dtj-4WxLF9evP9r7hZqLvsfVVkI4
,http://www.intuit.com/careers/glassdoor,Lead Software Engineer - Site Reliability Engineering(Remote Or Hybrid),"Minneapolis, MN",$106K - $190K (Employer est.),"Overview
Intuit is the global leader in financial management software where we have pioneered the shift to Virtual Platforms, cloud computing for consumers, small businesses and those that serve them. Intuit acts as a 35 year old startup, and we are constantly disrupting ourselves as we identify major new technology and design trends that are needed to deliver our mission to power prosperity around the world. Our groups are fast-paced teams focused on delivering innovative capabilities, and having fun while doing it.

Note: By applying to this position, your application will be automatically submitted for the following locations: Mountain View, San Diego and the following teams at Intuit.
What you'll bring",30d+,www.glassdoor.com/partner/jobListing.htm?pos=104&ao=1110586&s=58&guid=0000018469c25e8fbf2a1ab252e69ae1&src=GD_JOB_VIEW&t=SR&vt=w&cs=1_e08abfcb&cb=1668221678052&jobListingId=1008046980957&cpc=3BA4CE39D5B5DEF5&jrtk=3-0-1ghks4nmbi6jk801-1ghks4nn4i150800-1287d021b1cfd9b8--6NYlbfkN0Beu2OJZ6XHmZy_u3_RkDntRG6Ksvii-DCcBTBvP4k-PlBsYC6-IxpbwgudxYRbA-oqKlVkvjeJ3Z9csdu1e7MpzJcNkTxgD9-r-TwVF0AmX8hO_IFPxn9CnZVYP51Y54sAUX8ZlbrqKmLdraFVN-XXrBIVx0C2ucmq43TmIM_VBqx9iD_bLpbtcUd99thZ6Rr-bZY4P-a0eX0dAkBH5OUF922ZWU_pwp7F1nblN-BWFrFbqLQIGGgVk5Jj1jqFp5yXTfL_4k0hKiuwESWjPgJj7k3iYmt3lNctrHgy7o6maZJS8VlEsbKYv8YjVktTNotUKu2wxa101rdOHdf7IYgKMo4a4tNXQecsJz-mMo1YvVDpX8rpN8kcUvr_Hz0cq11qsY3E9pINq1dtDWY_iL9TC1xLVPTY_Lju5VE_BVz-UQkUxxWmOJRa2s7fx13cqkM%3D
"['Robert Half', '3.9']",http://www.roberthalf.com/,Lead Software Engineer - Site Reliability Engineering(Remote Or Hybrid),"Minneapolis, MN",$106K - $190K (Employer est.),"JOB REQUISITION
Senior Software Engineer
LOCATION
SAN RAMON
JOB DESCRIPTION

At Robert Half, we pioneered the idea of professional staffing services nearly 70 years ago, and as the needs of businesses have evolved, so have we. We work hard and know how to have fun, too. At Robert Half, people come first, celebrate diversity, drive innovation, give back to communities and offer flexible remote work. Also, Robert Half retains Forbes' list of America's Best Employers for Diversity. In addition, FORTUNE recognizes Robert Half as one of the 100 Best Companies to work.

About Our Team:



CA SAN RAMON CORP",22d,www.glassdoor.com/partner/jobListing.htm?pos=105&ao=1110586&s=58&guid=0000018469c25e8fbf2a1ab252e69ae1&src=GD_JOB_VIEW&t=SR&vt=w&cs=1_7f902ffe&cb=1668221681572&jobListingId=1008222017033&cpc=3BA4CE39D5B5DEF5&jrtk=3-0-1ghks4nmbi6jk801-1ghks4nn4i150800-0b72ae9c334153ae--6NYlbfkN0CpzDdaQkua3np5pkmj49lKioZwmwxQ-yx5plwbYmV_M1rAU60J3Su8F0L1WdWOEHmisdAMCc--fgE9YLjCh2YiQqyESAcR72J8P1NMUZgLvYfq_Q9K9OeaHv4YxMQxBOPuxVA_OdAv16u96-L2OyRejQFX6oT9xHDT7qbDp4b9Xqjb2-BDa_I3axgnk3JDoKk9YUwHdVvIgejI3whTT4jvLGfg6AVbF9XeKiP_Oui7VMndcTK2UVxmKVA10UIuB2biNye0o32isKEdb3Qmcq3Nd8XEV78NfKtmbO93KrRfoojDb3TZHBEwjdu_lfNI66xQBwUPr7AMcl_Yy4QvVWccC91lUSwgUJA_EZUK3iDd7GEmMNlWnLsI-m_SVhPe1Tw1TQ6mGE_4VtKppsNxYxUgNsh-Y_vlqRFmQ2ctkZquMdK2UBBO2TDdjiEudmp4kQMB6eX0h-Lf_oRrpRdGSSiouvdyc2SFNOYNegrEnPiGqcQOSgbex5MOICvcdQD2yxyIL6bx-eb8WRHxuAgG1lFO4E2mAv6U6zddbOZtMDEubCj-2DCCRDhSrcZeGqjF2fNLvB4puD-CzVwTOE2PvVNv008ELWN_c2Q%3D
"['FLEETCOR', '3.5']",http://www.fleetcor.com/,Lead Software Engineer - Site Reliability Engineering(Remote Or Hybrid),"Minneapolis, MN",$106K - $190K (Employer est.),"The game is changing in business payment, and FLEETCOR is leading the way with innovative solutions that streamline the payment process and help companies control spending.
The FLEETCOR team has cracked the code. We've assembled an A-team of business partners, payment networks, and employees. We have the technology and have made it our mission to develop and deliver better ways to pay.
Fleetcor provides opportunities for growth, in addition to work-life balance, and competitive compensation. We value fostering career paths, recognizing, and rewarding hard work! Come join a team that has flexible work schedules, and ongoing opportunities for professional development and advancement.
FLEETCOR is not just about fun team events or great learning opportunities (although we have those too!). We’re growing our team and are looking for an Senior Software Engineer to join us and make a real impact! If that is you, APPLY NOW!",30d+,
"['Yum! Brands', '3.5']",http://jobs.kfc.com/,Lead Software Engineer - Site Reliability Engineering(Remote Or Hybrid),"Minneapolis, MN",$106K - $190K (Employer est.),"Site Reliability Engineer
Remote
Who we are:
Our story might surprise you. We’re the world’s largest restaurant company—encompassing KFC, Pizza Hut, and Taco Bell—but there’s a lot more going on behind the scenes than just frying chicken, baking pizzas, and serving up tacos. We put this delicious food in the hands of customers through apps, websites, kiosks, POS, and other digital dining experiences – and we are only getting started. Here in Chicago, we’re building out a bold team of hackers to help Yum! Brands deliver the next generation of software to 49,000 restaurants in more than 145 countries. That’s a huge responsibility, which is why we’re on a mission to find the most fearless engineers to join our software startup within Yum!.",24h,www.glassdoor.com/partner/jobListing.htm?pos=107&ao=1136043&s=58&guid=0000018469c25e8fbf2a1ab252e69ae1&src=GD_JOB_VIEW&t=SR&vt=w&cs=1_f877b8a7&cb=1668221689551&jobListingId=1008275085947&jrtk=3-0-1ghks4nmbi6jk801-1ghks4nn4i150800-f5acc66df5ab9e3d-
"['Cisco Systems', '4.3']",http://www.cisco.com/,Lead Software Engineer - Site Reliability Engineering(Remote Or Hybrid),"Minneapolis, MN",$106K - $190K (Employer est.),"What You'll Do?
Do you have a reputation for being highly technical? Are your peers in awe of your logical troubleshooting skills? Could you be described as having an innate passion for driving improvement? If so, then Cisco’s Server Virtualization support team seeks you!
As an engineer in the Technical Assistance Center (TAC), you would work on problems at a deep technical level not normally experienced in a typical enterprise environment. Products supported will include the Unified Computing Systems (UCS) server line, management software, virtualized switched, hypervisors, server operating systems, and a cutting-edge cloud solution. You would be a key player recommending product changes, documenting solutions, and automating log analysis. This position affords a lot of personal growth opportunity.
Who You'll Work With?",1d,www.glassdoor.com/partner/jobListing.htm?pos=108&ao=1136043&s=58&guid=0000018469c25e8fbf2a1ab252e69ae1&src=GD_JOB_VIEW&t=SR&vt=w&cs=1_f9ec34f6&cb=1668221691400&jobListingId=1008272906045&jrtk=3-0-1ghks4nmbi6jk801-1ghks4nn4i150800-69cd799be9861a8b-
"['Descartes Labs', '4.5']",http://www.descarteslabs.com/,Lead Software Engineer - Site Reliability Engineering(Remote Or Hybrid),"Minneapolis, MN",$106K - $190K (Employer est.),"The Company

Descartes Labs helps organizations whose success depends on the scientific analysis of observable, physical world events. We are the leading provider of geospatial analytics that create actionable intelligence by strengthening our customers’ proprietary data with models of the earth. Our solutions create new sources of environmental sustainability and operational advantage and foresight for agriculture, consumer packaged goods (CPG), mining, and government users by combining machine intelligence and domain expertise into a complete operational solution.
Descartes Labs is proud to be a remote-first, deliberately distributed organization that recognizes that people have different needs and motivations for building a life and career that matters and works for them. For this reason, we are open to our employees working from any location, in a way that enhances their well-being, productivity, and role. We focus on helping our employees produce positive outcomes and we recognize that the path to getting there will look different for different people.",30d+,www.glassdoor.com/partner/jobListing.htm?pos=109&ao=1136043&s=58&guid=0000018469c25e8fbf2a1ab252e69ae1&src=GD_JOB_VIEW&t=SR&vt=w&cs=1_dd435cfa&cb=1668221694202&jobListingId=1008184788064&jrtk=3-0-1ghks4nmbi6jk801-1ghks4nn4i150800-83be3387b2869883-
"['NOKIA', '4.1']",http://www.nokia.com/,Lead Software Engineer - Site Reliability Engineering(Remote Or Hybrid),"Minneapolis, MN",$106K - $190K (Employer est.),"Come create the technology that helps the world act together
Nokia is committed to innovation and technology leadership across mobile, fixed and cloud networks. Your career here will have a positive impact on people’s lives and will help us build the capabilities needed for a more productive, sustainable, and inclusive world.
We challenge ourselves to create an inclusive way of working where we are open to new ideas, empowered to take risks and fearless to bring our authentic selves to work.

The team you'll be part of
Bell Labs Solutions Research leads innovative research focused on new Nokia value chains, and opportunities beyond the current Nokia BG Product and Solution Portfolio for both the short and long term, including new market spaces, internal incubation, technology licensing and possible “spin out” opportunities. This unit works closely with Bell Labs Core Research and other organizations in Nokia Strategy and Technology to drive fundamental and applied research to grow and expand Nokia’s position into new technology and business domains and ecosystems.",30d+,www.glassdoor.com/partner/jobListing.htm?pos=110&ao=1136043&s=58&guid=0000018469c25e8fbf2a1ab252e69ae1&src=GD_JOB_VIEW&t=SR&vt=w&cs=1_96c8e5c5&cb=1668221697188&jobListingId=1008158354290&jrtk=3-0-1ghks4nmbi6jk801-1ghks4nn4i150800-d35aa22ec43a1d10-
"['Coupang', '3.7']",http://www.coupang-usa.com/,Lead Software Engineer - Site Reliability Engineering(Remote Or Hybrid),"Minneapolis, MN",$106K - $190K (Employer est.),"Company Introduction
We exist to wow our customers. We know we're doing the right thing when we hear our customers say, ""How did we ever live without Coupang?"" Born out of an obsession to make shopping, eating, and living easier than ever, we're collectively disrupting the multi-billion-dollar e-commerce industry from the ground up. We are one of the fastest-growing e-commerce companies that established an unparalleled reputation for being a dominant and reliable force in South Korean commerce.
We are proud to have the best of both worlds — a startup culture with the resources of a large global public company. This fuels us to continue our growth and launch new services at the speed we have been since our inception. We are all entrepreneurial surrounded by opportunities to drive new initiatives and innovations. At our core, we are bold and ambitious people that like to get our hands dirty and make a hands-on impact. At Coupang, you will see yourself, your colleagues, your team, and the company grow every day.",30d+,
"['Kraft Heinz Company', '3.5']",http://www.kraftheinzcompany.com/,Lead Software Engineer - Site Reliability Engineering(Remote Or Hybrid),"Minneapolis, MN",$106K - $190K (Employer est.),"General information
All posting locations: Chicago, Illinois, United States of America, Remote, Illinois, United States of America
Job Function: 16 - Digital
Date Published: 07-Sep-2022
Ref #: R-60198 (GH)
Description & Requirements
WHO WE ARE",30d+,www.glassdoor.com/partner/jobListing.htm?pos=112&ao=1136043&s=58&guid=0000018469c25e8fbf2a1ab252e69ae1&src=GD_JOB_VIEW&t=SR&vt=w&cs=1_15acfbd2&cb=1668221705005&jobListingId=1008123766337&jrtk=3-0-1ghks4nmbi6jk801-1ghks4nn4i150800-9589098786a4600c-
"['2nd Watch', '3.9']",https://www.2ndwatch.com/,Lead Software Engineer - Site Reliability Engineering(Remote Or Hybrid),"Minneapolis, MN",$106K - $190K (Employer est.),"Company Description*
Why 2nd Watch*
2nd Watch is in growth mode, and we are looking for outcome driven, focused team members who want to win and have fun doing it! We are looking for the most technically forward-thinking, cloud-passionate employees in the world, and strive daily to align our core values with those that we hire.
2nd Watch has a unique company culture and working environment that live and breathe success and promote pushing the envelope every day in your respective role at the company. This is what drives our teams – a perpetual thirst for knowledge, and a desire to work with the best people and take on big challenges together. Getting our attention takes creativity, integrity, a desire to improve yourself and your co-workers each day, and a track record of caring about who you are affecting, both positively and negatively, while you are getting the right stuff done.
About 2nd Watch
As a cloud native company, 2nd Watch has walked alongside our clients for over a decade helping them migrate to the cloud, accelerate application development, and deliver on their company’s strategic goals through the blend of technology and innovation that is at our core. Our services deliver cloud native capabilities through strategic consulting, modernization services, and specialized technology practices focused on maximizing the value of public cloud through:",9d,www.glassdoor.com/partner/jobListing.htm?pos=113&ao=1136043&s=58&guid=0000018469c25e8fbf2a1ab252e69ae1&src=GD_JOB_VIEW&t=SR&vt=w&cs=1_19223e28&cb=1668221708068&jobListingId=1008252306194&jrtk=3-0-1ghks4nmbi6jk801-1ghks4nn4i150800-52789bb97b4bdf4d-
"['Toshiba Global Commerce Solutions, Inc.', '3.8']",http://commerce.toshiba.com/,Lead Software Engineer - Site Reliability Engineering(Remote Or Hybrid),"Minneapolis, MN",$106K - $190K (Employer est.),"Job Title: Software Engineer IV

Introduction:
Are you an exceptional engineering leader, with deep experience designing and building cloud-based applications? Do you have a passion for developing software that drives both development teams and the business?

Become the newest technical leader in Toshiba’s Digital Platform group. This position will focus on building the core point of sale application functionality on top of our cloud native platform using Microservices and OpenAPI. This opportunity will provide the candidate the chance to work on a microservices based platform and help code, lead, and design functional deliverables of our point-of-sale applications.

You will be working alongside other experienced engineers and developers, collaborating on the various layers of the infrastructure for our platform. Qualified candidates will have strong leadership, be forward thinking, self-motivated and bring excellence to the development and customer experience.",28d,www.glassdoor.com/partner/jobListing.htm?pos=114&ao=1136043&s=58&guid=0000018469c25e8fbf2a1ab252e69ae1&src=GD_JOB_VIEW&t=SR&vt=w&cs=1_67d38447&cb=1668221711963&jobListingId=1008208084136&jrtk=3-0-1ghks4nmbi6jk801-1ghks4nn4i150800-06cd13a244ca7f90-
"['DTN', '3.5']",http://www.dtn.com/,Lead Software Engineer - Site Reliability Engineering(Remote Or Hybrid),"Minneapolis, MN",$106K - $190K (Employer est.),"DTN is a global leader providing insights and analytics to our customers to feed, fuel, and protect the world. We help people make critical business decisions that impact the agriculture, oil and gas, trading, and weather industries.
It’s a difference you’ve likely felt without even knowing it. From the food on your plate to the gas in your car to the last flight you took, chances are a DTN customer made it possible. And that’s just for starters. That’s why we say, “When our customers prosper, we all win.”
Job Description:
Help Us Shape the Future
DTN is a global leader providing insights and analytics to our customers to feed, fuel, and protect the world. We help people make critical business decisions that impact the agriculture, oil and gas, trading, and weather industries.",30d,www.glassdoor.com/partner/jobListing.htm?pos=115&ao=1136043&s=58&guid=0000018469c25e8fbf2a1ab252e69ae1&src=GD_JOB_VIEW&t=SR&vt=w&cs=1_0ab4fcd4&cb=1668221714973&jobListingId=1008201060292&jrtk=3-0-1ghks4nmbi6jk801-1ghks4nn4i150800-c19c5e4c2bf328f0-
